title,link,description,published,contributors
Is buying a home in Australia only for the wealthy?,https://www.theguardian.com/australia-news/audio/2021/may/06/is-buying-a-home-in-australia-only-for-the-wealthy,"Across the country house prices are soaring, breaking records and leaving many first home buyers completely exasperated. With prices set to rise even further, there’s concern that large sections of the population may be priced out of home ownership. Martin Farrer explains what is driving the housing boom, and what it could mean for home ownership in Australia",2021-05-06,"Reported by Martin Farrer, and presented by Laura Murphy-Oates; produced by Hannah Izzard, Karishma Luthria, Miles Herbert and Joe Koning; the executive producers are Miles Martignoniand Gabrielle Jackson"
"Shock, fear and isolation as Australia criminalises those returning from India",https://www.theguardian.com/australia-news/audio/2021/may/05/shock-fear-and-isolation-as-australia-criminalises-those-returning-from-india,"With India’s Covid-19 case numbers rising, the Morrison government has announced tough fines or jail time for Australians returning home from India – a move that has provoked widespread backlash. Karishma Luthria speaks to people stranded in India, including Australian Subra Somayajula, about the unfolding crisis on the ground in India, and the impact of this policy",2021-05-05,Reported by Karishma Luthria and presented by Laura Murphy-Oates; produced by Miles Herbert and Joe Koning; the executive producers are Miles Martignoni and Gabrielle Jackson.
The Seaspiracy controversy: should we stop eating fish?,https://www.theguardian.com/australia-news/audio/2021/may/04/the-seaspiracy-controversy-should-we-stop-eating-fish,"The Netflix documentary on the impact of commercial fishing has received celebrity endorsements and a huge audience around the world, but it has also attracted criticism from experts who accuse it of making misleading claims",2021-05-04,Presented by Anushka Asthana with George Monbiot and Bryce Stewart. Produced by Alex Atack and Axel Kacoutié; execed by Lucy Greenwell. Executive producers Nicole Jackson and Phil Maynard. Introduced by Laura Murphy-Oates
"Ramadan: fasting, food, prayer and … television?",https://www.theguardian.com/australia-news/audio/2021/may/03/ramadan-fasting-food-prayer-and-television,"For many Muslims around the world, Ramadan is a month of fasting and prayer, but also primetime television – with a growing industry across the Middle East releasing hit shows viewed by millions of people. Guardian reporter Mostafa Rachwani explores the rise of Ramadan shows and what they mean for diaspora communities",2021-05-03,Presented by Laura Murphy-Oates and reported by Mostafa Rachwani. Produced by Ellen Leabeater and Joe Koning. The executive producers are Miles Martignoni and Gabrielle Jackson
Assessing Australia’s response to India’s Covid crisis – with Lenore Taylor,https://www.theguardian.com/australia-news/audio/2021/apr/30/assessing-australias-response-to-indias-covid-crisis-with-lenore-taylor,"As Covid deaths soared in India, Scott Morrison offered an aid package to help the country’s health system cope with demand and suspended all direct flights to Australia. Gabrielle Jackson talks to Lenore Taylor and David Munk about the moral implications of Australia’s response and what needs to happen to bring citizens home",2021-04-30,Presented by Gabrielle Jackson with Lenore Taylor and David Munk. Produced by Ryan Pemberton. Executive producer Miles Martignoni
The ongoing harm caused by LGBTQ conversion practices in Australia,https://www.theguardian.com/australia-news/audio/2021/apr/29/the-ongoing-harm-caused-by-lgbtq-conversion-practices-in-australia,"In the past year, three Australian states and territories have outlawed some forms of gay conversion ‘therapy’ – now referred to as LGBTQ conversion practices. But these damaging and harmful practices are still legal in many parts of the country.Laura Murphy-Oates speaks to survivor Nashy and journalist Gary Nunn about the long-lasting harm they can inflict, and the campaign to outlaw them nationwide",2021-04-29,Reported by Gary Nunnand presented by Laura Murphy-Oates; produced by Jon Tjhia and Joe Koning; the executive producers are Miles Martignoniand Gabrielle Jackson
India’s Covid disaster: a crisis for the world,https://www.theguardian.com/australia-news/audio/2021/apr/28/indias-covid-disaster-a-crisis-for-the-world,"A catastrophe is unfolding in India as hospitals run out of oxygen, the Guardian’s south Asia correspondent, Hannah Ellis-Petersen, reports from Delhi. And the country – the world’s foremost vaccine producer – is now constrained in how much it can export while it deals with the disaster",2021-04-28,Presented by Anushka Asthana and reported by Hannah Ellis-Petersen. Produced by Ned Carter Miles and Iain Chambers. Executive producers: Phil Maynard and Nicole Jackson
Will growing global pressure on climate change force Australia to step up?,https://www.theguardian.com/australia-news/audio/2021/apr/27/will-growing-global-pressure-on-climate-change-force-australia-to-step-up,"US president Joe Biden held a virtual summit last week and invited dozens of countries to speak on climate change. Japan, Canada and the US were among several nations that increased their emission reduction targets for this decade, but Australia did not. Environment editor Adam Morton examines how the mounting global pressure will affect Australia’s climate policy",2021-04-27,"Presented by Laura Murphy-Oates and reported by Adam Morton. Produced by Miles Herbert, Joe Koning and Ellen Leabeater. The executive producers are Miles Martignoni  and Gabrielle Jackson"
George Floyd: will Derek Chauvin’s guilty verdict change US policing?,https://www.theguardian.com/australia-news/audio/2021/apr/26/george-floyd-will-derek-chauvins-guilty-verdict-change-us-policing,"Oliver Laughland, the Guardian’s US southern bureau chief, covered the trial of former police officer Derek Chauvin, who was found guilty of the murder of George Floyd. It was a landmark moment in US criminal justice history. Oliver looks at what the verdict means for America",2021-04-26,"Presented by Anushka Asthana, with Oliver Laughland, produced by Elizabeth Cassinand Axel Kacoutié; executive producers Nicole Jacksonand Phil Maynard"
What’s causing Australia’s mental health crisis? – with Lenore Taylor,https://www.theguardian.com/australia-news/audio/2021/apr/23/whats-causing-australias-mental-health-crisis-with-lenore-taylor,"In the wake of the pandemic, mental ill health is on the rise, putting more pressure on what some say is an already broken system. Editor-in-chief Lenore Taylor and associate editor Lucy Clark speak to Gabrielle Jackson about what’s causing Australia’s mental health crisis, and how to fix it",2021-04-23,"Presented by Gabrielle Jackson with Lenore Taylor and Lucy Clark. Produced by Ellen Leabeater,  Ryan Pemberton and Laura Murphy-Oates. Executive producer Miles Martignoni"
Is sitting still slowly killing us?,https://www.theguardian.com/australia-news/audio/2021/apr/22/is-sitting-still-slowly-killing-us,"Modern lifestyles are increasingly sedentary and inactive, and the public health effects of this are only just starting to show up, says author and Guardian reporter Peter Walker",2021-04-22,"Presented by Anushka Asthana with Peter Walker, produced by Sami Kent and Pulama Kaufman. Executive producers Phil Maynard and Nicole Jackson"
What would it take to end period poverty in Australia?,https://www.theguardian.com/australia-news/audio/2021/apr/21/what-would-it-take-to-end-period-poverty-in-australia,"What if you didn’t have a spare $5 to buy pads or tampons when you got your period? That’s the predicament many girls and women find themselves in each month. It has been a government blind spot for decades, and advocates are pushing for period products to be made more easily available. So, how close is Australia to eradicating period poverty?",2021-04-21,Reported by Karishma Luthria and presented by by Laura Murphy-Oates. Produced by Ellen Leabeater and Joe Koning. Executive producers Miles Martignoni  and Gabrielle Jackson
Why is the Coalition changing the NDIS?,https://www.theguardian.com/australia-news/audio/2021/apr/20/why-is-the-coalition-changing-the-ndis,"In 2013 the Gillard government brought in the national disability insurance scheme, but now the Coalition government is working on an overhaul. Luke Henriques-Gomes explains how the changes could prioritise cost-cutting rather than the needs of vulnerable people",2021-04-20,Presented by Laura Murphy-Oates and reported by Luke Henriques-Gomes. Produced by Ellen Leabeater and Ryan Pemberton. The executive producers are Miles Martignoni and Gabrielle Jackson
Joe Biden’s southern border challenge: reversing Trumpism,https://www.theguardian.com/australia-news/audio/2021/apr/19/joe-bidens-southern-border-challenge-reversing-trumpism,"The 46th US president took office promising a more welcoming immigration policy. But Republicans are calling a new wave of migrants at the southern border a ‘crisis’ and demanding action. In this episode of Full Story, Washington bureau chief David Smith describes the pressure Biden is under to respond to the issue. Plus, the Guardian’s Nina Lakhani describes what she witnessed on the border in Texas, where migrants are still being detained, and many sent straight back across the border",2021-04-19,"Presented by Anushka Asthana with Nina Lakhani and David Smith; produced by Lucy Greenwell,  Sasha Mistlin and Axel Kacoutié; additional production by Joe Koning; the executive producers of Today in Focus are Phil Maynard and Nicole Jackson"
What does the Christine Holgate affair tell us about Scott Morrison’s leadership? – with Lenore Taylor,https://www.theguardian.com/australia-news/audio/2021/apr/16/what-does-the-christine-holgate-affair-tell-us-about-scott-morrisons-leadership-with-lenore-taylor,Scott Morrison’s reaction last year to revelations that Christine Holgate had rewarded Australia Post executives with Cartier watches was back in the spotlight this week when Holgate told a Senate inquiry she felt bullied and humiliated by the prime minister. Did Morrison overreact and what can the media learn from this story?,2021-04-16,Presented by Gabrielle Jackson with Lenore Taylor and Mike Ticher. Produced by Ryan Pemberton. Executive producer Miles Martignoni
Australia’s 30-year failure to end Indigenous deaths in custody,https://www.theguardian.com/australia-news/audio/2021/apr/15/australias-30-year-failure-to-end-indigenous-deaths-in-custody,Thursday marks 30 years since the royal commission into Aboriginal deaths in custody. In that time more than 474 Indigenous people have died in custody including five in the past month.Laura Murphy-Oates speaks to protestors and family members who are demanding change – and a meeting with the prime minister,2021-04-15,"Reported and presented by Laura Murphy-Oates; produced by Ellen Leabeater, Joe Koning and Jon Tjhia; the executive producers are Miles Martignoniand Gabrielle Jackson"
The ongoing scandals of Liberal MP Andrew Laming,https://www.theguardian.com/australia-news/audio/2021/apr/14/the-ongoing-scandals-of-liberal-mp-andrew-laming,"After Liberal backbencher Andrew Laming faced complaints of online harassment, the government said his behaviour was ‘unacceptable’, ordering him to take leave and undergo empathy training. Chief political correspondent Sarah Martin explores Laming’s political future and explains how her subsequent reporting into Laming’s online activity has triggered an electoral commission investigation",2021-04-14,Presented by Laura Murphy-Oates and reported by Sarah Martin; produced by Ellen Leabeaterand Joe Koning; the executive producers are Miles Martignoniand Gabrielle Jackson
Andrew Denton on the fight for voluntary assisted dying laws,https://www.theguardian.com/australia-news/audio/2021/apr/13/andrew-denton-on-the-fight-for-voluntary-assisted-dying-laws,"For the past six years, Andrew Denton has spoken to dozens of people around the world about the arguments for and against voluntary assisted dying. The new season of Denton’s podcast, Better Off Dead, examines how assisted dying laws are working in Victoria – currently the only Australian state with such legislation in effect.In this episode of Full Story, Denton explains what he discovered, and we hear from one Victorian family as they go through the difficult process.",2021-04-13,Presented by Laura Murphy-Oates featuring Andrew Denton. Produced by Ellen Leabeater and Joe Koning. The executive producers are Miles Martignoni and Gabrielle Jackson
The death of George Floyd and the case against Derek Chauvin,https://www.theguardian.com/australia-news/audio/2021/apr/12/the-death-of-george-floyd-and-the-case-against-derek-chauvin,"The death of George Floyd after being restrained by Minneapolis police last year sparked a wave of outrage that swept across the US and the world. Now the police officer who knelt on Floyd’s neck for more than nine minutes is on trial for his murder. Oliver Laughland has been following the proceedings inside the courtroom, and explains the key evidence and arguments so far. Plus Amudalat Ajasa tells Anushka Asthana that for black people across the US, it is difficult to watch",2021-04-12,Presented by Anushka Asthana with Oliver Laughland and Amudalat Ajasa; produced by Sami Kent and Pulama Kaufman; executive producers Phil Maynard and Nicole Jackson; additional production by  Ryan Pemberton and Jon Tjhia
