published,title,description,link,Pub
2026-01-22T06:42:49+00:00,Trump Lashes Out At European Allies & NATO Saying America “Won’t Forget” Greenland Debacle | 10 News,"President Trump has backflipped again, this time walking back threats to invade Greenland despite weeks of escalating rhetoric. The shock retreat came amid a combative speech at the World Economic Forum in Switzerland, in which he lashed his European allies and blasted the NATO alliance.    Join the conversation and follow us on:   Twitter: http://twitter.com/10NewsAU  Facebook: http://www.facebook.com/10NewsAU/  Instagram: http://www.instagram.com/10NewsAU/  TikTok: https://www.tiktok.com/@10NewsAU   10 News airs at 5 pm, seven nights a week in your local market on Network 10.  Missed the bulletin? Catch up at https://10.com.au/news   10 News is based in Australia and is a division of Paramount.",https://www.youtube.com/watch?v=xXdnfhdYLxU,10 News
2026-01-22T07:17:09+00:00,Jannik Sinner Takes On Aussie James Duckworth In Second Round Of Australian Open | 10 News,"Tonight, Australia's James Duckworth faces the daunting prospect of taking on defending champ Jannik Sinner on Rod Laver Arena.    Join the conversation and follow us on:   Twitter: http://twitter.com/10NewsAU  Facebook: http://www.facebook.com/10NewsAU/  Instagram: http://www.instagram.com/10NewsAU/  TikTok: https://www.tiktok.com/@10NewsAU   10 News airs at 5 pm, seven nights a week in your local market on Network 10.  Missed the bulletin? Catch up at https://10.com.au/news   10 News is based in Australia and is a division of Paramount.",https://www.youtube.com/watch?v=JdAz9jXqmfA,10 News
2026-01-22T07:19:02+00:00,NBA Legend Allen Iverson Praises Aussie Josh Giddey | 10 News,"NBA legend Allen Iverson is in Melbourne and has heaped praise on Aussie Josh Giddey. The former MVP also says LeBron James has years left to play.    Join the conversation and follow us on:   Twitter: http://twitter.com/10NewsAU  Facebook: http://www.facebook.com/10NewsAU/  Instagram: http://www.instagram.com/10NewsAU/  TikTok: https://www.tiktok.com/@10NewsAU   10 News airs at 5 pm, seven nights a week in your local market on Network 10.  Missed the bulletin? Catch up at https://10.com.au/news   10 News is based in Australia and is a division of Paramount.",https://www.youtube.com/watch?v=YodipovZqUM,10 News
2026-01-22T07:31:03+00:00,Valtteri Bottas Reveals He Is Cheering Rival Oscar Piastri To Win The Driver’s Title | 10 News,"Valtteri Bottas has little to hide. In a revealing interview with 10 News, the Formula One driver is cheering on one of his rivals in the paddock to win the driver's title, our Aussie, Oscar Piastri.   Join the conversation and follow us on:   Twitter: http://twitter.com/10NewsAU  Facebook: http://www.facebook.com/10NewsAU/  Instagram: http://www.instagram.com/10NewsAU/  TikTok: https://www.tiktok.com/@10NewsAU   10 News airs at 5 pm, seven nights a week in your local market on Network 10.  Missed the bulletin? Catch up at https://10.com.au/news   10 News is based in Australia and is a division of Paramount.",https://www.youtube.com/watch?v=Ks8eUUp8zdw,10 News
2026-01-22T07:35:47+00:00,"Reports Of Shooting In NSW, Multiple Missing In NZ Landslide, Barnaby On Coalition Split | 10 News+","Multiple fatalities are being reported with an alleged gunman on the loose after opening fire in Lake Cargelligo - a town in the NSW's central west.  An Australian father and son speak out on the terrifying landslide in New Zealand, as multiple people, including children, remain missing.  Barnaby Joyce breaks his silence on the mass exodus of National Party frontbenchers from the Federal Shadow Cabinet and the subsequent split of the coalition under Sussan Ley.  Today, Australia marks a National Day of Mourning for the victims of the Bondi Beach terror attack.  Join the conversation and follow us on:  Instagram: https://www.instagram.com/10NewsPlus/  TikTok: https://www.tiktok.com/@10newsplus/  Snapchat: https://www.snapchat.com/add/tennewsplus   Spotify: https://open.spotify.com/show/0tWZ6sIJTQ2WHgYdjgaAA7?si=cb30d7fd3d3541fa    10 News+ airs at 6pm on Monday to Friday and at 6:30pm on Sunday on Network 10.  Missed the bulletin? Catch up at https://10.com.au/news/   10 News+ is based in Australia and is a division of Paramount.",https://www.youtube.com/watch?v=HQldvAX6XsU,10 News
2026-01-22T07:42:58+00:00,Multiple People Dead In NSW Shooting | 10 News+,"#BREAKING: Multiple fatalities have been reported as a gunman is on the loose after opening fire in Lake Cargelligo, in NSW’s Central West. At least two people have been shot in a vehicle, and one other person has been shot at another location. Police are urging residents to shelter inside.  Join the conversation and follow us on: Instagram: https://www.instagram.com/10NewsPlus/ TikTok: https://www.tiktok.com/@10newsplus/ Facebook: https://www.facebook.com/10newsplus/ Snapchat: https://www.snapchat.com/add/tennewsplus Spotify: https://open.spotify.com/show/0tWZ6sIJTQ2WHgYdjgaAA7?si=cb30d7fd3d3541fa  10 News+ airs at 6pm on Monday to Friday and at 6:30pm on Sunday on Network 10. Missed the bulletin? Catch up at https://10.com.au/news/  10 News+ is based in Australia and is a division of Paramount.",https://www.youtube.com/watch?v=UeRHNotztLI,10 News
2026-01-22T07:51:25+00:00,PhD Student Charged With Terror Offence After Allegedly Planning Attack On Australia Day | 10 News,"A PhD Student has been charged with planning a terror attack targeting Australia Day crowds in Queensland. Police allege the man planned to throw a number of Molotov cocktails during a riot on the Gold Coast.   Join the conversation and follow us on:   Twitter: http://twitter.com/10NewsAU  Facebook: http://www.facebook.com/10NewsAU/  Instagram: http://www.instagram.com/10NewsAU/  TikTok: https://www.tiktok.com/@10NewsAU   10 News airs at 5 pm, seven nights a week in your local market on Network 10.  Missed the bulletin? Catch up at https://10.com.au/news   10 News is based in Australia and is a division of Paramount.",https://www.youtube.com/watch?v=f6X0E-Wff00,10 News
2026-01-22T08:15:28+00:00,Aussie Teen Recalls Terrifying Landslide At Popular NZ Holiday Park | 10 News+,A major rescue mission is underway after a landslide at a popular campsite in New Zealand. An Aussie teen on holiday at the park recalls the terrifying moment rubble started to fall.   Join the conversation and follow us on:    Instagram: https://www.instagram.com/10NewsPlus/    TikTok: https://www.tiktok.com/@10newsplus/   Facebook: https://www.facebook.com/10newsplus/   Snapchat: https://www.snapchat.com/add/tennewsplus   Spotify: https://open.spotify.com/show/0tWZ6sIJTQ2WHgYdjgaAA7?si=cb30d7fd3d3541fa    10 News+ airs at 6pm on Monday to Friday and at 6:30pm on Sunday on Network 10.   Missed the bulletin? Catch up at https://10.com.au/news/    10 News+ is based in Australia and is a division of Paramount.,https://www.youtube.com/watch?v=vyuHul9Ghsg,10 News
2026-01-22T08:30:28+00:00,Coalition Split Could See More Support for One Nation | 10 News+,"One Nation stands set to benefit the most as right-leaning voters become disillusioned. Barnaby Joyce told 10 News Plus it’s almost as if his former Coalition colleagues are recruiting for his new party. He says no Nationals MPs have formally asked about following him to Pauline Hanson’s party, but after the chaos of this week, “they’d better start thinking about it.”    Join the conversation and follow us on:    Instagram: https://www.instagram.com/10NewsPlus/   TikTok: https://www.tiktok.com/@10newsplus/   Facebook: https://www.facebook.com/10newsplus/   Snapchat: https://www.snapchat.com/add/tennewsplus   Spotify: https://open.spotify.com/show/0tWZ6sIJTQ2WHgYdjgaAA7?si=cb30d7fd3d3541fa    10 News+ airs at 6pm on Monday to Friday and at 6:30pm on Sunday on Network 10.   Missed the bulletin? Catch up at https://10.com.au/news/    10 News+ is based in Australia and is a division of Paramount.",https://www.youtube.com/watch?v=Pwb30_tAKxE,10 News
2026-01-22T08:45:01+00:00,‘Healthy’ Purple Tomato To Hit Aussie Shelves For First Time | 10 News+,"Genetically-modified purple tomatoes, which have been designed to have more antioxidants and the same health benefits as blueberries, have been approved to be sold in Australia.    Join the conversation and follow us on:    Instagram: https://www.instagram.com/10NewsPlus/   TikTok: https://www.tiktok.com/@10newsplus/   Facebook: https://www.facebook.com/10newsplus/   Snapchat: https://www.snapchat.com/add/tennewsplus   Spotify: https://open.spotify.com/show/0tWZ6sIJTQ2WHgYdjgaAA7?si=cb30d7fd3d3541fa    10 News+ airs at 6pm on Monday to Friday and at 6:30pm on Sunday on Network 10.   Missed the bulletin? Catch up at https://10.com.au/news/    10 News+ is based in Australia and is a division of Paramount.",https://www.youtube.com/watch?v=AZBNIBkFQ5g,10 News
2026-01-22T08:57:03+00:00,Aussie Teen Nearly Buried Alive In NZ Landslide | 10 News+,"“It was like a tsunami of dirt.”  An Aussie teen reveals their incredible story of survival after a landslide has left multiple people missing, including children, at a popular holiday park in New Zealand.  Join the conversation and follow us on:  Instagram: https://www.instagram.com/10NewsPlus/  TikTok: https://www.tiktok.com/@10newsplus/  Snapchat: https://www.snapchat.com/add/tennewsplus   Spotify: https://open.spotify.com/show/0tWZ6sIJTQ2WHgYdjgaAA7?si=cb30d7fd3d3541fa    10 News+ airs at 6pm on Monday to Friday and at 6:30pm on Sunday on Network 10.  Missed the bulletin? Catch up at https://10.com.au/news/   10 News+ is based in Australia and is a division of Paramount.",https://www.youtube.com/shorts/pAxEpBloWic,10 News
2026-01-22T10:58:38+00:00,Manhunt Underway After Three People Killed In NSW Country Town | 10 News,"Three people have been killed and another man seriously injured after a gunman opened fire in country New South Wales, in what's believed to be a domestic violence attack. It happened in the town of Lake Cargelligo more than 450 kilometres away from Sydney – where locals are being told to stay indoors tonight.  Join the conversation and follow us on: Twitter: http://twitter.com/10NewsAU Facebook: http://www.facebook.com/10NewsAU/ Instagram: http://www.instagram.com/10NewsAU/ TikTok: https://www.tiktok.com/@10NewsAU 10 News airs at 5pm, seven nights a week in your local market on Network 10. Missed the bulletin? Catch up at https://10.com.au/news 10 News is based in Australia and is a division of Paramount.",https://www.youtube.com/watch?v=v2srkkm7oPU,10 News
2026-01-22T10:58:41+00:00,Donald Trump Announces Members And Charter Of Board Of Peace | 10 News,"Donald Trump has unveiled his “Board of Peace” and will soon meet with Ukraine's Volodymyr Zelenskyy on the sidelines of the Davos summit.  But there's already been an extraordinary about turn from the President, who walked back his threats to invade Greenland and impose tariffs on eight European nations for standing in his way.   Join the conversation and follow us on: Twitter: http://twitter.com/10NewsAU Facebook: http://www.facebook.com/10NewsAU/ Instagram: http://www.instagram.com/10NewsAU/ TikTok: https://www.tiktok.com/@10NewsAU 10 News airs at 5pm, seven nights a week in your local market on Network 10. Missed the bulletin? Catch up at https://10.com.au/news 10 News is based in Australia and is a division of Paramount.",https://www.youtube.com/watch?v=zy0W8BfLwAY,10 News
2026-01-22T10:58:44+00:00,Memorial Service At Sydney Opera House To Honour Victims Of Bondi Beach Shooting | 10 News,"Light will win – that was the message from tonight's memorial service to honour the lives of the 15 people murdered at Bondi Beach. Family and friends gave heartfelt tributes to the dead, as they try to 'live without' the ones they will always love.   Join the conversation and follow us on: Twitter: http://twitter.com/10NewsAU Facebook: http://www.facebook.com/10NewsAU/ Instagram: http://www.instagram.com/10NewsAU/ TikTok: https://www.tiktok.com/@10NewsAU 10 News airs at 5pm, seven nights a week in your local market on Network 10. Missed the bulletin? Catch up at https://10.com.au/news 10 News is based in Australia and is a division of Paramount.",https://www.youtube.com/watch?v=LgKq9FPc_H8,10 News
2026-01-22T11:00:16+00:00,"Three Killed In NSW Shooting, Memorial Service For Bondi Victims, NZ Landslide | 10’s Late News","Tonight on 10’s Late News – three people have been killed and another seriously injured after a gunman opened fire in country NSW this evening, a memorial service has been held for the victims of the Bondi Beach terror attack last month, a man has been caught pretending to be a pilot to scam free flights and Bill and Hillary Clinton could be held in contempt of Congress after the House Oversight Committee responded to their decision not to testify in the ongoing investigation into Jeffrey Epstein.  Join the conversation and follow us on: TikTok: http://www.tiktok.com/@10NewsAU/ Instagram: http://www.instagram.com/10NewsAU/ Twitter: http://twitter.com/10NewsAU Facebook: http://www.facebook.com/10NewsAU/  10 News airs at 5pm, seven nights a week in your local market on Network 10. Missed the bulletin? Catch up at https://10.com.au/news  10 News is based in Australia and is a division of Paramount.",https://www.youtube.com/watch?v=HRKiWRqd_Tw,10 News
