published,title,description,link,Pub
2026-03-03T06:57:21+00:00,CCTV Shows Moment Sydney Trio Attempt To Shoot Homeowner In Failed Home Invasion | 10 News,"Three masked men have failed an attempted home invasion in Sydney's West. With CCTV showing the moment they tried to plough down the door and shoot the homeowner.   Join the conversation and follow us on:   X: https://x.com/10NewsAU  Facebook: http://www.facebook.com/10NewsAU/  Instagram: http://www.instagram.com/10NewsAU/  TikTok: https://www.tiktok.com/@10NewsAU  LinkedIn: https://www.linkedin.com/company/10newsau     10 News airs at 5pm, seven nights a week in your local market on Network 10.  Missed the bulletin? Catch up at https://10.com.au/news   10 News is based in Australia and is a division of Paramount.",https://www.youtube.com/watch?v=EGwYZEOobus,10 News
2026-03-03T07:05:51+00:00,Adelaide Man Dead And Son In Law Arrested After Alleged Street Fight | 10 News,"A man has died, and his 25-year-old son-in-law's been arrested, then bailed after both were involved in a street fight in Mount Barker.   Join the conversation and follow us on:   X: https://x.com/10NewsAU  Facebook: http://www.facebook.com/10NewsAU/  Instagram: http://www.instagram.com/10NewsAU/  TikTok: https://www.tiktok.com/@10NewsAU  LinkedIn: https://www.linkedin.com/company/10newsau   10 News airs at 5pm, seven nights a week in your local market on Network 10.  Missed the bulletin? Catch up at https://10.com.au/news   10 News is based in Australia and is a division of Paramount.",https://www.youtube.com/watch?v=Zz3D61T_F_c,10 News
2026-03-03T07:24:44+00:00,Queensland Police Shoot Knife-Wielding Man Dead During Welfare Check | 10 News,"A man has been killed after Police opened fire during a welfare check at a Tingalpa home.   Join the conversation and follow us on:   X: https://x.com/10NewsAU  Facebook: http://www.facebook.com/10NewsAU/  Instagram: http://www.instagram.com/10NewsAU/  TikTok: https://www.tiktok.com/@10NewsAU  LinkedIn: https://www.linkedin.com/company/10newsau     10 News airs at 5pm, seven nights a week in your local market on Network 10.  Missed the bulletin? Catch up at https://10.com.au/news   10 News is based in Australia and is a division of Paramount.",https://www.youtube.com/watch?v=BWvK6H0JWAk,10 News
2026-03-03T07:36:20+00:00,"Kyle And Jackie O Axed, Aussies Abandoned In Middle East, Tourette's Public Abuse | 10 News+","As the US-Iran conflict continues, questions are being raised over whether US President Donald Trump has a long-term plan.  An Aussie grandmother running out of medication is just one of an estimated 115,000 Aussies stranded in the Middle East.  There has been no communication from the Federal Government on whether they will help fly them home, despite other countries already running repatriation flights.  An Australian diagnosed with one of the most severe cases of Tourette Syndrome has endured years of confronting and heartbreaking encounters with strangers, prompting her to raise awareness about the neurological disorder.  10 News+ LIVE: Trusted, in-depth reporting from Australia and around the world. 👍 Like this stream to support our in-depth coverage 🔔 Subscribe and turn on notifications for breaking news alerts ↗ Share this coverage to keep others informed  📲 Stay Across Breaking News 24/7 Instagram: https://www.instagram.com/10NewsPlus/ TikTok: https://www.tiktok.com/@10newsplus/ Snapchat: https://www.snapchat.com/add/tennewsplus 🎧 Listen on Spotify: https://open.spotify.com/show/0tWZ6sIJTQ2WHgYdjgaAA7?si=cb30d7fd3d3541fa  📺 Watch 10 News+ 6pm Monday–Friday | 6:30pm Sunday on Network 10 Missed the bulletin? Catch up anytime 👉 https://10.com.au/news/  10 News+ is based in Australia and is a division of Paramount.",https://www.youtube.com/watch?v=51VuvnNe-uU,10 News
2026-03-03T07:51:35+00:00,Kyle And Jackie O Show Axed After 22 Years | 10 News +,"""Cannot continue to work with Kyle Sandilands.""  The Kyle and Jackie O show has come to an end after 22 years.   Jackie “O” Henderson’s contract has been terminated, while Kyle Sandilands has been suspended for two weeks following an explosive on-air fight.  More here: https://www.youtube.com/watch?v=51VuvnNe-uU  Watch and stream free at 6pm Monday–Friday | 6:30pm Sunday on Channel 10. Catch up on Spotify.",https://www.youtube.com/shorts/cDYpqFJhucc,10 News
2026-03-03T08:16:06+00:00,Aussie Grandmother Stranded In Qatar Running Out Of Medication | 10 News+,"An Aussie grandmother running out of medication is just one of an estimated 115,000 Aussies stranded in the Middle East.   There has been no communication from the Federal Government on whether they will help fly them home, despite other countries already running repatriation flights.   Join the conversation and follow us on:   Instagram: https://www.instagram.com/10NewsPlus/  TikTok: https://www.tiktok.com/@10newsplus/  Facebook: https://www.facebook.com/10newsplus/  Snapchat: https://www.snapchat.com/add/tennewsplus  Spotify: https://open.spotify.com/show/0tWZ6sIJTQ2WHgYdjgaAA7?si=cb30d7fd3d3541fa   10 News+ airs at 6pm on Monday to Friday and at 6:30pm on Sunday on Network 10.  Missed the bulletin? Catch up at https://10.com.au/news/ or https://youtube.com/live/51VuvnNe-uU?feature=share",https://www.youtube.com/watch?v=YU8JXBu8i5E,10 News
2026-03-03T08:30:00+00:00,What Is Really Behind Trump’s Motives In Iran? | 10 News+,"As the US-Iran conflict continues, questions are being raised over whether US President Donald Trump has a long-term plan.   Join the conversation and follow us on:   Instagram: https://www.instagram.com/10NewsPlus/  TikTok: https://www.tiktok.com/@10newsplus/  Facebook: https://www.facebook.com/10newsplus/  Snapchat: https://www.snapchat.com/add/tennewsplus  Spotify: https://open.spotify.com/show/0tWZ6sIJTQ2WHgYdjgaAA7?si=cb30d7fd3d3541fa   10 News+ airs at 6pm on Monday to Friday and at 6:30pm on Sunday on Network 10.  Missed the bulletin? Catch up at https://10.com.au/news/ or https://youtube.com/live/51VuvnNe-uU?feature=share",https://www.youtube.com/watch?v=0CDCbCw3NmM,10 News
2026-03-03T08:45:00+00:00,Kyle And Jackie O Show Axed After On Air Fight | 10 News+,"The Kyle and Jackie O show has come to an end after 22 years.   Jackie “O” Henderson’s contract has been terminated, while Kyle Sandilands has been suspended for two weeks following an explosive on-air fight.    Join the conversation and follow us on:   Instagram: https://www.instagram.com/10NewsPlus/  TikTok: https://www.tiktok.com/@10newsplus/  Facebook: https://www.facebook.com/10newsplus/  Snapchat: https://www.snapchat.com/add/tennewsplus  Spotify: https://open.spotify.com/show/0tWZ6sIJTQ2WHgYdjgaAA7?si=cb30d7fd3d3541fa   10 News+ airs at 6pm on Monday to Friday and at 6:30pm on Sunday on Network 10.  Missed the bulletin? Catch up at https://10.com.au/news/ or https://youtube.com/live/51VuvnNe-uU?feature=share",https://www.youtube.com/watch?v=8uLtz7rXDzs,10 News
2026-03-03T09:00:18+00:00,Aussie With World’s Most Severe Tourette’s Reveals Horror Public Encounters | 10 News+,"An Australian diagnosed with one of the most severe cases of Tourette Syndrome has endured years of confronting and heartbreaking encounters with strangers, prompting her to raise awareness about the neurological disorder.   Join the conversation and follow us on:   Instagram: https://www.instagram.com/10NewsPlus/  TikTok: https://www.tiktok.com/@10newsplus/  Facebook: https://www.facebook.com/10newsplus/  Snapchat: https://www.snapchat.com/add/tennewsplus  Spotify: https://open.spotify.com/show/0tWZ6sIJTQ2WHgYdjgaAA7?si=cb30d7fd3d3541fa    10 News+ airs at 6pm on Monday to Friday and at 6:30pm on Sunday on Network 10.  Missed the bulletin? Catch up at https://10.com.au/news/ or https://youtube.com/live/51VuvnNe-uU?feature=share",https://www.youtube.com/watch?v=HcnoVxYOk64,10 News
2026-03-03T09:11:39+00:00,Michelangelo Fresco Gets A Facial | 10 News,"A Michelangelo masterpiece that adorns the Sistine Chapel is getting a facial, as the sweat of millions of visitors has caused a salty white film to form on the fresco.   Join the conversation and follow us on: X: https://x.com/10NewsAU Facebook: http://www.facebook.com/10NewsAU/ Instagram: http://www.instagram.com/10NewsAU/ TikTok: https://www.tiktok.com/@10NewsAU LinkedIn: https://www.linkedin.com/company/10newsau  10 News airs at 5pm, seven nights a week in your local market on Network 10. Missed the bulletin? Catch up at https://10.com.au/news  10 News is based in Australia and is a division of Paramount.",https://www.youtube.com/shorts/QpxCK8NLOI0,10 News
2026-03-03T11:06:41+00:00,Israel Launches Ground Invasion Of Lebanon | 10 News,"Israel has launched a ground invasion of southern Lebanon as the nation’s defence minister says they have been authorised to seize strategic areas.  It comes as conflict continues to intensify in the Middle East, with more than 115,000 Australians stranded in the region.  Join the conversation and follow us on: X: https://x.com/10NewsAU Facebook: http://www.facebook.com/10NewsAU/ Instagram: http://www.instagram.com/10NewsAU/ TikTok: https://www.tiktok.com/@10NewsAU LinkedIn: https://www.linkedin.com/company/10newsau  10 News airs at 5pm, seven nights a week in your local market on Network 10. Missed the bulletin? Catch up at https://10.com.au/news  10 News is based in Australia and is a division of Paramount.",https://www.youtube.com/watch?v=df0zj-3L4W0,10 News
2026-03-03T11:07:43+00:00,8-Year-Old Australian Girl Dies At Japan Ski Resort | 10 News,"An 8-year-old girl from Queensland has been tragically killed on the ski slopes of Japan while holidaying with her family.  Reports suggest Chloe Jeffries was riding as a passenger on her mother’s snowmobile near Hakuba Village when it flipped over an embankment.  Join the conversation and follow us on: X: https://x.com/10NewsAU Facebook: http://www.facebook.com/10NewsAU/ Instagram: http://www.instagram.com/10NewsAU/ TikTok: https://www.tiktok.com/@10NewsAU LinkedIn: https://www.linkedin.com/company/10newsau  10 News airs at 5pm, seven nights a week in your local market on Network 10. Missed the bulletin? Catch up at https://10.com.au/news  10 News is based in Australia and is a division of Paramount.",https://www.youtube.com/watch?v=DR0XLlZ-x2s,10 News
2026-03-03T11:52:33+00:00,Scotland Legalises Water Cremation | 10 News,"Scotland has become the first UK nation to legalise water cremation, famously chosen by Archbishop Desmond Tutu for his own farewell.  10’s Late News explains the process of alkaline hydrolysis and how it’s being viewed as a green alternative.    Join the conversation and follow us on: X: https://x.com/10NewsAU Facebook: http://www.facebook.com/10NewsAU/ Instagram: http://www.instagram.com/10NewsAU/ TikTok: https://www.tiktok.com/@10NewsAU LinkedIn: https://www.linkedin.com/company/10newsau  10 News airs at 5pm, seven nights a week in your local market on Network 10. Missed the bulletin? Catch up at https://10.com.au/news  10 News is based in Australia and is a division of Paramount.",https://www.youtube.com/shorts/eqQkSFpJcy4,10 News
2026-03-03T11:55:01+00:00,Exclusive One-On-One With Oscar Piastri Ahead Of Australian Grand Prix | 10 News,"Formula One driver Oscar Piastri is gearing up for pole position at the upcoming Australian Grand Prix in Melbourne.  Despite disruptions caused by the conflict in the Middle East, the race is set to go ahead on Sunday at 3pm AEDT.  Join the conversation and follow us on: X: https://x.com/10NewsAU Facebook: http://www.facebook.com/10NewsAU/ Instagram: http://www.instagram.com/10NewsAU/ TikTok: https://www.tiktok.com/@10NewsAU LinkedIn: https://www.linkedin.com/company/10newsau  10 News airs at 5pm, seven nights a week in your local market on Network 10. Missed the bulletin? Catch up at https://10.com.au/news  10 News is based in Australia and is a division of Paramount.",https://www.youtube.com/watch?v=5kbAzdC1x-8,10 News
2026-03-03T12:05:06+00:00,"Israel Invades Lebanon, Jackie O Quits, Oscar Piastri In Melbourne | 10’s Late News","Tonight on 10’s Late News – Israel launches a ground invasion of Lebanon, Jackie O has quit the KIIS FM breakfast show after an on-air feud with Kyle Sandilands, an 8-year-old Australian girl has been killed in a snowmobile accident in Japan, a Sydney homeowner has survived an attempted shooting at his front door,  an armed man has been shot dead by police in Sydney, F1 driver Oscar Piastri has landed in his hometown of Melbourne ahead of the Australian Grand Prix, a Perth restaurant owner has been fined after a family was served insect repellant instead of cranberry juice, Bill and Hillary Clinton continue to adamantly deny any knowledge of sex-offender Jeffrey Epstein’s crimes, France is set to grow its nuclear warhead arsenal for the first time since the Cold War, more than 115,000 Australians remain stranded in the Middle East, a ‘Jeffrey Epstein Walk of Shame’ has popped up just a few steps away from the White House, and a United Airlines plane has been forced to make an emergency landing after fears of a catastrophic engine fire.   Join the conversation and follow us on: X: https://x.com/10NewsAU Facebook: http://www.facebook.com/10NewsAU/ Instagram: http://www.instagram.com/10NewsAU/ TikTok: https://www.tiktok.com/@10NewsAU LinkedIn: https://www.linkedin.com/company/10newsau  10 News airs at 5pm, seven nights a week in your local market on Network 10. Missed the bulletin? Catch up at https://10.com.au/news  10 News is based in Australia and is a division of Paramount.",https://www.youtube.com/watch?v=otEeprPyfzM,10 News
