published,title,description,link,Pub
2025-12-24T08:29:34+00:00,"Man charged with anti-Semetic posts, remembering Katie Allen and fatal stabbing details | 7NEWS","Subscribe and set 🔔 » https://7news.link/YTSubscribe |   For the latest Australian news and breaking news alerts, connect with 7NEWS online: Visit » https://7news.com.au 7Plus » https://7plus.com.au/ 7NEWS Podcast » https://open.spotify.com/user/dm9fk9hzoe68ibpttheragdgi Facebook » https://www.facebook.com/7NewsAustralia TikTok » https://www.tiktok.com/@7newsaustralia Instagram » https://www.instagram.com/7newsaustralia/  X » https://x.com/7NewsAustralia   7NEWS combines the trusted and powerful news brands including Sunrise, The Morning Show, Spotlight and 7NEWS.com.au, delivering unique, engaging and continuous coverage on the issues that matter most to Australians. Watch 7 News Australia full broadcasts and full episodes at 6pm and weekdays at 12pm and 4pm on Channel 7 and 7plus.  #BREAKINGNEWS #7NEWS",https://www.youtube.com/watch?v=Oi4yAcLtY-0,7News
2025-12-24T08:38:12+00:00,New records from investigation into Epstein released | 7NEWS,"Subscribe and set 🔔 » https://7news.link/YTSubscribe |   For the latest Australian news and breaking news alerts, connect with 7NEWS online: Visit » https://7news.com.au 7Plus » https://7plus.com.au/ 7NEWS Podcast » https://open.spotify.com/user/dm9fk9hzoe68ibpttheragdgi Facebook » https://www.facebook.com/7NewsAustralia TikTok » https://www.tiktok.com/@7newsaustralia Instagram » https://www.instagram.com/7newsaustralia/  X » https://x.com/7NewsAustralia   7NEWS combines the trusted and powerful news brands including Sunrise, The Morning Show, Spotlight and 7NEWS.com.au, delivering unique, engaging and continuous coverage on the issues that matter most to Australians. Watch 7 News Australia full broadcasts and full episodes at 6pm and weekdays at 12pm and 4pm on Channel 7 and 7plus.  #BREAKINGNEWS #7NEWS",https://www.youtube.com/watch?v=5gfcsbdeC1Q,7News
2025-12-24T08:42:04+00:00,"Fast-moving grass fire, hunt for break-in suspects and Israeli President to visit Australia | 7NEWS","Subscribe and set 🔔 » https://7news.link/YTSubscribe |   For the latest Australian news and breaking news alerts, connect with 7NEWS online: Visit » https://7news.com.au 7Plus » https://7plus.com.au/ 7NEWS Podcast » https://open.spotify.com/user/dm9fk9hzoe68ibpttheragdgi Facebook » https://www.facebook.com/7NewsAustralia TikTok » https://www.tiktok.com/@7newsaustralia Instagram » https://www.instagram.com/7newsaustralia/  X » https://x.com/7NewsAustralia   7NEWS combines the trusted and powerful news brands including Sunrise, The Morning Show, Spotlight and 7NEWS.com.au, delivering unique, engaging and continuous coverage on the issues that matter most to Australians. Watch 7 News Australia full broadcasts and full episodes at 6pm and weekdays at 12pm and 4pm on Channel 7 and 7plus.  #BREAKINGNEWS #7NEWS",https://www.youtube.com/watch?v=ZUlb_mjICTQ,7News
2025-12-24T09:00:55+00:00,Santa sets off from North Pole,Santa Claus has been spotted leaving the North Pole to start his long journey delivering Christmas gifts to the children of the world from his official hometown in the Arctic Circle. #santa #santaclaus #northpole #christmas #sleigh,https://www.youtube.com/shorts/ifkFThUNH5I,7News
2025-12-24T09:04:16+00:00,Newborn home after experiencing neonatal stroke | 7NEWS,"Subscribe and set 🔔 » https://7news.link/YTSubscribe |   For the latest Australian news and breaking news alerts, connect with 7NEWS online: Visit » https://7news.com.au 7Plus » https://7plus.com.au/ 7NEWS Podcast » https://open.spotify.com/user/dm9fk9hzoe68ibpttheragdgi Facebook » https://www.facebook.com/7NewsAustralia TikTok » https://www.tiktok.com/@7newsaustralia Instagram » https://www.instagram.com/7newsaustralia/  X » https://x.com/7NewsAustralia   7NEWS combines the trusted and powerful news brands including Sunrise, The Morning Show, Spotlight and 7NEWS.com.au, delivering unique, engaging and continuous coverage on the issues that matter most to Australians. Watch 7 News Australia full broadcasts and full episodes at 6pm and weekdays at 12pm and 4pm on Channel 7 and 7plus.  #BREAKINGNEWS #7NEWS",https://www.youtube.com/watch?v=GYunOXwgmWE,7News
2025-12-24T09:14:34+00:00,"Christmas preparations underway, storm power outage and latest Epstein records | 7NEWS","Subscribe and set 🔔 » https://7news.link/YTSubscribe |   For the latest Australian news and breaking news alerts, connect with 7NEWS online: Visit » https://7news.com.au 7Plus » https://7plus.com.au/ 7NEWS Podcast » https://open.spotify.com/user/dm9fk9hzoe68ibpttheragdgi Facebook » https://www.facebook.com/7NewsAustralia TikTok » https://www.tiktok.com/@7newsaustralia Instagram » https://www.instagram.com/7newsaustralia/  X » https://x.com/7NewsAustralia   7NEWS combines the trusted and powerful news brands including Sunrise, The Morning Show, Spotlight and 7NEWS.com.au, delivering unique, engaging and continuous coverage on the issues that matter most to Australians. Watch 7 News Australia full broadcasts and full episodes at 6pm and weekdays at 12pm and 4pm on Channel 7 and 7plus.  #BREAKINGNEWS #7NEWS",https://www.youtube.com/watch?v=cAVS4zxWs5U,7News
2025-12-24T10:27:30+00:00,FIFO worker arrested over extremist material and anti-Semitic posts | 7NEWS,"A 39-year-old former FIFO worker from Yanjabup, Western Australia, has been arrested after allegedly posting messages supporting the Bondi terrorist attack and making anti-Semitic statements online. Police raided his home and discovered six lawfully owned firearms, 4,000 rounds of ammunition, extremist material including Hezbollah and Hamas flags, notebooks with references to Hitler and the Holocaust, and what authorities describe as a bomb-making shopping list. Martin Thomas Glynn faces charges including conduct intended to racially harass, possessing a prohibited weapon, and failure to store a firearm.  Subscribe and set 🔔 » https://7news.link/YTSubscribe |   For the latest Australian news and breaking news alerts, connect with 7NEWS online: Visit » https://7news.com.au 7Plus » https://7plus.com.au/ 7NEWS Podcast » https://open.spotify.com/user/dm9fk9hzoe68ibpttheragdgi Facebook » https://www.facebook.com/7NewsAustralia TikTok » https://www.tiktok.com/@7newsaustralia Instagram » https://www.instagram.com/7newsaustralia/ X » https://x.com/7NewsAustralia  7NEWS combines the trusted and powerful news brands including Sunrise, The Morning Show, Spotlight and 7NEWS.com.au, delivering unique, engaging and continuous coverage on the issues that matter most to Australians. Watch 7 News Australia full broadcasts and full episodes at 6pm and weekdays at 12pm and 4pm on Channel 7 and 7plus.  #BREAKINGNEWS #7NEWS",https://www.youtube.com/watch?v=4ZbepAiA77s,7News
2025-12-24T10:27:57+00:00,Girl fights for life after Trigg Beach drowning | 7NEWS,"A 12-year-old girl remains in critical condition at Perth Children's Hospital after being caught in a rip at Trigg Beach's Blue Hole and found unresponsive. A local surfer rescued her companion while surf lifesavers and off-duty doctors performed CPR for 20 minutes before paramedics arrived. Authorities are urging beach safety ahead of Christmas with temperatures expected to reach 40 degrees, noting that 27 people drowned last year with over 990 rescues performed.  Subscribe and set 🔔 » https://7news.link/YTSubscribe |   For the latest Australian news and breaking news alerts, connect with 7NEWS online: Visit » https://7news.com.au 7Plus » https://7plus.com.au/ 7NEWS Podcast » https://open.spotify.com/user/dm9fk9hzoe68ibpttheragdgi Facebook » https://www.facebook.com/7NewsAustralia TikTok » https://www.tiktok.com/@7newsaustralia Instagram » https://www.instagram.com/7newsaustralia/ X » https://x.com/7NewsAustralia  7NEWS combines the trusted and powerful news brands including Sunrise, The Morning Show, Spotlight and 7NEWS.com.au, delivering unique, engaging and continuous coverage on the issues that matter most to Australians. Watch 7 News Australia full broadcasts and full episodes at 6pm and weekdays at 12pm and 4pm on Channel 7 and 7plus.  #BREAKINGNEWS #7NEWS",https://www.youtube.com/watch?v=FXvvj-T_Ljw,7News
2025-12-24T10:29:30+00:00,"Extremist arrested, PM honours Bondi heroes and more Epstein files released | 7NEWS","Subscribe and set 🔔 » https://7news.link/YTSubscribe |   For the latest Australian news and breaking news alerts, connect with 7NEWS online: Visit » https://7news.com.au 7Plus » https://7plus.com.au/ 7NEWS Podcast » https://open.spotify.com/user/dm9fk9hzoe68ibpttheragdgi Facebook » https://www.facebook.com/7NewsAustralia TikTok » https://www.tiktok.com/@7newsaustralia Instagram » https://www.instagram.com/7newsaustralia/  X » https://x.com/7NewsAustralia   7NEWS combines the trusted and powerful news brands including Sunrise, The Morning Show, Spotlight and 7NEWS.com.au, delivering unique, engaging and continuous coverage on the issues that matter most to Australians. Watch 7 News Australia full broadcasts and full episodes at 6pm and weekdays at 12pm and 4pm on Channel 7 and 7plus.  #BREAKINGNEWS #7NEWS",https://www.youtube.com/watch?v=d2FQhJ-_Xqc,7News
2025-12-24T21:00:47+00:00,"Robbie Williams calls 94-year-old superfan, Norma",Robbie Williams has surprised an elderly fan in England with a special Christmas message. The superstar singer-songwriter spoke to Norma in a video call after a previous clip online showed the 94-year-old talking about how she wanted to see him. #robbiewilliams #facetime #grimsby #england #uk,https://www.youtube.com/shorts/V6_X-br8FEI,7News
2025-12-24T23:01:15+00:00,The toys Aussie kids wanted for Christmas in 1985,"From Barbie dolls and Cabbage Patch Kids to Transformers and board games, see what toys Aussie kids wanted for Christmas 40 years ago. #christmas #santa #toys #presents #gifts",https://www.youtube.com/shorts/BHV6wKXFXHk,7News
2025-12-25T02:00:33+00:00,Croatian divers put their own underwater twist on the festive celebrations,"Everyone celebrates Christmas in a special way and these Croatian divers from the Underwater Sports Society, put their own underwater twist on the festive celebrations at the bottom of Lake Jarun. #Christmas #Croatia #Diver #Christmastree",https://www.youtube.com/shorts/Vx1f1zUOf80,7News
2025-12-25T04:00:51+00:00,"Spencer, WI police arrest the Grinch for 'trying to steal Christmas'","Police in Spencer, Wisconsin arrested The Grinch after he was caught ""trying to steal Christmas"". The grumpy green menace was forced to sing Rudolph The Red-Nosed Reindeer as part of his punishment. #grinch #xmas #christmas #police #arrest",https://www.youtube.com/shorts/tTBkArnsw1E,7News
2025-12-25T06:00:58+00:00,How to claim hundreds of dollars in Medicare benefits by logging onto myGov website,"Did you know you could have hundreds of dollars in unclaimed Medicare benefits? If you're strapped for cash these holidays, the process to get the money is as easy as going onto the myGov website. 250,000 Australians aged between 18 to 24 are collectively owed $62.8 million, or $275 per person on average. #medicare #money #finance #mygov #servicesaustralia",https://www.youtube.com/shorts/HZvewDsBFxE,7News
2025-12-25T23:01:02+00:00,7NEWS archive: 2004 Boxing Day tsunami in Asia,"It's been 21 years since the devastating Indian Ocean earthquake and tsunami of 2004. It was Boxing Day when a 9.2-9.3 magnitude earthquake struck off the west coast of Aceh in northern Sumatra, Indonesia. Approximately 275,000 people were killed across 14 countries, marking it one of the largest natural disasters in recorded history. #tsunami #boxingdaytsunami #earthquake #naturaldisaster #Asia",https://www.youtube.com/watch?v=UI7PRBcWAlg,7News
