published,title,description,link,Pub
2026-01-30T08:28:52+00:00,"2GB and 2UE sold, $25 billion hospital deal and Police open fire on stolen car in Geelong | 7NEWS","Subscribe and set 🔔 » https://7news.link/YTSubscribe |   For the latest Australian news and breaking news alerts, connect with 7NEWS online: Visit » https://7news.com.au 7Plus » https://7plus.com.au/ 7NEWS Podcast » https://open.spotify.com/user/dm9fk9hzoe68ibpttheragdgi Facebook » https://www.facebook.com/7NewsAustralia TikTok » https://www.tiktok.com/@7newsaustralia Instagram » https://www.instagram.com/7newsaustralia/  X » https://x.com/7NewsAustralia   7NEWS combines the trusted and powerful news brands including Sunrise, The Morning Show, Spotlight and 7NEWS.com.au, delivering unique, engaging and continuous coverage on the issues that matter most to Australians. Watch 7 News Australia full broadcasts and full episodes at 6pm and weekdays at 12pm and 4pm on Channel 7 and 7plus.  #BREAKINGNEWS #7NEWS",https://www.youtube.com/watch?v=PFrqlGmgJ5o,7News
2026-01-30T08:32:18+00:00,Final farewell for iconic V-set train | 7NEWS,"Fans packed in at Central Station to farewell the final V-set train. After millions of kilometres, the fleet has reached the end of the line.  Subscribe and set 🔔 » https://7news.link/YTSubscribe |   For the latest Australian news and breaking news alerts, connect with 7NEWS online: Visit » https://7news.com.au 7Plus » https://7plus.com.au/ 7NEWS Podcast » https://open.spotify.com/user/dm9fk9hzoe68ibpttheragdgi Facebook » https://www.facebook.com/7NewsAustralia TikTok » https://www.tiktok.com/@7newsaustralia Instagram » https://www.instagram.com/7newsaustralia/ X » https://x.com/7NewsAustralia  7NEWS combines the trusted and powerful news brands including Sunrise, The Morning Show, Spotlight and 7NEWS.com.au, delivering unique, engaging and continuous coverage on the issues that matter most to Australians. Watch 7 News Australia full broadcasts and full episodes at 6pm and weekdays at 12pm and 4pm on Channel 7 and 7plus.  #BREAKINGNEWS #7NEWS",https://www.youtube.com/watch?v=OsN1bthMPG8,7News
2026-01-30T08:33:45+00:00,Concord High unveils major school upgrade | 7NEWS,"Concord High School has completed a major infrastructure upgrade featuring 40 new permanent teaching spaces across three buildings, including 32 general classrooms, specialist facilities for visual arts, performing arts and health and movement science, a new school hall, and updated administration areas.  Subscribe and set 🔔 » https://7news.link/YTSubscribe |   For the latest Australian news and breaking news alerts, connect with 7NEWS online: Visit » https://7news.com.au 7Plus » https://7plus.com.au/ 7NEWS Podcast » https://open.spotify.com/user/dm9fk9hzoe68ibpttheragdgi Facebook » https://www.facebook.com/7NewsAustralia TikTok » https://www.tiktok.com/@7newsaustralia Instagram » https://www.instagram.com/7newsaustralia/ X » https://x.com/7NewsAustralia  7NEWS combines the trusted and powerful news brands including Sunrise, The Morning Show, Spotlight and 7NEWS.com.au, delivering unique, engaging and continuous coverage on the issues that matter most to Australians. Watch 7 News Australia full broadcasts and full episodes at 6pm and weekdays at 12pm and 4pm on Channel 7 and 7plus.  #BREAKINGNEWS #7NEWS",https://www.youtube.com/watch?v=ButIr_ntv9g,7News
2026-01-30T08:39:41+00:00,Brain chip gives paralysed patients new independence | 7NEWS,"A computer chip implanted in the brain is enabling paraplegics to control computers using only their thoughts.   Subscribe and set 🔔 » https://7news.link/YTSubscribe |   For the latest Australian news and breaking news alerts, connect with 7NEWS online: Visit » https://7news.com.au 7Plus » https://7plus.com.au/ 7NEWS Podcast » https://open.spotify.com/user/dm9fk9hzoe68ibpttheragdgi Facebook » https://www.facebook.com/7NewsAustralia TikTok » https://www.tiktok.com/@7newsaustralia Instagram » https://www.instagram.com/7newsaustralia/ X » https://x.com/7NewsAustralia  7NEWS combines the trusted and powerful news brands including Sunrise, The Morning Show, Spotlight and 7NEWS.com.au, delivering unique, engaging and continuous coverage on the issues that matter most to Australians. Watch 7 News Australia full broadcasts and full episodes at 6pm and weekdays at 12pm and 4pm on Channel 7 and 7plus.  #BREAKINGNEWS #7NEWS",https://www.youtube.com/watch?v=EJHlosgTAGc,7News
2026-01-30T08:49:51+00:00,The western world ramps up the pressure on Iran | 7NEWS,"Subscribe and set 🔔 » https://7news.link/YTSubscribe |   For the latest Australian news and breaking news alerts, connect with 7NEWS online: Visit » https://7news.com.au 7Plus » https://7plus.com.au/ 7NEWS Podcast » https://open.spotify.com/user/dm9fk9hzoe68ibpttheragdgi Facebook » https://www.facebook.com/7NewsAustralia TikTok » https://www.tiktok.com/@7newsaustralia Instagram » https://www.instagram.com/7newsaustralia/  X » https://x.com/7NewsAustralia   7NEWS combines the trusted and powerful news brands including Sunrise, The Morning Show, Spotlight and 7NEWS.com.au, delivering unique, engaging and continuous coverage on the issues that matter most to Australians. Watch 7 News Australia full broadcasts and full episodes at 6pm and weekdays at 12pm and 4pm on Channel 7 and 7plus.  #BREAKINGNEWS #7NEWS",https://www.youtube.com/watch?v=GIXOfsRN_XU,7News
2026-01-30T08:59:24+00:00,"Police question charity founder , man killed in bulldozer accident and Liberal leader battle | 7NEWS","Subscribe and set 🔔 » https://7news.link/YTSubscribe |   For the latest Australian news and breaking news alerts, connect with 7NEWS online: Visit » https://7news.com.au 7Plus » https://7plus.com.au/ 7NEWS Podcast » https://open.spotify.com/user/dm9fk9hzoe68ibpttheragdgi Facebook » https://www.facebook.com/7NewsAustralia TikTok » https://www.tiktok.com/@7newsaustralia Instagram » https://www.instagram.com/7newsaustralia/  X » https://x.com/7NewsAustralia   7NEWS combines the trusted and powerful news brands including Sunrise, The Morning Show, Spotlight and 7NEWS.com.au, delivering unique, engaging and continuous coverage on the issues that matter most to Australians. Watch 7 News Australia full broadcasts and full episodes at 6pm and weekdays at 12pm and 4pm on Channel 7 and 7plus.  #BREAKINGNEWS #7NEWS",https://www.youtube.com/watch?v=ZrLPLOeD06A,7News
2026-01-30T09:00:38+00:00,Public servants take more sick leaves than private workers,New statistics show public servants take a lot more sick days than workers in the private sector. #sickleaves #publicservants #workers,https://www.youtube.com/shorts/sJRcyLbwgxA,7News
2026-01-30T09:01:22+00:00,"""Border tsar"" to make ICE operations safer in Minneapolis","Donald Trump's proclaimed ""border tsar"", Tom Homan, says he is working on making ICE operations in Minneapolis safer and more efficient, after taking over immigration enforcement operations. #bordertsar #tomhoman #immigration #ICE #Minneapolis  #minneapolis",https://www.youtube.com/shorts/uVNBWQ4Uz00,7News
2026-01-30T09:45:03+00:00,"Strong winds cause Qantas flight diversion, wild school brawl and high alert for Nipah virus | 7NEWS","Subscribe and set 🔔 » https://7news.link/YTSubscribe |   For the latest Australian news and breaking news alerts, connect with 7NEWS online: Visit » https://7news.com.au 7Plus » https://7plus.com.au/ 7NEWS Podcast » https://open.spotify.com/user/dm9fk9hzoe68ibpttheragdgi Facebook » https://www.facebook.com/7NewsAustralia TikTok » https://www.tiktok.com/@7newsaustralia Instagram » https://www.instagram.com/7newsaustralia/  X » https://x.com/7NewsAustralia   7NEWS combines the trusted and powerful news brands including Sunrise, The Morning Show, Spotlight and 7NEWS.com.au, delivering unique, engaging and continuous coverage on the issues that matter most to Australians. Watch 7 News Australia full broadcasts and full episodes at 6pm and weekdays at 12pm and 4pm on Channel 7 and 7plus.  #BREAKINGNEWS #7NEWS",https://www.youtube.com/watch?v=gVVQE8LfoZ8,7News
2026-01-30T10:00:50+00:00,"Man arrested over Pokémon card robbery in Edmond, Oklahoma","Police have arrested a shirtless suspect in the freezing cold after thousands of dollars worth of Pokémon cards were stolen from a business in Edmond, Oklahoma. Police say the man crashed a stolen vehicle into a mailbox before fleeing on foot, when he was apprehended in -11C weather. ""Gotta catch ’em all… including the suspect,"" the police department joked on Facebook. #pokemon #police #arrest #bodycam #oklahoma",https://www.youtube.com/shorts/BOZKPQadwAg,7News
2026-01-30T10:13:30+00:00,"Police shooting in Geelong, two teens hospitalised and council crackdown on statue vandalism | 7NEWS","Subscribe and set 🔔 » https://7news.link/YTSubscribe |   For the latest Australian news and breaking news alerts, connect with 7NEWS online: Visit » https://7news.com.au 7Plus » https://7plus.com.au/ 7NEWS Podcast » https://open.spotify.com/user/dm9fk9hzoe68ibpttheragdgi Facebook » https://www.facebook.com/7NewsAustralia TikTok » https://www.tiktok.com/@7newsaustralia Instagram » https://www.instagram.com/7newsaustralia/  X » https://x.com/7NewsAustralia   7NEWS combines the trusted and powerful news brands including Sunrise, The Morning Show, Spotlight and 7NEWS.com.au, delivering unique, engaging and continuous coverage on the issues that matter most to Australians. Watch 7 News Australia full broadcasts and full episodes at 6pm and weekdays at 12pm and 4pm on Channel 7 and 7plus.  #BREAKINGNEWS #7NEWS",https://www.youtube.com/watch?v=ZKmLTQyXyBM,7News
2026-01-30T10:33:23+00:00,Ellenbrook bushfire flares twice in two days | 7NEWS,"A bushfire in Ellenbrook flared up twice over consecutive days, forcing firefighters to protect the same homes multiple times. Investigators believe a discarded cigarette butt, whipped up by strong winds, caused the blaze which destroyed hectares of bushland and damaged nine houses. Water bombers and ground crews successfully prevented complete property loss, though flames came within metres of residential properties built adjacent to bushland.  Subscribe and set 🔔 » https://7news.link/YTSubscribe |   For the latest Australian news and breaking news alerts, connect with 7NEWS online: Visit » https://7news.com.au 7Plus » https://7plus.com.au/ 7NEWS Podcast » https://open.spotify.com/user/dm9fk9hzoe68ibpttheragdgi Facebook » https://www.facebook.com/7NewsAustralia TikTok » https://www.tiktok.com/@7newsaustralia Instagram » https://www.instagram.com/7newsaustralia/ X » https://x.com/7NewsAustralia  7NEWS combines the trusted and powerful news brands including Sunrise, The Morning Show, Spotlight and 7NEWS.com.au, delivering unique, engaging and continuous coverage on the issues that matter most to Australians. Watch 7 News Australia full broadcasts and full episodes at 6pm and weekdays at 12pm and 4pm on Channel 7 and 7plus.  #BREAKINGNEWS #7NEWS",https://www.youtube.com/watch?v=a-FivbPx0sM,7News
2026-01-30T10:33:37+00:00,Mosman Park family tragedy shocks community | 7NEWS,"A Mosman Park family of four, including two teenage boys aged 14 and 16 with significant health challenges, and their parents were found dead in their home along with three pets. Homicide detectives are treating the incident as a double murder-suicide, with evidence suggesting the parents killed their children and themselves. Police discovered the bodies after a visitor found a note warning not to enter and to call authorities.  Subscribe and set 🔔 » https://7news.link/YTSubscribe |   For the latest Australian news and breaking news alerts, connect with 7NEWS online: Visit » https://7news.com.au 7Plus » https://7plus.com.au/ 7NEWS Podcast » https://open.spotify.com/user/dm9fk9hzoe68ibpttheragdgi Facebook » https://www.facebook.com/7NewsAustralia TikTok » https://www.tiktok.com/@7newsaustralia Instagram » https://www.instagram.com/7newsaustralia/ X » https://x.com/7NewsAustralia  7NEWS combines the trusted and powerful news brands including Sunrise, The Morning Show, Spotlight and 7NEWS.com.au, delivering unique, engaging and continuous coverage on the issues that matter most to Australians. Watch 7 News Australia full broadcasts and full episodes at 6pm and weekdays at 12pm and 4pm on Channel 7 and 7plus.  #BREAKINGNEWS #7NEWS",https://www.youtube.com/watch?v=g-Cuzjbr2lc,7News
2026-01-30T10:51:54+00:00,"Family found dead inside home, Ellenbrook fires and Sussan Ley bracing for challenge | 7NEWS","Subscribe and set 🔔 » https://7news.link/YTSubscribe |   For the latest Australian news and breaking news alerts, connect with 7NEWS online: Visit » https://7news.com.au 7Plus » https://7plus.com.au/ 7NEWS Podcast » https://open.spotify.com/user/dm9fk9hzoe68ibpttheragdgi Facebook » https://www.facebook.com/7NewsAustralia TikTok » https://www.tiktok.com/@7newsaustralia Instagram » https://www.instagram.com/7newsaustralia/  X » https://x.com/7NewsAustralia   7NEWS combines the trusted and powerful news brands including Sunrise, The Morning Show, Spotlight and 7NEWS.com.au, delivering unique, engaging and continuous coverage on the issues that matter most to Australians. Watch 7 News Australia full broadcasts and full episodes at 6pm and weekdays at 12pm and 4pm on Channel 7 and 7plus.  #BREAKINGNEWS #7NEWS",https://www.youtube.com/watch?v=ou-gMbtjiDI,7News
2026-01-30T18:30:38+00:00,Coalition in crisis: Liberal & National leaders speak out on historic split | 7NEWS,"The Australian Coalition faces its most serious crisis in decades. In this exclusive episode of The Issue, host Tim Lester sits down with two Coalition veterans - former Nationals leader Michael McCormack and Liberal Senator Richard Colbeck - as they reveal what's really happening behind the scenes.  With the Coalition splitting for the second time in nine months, both politicians offer rare insights into: - The ultimatum that broke the partnership - Whether Susan Ley can survive as Liberal leader - David Littleproud's controversial demands - The impact of Barnaby Joyce joining One Nation - Whether the Coalition can reunite before the next election - What happens if they don't  ""To stay separated would be disastrous,"" warns McCormack. ""I'm not sure how we recover that at this point in time,"" admits Colbeck.  As both parties prepare for crucial party room meetings, this conversation captures a pivotal moment in Australian political history.  #AustralianPolitics #Coalition #LiberalParty #NationalParty #TheIssue  Subscribe and set 🔔 » https://7news.link/YTSubscribe |   For the latest Australian news and breaking news alerts, connect with 7NEWS online: Visit » https://7news.com.au 7Plus » https://7plus.com.au/ 7NEWS Podcast » https://open.spotify.com/user/dm9fk9hzoe68ibpttheragdgi Facebook » https://www.facebook.com/7NewsAustralia TikTok » https://www.tiktok.com/@7newsaustralia Instagram » https://www.instagram.com/7newsaustralia/  X » https://x.com/7NewsAustralia   7NEWS combines the trusted and powerful news brands including Sunrise, The Morning Show, Spotlight and 7NEWS.com.au, delivering unique, engaging and continuous coverage on the issues that matter most to Australians. Watch 7 News Australia full broadcasts and full episodes at 6pm and weekdays at 12pm and 4pm on Channel 7 and 7plus.  #BREAKINGNEWS #7NEWS",https://www.youtube.com/watch?v=LQ4qVvwtaRk,7News
