published,title,description,link,Pub
2025-11-18T08:36:48+00:00,"Accused killer falls pregnant, asbestos sand enquiry and workers union pay deal | 7NEWS","Subscribe and set 🔔 » https://7news.link/YTSubscribe |   For the latest Australian news and breaking news alerts, connect with 7NEWS online: Visit » https://7news.com.au 7Plus » https://7plus.com.au/ 7NEWS Podcast » https://open.spotify.com/user/dm9fk9hzoe68ibpttheragdgi Facebook » https://www.facebook.com/7NewsAustralia TikTok » https://www.tiktok.com/@7newsaustralia Instagram » https://www.instagram.com/7newsaustralia/  X » https://x.com/7NewsAustralia   7NEWS combines the trusted and powerful news brands including Sunrise, The Morning Show, Spotlight and 7NEWS.com.au, delivering unique, engaging and continuous coverage on the issues that matter most to Australians. Watch 7 News Australia full broadcasts and full episodes at 6pm and weekdays at 12pm and 4pm on Channel 7 and 7plus.  #BREAKINGNEWS #7NEWS",https://www.youtube.com/watch?v=8k-W9pU67Es,7News
2025-11-18T08:39:45+00:00,Warning over dangerous button-battery toys | 7NEWS,"Choice says nearly three-quarters of toys it bought online failed safety tests, prompting a serious alert for parents ahead of Christmas.  Subscribe and set 🔔 » https://7news.link/YTSubscribe |   For the latest Australian news and breaking news alerts, connect with 7NEWS online: Visit » https://7news.com.au 7Plus » https://7plus.com.au/ 7NEWS Podcast » https://open.spotify.com/user/dm9fk9hzoe68ibpttheragdgi Facebook » https://www.facebook.com/7NewsAustralia TikTok » https://www.tiktok.com/@7newsaustralia Instagram » https://www.instagram.com/7newsaustralia/  X » https://x.com/7NewsAustralia   7NEWS combines the trusted and powerful news brands including Sunrise, The Morning Show, Spotlight and 7NEWS.com.au, delivering unique, engaging and continuous coverage on the issues that matter most to Australians. Watch 7 News Australia full broadcasts and full episodes at 6pm and weekdays at 12pm and 4pm on Channel 7 and 7plus.  #BREAKINGNEWS #7NEWS",https://www.youtube.com/watch?v=DD_nf6izR9o,7News
2025-11-18T08:42:36+00:00,"Teachers strike action, armed man shot by police and family dog in stolen car found dead | 7NEWS","Subscribe and set 🔔 » https://7news.link/YTSubscribe |   For the latest Australian news and breaking news alerts, connect with 7NEWS online: Visit » https://7news.com.au 7Plus » https://7plus.com.au/ 7NEWS Podcast » https://open.spotify.com/user/dm9fk9hzoe68ibpttheragdgi Facebook » https://www.facebook.com/7NewsAustralia TikTok » https://www.tiktok.com/@7newsaustralia Instagram » https://www.instagram.com/7newsaustralia/  X » https://x.com/7NewsAustralia   7NEWS combines the trusted and powerful news brands including Sunrise, The Morning Show, Spotlight and 7NEWS.com.au, delivering unique, engaging and continuous coverage on the issues that matter most to Australians. Watch 7 News Australia full broadcasts and full episodes at 6pm and weekdays at 12pm and 4pm on Channel 7 and 7plus.  #BREAKINGNEWS #7NEWS",https://www.youtube.com/watch?v=qGvlGV85upg,7News
2025-11-18T09:00:59+00:00,Police drag unconscious driver from burning car moments before it goes up in flames,Two police officers in New Jersey have pulled an unconscious driver from his burning car just moments before it became engulfed in flames. The South Brunswick police chief credited the officers with saving the 26-year-old man's life after the crash in Franklin Township earlier this month. #carcrash #carfire #dashcam #police #emergency,https://www.youtube.com/shorts/aBiFyU35nzM,7News
2025-11-18T09:16:57+00:00,Is protein water good for you? | 7NEWS,"Subscribe and set 🔔 » https://7news.link/YTSubscribe |   For the latest Australian news and breaking news alerts, connect with 7NEWS online: Visit » https://7news.com.au 7Plus » https://7plus.com.au/ 7NEWS Podcast » https://open.spotify.com/user/dm9fk9hzoe68ibpttheragdgi Facebook » https://www.facebook.com/7NewsAustralia TikTok » https://www.tiktok.com/@7newsaustralia Instagram » https://www.instagram.com/7newsaustralia/  X » https://x.com/7NewsAustralia   7NEWS combines the trusted and powerful news brands including Sunrise, The Morning Show, Spotlight and 7NEWS.com.au, delivering unique, engaging and continuous coverage on the issues that matter most to Australians. Watch 7 News Australia full broadcasts and full episodes at 6pm and weekdays at 12pm and 4pm on Channel 7 and 7plus.  #BREAKINGNEWS #7NEWS",https://www.youtube.com/watch?v=vosEVCPAM4g,7News
2025-11-18T10:18:39+00:00,Wanted driver climbs on car roof in Como chase | 7NEWS,"A peak hour police pursuit in Como ended dramatically when a wanted driver climbed onto the roof of his red MG after being cornered by officers on Lockhart Street. The chase began in Bibra Lake and was tracked by police air wing through several suburbs, with the driver crossing to the wrong side of the road before the chaotic conclusion at 9:30am. A man in his 20s and a woman in her 30s were arrested following the incident.  Subscribe and set 🔔 » https://7news.link/YTSubscribe |   For the latest Australian news and breaking news alerts, connect with 7NEWS online: Visit » https://7news.com.au 7Plus » https://7plus.com.au/ 7NEWS Podcast » https://open.spotify.com/user/dm9fk9hzoe68ibpttheragdgi Facebook » https://www.facebook.com/7NewsAustralia TikTok » https://www.tiktok.com/@7newsaustralia Instagram » https://www.instagram.com/7newsaustralia/ X » https://x.com/7NewsAustralia  7NEWS combines the trusted and powerful news brands including Sunrise, The Morning Show, Spotlight and 7NEWS.com.au, delivering unique, engaging and continuous coverage on the issues that matter most to Australians. Watch 7 News Australia full broadcasts and full episodes at 6pm and weekdays at 12pm and 4pm on Channel 7 and 7plus.  #BREAKINGNEWS #7NEWS",https://www.youtube.com/watch?v=qF8qQf5yTf8,7News
2025-11-18T10:19:31+00:00,Man charged over $200k NDIS fraud scheme | 7NEWS,"A Brookdale man has been arrested and charged with 160 offences following allegations he orchestrated an elaborate disability invoice scam that defrauded the National Disability Insurance Scheme of nearly $200,000. Police allege John Sutherland posed as a disability services coordinator, submitting fraudulent invoices while also engaging in identity theft, corporate account fraud, and luxury vehicle hire using false documents. The arrest occurred during a dramatic police chase that ended at a BP petrol station in Baldivis, with six people charged in total as part of the alleged criminal network.  Subscribe and set 🔔 » https://7news.link/YTSubscribe |   For the latest Australian news and breaking news alerts, connect with 7NEWS online: Visit » https://7news.com.au 7Plus » https://7plus.com.au/ 7NEWS Podcast » https://open.spotify.com/user/dm9fk9hzoe68ibpttheragdgi Facebook » https://www.facebook.com/7NewsAustralia TikTok » https://www.tiktok.com/@7newsaustralia Instagram » https://www.instagram.com/7newsaustralia/ X » https://x.com/7NewsAustralia  7NEWS combines the trusted and powerful news brands including Sunrise, The Morning Show, Spotlight and 7NEWS.com.au, delivering unique, engaging and continuous coverage on the issues that matter most to Australians. Watch 7 News Australia full broadcasts and full episodes at 6pm and weekdays at 12pm and 4pm on Channel 7 and 7plus.  #BREAKINGNEWS #7NEWS",https://www.youtube.com/watch?v=m6XGgJs-Img,7News
2025-11-18T10:20:45+00:00,Air traffic control outage delays flights | 7NEWS,"Technical issues with air traffic control systems have caused flight delays at major Australian airports including Perth, Melbourne and Adelaide. Passengers are experiencing extended wait times with some flights being held at gates for much longer than usual. Air Services Australia has not yet indicated when the system problems will be resolved.  Subscribe and set 🔔 » https://7news.link/YTSubscribe |   For the latest Australian news and breaking news alerts, connect with 7NEWS online: Visit » https://7news.com.au 7Plus » https://7plus.com.au/ 7NEWS Podcast » https://open.spotify.com/user/dm9fk9hzoe68ibpttheragdgi Facebook » https://www.facebook.com/7NewsAustralia TikTok » https://www.tiktok.com/@7newsaustralia Instagram » https://www.instagram.com/7newsaustralia/ X » https://x.com/7NewsAustralia  7NEWS combines the trusted and powerful news brands including Sunrise, The Morning Show, Spotlight and 7NEWS.com.au, delivering unique, engaging and continuous coverage on the issues that matter most to Australians. Watch 7 News Australia full broadcasts and full episodes at 6pm and weekdays at 12pm and 4pm on Channel 7 and 7plus.  #BREAKINGNEWS #7NEWS",https://www.youtube.com/watch?v=6F3d_YmP74o,7News
2025-11-18T10:28:47+00:00,Prison conditions spark lighter sentences for violent criminals | 7NEWS,"Western Australian judges are reducing prison sentences for violent criminals due to what they describe as inhumane conditions in Perth prisons, including cockroach infestations and extended lockdowns. A carjacker who attacked a 90-year-old grandfather received only two and a half years instead of a potential 20-year sentence, with the judge citing appalling conditions at Hakea prison as a contributing factor. WA prisons are operating at 98% capacity with 192 inmates sleeping on mattresses on the floor.  Subscribe and set 🔔 » https://7news.link/YTSubscribe |   For the latest Australian news and breaking news alerts, connect with 7NEWS online: Visit » https://7news.com.au 7Plus » https://7plus.com.au/ 7NEWS Podcast » https://open.spotify.com/user/dm9fk9hzoe68ibpttheragdgi Facebook » https://www.facebook.com/7NewsAustralia TikTok » https://www.tiktok.com/@7newsaustralia Instagram » https://www.instagram.com/7newsaustralia/ X » https://x.com/7NewsAustralia  7NEWS combines the trusted and powerful news brands including Sunrise, The Morning Show, Spotlight and 7NEWS.com.au, delivering unique, engaging and continuous coverage on the issues that matter most to Australians. Watch 7 News Australia full broadcasts and full episodes at 6pm and weekdays at 12pm and 4pm on Channel 7 and 7plus.  #BREAKINGNEWS #7NEWS",https://www.youtube.com/watch?v=yV1yxlOzxHk,7News
2025-11-18T10:38:54+00:00,"Lighter criminal sentences, neo-Nazi faces deportation and violent marketplace sale | 7NEWS","Subscribe and set 🔔 » https://7news.link/YTSubscribe |   For the latest Australian news and breaking news alerts, connect with 7NEWS online: Visit » https://7news.com.au 7Plus » https://7plus.com.au/ 7NEWS Podcast » https://open.spotify.com/user/dm9fk9hzoe68ibpttheragdgi Facebook » https://www.facebook.com/7NewsAustralia TikTok » https://www.tiktok.com/@7newsaustralia Instagram » https://www.instagram.com/7newsaustralia/  X » https://x.com/7NewsAustralia   7NEWS combines the trusted and powerful news brands including Sunrise, The Morning Show, Spotlight and 7NEWS.com.au, delivering unique, engaging and continuous coverage on the issues that matter most to Australians. Watch 7 News Australia full broadcasts and full episodes at 6pm and weekdays at 12pm and 4pm on Channel 7 and 7plus.  #BREAKINGNEWS #7NEWS",https://www.youtube.com/watch?v=a8XO3fA48U8,7News
2025-11-18T18:42:16+00:00,Epstein files vote looms as global tech outage hits | 7NEWS,"The US House of Representatives prepares for a crucial vote on releasing the remaining Jeffrey Epstein files to the public, with Donald Trump dropping his previous opposition to the bipartisan bill. A global tech outage caused by Cloudflare brought down systems worldwide, affecting airports in Melbourne, Adelaide and Perth, along with major apps including X, ChatGPT, Uber and Spotify. Radio legend John Laws will receive a state funeral in Sydney, while Queensland teachers announce a second strike this year affecting over 500,000 students.  Subscribe and set 🔔 » https://7news.link/YTSubscribe |   For the latest Australian news and breaking news alerts, connect with 7NEWS online: Visit » https://7news.com.au 7Plus » https://7plus.com.au/ 7NEWS Podcast » https://open.spotify.com/user/dm9fk9hzoe68ibpttheragdgi Facebook » https://www.facebook.com/7NewsAustralia TikTok » https://www.tiktok.com/@7newsaustralia Instagram » https://www.instagram.com/7newsaustralia/ X » https://x.com/7NewsAustralia  7NEWS combines the trusted and powerful news brands including Sunrise, The Morning Show, Spotlight and 7NEWS.com.au, delivering unique, engaging and continuous coverage on the issues that matter most to Australians. Watch 7 News Australia full broadcasts and full episodes at 6pm and weekdays at 12pm and 4pm on Channel 7 and 7plus.  #BREAKINGNEWS #7NEWS",https://www.youtube.com/watch?v=bLuF_BVxL18,7News
2025-11-18T18:42:33+00:00,Cloudflare outage grounds flights and crashes apps | 7NEWS,"Cloudflare, a web security software company used by thousands of companies worldwide, suffered a network failure lasting several hours. The outage caused air traffic control systems to go down at airports in Melbourne, Adelaide and Perth, delaying flights and taking major apps like X, ChatGPT, Uber and Spotify offline. Cloudflare described the incident as an internal service degradation that they were working to fix.  Subscribe and set 🔔 » https://7news.link/YTSubscribe |   For the latest Australian news and breaking news alerts, connect with 7NEWS online: Visit » https://7news.com.au 7Plus » https://7plus.com.au/ 7NEWS Podcast » https://open.spotify.com/user/dm9fk9hzoe68ibpttheragdgi Facebook » https://www.facebook.com/7NewsAustralia TikTok » https://www.tiktok.com/@7newsaustralia Instagram » https://www.instagram.com/7newsaustralia/ X » https://x.com/7NewsAustralia  7NEWS combines the trusted and powerful news brands including Sunrise, The Morning Show, Spotlight and 7NEWS.com.au, delivering unique, engaging and continuous coverage on the issues that matter most to Australians. Watch 7 News Australia full broadcasts and full episodes at 6pm and weekdays at 12pm and 4pm on Channel 7 and 7plus.  #BREAKINGNEWS #7NEWS",https://www.youtube.com/watch?v=VYGu4NgKNX0,7News
2025-11-18T18:42:46+00:00,Two-way tolls proposed for Harbour Bridge | 7NEWS,"Sydney drivers may face two-way tolls on the Harbour Bridge, with northbound traffic to be charged alongside the existing southbound toll. The Premier indicates this measure will help fund the $60 toll cap system that provides drivers with rebates of up to $340. The additional northbound toll will be implemented when the Western Harbour Tunnel opens.  Subscribe and set 🔔 » https://7news.link/YTSubscribe |   For the latest Australian news and breaking news alerts, connect with 7NEWS online: Visit » https://7news.com.au 7Plus » https://7plus.com.au/ 7NEWS Podcast » https://open.spotify.com/user/dm9fk9hzoe68ibpttheragdgi Facebook » https://www.facebook.com/7NewsAustralia TikTok » https://www.tiktok.com/@7newsaustralia Instagram » https://www.instagram.com/7newsaustralia/ X » https://x.com/7NewsAustralia  7NEWS combines the trusted and powerful news brands including Sunrise, The Morning Show, Spotlight and 7NEWS.com.au, delivering unique, engaging and continuous coverage on the issues that matter most to Australians. Watch 7 News Australia full broadcasts and full episodes at 6pm and weekdays at 12pm and 4pm on Channel 7 and 7plus.  #BREAKINGNEWS #7NEWS",https://www.youtube.com/watch?v=qqIleXj9qFw,7News
2025-11-18T18:43:01+00:00,Parents launch methanol warning campaign after Laos tragedy | 7NEWS,"The parents of Australian teenagers Holly Bowles and Bianca Jones, who died from methanol poisoning in Laos during their gap year, have launched a national campaign warning other schoolies about contaminated alcohol dangers. The 19-year-old best friends were fatally poisoned after being served tainted alcohol at their youth hostel, part of an incident that claimed six lives with no charges laid yet despite Foreign Minister Penny Wong pressing the Laos government 50 times for updates.  Subscribe and set 🔔 » https://7news.link/YTSubscribe |   For the latest Australian news and breaking news alerts, connect with 7NEWS online: Visit » https://7news.com.au 7Plus » https://7plus.com.au/ 7NEWS Podcast » https://open.spotify.com/user/dm9fk9hzoe68ibpttheragdgi Facebook » https://www.facebook.com/7NewsAustralia TikTok » https://www.tiktok.com/@7newsaustralia Instagram » https://www.instagram.com/7newsaustralia/ X » https://x.com/7NewsAustralia  7NEWS combines the trusted and powerful news brands including Sunrise, The Morning Show, Spotlight and 7NEWS.com.au, delivering unique, engaging and continuous coverage on the issues that matter most to Australians. Watch 7 News Australia full broadcasts and full episodes at 6pm and weekdays at 12pm and 4pm on Channel 7 and 7plus.  #BREAKINGNEWS #7NEWS",https://www.youtube.com/watch?v=IpkMn-alMB4,7News
2025-11-18T18:43:17+00:00,House votes on releasing Epstein files | 7NEWS,"The US House of Representatives is voting on a bipartisan bill to release the remaining Jeffrey Epstein files to the public. Donald Trump initially opposed the bill, calling it a 'democratic hoax', but dropped his opposition two days ago after mounting pressure from his own party members. Victims of Epstein, including family members of Virginia Dufresne who took her own life in Australia earlier this year, are present to witness the vote.  Subscribe and set 🔔 » https://7news.link/YTSubscribe |   For the latest Australian news and breaking news alerts, connect with 7NEWS online: Visit » https://7news.com.au 7Plus » https://7plus.com.au/ 7NEWS Podcast » https://open.spotify.com/user/dm9fk9hzoe68ibpttheragdgi Facebook » https://www.facebook.com/7NewsAustralia TikTok » https://www.tiktok.com/@7newsaustralia Instagram » https://www.instagram.com/7newsaustralia/ X » https://x.com/7NewsAustralia  7NEWS combines the trusted and powerful news brands including Sunrise, The Morning Show, Spotlight and 7NEWS.com.au, delivering unique, engaging and continuous coverage on the issues that matter most to Australians. Watch 7 News Australia full broadcasts and full episodes at 6pm and weekdays at 12pm and 4pm on Channel 7 and 7plus.  #BREAKINGNEWS #7NEWS",https://www.youtube.com/watch?v=VKdMnsBqsD0,7News
