published,title,description,link,Pub
2026-01-29T07:58:54+00:00,First day of term shooting in Geelong; Pauline Hanson's film premiere goes ahead | 7NEWS Melbourne,"A major police operation is unfolding after a car rammed into a school bus, accelerated towards a police officer, and fired shots in the process. Despite being initially cancelled due to backlash, Pauline Hanson's controversial new movie will premiere tonight at Village Cinemas Crown.  Subscribe and set 🔔 » https://7news.link/YTSubscribe |   For the latest Australian news and breaking news alerts, connect with 7NEWS online: Visit » https://7news.com.au 7Plus » https://7plus.com.au/ 7NEWS Podcast » https://open.spotify.com/user/dm9fk9hzoe68ibpttheragdgi Facebook » https://www.facebook.com/7NewsAustralia TikTok » https://www.tiktok.com/@7newsaustralia Instagram » https://www.instagram.com/7newsaustralia/  X » https://x.com/7NewsAustralia   7NEWS combines the trusted and powerful news brands including Sunrise, The Morning Show, Spotlight and 7NEWS.com.au, delivering unique, engaging and continuous coverage on the issues that matter most to Australians. Watch 7 News Australia full broadcasts and full episodes at 6pm and weekdays at 12pm and 4pm on Channel 7 and 7plus.  #BREAKINGNEWS #7NEWS",https://www.youtube.com/watch?v=YlQhafhMIqE,7News
2026-01-29T07:59:54+00:00,Monster bull shark caught in Sydney Harbour | 7NEWS,"There's been another close call involving a shark off our coast. A surfer knocked off his board, forcing Angels Beach near Ballina to be evacuated and closed.  Subscribe and set 🔔 » https://7news.link/YTSubscribe |   For the latest Australian news and breaking news alerts, connect with 7NEWS online: Visit » https://7news.com.au 7Plus » https://7plus.com.au/ 7NEWS Podcast » https://open.spotify.com/user/dm9fk9hzoe68ibpttheragdgi Facebook » https://www.facebook.com/7NewsAustralia TikTok » https://www.tiktok.com/@7newsaustralia Instagram » https://www.instagram.com/7newsaustralia/ X » https://x.com/7NewsAustralia  7NEWS combines the trusted and powerful news brands including Sunrise, The Morning Show, Spotlight and 7NEWS.com.au, delivering unique, engaging and continuous coverage on the issues that matter most to Australians. Watch 7 News Australia full broadcasts and full episodes at 6pm and weekdays at 12pm and 4pm on Channel 7 and 7plus.  #BREAKINGNEWS #7NEWS",https://www.youtube.com/watch?v=t7viOW_fLt8,7News
2026-01-29T08:06:13+00:00,"44 housing towers to transform lives, but vulnerable Melburnians left in limbo | 7NEWS","EXCLUSIVE: 7NEWS can reveal the next seven housing towers to be axed under a controversial demolition project. But housing advocates warn the Allan government is not meeting its own construction targets, leaving vulnerable Victorians on the waiting list.  Subscribe and set 🔔 » https://7news.link/YTSubscribe |   For the latest Australian news and breaking news alerts, connect with 7NEWS online: Visit » https://7news.com.au 7Plus » https://7plus.com.au/ 7NEWS Podcast » https://open.spotify.com/user/dm9fk9hzoe68ibpttheragdgi Facebook » https://www.facebook.com/7NewsAustralia TikTok » https://www.tiktok.com/@7newsaustralia Instagram » https://www.instagram.com/7newsaustralia/ X » https://x.com/7NewsAustralia  7NEWS combines the trusted and powerful news brands including Sunrise, The Morning Show, Spotlight and 7NEWS.com.au, delivering unique, engaging and continuous coverage on the issues that matter most to Australians. Watch 7 News Australia full broadcasts and full episodes at 6pm and weekdays at 12pm and 4pm on Channel 7 and 7plus.  #BREAKINGNEWS #7NEWS",https://www.youtube.com/watch?v=8Wam3Y48r4c,7News
2026-01-29T08:17:33+00:00,King Charles reveals environmental legacy in new documentary | 7NEWS,"King Charles has given the world a rare and intimate look into his lifelong commitment to nature in a new documentary. The monarch opens up about the backlash he faced in the early days of his environmental fight, but he stayed silent on another touchy subject.   Subscribe and set 🔔 » https://7news.link/YTSubscribe |   For the latest Australian news and breaking news alerts, connect with 7NEWS online: Visit » https://7news.com.au 7Plus » https://7plus.com.au/ 7NEWS Podcast » https://open.spotify.com/user/dm9fk9hzoe68ibpttheragdgi Facebook » https://www.facebook.com/7NewsAustralia TikTok » https://www.tiktok.com/@7newsaustralia Instagram » https://www.instagram.com/7newsaustralia/  X » https://x.com/7NewsAustralia   7NEWS combines the trusted and powerful news brands including Sunrise, The Morning Show, Spotlight and 7NEWS.com.au, delivering unique, engaging and continuous coverage on the issues that matter most to Australians. Watch 7 News Australia full broadcasts and full episodes at 6pm and weekdays at 12pm and 4pm on Channel 7 and 7plus.  #BREAKINGNEWS #7NEWS",https://www.youtube.com/watch?v=ZxpgjHAwkaA,7News
2026-01-29T08:21:04+00:00,Trump deploys warships as Iran tensions escalate | 7NEWS,"Donald Trump is now threatening Iran with military action if it won't negotiate on nuclear weapons. A fleet of American warships has advanced into the Middle East, giving the US president plenty of options should he decide to strike.  Subscribe and set 🔔 » https://7news.link/YTSubscribe |   For the latest Australian news and breaking news alerts, connect with 7NEWS online: Visit » https://7news.com.au 7Plus » https://7plus.com.au/ 7NEWS Podcast » https://open.spotify.com/user/dm9fk9hzoe68ibpttheragdgi Facebook » https://www.facebook.com/7NewsAustralia TikTok » https://www.tiktok.com/@7newsaustralia Instagram » https://www.instagram.com/7newsaustralia/  X » https://x.com/7NewsAustralia   7NEWS combines the trusted and powerful news brands including Sunrise, The Morning Show, Spotlight and 7NEWS.com.au, delivering unique, engaging and continuous coverage on the issues that matter most to Australians. Watch 7 News Australia full broadcasts and full episodes at 6pm and weekdays at 12pm and 4pm on Channel 7 and 7plus.  #BREAKINGNEWS #7NEWS",https://www.youtube.com/watch?v=GU2qS9_0-6U,7News
2026-01-29T08:33:08+00:00,$40 million reasons why Neale Daniher is smiling | 7NEWS,"The federal government today announced a $40 million grant to establish the Neale Daniher MND Clinical Network. It is a legacy of Neale's term as Australian of the Year and will fast-track the search for a cure.  Subscribe and set 🔔 » https://7news.link/YTSubscribe |   For the latest Australian news and breaking news alerts, connect with 7NEWS online: Visit » https://7news.com.au 7Plus » https://7plus.com.au/ 7NEWS Podcast » https://open.spotify.com/user/dm9fk9hzoe68ibpttheragdgi Facebook » https://www.facebook.com/7NewsAustralia TikTok » https://www.tiktok.com/@7newsaustralia Instagram » https://www.instagram.com/7newsaustralia/ X » https://x.com/7NewsAustralia  7NEWS combines the trusted and powerful news brands including Sunrise, The Morning Show, Spotlight and 7NEWS.com.au, delivering unique, engaging and continuous coverage on the issues that matter most to Australians. Watch 7 News Australia full broadcasts and full episodes at 6pm and weekdays at 12pm and 4pm on Channel 7 and 7plus.  #BREAKINGNEWS #7NEWS",https://www.youtube.com/watch?v=_iBxhGwsHW0,7News
2026-01-29T08:35:32+00:00,Baby critically injured after being hit by a car on the Gold Coast | 7NEWS,"A baby will be spending her first birthday in hospital after she was critically injured in a crash on the Gold Coast. She was being pushed in a pram by her grandmother, when they were both hit by a car.   Subscribe and set 🔔 » https://7news.link/YTSubscribe |   For the latest Australian news and breaking news alerts, connect with 7NEWS online: Visit » https://7news.com.au 7Plus » https://7plus.com.au/ 7NEWS Podcast » https://open.spotify.com/user/dm9fk9hzoe68ibpttheragdgi Facebook » https://www.facebook.com/7NewsAustralia TikTok » https://www.tiktok.com/@7newsaustralia Instagram » https://www.instagram.com/7newsaustralia/  X » https://x.com/7NewsAustralia   7NEWS combines the trusted and powerful news brands including Sunrise, The Morning Show, Spotlight and 7NEWS.com.au, delivering unique, engaging and continuous coverage on the issues that matter most to Australians. Watch 7 News Australia full broadcasts and full episodes at 6pm and weekdays at 12pm and 4pm on Channel 7 and 7plus.  #BREAKINGNEWS #7NEWS",https://www.youtube.com/watch?v=i8VQd7Aibuc,7News
2026-01-29T08:37:52+00:00,Chilling video of Netley victim begging for help; Grass fires blazing near Berri | 7NEWS Adelaide,"7NEWS has obtained vision of the moment a stab victim desperately pleaded for a stranger's help before being threatened again by his attacker. Flames have broken out on Katarapko Island this morning and though there has been no risk to the community, the CFS has issued a warning about the thick black smoke.  Subscribe and set 🔔 » https://7news.link/YTSubscribe |   For the latest Australian news and breaking news alerts, connect with 7NEWS online: Visit » https://7news.com.au 7Plus » https://7plus.com.au/ 7NEWS Podcast » https://open.spotify.com/user/dm9fk9hzoe68ibpttheragdgi Facebook » https://www.facebook.com/7NewsAustralia TikTok » https://www.tiktok.com/@7newsaustralia Instagram » https://www.instagram.com/7newsaustralia/  X » https://x.com/7NewsAustralia   7NEWS combines the trusted and powerful news brands including Sunrise, The Morning Show, Spotlight and 7NEWS.com.au, delivering unique, engaging and continuous coverage on the issues that matter most to Australians. Watch 7 News Australia full broadcasts and full episodes at 6pm and weekdays at 12pm and 4pm on Channel 7 and 7plus.  #BREAKINGNEWS #7NEWS",https://www.youtube.com/watch?v=QiugsUiIcmY,7News
2026-01-29T08:41:30+00:00,Sydney Zoo welcomes baby giraffe calf | 7NEWS,"A male giraffe calf has been born at Sydney Zoo, standing nearly two metres tall and weighing 120 kgs.  Subscribe and set 🔔 » https://7news.link/YTSubscribe |   For the latest Australian news and breaking news alerts, connect with 7NEWS online: Visit » https://7news.com.au 7Plus » https://7plus.com.au/ 7NEWS Podcast » https://open.spotify.com/user/dm9fk9hzoe68ibpttheragdgi Facebook » https://www.facebook.com/7NewsAustralia TikTok » https://www.tiktok.com/@7newsaustralia Instagram » https://www.instagram.com/7newsaustralia/ X » https://x.com/7NewsAustralia  7NEWS combines the trusted and powerful news brands including Sunrise, The Morning Show, Spotlight and 7NEWS.com.au, delivering unique, engaging and continuous coverage on the issues that matter most to Australians. Watch 7 News Australia full broadcasts and full episodes at 6pm and weekdays at 12pm and 4pm on Channel 7 and 7plus.  #BREAKINGNEWS #7NEWS",https://www.youtube.com/watch?v=s6MJKIpTquU,7News
2026-01-29T08:44:38+00:00,The Domain as a new 'protest precinct'?,The Domain is currently being considered as a new 'protest precinct' by NSW Premier Chris Minns to counteract the blocking of Sydney CBD streets. #thedomain #protests #chrisminns #sydney,https://www.youtube.com/shorts/4BImxapiJPg,7News
2026-01-29T09:01:50+00:00,40 years since NASA's Challenger space shuttle disaster killed seven astronauts,"It's been 40 years since NASA's Challenger disaster. The space shuttle exploded 73 seconds after take-off, killing all seven astronauts on board including teacher Christa McAuliffe.  The tragedy unfolded live on television. Investigators later blamed an O-ring that failed in the freezing launch conditions at Cape Canaveral, Florida.  #challenger #spaceshuttle #spacetravel #nasa #capecanaveral",https://www.youtube.com/shorts/LR5bqH4GIlI,7News
2026-01-29T09:06:36+00:00,Serious vehicle accidents not falling as fast as expected | 7NEWS,"Cars on Australian roads are getting smarter, packed with technology designed to keep us safe. But despite more vehicles with those safer systems, serious accidents aren't falling as fast as expected. An Australian first study has been launched to find out why.  Subscribe and set 🔔 » https://7news.link/YTSubscribe |   For the latest Australian news and breaking news alerts, connect with 7NEWS online: Visit » https://7news.com.au 7Plus » https://7plus.com.au/ 7NEWS Podcast » https://open.spotify.com/user/dm9fk9hzoe68ibpttheragdgi Facebook » https://www.facebook.com/7NewsAustralia TikTok » https://www.tiktok.com/@7newsaustralia Instagram » https://www.instagram.com/7newsaustralia/  X » https://x.com/7NewsAustralia   7NEWS combines the trusted and powerful news brands including Sunrise, The Morning Show, Spotlight and 7NEWS.com.au, delivering unique, engaging and continuous coverage on the issues that matter most to Australians. Watch 7 News Australia full broadcasts and full episodes at 6pm and weekdays at 12pm and 4pm on Channel 7 and 7plus.  #BREAKINGNEWS #7NEWS",https://www.youtube.com/watch?v=pvY_vJZJK5U,7News
2026-01-29T10:18:31+00:00,Fast-moving bushfire emergency devastates Ellenbrook homes | 7NEWS,"Residents were told to act immediately and leave their homes now as houses in Ellenbrook have been in the direct path of a fast-moving bushfire emergency today.  Subscribe and set 🔔 » https://7news.link/YTSubscribe |   For the latest Australian news and breaking news alerts, connect with 7NEWS online: Visit » https://7news.com.au 7Plus » https://7plus.com.au/ 7NEWS Podcast » https://open.spotify.com/user/dm9fk9hzoe68ibpttheragdgi Facebook » https://www.facebook.com/7NewsAustralia TikTok » https://www.tiktok.com/@7newsaustralia Instagram » https://www.instagram.com/7newsaustralia/  X » https://x.com/7NewsAustralia   7NEWS combines the trusted and powerful news brands including Sunrise, The Morning Show, Spotlight and 7NEWS.com.au, delivering unique, engaging and continuous coverage on the issues that matter most to Australians. Watch 7 News Australia full broadcasts and full episodes at 6pm and weekdays at 12pm and 4pm on Channel 7 and 7plus.  #BREAKINGNEWS #7NEWS",https://www.youtube.com/watch?v=YJRakKloIKE,7News
2026-01-29T10:21:47+00:00,Building company Niche Living holds customers in financial limbo | 7NEWS,"The notorious Perth building company is currently facing allegations of unreliable handling of customers' money, putting it in their own bank account.  Subscribe and set 🔔 » https://7news.link/YTSubscribe |   For the latest Australian news and breaking news alerts, connect with 7NEWS online: Visit » https://7news.com.au 7Plus » https://7plus.com.au/ 7NEWS Podcast » https://open.spotify.com/user/dm9fk9hzoe68ibpttheragdgi Facebook » https://www.facebook.com/7NewsAustralia TikTok » https://www.tiktok.com/@7newsaustralia Instagram » https://www.instagram.com/7newsaustralia/  X » https://x.com/7NewsAustralia   7NEWS combines the trusted and powerful news brands including Sunrise, The Morning Show, Spotlight and 7NEWS.com.au, delivering unique, engaging and continuous coverage on the issues that matter most to Australians. Watch 7 News Australia full broadcasts and full episodes at 6pm and weekdays at 12pm and 4pm on Channel 7 and 7plus.  #BREAKINGNEWS #7NEWS",https://www.youtube.com/watch?v=ctHY2GjavFI,7News
2026-01-29T10:49:40+00:00,Ellenbrook residents evacuate homes amid bushfire emergency; Outbreak of  Nipah virus | 7NEWS Perth,"Plumes of thick black smoke has blanketed Ellenbrook within minutes, as the devastating bushfire took hold just past 3pm this afternoon. The outbreak of the Nipah virus in India has triggered a global outbreak as travellers are now being stopped and screened for the virus at all major airports.  Subscribe and set 🔔 » https://7news.link/YTSubscribe |   For the latest Australian news and breaking news alerts, connect with 7NEWS online: Visit » https://7news.com.au 7Plus » https://7plus.com.au/ 7NEWS Podcast » https://open.spotify.com/user/dm9fk9hzoe68ibpttheragdgi Facebook » https://www.facebook.com/7NewsAustralia TikTok » https://www.tiktok.com/@7newsaustralia Instagram » https://www.instagram.com/7newsaustralia/  X » https://x.com/7NewsAustralia   7NEWS combines the trusted and powerful news brands including Sunrise, The Morning Show, Spotlight and 7NEWS.com.au, delivering unique, engaging and continuous coverage on the issues that matter most to Australians. Watch 7 News Australia full broadcasts and full episodes at 6pm and weekdays at 12pm and 4pm on Channel 7 and 7plus.  #BREAKINGNEWS #7NEWS",https://www.youtube.com/watch?v=H_41cXrce1Y,7News
