published,title,description,link,Pub
2026-03-18T20:06:15+00:00,Emergency summit called as fuel crisis deepens | 7NEWS,"The Prime Minister is convening an emergency national cabinet meeting to address Australia's escalating fuel crisis, with plans to appoint a national fuel tsar to manage distribution. Service stations across Sydney's west and northwest are running dry, while South Australia has recorded a 37% increase in fuel drive-offs in the past week, prompting police to call for American-style prepayment systems at petrol stations.  Subscribe and set 🔔 » https://7news.link/YTSubscribe |   For the latest Australian news and breaking news alerts, connect with 7NEWS online: Visit » https://7news.com.au 7Plus » https://7plus.com.au/ 7NEWS Podcast » https://open.spotify.com/user/dm9fk9hzoe68ibpttheragdgi Facebook » https://www.facebook.com/7NewsAustralia TikTok » https://www.tiktok.com/@7newsaustralia Instagram » https://www.instagram.com/7newsaustralia/ X » https://x.com/7NewsAustralia  7NEWS combines the trusted and powerful news brands including Sunrise, The Morning Show, Spotlight and 7NEWS.com.au, delivering unique, engaging and continuous coverage on the issues that matter most to Australians. Watch 7 News Australia full broadcasts and full episodes at 6pm and weekdays at 12pm and 4pm on Channel 7 and 7plus.  #BREAKINGNEWS #7NEWS",https://www.youtube.com/watch?v=fFvbgX8iPNM,7News
2026-03-18T20:31:05+00:00,Australia joins declaration condemning Iran's attacks in Strait of Hormuz,"World leaders, including Australia, are set to call on Iran to immediately stop blocking the Strait of Hormuz which is leading to petrol shortages and soaring prices around the globe.  An emergency session of the International Maritime Council was ordered on Wednesday where global leaders are expected to condemn Iran’s attacks on seafarers and merchant vessels in the Strait of Hormuz, through which 20 per cent of the world’s oil is shipped. #straitofhormuz #iran #maritime #shippinglane #middleeast",https://www.youtube.com/shorts/xtfnJxPe3d0,7News
2026-03-18T20:42:38+00:00,Army called in ahead of Cyclone Narelle landfall,"The army has been put on standby ahead of Tropical Cyclone Narelle's predicted landfall tomorrow morning. The tropical storm has intensified to a Category 4 system, with residents in Far North Queensland bracing for potential flash flooding. #cyclone #cyclonenarelle #tropicalstorm #storm #wildweather",https://www.youtube.com/shorts/To3BQPnkdog,7News
2026-03-18T21:13:39+00:00,Iran's intelligence chief killed in Israeli attack,"Iranian Intelligence Minister Esmail Khatib has been killed in the third high-profile assassination in two days.   The country’s Prime Minister, Masoud Pezeshkian, on Wednesday confirmed Israeli reports of a targeted attack which killed Khatib. #iran #middleeast #intelligence #israel #worldnews",https://www.youtube.com/shorts/oqba5d4c7ac,7News
2026-03-18T21:25:26+00:00,Iranian soccer player reportedly denies pressure to return to Iran,"An Iranian Women’s Football player has reportedly spoken out after returning home following the AFC Women’s Asian Cup in Australia., denying there was pressure to come back to Iran. #iran #soccer #lionesses #iranianwomenssoccer #asiacup",https://www.youtube.com/shorts/6rqo8s2eoRw,7News
2026-03-19T01:39:31+00:00,National fuel coordinator appointed amid supply crisis | 7NEWS,"Prime Minister Anthony Albanese has appointed Anthea Harris, former CEO of the Australian Energy Regulator, as Australia's first national fuel coordinator to oversee petrol and diesel supply issues nationwide. The appointment follows an emergency national cabinet meeting in Hobart, where all state and territory leaders agreed to appoint local coordinators to work with Harris. Opposition Leader Angus Taylor criticised the government's handling of fuel supply issues as the ACCC launches an investigation into alleged anti-competitive conduct by major fuel suppliers Ampol, BP and Viva Energy, particularly regarding diesel supply to regional and remote areas.  Subscribe and set 🔔 » https://7news.link/YTSubscribe |   For the latest Australian news and breaking news alerts, connect with 7NEWS online: Visit » https://7news.com.au 7Plus » https://7plus.com.au/ 7NEWS Podcast » https://open.spotify.com/user/dm9fk9hzoe68ibpttheragdgi Facebook » https://www.facebook.com/7NewsAustralia TikTok » https://www.tiktok.com/@7newsaustralia Instagram » https://www.instagram.com/7newsaustralia/ X » https://x.com/7NewsAustralia  7NEWS combines the trusted and powerful news brands including Sunrise, The Morning Show, Spotlight and 7NEWS.com.au, delivering unique, engaging and continuous coverage on the issues that matter most to Australians. Watch 7 News Australia full broadcasts and full episodes at 6pm and weekdays at 12pm and 4pm on Channel 7 and 7plus.  #BREAKINGNEWS #7NEWS",https://www.youtube.com/watch?v=7FmlEn6umFs,7News
2026-03-19T01:40:05+00:00,Cyclone Narelle intensifies to category 5 | 7NEWS,"Severe tropical cyclone Narelle has intensified to a Category 5 system and is barrelling towards Queensland's far north, with landfall expected near the remote town of Lockhart River as a Category 4 or 5 system. The Australian Army has been placed on standby, and residents in Cooktown and surrounding areas within the Cook Shire are being urged to shelter in place. This is the most intense cyclone to hit this part of Queensland since 1990, with water supplies being turned off and evacuations underway for those living on boats.  Subscribe and set 🔔 » https://7news.link/YTSubscribe |   For the latest Australian news and breaking news alerts, connect with 7NEWS online: Visit » https://7news.com.au 7Plus » https://7plus.com.au/ 7NEWS Podcast » https://open.spotify.com/user/dm9fk9hzoe68ibpttheragdgi Facebook » https://www.facebook.com/7NewsAustralia TikTok » https://www.tiktok.com/@7newsaustralia Instagram » https://www.instagram.com/7newsaustralia/ X » https://x.com/7NewsAustralia  7NEWS combines the trusted and powerful news brands including Sunrise, The Morning Show, Spotlight and 7NEWS.com.au, delivering unique, engaging and continuous coverage on the issues that matter most to Australians. Watch 7 News Australia full broadcasts and full episodes at 6pm and weekdays at 12pm and 4pm on Channel 7 and 7plus.  #BREAKINGNEWS #7NEWS",https://www.youtube.com/watch?v=iHVNxkyMV7w,7News
2026-03-19T01:40:28+00:00,Iran and Israel exchange strikes over gas field | 7NEWS,"Israeli-U.S. forces and Iran have exchanged missile attacks in a significant escalation of Middle East tensions. An apartment building in Beirut was flattened after evacuation orders, with Israel claiming it housed Hezbollah funds, while Iran launched retaliatory strikes after Israel hit the Paz natural gas field shared with Qatar. Iran's intelligence minister Ali Laragini has been killed following the earlier assassination of Iran's security chief, prompting new supreme leader Mostaba Khamenei to vow revenge.  Subscribe and set 🔔 » https://7news.link/YTSubscribe |   For the latest Australian news and breaking news alerts, connect with 7NEWS online: Visit » https://7news.com.au 7Plus » https://7plus.com.au/ 7NEWS Podcast » https://open.spotify.com/user/dm9fk9hzoe68ibpttheragdgi Facebook » https://www.facebook.com/7NewsAustralia TikTok » https://www.tiktok.com/@7newsaustralia Instagram » https://www.instagram.com/7newsaustralia/ X » https://x.com/7NewsAustralia  7NEWS combines the trusted and powerful news brands including Sunrise, The Morning Show, Spotlight and 7NEWS.com.au, delivering unique, engaging and continuous coverage on the issues that matter most to Australians. Watch 7 News Australia full broadcasts and full episodes at 6pm and weekdays at 12pm and 4pm on Channel 7 and 7plus.  #BREAKINGNEWS #7NEWS",https://www.youtube.com/watch?v=vqShbHONSDg,7News
2026-03-19T01:41:56+00:00,Iranian footballers withdraw asylum claims and return home | 7NEWS,"Five Iranian national football team players have withdrawn their asylum claims in Australia and returned to Iran via Turkey. Two players remain in Australia while concerns persist about the treatment awaiting those who have gone back. The team had initially sought refuge due to fears for their safety.  Subscribe and set 🔔 » https://7news.link/YTSubscribe |   For the latest Australian news and breaking news alerts, connect with 7NEWS online: Visit » https://7news.com.au 7Plus » https://7plus.com.au/ 7NEWS Podcast » https://open.spotify.com/user/dm9fk9hzoe68ibpttheragdgi Facebook » https://www.facebook.com/7NewsAustralia TikTok » https://www.tiktok.com/@7newsaustralia Instagram » https://www.instagram.com/7newsaustralia/ X » https://x.com/7NewsAustralia  7NEWS combines the trusted and powerful news brands including Sunrise, The Morning Show, Spotlight and 7NEWS.com.au, delivering unique, engaging and continuous coverage on the issues that matter most to Australians. Watch 7 News Australia full broadcasts and full episodes at 6pm and weekdays at 12pm and 4pm on Channel 7 and 7plus.  #BREAKINGNEWS #7NEWS",https://www.youtube.com/watch?v=sO4O9WfiDbU,7News
2026-03-19T01:42:32+00:00,Historic Toowoomba PCYC destroyed by suspicious fire | 7NEWS,"A historic PCYC youth centre on James Street in Toowoomba was destroyed by fire overnight, with the blaze first spotted by paramedics around 1am. The building, which has served the community since 1969, was unoccupied at the time and no injuries were reported. A man in his 20s is being questioned by police after CCTV footage captured someone fleeing the scene, with the rebuild expected to cost millions of dollars.  Subscribe and set 🔔 » https://7news.link/YTSubscribe |   For the latest Australian news and breaking news alerts, connect with 7NEWS online: Visit » https://7news.com.au 7Plus » https://7plus.com.au/ 7NEWS Podcast » https://open.spotify.com/user/dm9fk9hzoe68ibpttheragdgi Facebook » https://www.facebook.com/7NewsAustralia TikTok » https://www.tiktok.com/@7newsaustralia Instagram » https://www.instagram.com/7newsaustralia/ X » https://x.com/7NewsAustralia  7NEWS combines the trusted and powerful news brands including Sunrise, The Morning Show, Spotlight and 7NEWS.com.au, delivering unique, engaging and continuous coverage on the issues that matter most to Australians. Watch 7 News Australia full broadcasts and full episodes at 6pm and weekdays at 12pm and 4pm on Channel 7 and 7plus.  #BREAKINGNEWS #7NEWS",https://www.youtube.com/watch?v=qo28_NqmyEk,7News
2026-03-19T01:43:01+00:00,Jacinta Allan faces leadership challenge before election | 7NEWS,"Victorian Premier Jacinta Allan faces potential removal as leader before the November state election, with key figures from her socialist left faction reportedly holding secret discussions about a leadership change. The speculation follows internal polling predicting Labor could lose up to 20 seats, combined with dire polling showing Allan is now the most unpopular leader in the country. If a switch occurs, it would be Victoria Labor's first leadership change this close to an election since John Brumby was replaced by Steve Bracks seven months before Bracks defeated Jeff Kennett.  Subscribe and set 🔔 » https://7news.link/YTSubscribe |   For the latest Australian news and breaking news alerts, connect with 7NEWS online: Visit » https://7news.com.au 7Plus » https://7plus.com.au/ 7NEWS Podcast » https://open.spotify.com/user/dm9fk9hzoe68ibpttheragdgi Facebook » https://www.facebook.com/7NewsAustralia TikTok » https://www.tiktok.com/@7newsaustralia Instagram » https://www.instagram.com/7newsaustralia/ X » https://x.com/7NewsAustralia  7NEWS combines the trusted and powerful news brands including Sunrise, The Morning Show, Spotlight and 7NEWS.com.au, delivering unique, engaging and continuous coverage on the issues that matter most to Australians. Watch 7 News Australia full broadcasts and full episodes at 6pm and weekdays at 12pm and 4pm on Channel 7 and 7plus.  #BREAKINGNEWS #7NEWS",https://www.youtube.com/watch?v=Yhdw4l1eyB0,7News
2026-03-19T01:43:28+00:00,Queen Mary's homecoming to Tasmania | 7NEWS,"Denmark's Queen Mary has returned to her homeland of Tasmania for a royal tour, accompanied by her royal partner. The visit includes a traditional welcome to country ceremony at Government House, tours of a marine conservation farm and electric ship builder Incat, a visit to an award-winning restaurant, a stop at the Museum of Old and New Art (MONA), and a public meet-and-greet along Hobart's waterfront on Hunter Street.  Subscribe and set 🔔 » https://7news.link/YTSubscribe |   For the latest Australian news and breaking news alerts, connect with 7NEWS online: Visit » https://7news.com.au 7Plus » https://7plus.com.au/ 7NEWS Podcast » https://open.spotify.com/user/dm9fk9hzoe68ibpttheragdgi Facebook » https://www.facebook.com/7NewsAustralia TikTok » https://www.tiktok.com/@7newsaustralia Instagram » https://www.instagram.com/7newsaustralia/ X » https://x.com/7NewsAustralia  7NEWS combines the trusted and powerful news brands including Sunrise, The Morning Show, Spotlight and 7NEWS.com.au, delivering unique, engaging and continuous coverage on the issues that matter most to Australians. Watch 7 News Australia full broadcasts and full episodes at 6pm and weekdays at 12pm and 4pm on Channel 7 and 7plus.  #BREAKINGNEWS #7NEWS",https://www.youtube.com/watch?v=TTsbz3-h8-8,7News
2026-03-19T01:48:27+00:00,"Fuel crisis continues, Kyle Sandilands speaks and Cyclone Narelle intensifies to category 5| 7NEWS","Subscribe and set 🔔 » https://7news.link/YTSubscribe |   For the latest Australian news and breaking news alerts, connect with 7NEWS online: Visit » https://7news.com.au 7Plus » https://7plus.com.au/ 7NEWS Podcast » https://open.spotify.com/user/dm9fk9hzoe68ibpttheragdgi Facebook » https://www.facebook.com/7NewsAustralia TikTok » https://www.tiktok.com/@7newsaustralia Instagram » https://www.instagram.com/7newsaustralia/  X » https://x.com/7NewsAustralia   7NEWS combines the trusted and powerful news brands including Sunrise, The Morning Show, Spotlight and 7NEWS.com.au, delivering unique, engaging and continuous coverage on the issues that matter most to Australians. Watch 7 News Australia full broadcasts and full episodes at 6pm and weekdays at 12pm and 4pm on Channel 7 and 7plus.  #BREAKINGNEWS #7NEWS",https://www.youtube.com/watch?v=s215i9SdUe8,7News
2026-03-19T02:00:58+00:00,Sean Penn receives 'Oscar' in Ukraine after skipping ceremony,"Actor Sean Penn received an Oscar-shaped award made from a railcar damaged in a Russian attack. Ukrainian railway operator Ukrzaliznytsia presented Penn with the award during his visit in Ukraine after he skipped the ceremony  He won an Oscar on Sunday for Best Supporting Actor for his role in One Battle After Another, but didn't attend the ceremony as he was to meet with Zelensky in Kyiv. The long-time advocate for Ukraine has visited the country several times during the four-year war with Russia. #SeanPenn #Oscars #Ukraine",https://www.youtube.com/shorts/j4wmpkkxL30,7News
2026-03-19T02:22:04+00:00,National taskforce established to tackle Australia's fuel crisis,The federal government has set up a national taskforce to tackle Australia's fuel crisis. #fuel #petrol #diesel #oil #auspol,https://www.youtube.com/shorts/K27SPTf0mzI,7News
