published,title,description,link,Pub
2025-12-02T08:37:48+00:00,Lady Gaga arrives at Sydney Airport,"Calling all Little Monsters, as Lady Gaga has just touched down in Sydney ahead of her five big Aussie shows! #ladygaga #littlemonsters #themayhemball #accorstadium",https://www.youtube.com/shorts/01AMlERFdQo,7News
2025-12-02T08:38:08+00:00,Keyborough school stabbing; Gordon family's emotional response to sentence | 7NEWS Melbourne,"A school principal has reportedly been stabbed by an alleged staff member, sending classrooms into lockdown. Dr Ash Gordon's teenage killer has been imprisoned but could be set free in a little over a decade. The doctor's family unite in their campaign for a crackdown on youth crime.  Subscribe and set 🔔 » https://7news.link/YTSubscribe |   For the latest Australian news and breaking news alerts, connect with 7NEWS online: Visit » https://7news.com.au 7Plus » https://7plus.com.au/ 7NEWS Podcast » https://open.spotify.com/user/dm9fk9hzoe68ibpttheragdgi Facebook » https://www.facebook.com/7NewsAustralia TikTok » https://www.tiktok.com/@7newsaustralia Instagram » https://www.instagram.com/7newsaustralia/  X » https://x.com/7NewsAustralia   7NEWS combines the trusted and powerful news brands including Sunrise, The Morning Show, Spotlight and 7NEWS.com.au, delivering unique, engaging and continuous coverage on the issues that matter most to Australians. Watch 7 News Australia full broadcasts and full episodes at 6pm and weekdays at 12pm and 4pm on Channel 7 and 7plus.  #BREAKINGNEWS #7NEWS",https://www.youtube.com/watch?v=ixMqOSdbBcE,7News
2025-12-02T08:47:42+00:00,Hands on with the Australian Army detonating lost bombs | 7NEWS,"Subscribe and set 🔔 » https://7news.link/YTSubscribe |   For the latest Australian news and breaking news alerts, connect with 7NEWS online: Visit » https://7news.com.au 7Plus » https://7plus.com.au/ 7NEWS Podcast » https://open.spotify.com/user/dm9fk9hzoe68ibpttheragdgi Facebook » https://www.facebook.com/7NewsAustralia TikTok » https://www.tiktok.com/@7newsaustralia Instagram » https://www.instagram.com/7newsaustralia/  X » https://x.com/7NewsAustralia   7NEWS combines the trusted and powerful news brands including Sunrise, The Morning Show, Spotlight and 7NEWS.com.au, delivering unique, engaging and continuous coverage on the issues that matter most to Australians. Watch 7 News Australia full broadcasts and full episodes at 6pm and weekdays at 12pm and 4pm on Channel 7 and 7plus.  #BREAKINGNEWS #7NEWS",https://www.youtube.com/watch?v=siIhbzc3FHE,7News
2025-12-02T08:52:27+00:00,Elderly woman hospitalised after random attack; Millswood home raided by AFP | 7NEWS Adelaide,"An 84-year-old woman has been brutally punched in a random cowardly attack in South Plympton. Officers and a sniffer dog have reportedly spent several hours searching a home on Weller Street in Adelaide's Inner South. 7NEWS understands that the home is rented by a well-known businessman, though further details have yet to be released.  Subscribe and set 🔔 » https://7news.link/YTSubscribe |   For the latest Australian news and breaking news alerts, connect with 7NEWS online: Visit » https://7news.com.au 7Plus » https://7plus.com.au/ 7NEWS Podcast » https://open.spotify.com/user/dm9fk9hzoe68ibpttheragdgi Facebook » https://www.facebook.com/7NewsAustralia TikTok » https://www.tiktok.com/@7newsaustralia Instagram » https://www.instagram.com/7newsaustralia/  X » https://x.com/7NewsAustralia   7NEWS combines the trusted and powerful news brands including Sunrise, The Morning Show, Spotlight and 7NEWS.com.au, delivering unique, engaging and continuous coverage on the issues that matter most to Australians. Watch 7 News Australia full broadcasts and full episodes at 6pm and weekdays at 12pm and 4pm on Channel 7 and 7plus.  #BREAKINGNEWS #7NEWS",https://www.youtube.com/watch?v=erm6cNxZFoA,7News
2025-12-02T08:56:40+00:00,WHO backs weight-loss drugs despite safety concerns | 7NEWS,"The World Health Organisation has formally endorsed medications like Ozempic and Mounjaro, even as Australia’s medicines regulator warns of potentially deadly side effects.  Subscribe and set 🔔 » https://7news.link/YTSubscribe |   For the latest Australian news and breaking news alerts, connect with 7NEWS online: Visit » https://7news.com.au 7Plus » https://7plus.com.au/ 7NEWS Podcast » https://open.spotify.com/user/dm9fk9hzoe68ibpttheragdgi Facebook » https://www.facebook.com/7NewsAustralia TikTok » https://www.tiktok.com/@7newsaustralia Instagram » https://www.instagram.com/7newsaustralia/  X » https://x.com/7NewsAustralia   7NEWS combines the trusted and powerful news brands including Sunrise, The Morning Show, Spotlight and 7NEWS.com.au, delivering unique, engaging and continuous coverage on the issues that matter most to Australians. Watch 7 News Australia full broadcasts and full episodes at 6pm and weekdays at 12pm and 4pm on Channel 7 and 7plus.  #BREAKINGNEWS #7NEWS",https://www.youtube.com/watch?v=AT0HSFZwXHM,7News
2025-12-02T09:18:54+00:00,Shock find leads police to driver they say sent Northland shoppers running for their lives | 7NEWS,"The man accused of a terrifying rampage through Northland Shopping Centre is planning to fight the charges.   A magistrate has ordered the 27-year-old to stand trial after shoppers were sent scrambling.  Subscribe and set 🔔 » https://7news.link/YTSubscribe |   For the latest Australian news and breaking news alerts, connect with 7NEWS online: Visit » https://7news.com.au 7Plus » https://7plus.com.au/ 7NEWS Podcast » https://open.spotify.com/user/dm9fk9hzoe68ibpttheragdgi Facebook » https://www.facebook.com/7NewsAustralia TikTok » https://www.tiktok.com/@7newsaustralia Instagram » https://www.instagram.com/7newsaustralia/  X » https://x.com/7NewsAustralia   7NEWS combines the trusted and powerful news brands including Sunrise, The Morning Show, Spotlight and 7NEWS.com.au, delivering unique, engaging and continuous coverage on the issues that matter most to Australians. Watch 7 News Australia full broadcasts and full episodes at 6pm and weekdays at 12pm and 4pm on Channel 7 and 7plus.  #BREAKINGNEWS #7NEWS",https://www.youtube.com/watch?v=lYdEwPzzdsY,7News
2025-12-02T09:20:10+00:00,School of rock takes over Dulwich Hill | 7NEWS,"Local kids light up the stage at Butcher Brew, proving that on a school night, rock and roll rules.  Subscribe and set 🔔 » https://7news.link/YTSubscribe |   For the latest Australian news and breaking news alerts, connect with 7NEWS online: Visit » https://7news.com.au 7Plus » https://7plus.com.au/ 7NEWS Podcast » https://open.spotify.com/user/dm9fk9hzoe68ibpttheragdgi Facebook » https://www.facebook.com/7NewsAustralia TikTok » https://www.tiktok.com/@7newsaustralia Instagram » https://www.instagram.com/7newsaustralia/  X » https://x.com/7NewsAustralia   7NEWS combines the trusted and powerful news brands including Sunrise, The Morning Show, Spotlight and 7NEWS.com.au, delivering unique, engaging and continuous coverage on the issues that matter most to Australians. Watch 7 News Australia full broadcasts and full episodes at 6pm and weekdays at 12pm and 4pm on Channel 7 and 7plus.  #BREAKINGNEWS #7NEWS",https://www.youtube.com/watch?v=ez8unGn4xTQ,7News
2025-12-02T09:26:45+00:00,"Australia is about to become ""the canary in a coal mine"" when it comes to social media | 7NEWS","EXCLUSIVE: The prime minister is adamant Australia’s bold move to block under-16s from social media will curb online bullying.   In the third part of our series, Anthony Albanese tells 7NEWS the ban will not be perfect, but it will save young lives.   Subscribe and set 🔔 » https://7news.link/YTSubscribe |   For the latest Australian news and breaking news alerts, connect with 7NEWS online: Visit » https://7news.com.au 7Plus » https://7plus.com.au/ 7NEWS Podcast » https://open.spotify.com/user/dm9fk9hzoe68ibpttheragdgi Facebook » https://www.facebook.com/7NewsAustralia TikTok » https://www.tiktok.com/@7newsaustralia Instagram » https://www.instagram.com/7newsaustralia/  X » https://x.com/7NewsAustralia   7NEWS combines the trusted and powerful news brands including Sunrise, The Morning Show, Spotlight and 7NEWS.com.au, delivering unique, engaging and continuous coverage on the issues that matter most to Australians. Watch 7 News Australia full broadcasts and full episodes at 6pm and weekdays at 12pm and 4pm on Channel 7 and 7plus.  #BREAKINGNEWS #7NEWS",https://www.youtube.com/watch?v=KQVRHwfPT9U,7News
2025-12-02T09:49:28+00:00,Detonating lost bombs with Aussie army,"The Australian Army's Explosive Ordnance Team has invited 7NEWS' Tim Lester to witness, and get involved in, detonating unexploded bombs and artillery shells which regularly wash up on Aussie shores. The Explosive Ordnance Team conducts approximately 500 disposal operations annually across Australia to avoid the risk of a civilian's accidental explosion. #australianarmy #explosiveordnanceteam #militarywaste",https://www.youtube.com/shorts/KcdBhsccK5o,7News
2025-12-02T10:16:46+00:00,Teenager survives collapsed retaining wall; Fatal fire destroys Redland Bay home | 7NEWS Brisbane,"Police, firefighters, and workmates have worked together to free a teenager from underneath collapsed concrete. His 45-year-old step-father did not survive when the wall gave way. A deadly bayside house fire is survived by two individuals, but has killed a man who was on the top floor of the home. It took the fire crews an hour to contain the blaze.  Subscribe and set 🔔 » https://7news.link/YTSubscribe |   For the latest Australian news and breaking news alerts, connect with 7NEWS online: Visit » https://7news.com.au 7Plus » https://7plus.com.au/ 7NEWS Podcast » https://open.spotify.com/user/dm9fk9hzoe68ibpttheragdgi Facebook » https://www.facebook.com/7NewsAustralia TikTok » https://www.tiktok.com/@7newsaustralia Instagram » https://www.instagram.com/7newsaustralia/  X » https://x.com/7NewsAustralia   7NEWS combines the trusted and powerful news brands including Sunrise, The Morning Show, Spotlight and 7NEWS.com.au, delivering unique, engaging and continuous coverage on the issues that matter most to Australians. Watch 7 News Australia full broadcasts and full episodes at 6pm and weekdays at 12pm and 4pm on Channel 7 and 7plus.  #BREAKINGNEWS #7NEWS",https://www.youtube.com/watch?v=vaYoVoRdsfU,7News
2025-12-02T10:21:58+00:00,18-year-old flung into the air after hit-run in Mandurah | 7NEWS,"A teenager has survived a hit-and-run in Mandurah Terrace, after an SUV swerved onto the wrong side of the road and hits the boy as he was crossing.  Subscribe and set 🔔 » https://7news.link/YTSubscribe |   For the latest Australian news and breaking news alerts, connect with 7NEWS online: Visit » https://7news.com.au 7Plus » https://7plus.com.au/ 7NEWS Podcast » https://open.spotify.com/user/dm9fk9hzoe68ibpttheragdgi Facebook » https://www.facebook.com/7NewsAustralia TikTok » https://www.tiktok.com/@7newsaustralia Instagram » https://www.instagram.com/7newsaustralia/  X » https://x.com/7NewsAustralia   7NEWS combines the trusted and powerful news brands including Sunrise, The Morning Show, Spotlight and 7NEWS.com.au, delivering unique, engaging and continuous coverage on the issues that matter most to Australians. Watch 7 News Australia full broadcasts and full episodes at 6pm and weekdays at 12pm and 4pm on Channel 7 and 7plus.  #BREAKINGNEWS #7NEWS",https://www.youtube.com/watch?v=3tmYNt_r46E,7News
2025-12-02T10:33:12+00:00,Deadly bushfire devastates Ravensthorpe community | 7NEWS,"Communities have been left shell-shocked after fatal fires erupted across Western Australia. Beloved farmer Mark Mudie was killed by the deadly bushfire as he tried to fight the flames which terrorised property near Ravensthorpe.  Subscribe and set 🔔 » https://7news.link/YTSubscribe |   For the latest Australian news and breaking news alerts, connect with 7NEWS online: Visit » https://7news.com.au 7Plus » https://7plus.com.au/ 7NEWS Podcast » https://open.spotify.com/user/dm9fk9hzoe68ibpttheragdgi Facebook » https://www.facebook.com/7NewsAustralia TikTok » https://www.tiktok.com/@7newsaustralia Instagram » https://www.instagram.com/7newsaustralia/  X » https://x.com/7NewsAustralia   7NEWS combines the trusted and powerful news brands including Sunrise, The Morning Show, Spotlight and 7NEWS.com.au, delivering unique, engaging and continuous coverage on the issues that matter most to Australians. Watch 7 News Australia full broadcasts and full episodes at 6pm and weekdays at 12pm and 4pm on Channel 7 and 7plus.  #BREAKINGNEWS #7NEWS",https://www.youtube.com/watch?v=CX-vuQMnj3U,7News
2025-12-02T10:42:22+00:00,Crackdown on abusive behaviour against retail staff | 7NEWS,"In a bid to stamp out abusive customer behaviour, new retail barring orders will work similarly to restraining orders which could lead to jail time, should the order be broken.  Subscribe and set 🔔 » https://7news.link/YTSubscribe |   For the latest Australian news and breaking news alerts, connect with 7NEWS online: Visit » https://7news.com.au 7Plus » https://7plus.com.au/ 7NEWS Podcast » https://open.spotify.com/user/dm9fk9hzoe68ibpttheragdgi Facebook » https://www.facebook.com/7NewsAustralia TikTok » https://www.tiktok.com/@7newsaustralia Instagram » https://www.instagram.com/7newsaustralia/  X » https://x.com/7NewsAustralia   7NEWS combines the trusted and powerful news brands including Sunrise, The Morning Show, Spotlight and 7NEWS.com.au, delivering unique, engaging and continuous coverage on the issues that matter most to Australians. Watch 7 News Australia full broadcasts and full episodes at 6pm and weekdays at 12pm and 4pm on Channel 7 and 7plus.  #BREAKINGNEWS #7NEWS",https://www.youtube.com/watch?v=r0OgO40eg8E,7News
2025-12-02T10:58:45+00:00,Teenager mowed down in hit-and-run; Mudie family and Ravensthorpe community mourns | 7NEWS Perth,"After a car swerved onto the wrong side of the road, an 18-year-old was flung into the air, luckily surviving with no major injuries. A deadly bushfire has devastated Mark Mudie's family and the Ravensthorpe community, after the beloved community member and farmer was killed trying to fight the fire.  Subscribe and set 🔔 » https://7news.link/YTSubscribe |   For the latest Australian news and breaking news alerts, connect with 7NEWS online: Visit » https://7news.com.au 7Plus » https://7plus.com.au/ 7NEWS Podcast » https://open.spotify.com/user/dm9fk9hzoe68ibpttheragdgi Facebook » https://www.facebook.com/7NewsAustralia TikTok » https://www.tiktok.com/@7newsaustralia Instagram » https://www.instagram.com/7newsaustralia/  X » https://x.com/7NewsAustralia   7NEWS combines the trusted and powerful news brands including Sunrise, The Morning Show, Spotlight and 7NEWS.com.au, delivering unique, engaging and continuous coverage on the issues that matter most to Australians. Watch 7 News Australia full broadcasts and full episodes at 6pm and weekdays at 12pm and 4pm on Channel 7 and 7plus.  #BREAKINGNEWS #7NEWS",https://www.youtube.com/watch?v=EWeroSKi_p0,7News
2025-12-02T11:13:25+00:00,Bear squatter found underneath Californian home,"After setting up surveillance cameras, a Southern California resident has discovered that a 500-pound bear currently lives beneath his home. According to the resident, he has previously seen this bear rummaging through his trash, and now, has footage of the bear squeezing into crawl space underneath his house. #bear #southerncalifornia #altadena",https://www.youtube.com/shorts/l2SXeffnu2w,7News
