published,title,description,link,Pub
2025-10-29T07:36:58+00:00,Aussie paragliders rescued in the Himalayas | 9 News Australia,The pair huddled together through the night as rescue crews battled to reach their remote location. #9News #Shorts,https://www.youtube.com/shorts/vR0GyM458f4,9News
2025-10-29T07:44:58+00:00,Aussie paraglider survives freezing temperatures in 'book-worthy' rescue | 9 News Australia,"Clinging to the side of a mountain in the Himalayas, the mates huddled together through the night as rescue crews battled to reach their remote location. | *Subscribe and 🔔: http://9Soci.al/KM6e50GjSK9*  *Get more breaking news at 9News.com.au: http://9Soci.al/iyCO50GjSK6*  FOLLOW 9News Australia ► Facebook: https://www.facebook.com/9News/ ► Twitter: https://twitter.com/9NewsAUS ► Instagram: https://www.instagram.com/9news/  Join 9News for the latest in news and events that affect you in your local city, as well as news from across Australia and the world.  #9News #BreakingNews #NineNewsAustralia #9NewsAU",https://www.youtube.com/watch?v=PIoY195eckU,9News
2025-10-29T07:45:48+00:00,Woman fronts court over alleged hospital tampering | 9 News Australia,"A safety audit is underway at every hospital in the state, after a woman was accused of tampering with essential medical gas mains at two locations in Sydney's south. #9News #Shorts",https://www.youtube.com/shorts/HRYjc5TFbrs,9News
2025-10-29T07:53:56+00:00,Unprecedented day for SA Police after major sting operation | 9 News Australia,"Nearly 60 people have been arrested in South Australia as part of a nationwide sting operation linked to an encrypted app. | *Subscribe and 🔔: http://9Soci.al/KM6e50GjSK9*  *Get more breaking news at 9News.com.au: http://9Soci.al/iyCO50GjSK6*  FOLLOW 9News Australia ► Facebook: https://www.facebook.com/9News/ ► Twitter: https://twitter.com/9NewsAUS ► Instagram: https://www.instagram.com/9news/  Join 9News for the latest in news and events that affect you in your local city, as well as news from across Australia and the world.  #9News #BreakingNews #NineNewsAustralia #9NewsAU",https://www.youtube.com/watch?v=AOaa2tVWgI4,9News
2025-10-29T07:55:49+00:00,TEN-YEAR FIGHT: Residents STILL living on contaminated land | 9 News Australia,"Williamtown residents have dealt with confusion, inaction, and countless meetings after the forever chemical PFAS contaminated their land and their waterways over a decade ago.   | Subscribe and 🔔: http://9Soci.al/KM6e50GjSK9 | Get more breaking news at 9News.com.au: http://9Soci.al/iyCO50GjSK6  FOLLOW 9News Australia ► Facebook: https://www.facebook.com/9News/ ► Twitter: https://twitter.com/9NewsAUS ► Instagram: https://www.instagram.com/9news/  Join 9News for the latest in news and events that affect you in your local city, as well as news from across Australia and the world.  #BREAKINGNEWS #9NEWS #AUSTRALIA",https://www.youtube.com/shorts/UPgZhT04C5o,9News
2025-10-29T08:07:17+00:00,U.S. strikes target alleged drug trafficking boats | 9 News Australia,"The Trump administration has killed at least 51 people in its two-month campaign against drug trafficking vessels. #9News | Subscribe and 🔔: http://9Soci.al/KM6e50GjSK9 | Get more breaking news at 9News.com.au: http://9Soci.al/iyCO50GjSK6  FOLLOW 9News Australia ► Facebook: https://www.facebook.com/9News/ ► Twitter: https://twitter.com/9NewsAUS ► Instagram: https://www.instagram.com/9news/  Join 9News for the latest in news and events that affect you in your local city, as well as news from across Australia and the world.  #BREAKINGNEWS #9NEWS #AUSTRALIA",https://www.youtube.com/shorts/OC-JOKNV7hc,9News
2025-10-29T08:08:43+00:00,"AFP crackdown on ""crimefluencers"" gamifying exploitation | 9 News Australia","Australian girls are being targeted online by sadistic young men, who treat their victims as if they were characters in a video game, the new head of the Australian Federal Police has revealed. #9News | Subscribe and 🔔: http://9Soci.al/KM6e50GjSK9 | Get more breaking news at 9News.com.au: http://9Soci.al/iyCO50GjSK6  FOLLOW 9News Australia ► Facebook: https://www.facebook.com/9News/ ► Twitter: https://twitter.com/9NewsAUS ► Instagram: https://www.instagram.com/9news/  Join 9News for the latest in news and events that affect you in your local city, as well as news from across Australia and the world.  #BREAKINGNEWS #9NEWS #AUSTRALIA",https://www.youtube.com/shorts/CyFMhrWzI1E,9News
2025-10-29T08:09:05+00:00,Bureau of Meteorology forced to apologise after website revamp flop | 9 News Australia,"The boss of the Bureau of Meteorology has issued a national apology after making expensive taxpayer-funded changes to the weather website. | *Subscribe and 🔔: http://9Soci.al/KM6e50GjSK9*  *Get more breaking news at 9News.com.au: http://9Soci.al/iyCO50GjSK6*  FOLLOW 9News Australia ► Facebook: https://www.facebook.com/9News/ ► Twitter: https://twitter.com/9NewsAUS ► Instagram: https://www.instagram.com/9news/  Join 9News for the latest in news and events that affect you in your local city, as well as news from across Australia and the world.  #9News #BreakingNews #NineNewsAustralia #9NewsAU",https://www.youtube.com/watch?v=Fpvtgt4dI1M,9News
2025-10-29T08:09:48+00:00,At least 60 killed by Israeli strikes on Gaza | 9 News Australia,"At least 60 people have been killed by Israeli strikes on Gaza after Hamas was accused of violating the ceasefire agreement. #9News  | Subscribe and 🔔: http://9Soci.al/KM6e50GjSK9 | Get more breaking news at 9News.com.au: http://9Soci.al/iyCO50GjSK6  FOLLOW 9News Australia ► Facebook: https://www.facebook.com/9News/ ► Twitter: https://twitter.com/9NewsAUS ► Instagram: https://www.instagram.com/9news/  Join 9News for the latest in news and events that affect you in your local city, as well as news from across Australia and the world.  #BREAKINGNEWS #9NEWS #AUSTRALIA",https://www.youtube.com/shorts/ISViOClwrqs,9News
2025-10-29T08:11:47+00:00,Hundreds of Year 12 students taught the wrong subject ahead of exam | 9 News Australia,"Queensland's education minister has vowed to get to the bottom of a massive exam bungle that means hundreds of students sat an exam on a topic they hadn't learnt about. | *Subscribe and 🔔: http://9Soci.al/KM6e50GjSK9*  *Get more breaking news at 9News.com.au: http://9Soci.al/iyCO50GjSK6*  FOLLOW 9News Australia ► Facebook: https://www.facebook.com/9News/ ► Twitter: https://twitter.com/9NewsAUS ► Instagram: https://www.instagram.com/9news/  Join 9News for the latest in news and events that affect you in your local city, as well as news from across Australia and the world.  #9News #BreakingNews #NineNewsAustralia #9NewsAU",https://www.youtube.com/watch?v=HEvLMgWkyC4,9News
2025-10-29T09:06:40+00:00,One of the 'most ambitious homes ever built in Australia' hits the market | 9 News Australia,"Billed as one of the 'most ambitious homes ever built in Australia', a Gold Coast mega mansion is now hitting the market, expected to break sales records at auction. | *Subscribe and 🔔: http://9Soci.al/KM6e50GjSK9*  *Get more breaking news at 9News.com.au: http://9Soci.al/iyCO50GjSK6*  FOLLOW 9News Australia ► Facebook: https://www.facebook.com/9News/ ► Twitter: https://twitter.com/9NewsAUS ► Instagram: https://www.instagram.com/9news/  Join 9News for the latest in news and events that affect you in your local city, as well as news from across Australia and the world.  #9News #BreakingNews #NineNewsAustralia #9NewsAU",https://www.youtube.com/watch?v=R2s-_x_pRc4,9News
2025-10-29T11:00:29+00:00,9News Adelaide | Wednesday October 29 | Full Episode,"Brenton Ragless and Kate Collins lead the Adelaide news, with major breaking news, including an unprecedented day of arrests in South Australia linked to the Operation Ironside ""AN0M"" app, state government proposals for new laws to protect retail workers, fresh inflation figures impacting interest rate forecasts, and catastrophic destruction from a Category 5 hurricane.  | Subscribe and 🔔: http://9Soci.al/KM6e50GjSK9 | Get more breaking news at 9News.com.au: http://9Soci.al/iyCO50GjSK6  CHAPTERS: 0:00 Bulletin Start & Headlines 0:41 Unprecedented Police Sting: Operation Ironside 3.0 4:58 Retail Worker Safety: Push for Shop Bans 6:50 Adelaide Bottle Shop Robbery & Youth Arrests 7:16 Truck Overturns at Edinburgh Roundabout 7:49 Inflation Shock & Interest Rate Outlook 9:11 Trade Tensions & US-China Summit in Korea 9:39 Hurricane Melissa Makes Landfall as Cat 5 in Jamaica 12:49 Pivotal US-China Summit in South Korea 14:01 PM Albanese in South Korea for Strategic Talks 14:46 Candle Ignites Welland Unit Fire 15:13 Bike Thief's Clumsy Getaway 15:32 Major ADHD Diagnosis Reform for South Australian Families 16:21 SA Nurses to Walk Off Job in Pay Dispute 17:54 Cruise Ship 'Carnival Adventure' Homeporting in Adelaide  FOLLOW 9News Australia ► Facebook: https://www.facebook.com/9News/ ► Twitter: https://twitter.com/9NewsAUS ► Instagram: https://www.instagram.com/9news/  Join 9News for the latest in news and events that affect you in your local city, as well as news from across Australia and the world.  #BREAKINGNEWS #9NEWS #AUSTRALIA",https://www.youtube.com/watch?v=FB-C9lFd0_I,9News
2025-10-29T11:01:05+00:00,9News Sydney | Wednesday October 29 | Full Episode,"This bulletin features a serious investigation into a patient death following alleged sabotage at two Sydney hospitals. Other key stories include the catastrophic damage from Hurricane Melissa, new inflation figures, an update on Mark Latham's AVO case, and a tribute to late British actress Prunella Scales.    | Subscribe and 🔔: http://9Soci.al/KM6e50GjSK9 | Get more breaking news at 9News.com.au: http://9Soci.al/iyCO50GjSK6  CHAPTERS:  0:00 Bulletin Start & Headlines 0:50 Sydney Hospital Sabotage Investigation 3:07 Hurricane Melissa's Full Fury Hits Jamaica 5:58 Former MP Gareth Ward Sentence Delay 6:28 Mark Latham AVO Case Update 6:51 Inflation Shock: Price Spikes & Rate Cut Outlook 7:06 Treasurer & Opposition on Cost of Living 8:33 Teen Struck by Cricket Ball Fighting for Life 9:45 Mark Latham's AVO Case Near Settlement 10:10 AFP Launches Taskforce to Target 'Crimefluencers' 10:39 Fragile Gaza Ceasefire Agreement Update 11:12 Pivotal US-China Summit in South Korea 12:44 PM Albanese in South Korea & Wreath Laying Ceremony 13:48 Russian Consulate Rammer Jailed 14:04 Moguls Team Train 100 Days Out from Winter Olympics 15:41 Tribute to British Icon Prunella Scales  17:37 Sydney Weather: Rainfall Totals & Outlook 18:59 Police Raids in Sydney: Guns, Drugs, and Cash Seized 19:40 BOM Website Backlash & Official Apology 21:36 US Anti-Drug Campaign Escalates in Pacific Ocean 22:04 Potentially Infected Lab Monkeys Escape in U.S. 22:25 Teen Struck by Cricket Ball Update & Vigil  FOLLOW 9News Australia ► Facebook: https://www.facebook.com/9News/ ► Twitter: https://twitter.com/9NewsAUS ► Instagram: https://www.instagram.com/9news/  Join 9News for the latest in news and events that affect you in your local city, as well as news from across Australia and the world.  #BREAKINGNEWS #9NEWS #AUSTRALIA",https://www.youtube.com/watch?v=SYep8O3JEag,9News
2025-10-29T11:01:31+00:00,9News Melbourne | Wednesday October 29 | Full Episode,"Alicia Loxley and Tom Steinfort present the Melbourne news, with key stories including a teen cricketer fighting for life after a traumatic injury, a Singapore Airlines emergency landing at Melbourne Airport, a father's heroic defense during an armed home invasion, a tragic update on the 1977 Easey Street murders, and the shock inflation data that rules out a Melbourne Cup Day interest rate cut.   | Subscribe and 🔔: http://9Soci.al/KM6e50GjSK9 | Get more breaking news at 9News.com.au: http://9Soci.al/iyCO50GjSK6  CHAPTERS: 0:00 Bulletin Start & Headlines 0:50 Teen Cricketer Fighting for Life After Training Injury 2:15 Breaking News: Singapore Airlines Emergency Landing in Melbourne 3:37 Father Confronts Intruders Armed with Hammer and Bat 5:29 Easey Street Murders: DNA Evidence Claims and Court Hearing 7:22 Melbourne Cup Day Interest Rate Outlook 9:43 Hurricane Melissa's Path of Destruction in the Caribbean 12:48 Oasis Arrives in Melbourne for First Show in 20 Years 16:52 Tasmanian MPs Fail to Sway AFL on Stadium Project 17:33 AFL Rule Changes & Cricket Training Update in Sport 18:44 Ballarat Man Blows Record BAC 19:14 Queensland School Exam Bungle 19:57 Police Patrol Anti-Lockdown Protest Footage 20:57 Victorian Parliamentary Debate on Assisted Dying Laws 21:36 Tribute to Fawlty Towers Star Prunella Scales 23:31 Melbourne Weather Forecast  FOLLOW 9News Australia ► Facebook: https://www.facebook.com/9News/ ► Twitter: https://twitter.com/9NewsAUS ► Instagram: https://www.instagram.com/9news/  Join 9News for the latest in news and events that affect you in your local city, as well as news from across Australia and the world.  #BREAKINGNEWS #9NEWS #AUSTRALIA",https://www.youtube.com/watch?v=WHQrAbdj1fQ,9News
2025-10-29T11:01:59+00:00,9News Brisbane | Wednesday October 29 | Full Episode,"Melissa Downs and Joel Dry lead the Queensland news, with key stories including the BOM's apology after its expensive website failed Queenslanders during a severe storm, an incredible Year 12 Ancient History exam blunder involving Julius Caesar and Augustus, catastrophic damage from Hurricane Melissa in the Caribbean, and exclusive footage of a dramatic arrest after a violent public rampage. Plus, the price spikes that are keeping interest rates on hold.  | Subscribe and 🔔: http://9Soci.al/KM6e50GjSK9 | Get more breaking news at 9News.com.au: http://9Soci.al/iyCO50GjSK6  CHAPTERS: 0:00 Bulletin Start & Headlines 0:43 BOM Website Backlash & Apology After Storm 3:05 QLD Year 12 Ancient History Exam Bungle Begins 4:54 Uber Driver Stabbing Update: Accused Teen's Case Delayed 5:35 Suspected Human Remains Found in Paul Woods Search 6:07 Hurricane Melissa's Catastrophic Impact on Jamaica 8:26 AFP Launches Taskforce Against 'Crimefluencers' 9:16 Health Minister Grilled Over Chief Health Officer Appointment 11:27 Murder Trial: Human Remains Found in Paul Woods Case 12:48 Brisbane Mum Murder Trial: Disturbing Evidence Revealed 14:26 Inflation Shock: Price Spikes Keep Rates on Hold 15:08 Treasurer and Opposition on Cost of Living 16:51 Moguls Team Train 100 Days Out from Winter Olympics 18:50 VIP Tour: Queensland's Most Luxurious Mansion 19:16 Police Crackdown: 400 Hoon Drivers Charged 19:57 Dramatic Arrest After Violent Rampage in Beenleigh 21:34 US Anti-Drug Campaign Escalates in Pacific Ocean 22:04 Potentially Infected Lab Monkeys Escape in U.S. 22:25 Teen Struck by Cricket Ball Update & Vigil  FOLLOW 9News Australia ► Facebook: https://www.facebook.com/9News/ ► Twitter: https://twitter.com/9NewsAUS ► Instagram: https://www.instagram.com/9news/  Join 9News for the latest in news and events that affect you in your local city, as well as news from across Australia and the world.  #BREAKINGNEWS #9NEWS #AUSTRALIA",https://www.youtube.com/watch?v=tHHcCkoNPdc,9News
