published,title,description,link,Pub
2025-12-08T07:57:24+00:00,Family stare down their daughter's killer in court | 9 News Australia,"Western Sydney mother Drew Douglas was trying to leave her abusive partner but was stabbed to death before she had the chance. Today her family stared down her killer in court as they spoke of their never-ending grief. | *Subscribe and 🔔: http://9Soci.al/KM6e50GjSK9*  *Get more breaking news at 9News.com.au: http://9Soci.al/iyCO50GjSK6*  FOLLOW 9News Australia ► Facebook: https://www.facebook.com/9News/ ► Twitter: https://twitter.com/9NewsAUS ► Instagram: https://www.instagram.com/9news/  Join 9News for the latest in news and events that affect you in your local city, as well as news from across Australia and the world.  #9News #BreakingNews #NineNewsAustralia #9NewsAU",https://www.youtube.com/watch?v=V9Mm2u-6AWs,9News
2025-12-08T08:00:28+00:00,More than 20 people injured after pepper spray attack at Heathrow Airport | 9 News Australia,"Three men are still on the run after stealing a woman's suitcase and targeting people with pepper spray at Heathrow Airport. | *Subscribe and 🔔: http://9Soci.al/KM6e50GjSK9*  *Get more breaking news at 9News.com.au: http://9Soci.al/iyCO50GjSK6*  FOLLOW 9News Australia ► Facebook: https://www.facebook.com/9News/ ► Twitter: https://twitter.com/9NewsAUS ► Instagram: https://www.instagram.com/9news/  Join 9News for the latest in news and events that affect you in your local city, as well as news from across Australia and the world.  #9News #BreakingNews #NineNewsAustralia #9NewsAU",https://www.youtube.com/watch?v=ntpSHWF9Cfg,9News
2025-12-08T08:06:59+00:00,Family's lucky escape after suspected battery fire engulfs home | 9 News Australia,"A Caroline Springs family were forced to climb into a neighbour's backyard to escape their burning home. A lithium-ion battery is believed to have sparked the blaze, prompting a warning from firefighters. | *Subscribe and 🔔: http://9Soci.al/KM6e50GjSK9*  *Get more breaking news at 9News.com.au: http://9Soci.al/iyCO50GjSK6*  FOLLOW 9News Australia ► Facebook: https://www.facebook.com/9News/ ► Twitter: https://twitter.com/9NewsAUS ► Instagram: https://www.instagram.com/9news/  Join 9News for the latest in news and events that affect you in your local city, as well as news from across Australia and the world.  #9News #BreakingNews #NineNewsAustralia #9NewsAU",https://www.youtube.com/watch?v=T179ZiVX4qk,9News
2025-12-08T08:07:15+00:00,Chelsea and Tottenham planned to join 2026 Sydney Super Cup | 9 News Australia,"Australian football fans are in for a treat next year, as Premier League heavyweights Chelsea and Tottenham plan to come Down Under.  | *Subscribe and 🔔: http://9Soci.al/KM6e50GjSK9*  *Get more breaking news at 9News.com.au: http://9Soci.al/iyCO50GjSK6*  FOLLOW 9News Australia ► Facebook: https://www.facebook.com/9News/ ► Twitter: https://twitter.com/9NewsAUS ► Instagram: https://www.instagram.com/9news/  Join 9News for the latest in news and events that affect you in your local city, as well as news from across Australia and the world.  #9News #BreakingNews #NineNewsAustralia #9NewsAU",https://www.youtube.com/watch?v=w0bbhlccKFM,9News
2025-12-08T08:08:49+00:00,Crucial dementia care service at risk due to future funding | 9 News Australia,"Respite cottages, which many carers rely on to keep loved ones at home and out of aged care, could be jeopardised by a major Commonwealth funding shakeup. | *Subscribe and 🔔: http://9Soci.al/KM6e50GjSK9*  *Get more breaking news at 9News.com.au: http://9Soci.al/iyCO50GjSK6*  FOLLOW 9News Australia ► Facebook: https://www.facebook.com/9News/ ► Twitter: https://twitter.com/9NewsAUS ► Instagram: https://www.instagram.com/9news/  Join 9News for the latest in news and events that affect you in your local city, as well as news from across Australia and the world.  #9News #BreakingNews #NineNewsAustralia #9NewsAU",https://www.youtube.com/watch?v=401dZnMtAec,9News
2025-12-08T08:10:54+00:00,SA Liberals elect Ashton Hurn as new opposition leader | 9 News Australia,"The hopes of the South Australian Liberal Party is now resting on the shoulders of Ashton Hurn. Elected Opposition Leader unopposed this morning, she has just four months to woo the public, and prevent a looming Labor landslide at the next election. | *Subscribe and 🔔: http://9Soci.al/KM6e50GjSK9*  *Get more breaking news at 9News.com.au: http://9Soci.al/iyCO50GjSK6*  FOLLOW 9News Australia ► Facebook: https://www.facebook.com/9News/ ► Twitter: https://twitter.com/9NewsAUS ► Instagram: https://www.instagram.com/9news/  Join 9News for the latest in news and events that affect you in your local city, as well as news from across Australia and the world.  #9News #BreakingNews #NineNewsAustralia #9NewsAU",https://www.youtube.com/watch?v=nQfIpGGElXo,9News
2025-12-08T08:13:14+00:00,Bottle shop robbery turns violent in Adelaide | 9 News Australia,"A robbery at an Adelaide bottle shop has turned violent, with an elderly man thrown to the ground and a staff member rushed to hospital. Five teenagers have been arrested over the incident, with two of them as young as thirteen. | *Subscribe and 🔔: http://9Soci.al/KM6e50GjSK9*  *Get more breaking news at 9News.com.au: http://9Soci.al/iyCO50GjSK6*  FOLLOW 9News Australia ► Facebook: https://www.facebook.com/9News/ ► Twitter: https://twitter.com/9NewsAUS ► Instagram: https://www.instagram.com/9news/  Join 9News for the latest in news and events that affect you in your local city, as well as news from across Australia and the world.  #9News #BreakingNews #NineNewsAustralia #9NewsAU",https://www.youtube.com/watch?v=WvNTaSIfkg8,9News
2025-12-08T08:23:43+00:00,Rajwinder Singh found guilty of murdering Toyah Cordingley | 9 News Australia,"A former hospital nurse has been found guilty of murdering Toyah Cordingley, seven years after the young woman's body was found on an isolated beach. | *Subscribe and 🔔: http://9Soci.al/KM6e50GjSK9*  *Get more breaking news at 9News.com.au: http://9Soci.al/iyCO50GjSK6*  FOLLOW 9News Australia ► Facebook: https://www.facebook.com/9News/ ► Twitter: https://twitter.com/9NewsAUS ► Instagram: https://www.instagram.com/9news/  Join 9News for the latest in news and events that affect you in your local city, as well as news from across Australia and the world.  #9News #BreakingNews #NineNewsAustralia #9NewsAU",https://www.youtube.com/watch?v=5zQjOHowiZE,9News
2025-12-08T08:26:10+00:00,Report finds five missed opportunities to stop prolific paedophile | 9 News Australia,"A report has found there were at least five missed opportunities to stop prolific paedophile Ashley Paul Griffith.| *Subscribe and 🔔: http://9Soci.al/KM6e50GjSK9*  *Get more breaking news at 9News.com.au: http://9Soci.al/iyCO50GjSK6*  FOLLOW 9News Australia ► Facebook: https://www.facebook.com/9News/ ► Twitter: https://twitter.com/9NewsAUS ► Instagram: https://www.instagram.com/9news/  Join 9News for the latest in news and events that affect you in your local city, as well as news from across Australia and the world.  #9News #BreakingNews #NineNewsAustralia #9NewsAU",https://www.youtube.com/watch?v=JgxjwJZu5nk,9News
2025-12-08T08:29:02+00:00,Australia's Social Media Ban: Your Questions Answered | 9 News Australia,"Australia's world-leading social media ban for under-16s comes into effect this week, but parents and young Aussies still have plenty of questions - so we took them to the people in charge. | Subscribe and 🔔: http://9Soci.al/KM6e50GjSK9 | Get more breaking news at 9News.com.au: http://9Soci.al/iyCO50GjSK6  FOLLOW 9News Australia ► Facebook: https://www.facebook.com/9News/ ► Twitter: https://twitter.com/9NewsAUS ► Instagram: https://www.instagram.com/9news/  Join 9News for the latest in news and events that affect you in your local city, as well as news from across Australia and the world.  #BREAKINGNEWS #9NEWS #AUSTRALIA   Chapters: 00:00 Introduction: A World First in Australia 00:12 The Government's Position & Public Debate 00:28 Is it the Government's Place to Tell Parents How to Raise Children? 01:15 Which Platforms Are In and Which Are Out of the Ban? 01:55 Why is Discord excluded from the ban? 02:39 YouTube's Non-Account Access & Targeted Advertising 03:30 Why isn't age verification needed for adult websites (pornography) and AI chatbots? 04:45 Data Security and Privacy Concerns 05:45 Age Assurance Technology: Are the Commissioner's Discussions Satisfactory? 06:20 Why a Ban on Platforms, Not Just Harmful Content? 09:25 Other Tools to Combat Harmful Content 10:02 YouTube's Harmful Content Problem 14:46 Upcoming Rules for Search Engines and AI Chatbots 16:26 The Technology Underpinning the Ban 18:44 The VPN and Circumvention Issue 21:39 Parental Responsibility & Penalty 22:47 Reporting Loopholes and Underage Users 25:55 Support for Teachers and Parents",https://www.youtube.com/watch?v=PuAn795YUrQ,9News
2025-12-08T08:30:24+00:00,Tragedy in the NSW bushfire emergency | 9 News Australia,"The bushfire battle in Northern New South Wales has taken a tragic turn, with a firefighter dead after being hit by a tree branch near Bulahdelah. | *Subscribe and 🔔: http://9Soci.al/KM6e50GjSK9*  *Get more breaking news at 9News.com.au: http://9Soci.al/iyCO50GjSK6*  FOLLOW 9News Australia ► Facebook: https://www.facebook.com/9News/ ► Twitter: https://twitter.com/9NewsAUS ► Instagram: https://www.instagram.com/9news/  Join 9News for the latest in news and events that affect you in your local city, as well as news from across Australia and the world.  #9News #BreakingNews #NineNewsAustralia #9NewsAU",https://www.youtube.com/watch?v=i3xW1ERiZTA,9News
2025-12-08T10:41:18+00:00,The new dangerous birthing trend,"There's a new birth trend that's raising the alarm, where there's no hospital and no medical assistance. #9News | *Subscribe and 🔔: http://9Soci.al/KM6e50GjSK9*  *Get more breaking news at 9News.com.au: http://9Soci.al/iyCO50GjSK6*  FOLLOW 9News Australia ► Facebook: https://www.facebook.com/9News/ ► Twitter: https://twitter.com/9NewsAUS ► Instagram: https://www.instagram.com/9news/  Join 9News for the latest in news and events that affect you in your local city, as well as news from across Australia and the world.  #9News #BreakingNews #NineNewsAustralia #9NewsAU",https://www.youtube.com/watch?v=bgJ_RkwHOFQ,9News
2025-12-08T11:01:19+00:00,9News Sydney | Monday December 8 | Full Episode,"Georgie Gardner leads the bulletin with major news, including tragedy on the NSW coastline as a veteran firefighter is killed battling bushfires. Federal cost-of-living relief ends, hitting Australian households, just as Barnaby Joyce causes a political sensation by defecting to One Nation. We also cover the guilty verdict in the high-profile Toyah Cordingley murder case, the Wests Tigers internal chaos, and a crackdown on hate crime.   CHAPTERS:  0:01 Bushfire Tragedy: Firefighter Killed 2:09 Tasmania Fire Emergency 2:29 Cost of Living Blow: Energy Rebates End 4:26 RBA Interest Rate Meeting Preview 5:26 Scots College Alleged Student Assault 6:59 NRL Bans Over Katoa Concussion Protocol 7:56 Fatal Motorbike Crash 8:15 Bankstown Stabbing Arrest 8:32 Police Blitz on Organised Crime 9:03 Political Earthquake: Barnaby Joyce Joins One Nation 10:55 Convictions Quashed: Newcastle Gang Rape 11:24 Hate Crime Crackdown 12:12 Domestic Violence Murder Sentencing Hearing 14:06 E-Bike Mandatory Number Plates Proposed 14:25 Wests Tigers CEO Shane Richardson Quits 16:02 Hospital Carpark Crash 16:19 Rajwinder Singh Guilty of Toyah Cordingley Murder 17:57 Heathrow Pepper Spray Attack 19:25 Chernobyl Shield Unsafe 19:46 Thailand Launches Border Strikes 20:09 Mountaineer Charged with Manslaughter 20:31 Donald Trump Hosts Kennedy Centre Honours  | *Subscribe and 🔔: http://9Soci.al/KM6e50GjSK9*  *Get more breaking news at 9News.com.au: http://9Soci.al/iyCO50GjSK6*  FOLLOW 9News Australia ► Facebook: https://www.facebook.com/9News/ ► Twitter: https://twitter.com/9NewsAUS ► Instagram: https://www.instagram.com/9news/  Join 9News for the latest in news and events that affect you in your local city, as well as news from across Australia and the world.  #9News #BreakingNews #NineNewsAustralia #9NewsAU",https://www.youtube.com/watch?v=cLy9PQlnYos,9News
2025-12-08T11:15:08+00:00,9News Melbourne | Thursday December 8 | Full Episode,"Brett McLeod presents the Melbourne news, covering a range of major stories, including a fatal car crash at a medical centre, the fallout from a shocking political defection to One Nation, a new Formula 1 World Champion, and Victoria Police's response to a surge in retail crime. | *Subscribe and 🔔: http://9Soci.al/KM6e50GjSK9*  CHAPTERS IN THIS VIDEO:  0:00 Crash Tragedy 2:21 Alleged Arson Vengeance 4:24 Murder Ruling 4:49 Power Rebate 6:45 Rate Hike 7:45 Retail Crime Crackdown 10:01 Fatal Stabbing 11:44 Barnaby to One Nation 13:34 F1 Champion 15:51 Police Chase 16:16 Gang Crackdown 18:00 Alleged Manslaughter 18:22 Gaza Peace 18:48 Trump Honours 19:20 School Openings  *Get more breaking news at 9News.com.au: http://9Soci.al/iyCO50GjSK6*  FOLLOW 9News Australia ► Facebook: https://www.facebook.com/9News/ ► Twitter: https://twitter.com/9NewsAUS ► Instagram: https://www.instagram.com/9news/  Join 9News for the latest in news and events that affect you in your local city, as well as news from across Australia and the world.  #9News #BreakingNews #NineNewsAustralia #9NewsAU",https://www.youtube.com/watch?v=XG1e-eEciAk,9News
2025-12-08T11:45:05+00:00,9News Adelaide | Monday December 8 | Full Episode,"Brenton Lagless leads the Adelaide news with the Liberal Party electing its youngest-ever leader just months out from the state election. Also in the news: a shocking bottle shop robbery in Modbury, a major prison officers' strike across SA, and the end of the line for federal electricity rebates. Plus, the latest on Oscar Piastri's F1 World Championship bid and a tragic turn in the NSW bushfire crisis. | *Subscribe and 🔔: http://9Soci.al/KM6e50GjSK9*  CHAPTERS IN THIS VIDEO:   0:00 Liberal Leader 2:37 Violent Robbery 4:25 Bike Crash 6:17 Grass Fire 6:39 Prison Strike 7:20 Power Rebates 9:16 RBA Meeting 10:20 Joyce Joins One Nation 12:12 Social Media 12:51 Prize Fish 13:32 F1 Championship 15:52 City Fire 16:09 Murder Verdict 16:33 Fatal Crash 18:18 Firefighter Killed 20:19 Alleged Hate Crime 21:04 Health Extras  *Get more breaking news at 9News.com.au: http://9Soci.al/iyCO50GjSK6*  FOLLOW 9News Australia ► Facebook: https://www.facebook.com/9News/ ► Twitter: https://twitter.com/9NewsAUS ► Instagram: https://www.instagram.com/9news/  Join 9News for the latest in news and events that affect you in your local city, as well as news from across Australia and the world.  #9News #BreakingNews #NineNewsAustralia #9NewsAU",https://www.youtube.com/watch?v=VJvye4Qrtoo,9News
