published,title,description,link,Pub
2026-03-02T07:43:19+00:00,Strikes and counterstrikes shake the Middle East | 9 News Australia,"The war in the Middle East is escalating, with countries in Asia and Europe being drawn into the conflict. The death toll is rising in Iran, Israel, and Lebanon as the US warns the bloodshed could last for weeks. | *Subscribe and 🔔: http://9Soci.al/KM6e50GjSK9*  *Get more breaking news at 9News.com.au: http://9Soci.al/iyCO50GjSK6*  FOLLOW 9News Australia ► Facebook: https://www.facebook.com/9News/ ► Twitter: https://twitter.com/9NewsAUS ► Instagram: https://www.instagram.com/9news/  Join 9News for the latest in news and events that affect you in your local city, as well as news from across Australia and the world.  #9News #BreakingNews #NineNewsAustralia #9NewsAU",https://www.youtube.com/watch?v=1KFUKzMSUFU,9News
2026-03-02T07:45:06+00:00,Albert Park serves up hospitality spectacle for Australian Grand Prix | 9 News Australia,"Albert Park is serving up a hospitality spectacle for the Australian Grand Prix, with some of the country's best chefs rolling out their finest foods. | *Subscribe and 🔔: http://9Soci.al/KM6e50GjSK9*  *Get more breaking news at 9News.com.au: http://9Soci.al/iyCO50GjSK6*  FOLLOW 9News Australia ► Facebook: https://www.facebook.com/9News/ ► Twitter: https://twitter.com/9NewsAUS ► Instagram: https://www.instagram.com/9news/  Join 9News for the latest in news and events that affect you in your local city, as well as news from across Australia and the world.  #9News #BreakingNews #NineNewsAustralia #9NewsAU",https://www.youtube.com/watch?v=xTFmaavTCwE,9News
2026-03-02T07:54:56+00:00,Dragons licking wounds after loss to Bulldogs in golden point Las Vegas thriller | 9 News Australia,"It will be a long flight home from Las Vegas for the Dragons who were left seething after their golden point loss to the Bulldogs in their season opener. The Red V believe key referee decisions cost them victory at Allegiant Stadium. | *Subscribe and 🔔: http://9Soci.al/KM6e50GjSK9*  *Get more breaking news at 9News.com.au: http://9Soci.al/iyCO50GjSK6*  FOLLOW 9News Australia ► Facebook: https://www.facebook.com/9News/ ► Twitter: https://twitter.com/9NewsAUS ► Instagram: https://www.instagram.com/9news/  Join 9News for the latest in news and events that affect you in your local city, as well as news from across Australia and the world.  #9News #BreakingNews #NineNewsAustralia #9NewsAU",https://www.youtube.com/watch?v=JiGw0OhA028,9News
2026-03-02T07:58:24+00:00,World-first trial offers hope for hair loss sufferers | 9 News Australia,"Australian researchers are calling for hundreds of hair loss sufferers to partake in a world-first treatment trial, offering participants the potential to be paid tens of thousands of dollars for their time. | *Subscribe and 🔔: http://9Soci.al/KM6e50GjSK9*  *Get more breaking news at 9News.com.au: http://9Soci.al/iyCO50GjSK6*  FOLLOW 9News Australia ► Facebook: https://www.facebook.com/9News/ ► Twitter: https://twitter.com/9NewsAUS ► Instagram: https://www.instagram.com/9news/  Join 9News for the latest in news and events that affect you in your local city, as well as news from across Australia and the world.  #9News #BreakingNews #NineNewsAustralia #9NewsAU",https://www.youtube.com/watch?v=NTRW8vrx7zo,9News
2026-03-02T08:01:41+00:00,Massive turnout for Adelaide Motorsport Festival | 9 News Australia,"Thousands of keen car fans have packed out the Adelaide Motorsport Festival to watch the pros warm up ahead of the Grand Prix in Melbourne. | Subscribe and 🔔: http://9Soci.al/KM6e50GjSK9 | Get more breaking news at 9News.com.au: http://9Soci.al/iyCO50GjSK6  FOLLOW 9News Australia ► Facebook: https://www.facebook.com/9News/ ► Twitter: https://twitter.com/9NewsAUS ► Instagram: https://www.instagram.com/9news/  Join 9News for the latest in news and events that affect you in your local city, as well as news from across Australia and the world.  #BREAKINGNEWS #9NEWS #AUSTRALIA",https://www.youtube.com/shorts/Lm3nTC76uB8,9News
2026-03-02T08:03:02+00:00,Iranian conflict state of play after 48 hours | 9 News Australia,"Two days into the conflict between Iran and the US and Iran, Political Editor Charles Croucher explains the state of play. #9News  | Subscribe and 🔔: http://9Soci.al/KM6e50GjSK9 | Get more breaking news at 9News.com.au: http://9Soci.al/iyCO50GjSK6  FOLLOW 9News Australia ► Facebook: https://www.facebook.com/9News/ ► Twitter: https://twitter.com/9NewsAUS ► Instagram: https://www.instagram.com/9news/  Join 9News for the latest in news and events that affect you in your local city, as well as news from across Australia and the world.  #BREAKINGNEWS #9NEWS #AUSTRALIA",https://www.youtube.com/shorts/3MhWp6MjKvw,9News
2026-03-02T08:03:43+00:00,Adelaide's O-Bahn Busway turns 40! | 9 News Australia,"To celebrate Adelaide's beloved O-Bahn Busway turning 40, #9News has spoken to one of the tracks original drivers. | Subscribe and 🔔: http://9Soci.al/KM6e50GjSK9 | Get more breaking news at 9News.com.au: http://9Soci.al/iyCO50GjSK6  FOLLOW 9News Australia ► Facebook: https://www.facebook.com/9News/ ► Twitter: https://twitter.com/9NewsAUS ► Instagram: https://www.instagram.com/9news/  Join 9News for the latest in news and events that affect you in your local city, as well as news from across Australia and the world.  #BREAKINGNEWS #9NEWS #AUSTRALIA",https://www.youtube.com/shorts/hAO1znR8IIg,9News
2026-03-02T08:05:33+00:00,Adelaide O-Bahn's greatest hits | 9 News Australia,"Despite its convenience, the O-Bahn has been the host of an incident... or two... or three. | Subscribe and 🔔: http://9Soci.al/KM6e50GjSK9 | Get more breaking news at 9News.com.au: http://9Soci.al/iyCO50GjSK6  FOLLOW 9News Australia ► Facebook: https://www.facebook.com/9News/ ► Twitter: https://twitter.com/9NewsAUS ► Instagram: https://www.instagram.com/9news/  Join 9News for the latest in news and events that affect you in your local city, as well as news from across Australia and the world.  #BREAKINGNEWS #9NEWS #AUSTRALIA",https://www.youtube.com/shorts/dcqgIjvE08M,9News
2026-03-02T08:07:55+00:00,Truck driver rescued from floodwaters | 9 News Australia,"A truck driver has been rescued from floodwaters on the Barrier Highway in Yunta, 200km southwest of Broken Hill.  The LifeFlight special mission helicopter landed a few hundred metres away from the dangerous flooding where police officers were waiting to assist the uninjured driver. | Subscribe and 🔔: http://9Soci.al/KM6e50GjSK9 | Get more breaking news at 9News.com.au: http://9Soci.al/iyCO50GjSK6  FOLLOW 9News Australia ► Facebook: https://www.facebook.com/9News/ ► Twitter: https://twitter.com/9NewsAUS ► Instagram: https://www.instagram.com/9news/  Join 9News for the latest in news and events that affect you in your local city, as well as news from across Australia and the world.  #BREAKINGNEWS #9NEWS #AUSTRALIA",https://www.youtube.com/shorts/FlW40G82jvc,9News
2026-03-02T08:11:21+00:00,Vision captures truck driver's helicopter rescue in dangerous floodwaters | 9 News Australia,"#9News has extraordinary vision of the moment a rescue helicopter saves a truck driver stuck in dangerous floodwaters south of Yunta. | *Subscribe and 🔔: http://9Soci.al/KM6e50GjSK9*  *Get more breaking news at 9News.com.au: http://9Soci.al/iyCO50GjSK6*  FOLLOW 9News Australia ► Facebook: https://www.facebook.com/9News/ ► Twitter: https://twitter.com/9NewsAUS ► Instagram: https://www.instagram.com/9news/  Join 9News for the latest in news and events that affect you in your local city, as well as news from across Australia and the world.  #9News #BreakingNews #NineNewsAustralia #9NewsAU",https://www.youtube.com/watch?v=mi4R57icyak,9News
2026-03-02T08:43:49+00:00,LATEST: Middle East conflict enters third day | 9 News Australia,"The war in the Middle East is escalating as the death toll rises in Iran, Israel and Lebanon. | *Subscribe and 🔔: http://9Soci.al/KM6e50GjSK9*  *Get more breaking news at 9News.com.au: http://9Soci.al/iyCO50GjSK6*  FOLLOW 9News Australia ► Facebook: https://www.facebook.com/9News/ ► Twitter: https://twitter.com/9NewsAUS ► Instagram: https://www.instagram.com/9news/  Join 9News for the latest in news and events that affect you in your local city, as well as news from across Australia and the world.  #9News #BreakingNews #NineNewsAustralia #9NewsAU",https://www.youtube.com/watch?v=tH1oaEF08-M,9News
2026-03-02T11:15:00+00:00,9News Melbourne | Monday March 2,"Alicia Loxley and Tom Steinfort present the Melbourne news. Special charter flights have been organised to get Formula 1 teams stuck in Europe to Melbourne for the Australian Grand Prix. In other news, Melbourne's Steven May has fronted teammates after announcing his shock retirement.  | *Subscribe and 🔔: http://9Soci.al/KM6e50GjSK9*  *Get more breaking news at 9News.com.au: http://9Soci.al/iyCO50GjSK6*  FOLLOW 9News Australia ► Facebook: https://www.facebook.com/9News/ ► Twitter: https://twitter.com/9NewsAUS ► Instagram: https://www.instagram.com/9news/  Join 9News for the latest in news and events that affect you in your local city, as well as news from across Australia and the world.  #9News #BreakingNews #NineNewsAustralia #9NewsAU",https://www.youtube.com/watch?v=37c9q67a2_s,9News
2026-03-02T11:30:20+00:00,9News Sydney | Monday March 2,"Peter Overton presents the Sydney news. There was a historic moment for Sydney's Metro West as the final metre of tunnelling to Hunter Street station was completed as dozens of workers watched on. In other news, the family of a Bossley Park woman who vanished three years ago is hoping an inquest will give them some answers. | *Subscribe and 🔔: http://9Soci.al/KM6e50GjSK9*  *Get more breaking news at 9News.com.au: http://9Soci.al/iyCO50GjSK6*  FOLLOW 9News Australia ► Facebook: https://www.facebook.com/9News/ ► Twitter: https://twitter.com/9NewsAUS ► Instagram: https://www.instagram.com/9news/  Join 9News for the latest in news and events that affect you in your local city, as well as news from across Australia and the world.  #9News #BreakingNews #NineNewsAustralia #9NewsAU",https://www.youtube.com/watch?v=PhM4BTw8p38,9News
2026-03-02T11:45:07+00:00,9News Adelaide | Monday March 2,"Extraordinary vision shows the moment a rescue helicopter saves a truck driver stuck in dangerous floodwaters south of Yunta. In other news, the O-Bahn Busway turns 40 today, and it's proven to be a popular public transport route connecting Adelaide to the north-eastern suburbs. | *Subscribe and 🔔: http://9Soci.al/KM6e50GjSK9*  *Get more breaking news at 9News.com.au: http://9Soci.al/iyCO50GjSK6*  FOLLOW 9News Australia ► Facebook: https://www.facebook.com/9News/ ► Twitter: https://twitter.com/9NewsAUS ► Instagram: https://www.instagram.com/9news/  Join 9News for the latest in news and events that affect you in your local city, as well as news from across Australia and the world.  #9News #BreakingNews #NineNewsAustralia #9NewsAU",https://www.youtube.com/watch?v=ol29yvoqa4w,9News
2026-03-02T12:15:00+00:00,9News Queensland | Monday March 2,"North Queenslanders have been left stranded as heavy rain causes roads to be cut off by floodwaters around Townsville. In other news, Police have charged more than 1,000 adults and 200 juveniles in a crime crackdown across Brisbane's south. | *Subscribe and 🔔: http://9Soci.al/KM6e50GjSK9*  *Get more breaking news at 9News.com.au: http://9Soci.al/iyCO50GjSK6*  FOLLOW 9News Australia ► Facebook: https://www.facebook.com/9News/ ► Twitter: https://twitter.com/9NewsAUS ► Instagram: https://www.instagram.com/9news/  Join 9News for the latest in news and events that affect you in your local city, as well as news from across Australia and the world.  #9News #BreakingNews #NineNewsAustralia #9NewsAU",https://www.youtube.com/watch?v=6pyLOpMSfpQ,9News
