published,title,description,link,Pub
2026-02-17T07:44:38+00:00,Jet ski tour operator rams teenager on Nerang River | 9 News Australia,"A jet ski tour instructor has landed himself in hot water after ramming and assaulting a teenage rider on the Nerang River. | Subscribe and 🔔: http://9Soci.al/KM6e50GjSK9 | Get more breaking news at 9News.com.au: http://9Soci.al/iyCO50GjSK6  FOLLOW 9News Australia  ► Facebook: https://www.facebook.com/9News/  ► Twitter: https://twitter.com/9NewsAUS  ► Instagram: https://www.instagram.com/9news/  Join 9News for the latest in news and events that affect you in your local city, as well as news from across Australia and the world.  #BREAKINGNEWS #9NEWS #AUSTRALIA",https://www.youtube.com/shorts/zSkMAlZ1mDA,9News
2026-02-17T07:46:07+00:00,ISIS brides remain hopeful of return to Australia | 9 News Australia,"ISIS brides attempting to return to Australia from Syria with their children have not given up hope despite the PM's refusal to assist the 11 families. | *Subscribe and 🔔: http://9Soci.al/KM6e50GjSK9*  *Get more breaking news at 9News.com.au: http://9Soci.al/iyCO50GjSK6*  FOLLOW 9News Australia ► Facebook: https://www.facebook.com/9News/ ► Twitter: https://twitter.com/9NewsAUS ► Instagram: https://www.instagram.com/9news/  Join 9News for the latest in news and events that affect you in your local city, as well as news from across Australia and the world.  #9News #BreakingNews #NineNewsAustralia #9NewsAU",https://www.youtube.com/watch?v=cP6pCGyIQFw,9News
2026-02-17T07:47:41+00:00,Fire threatens homes near Seymour | 9 News Australia,"A bushfire that has broken out in northern Victoria has quickly climbed to the highest emergency warning level as it endangers homes and lives. | *Subscribe and 🔔: http://9Soci.al/KM6e50GjSK9*  *Get more breaking news at 9News.com.au: http://9Soci.al/iyCO50GjSK6*  FOLLOW 9News Australia ► Facebook: https://www.facebook.com/9News/ ► Twitter: https://twitter.com/9NewsAUS ► Instagram: https://www.instagram.com/9news/  Join 9News for the latest in news and events that affect you in your local city, as well as news from across Australia and the world.  #9News #BreakingNews #NineNewsAustralia #9NewsAU",https://www.youtube.com/watch?v=ktq8rOpdQvQ,9News
2026-02-17T07:50:42+00:00,Angus Taylor announces new frontbench | 9 News Australia,"Opposition Leader Angus Taylor has unveiled his new frontbench just days after taking over the position. | *Subscribe and 🔔: http://9Soci.al/KM6e50GjSK9*  *Get more breaking news at 9News.com.au: http://9Soci.al/iyCO50GjSK6*  FOLLOW 9News Australia ► Facebook: https://www.facebook.com/9News/ ► Twitter: https://twitter.com/9NewsAUS ► Instagram: https://www.instagram.com/9news/  Join 9News for the latest in news and events that affect you in your local city, as well as news from across Australia and the world.  #9News #BreakingNews #NineNewsAustralia #9NewsAU",https://www.youtube.com/watch?v=_vv2GGz4dm4,9News
2026-02-17T07:52:52+00:00,The bold bid to lure more teachers into education | 9 News Australia,"A shortage of teachers has prompted the Australian Education Union to come up with an ambitious move to attract more staff. | *Subscribe and 🔔: http://9Soci.al/KM6e50GjSK9*  *Get more breaking news at 9News.com.au: http://9Soci.al/iyCO50GjSK6*  FOLLOW 9News Australia ► Facebook: https://www.facebook.com/9News/ ► Twitter: https://twitter.com/9NewsAUS ► Instagram: https://www.instagram.com/9news/  Join 9News for the latest in news and events that affect you in your local city, as well as news from across Australia and the world.  #9News #BreakingNews #NineNewsAustralia #9NewsAU",https://www.youtube.com/watch?v=CGkm2ZRNPQ0,9News
2026-02-17T07:57:13+00:00,Tributes grow for Hollywood icon Robert Duvall | 9 News Australia,"Tributes are growing for Oscar-winning actor Robert Duvall who has passed away age 95. | *Subscribe and 🔔: http://9Soci.al/KM6e50GjSK9*  *Get more breaking news at 9News.com.au: http://9Soci.al/iyCO50GjSK6*  FOLLOW 9News Australia ► Facebook: https://www.facebook.com/9News/ ► Twitter: https://twitter.com/9NewsAUS ► Instagram: https://www.instagram.com/9news/  Join 9News for the latest in news and events that affect you in your local city, as well as news from across Australia and the world.  #9News #BreakingNews #NineNewsAustralia #9NewsAU",https://www.youtube.com/watch?v=a51uR-T18gA,9News
2026-02-17T07:59:58+00:00,Dodgy taxi drivers to face hefty fines and expulsion | 9 News Australia,"Victoria's dodgy taxi and rideshare drivers have been warned, with a new two strikes police to be introduce to abate passengers getting ripped off. | *Subscribe and 🔔: http://9Soci.al/KM6e50GjSK9*  *Get more breaking news at 9News.com.au: http://9Soci.al/iyCO50GjSK6*  FOLLOW 9News Australia ► Facebook: https://www.facebook.com/9News/ ► Twitter: https://twitter.com/9NewsAUS ► Instagram: https://www.instagram.com/9news/  Join 9News for the latest in news and events that affect you in your local city, as well as news from across Australia and the world.  #9News #BreakingNews #NineNewsAustralia #9NewsAU",https://www.youtube.com/watch?v=2rdVUzwXf88,9News
2026-02-17T08:02:57+00:00,Does Sydney need new light rail lines? | 9 News Australia,Sydney's light rail operator believes adding more lines could solve the city's housing crisis. #9News,https://www.youtube.com/shorts/VEZmFqqJeew,9News
2026-02-17T08:10:18+00:00,Fire fight in the Adelaide Hills | 9 News Australia,"A grassfire has raged right up to property lines, forcing residents of Macclesfield in the Adelaide Hills out of their homes in the middle of the night. | *Subscribe and 🔔: http://9Soci.al/KM6e50GjSK9*  *Get more breaking news at 9News.com.au: http://9Soci.al/iyCO50GjSK6*  FOLLOW 9News Australia ► Facebook: https://www.facebook.com/9News/ ► Twitter: https://twitter.com/9NewsAUS ► Instagram: https://www.instagram.com/9news/  Join 9News for the latest in news and events that affect you in your local city, as well as news from across Australia and the world.  #9News #BreakingNews #NineNewsAustralia #9NewsAU",https://www.youtube.com/watch?v=qW0OtguKsbA,9News
2026-02-17T08:11:50+00:00,Search expanded for Gus Lamont | 9 News Australia,"Police have inspected a water tank and an outhouse in the search for missing boy Gus Lamont. | *Subscribe and 🔔: http://9Soci.al/KM6e50GjSK9*  *Get more breaking news at 9News.com.au: http://9Soci.al/iyCO50GjSK6*  FOLLOW 9News Australia ► Facebook: https://www.facebook.com/9News/ ► Twitter: https://twitter.com/9NewsAUS ► Instagram: https://www.instagram.com/9news/  Join 9News for the latest in news and events that affect you in your local city, as well as news from across Australia and the world.  #9News #BreakingNews #NineNewsAustralia #9NewsAU",https://www.youtube.com/watch?v=a-zNOaEaX6s,9News
2026-02-17T08:13:48+00:00,Police on the hunt for five men | 9 News Australia,"Police are on the hunt for five men who forced their way inside a northern suburbs home, firing guns and brandishing a machete. | *Subscribe and 🔔: http://9Soci.al/KM6e50GjSK9*  *Get more breaking news at 9News.com.au: http://9Soci.al/iyCO50GjSK6*  FOLLOW 9News Australia ► Facebook: https://www.facebook.com/9News/ ► Twitter: https://twitter.com/9NewsAUS ► Instagram: https://www.instagram.com/9news/  Join 9News for the latest in news and events that affect you in your local city, as well as news from across Australia and the world.  #9News #BreakingNews #NineNewsAustralia #9NewsAU",https://www.youtube.com/watch?v=GmG-zPLAg0w,9News
2026-02-17T10:50:55+00:00,Western Australia's Chinese story | 9 News Australia,"As we enter the Year of the Fire Horse, follow along with Andrew Du as 9 News celebrates Chinese history in Western Australia. | Subscribe and 🔔: http://9Soci.al/KM6e50GjSK9 | Get more breaking news at 9News.com.au: http://9Soci.al/iyCO50GjSK6  FOLLOW 9News Australia ► Facebook: https://www.facebook.com/9News/ ► Twitter: https://twitter.com/9NewsAUS ► Instagram: https://www.instagram.com/9news/  Join 9News for the latest in news and events that affect you in your local city, as well as news from across Australia and the world.  #BREAKINGNEWS #9NEWS #AUSTRALIA",https://www.youtube.com/watch?v=EDrowGFefeA,9News
2026-02-17T11:00:37+00:00,9News Melbourne | Tuesday February 17 | Full Episode,"Alicia Loxley and Tom Steinfort lead the bulletin with a Berwick jeweller attacked with hammers. In other news, residents have been told to take shelter as an out-of-control bushfire threatens homes north-east of Melbourne. At the Milano Cortina Winter Olympics, a blizzard has caused chaos during day 10 of competition. | *Subscribe and 🔔: http://9Soci.al/KM6e50GjSK9*  *Get more breaking news at 9News.com.au: http://9Soci.al/iyCO50GjSK6*  FOLLOW 9News Australia ► Facebook: https://www.facebook.com/9News/ ► Twitter: https://twitter.com/9NewsAUS ► Instagram: https://www.instagram.com/9news/  Join 9News for the latest in news and events that affect you in your local city, as well as news from across Australia and the world.  #9News #BreakingNews #NineNewsAustralia #9NewsAU",https://www.youtube.com/watch?v=NpWjPhHW0Xs,9News
2026-02-17T11:01:17+00:00,9News Sydney | Tuesday February 17 | Full Episode,"Peter Overton leads the bulletin with a random mass stabbing on a main shopping strip in Merrylands. In other news, Anthony Albanese remains steadfast in his refusal to assist ISIS brides attempting to return to Australia from Syria. At the Milano Cortina Winter Olympics, a blizzard has caused chaos during day 10 of competition. | *Subscribe and 🔔: http://9Soci.al/KM6e50GjSK9*  *Get more breaking news at 9News.com.au: http://9Soci.al/iyCO50GjSK6*  FOLLOW 9News Australia ► Facebook: https://www.facebook.com/9News/ ► Twitter: https://twitter.com/9NewsAUS ► Instagram: https://www.instagram.com/9news/  Join 9News for the latest in news and events that affect you in your local city, as well as news from across Australia and the world.  #9News #BreakingNews #NineNewsAustralia #9NewsAU",https://www.youtube.com/watch?v=lrIK_aF_3Xk,9News
2026-02-17T18:59:25+00:00,CCTV of fatal Sydney stabbing attack; Jeweller takes on three armed thieves | 9 News Australia,"New CCTV footage has been released showing a fatal stabbing attack in Western Sydney, capturing the moments inside a shop just before the alleged attacker randomly stabbed a woman. In other news, a Melbourne jewellery shop owner takes on three armed thieves ransacking his store. | *Subscribe and 🔔: http://9Soci.al/KM6e50GjSK9*  *Get more breaking news at 9News.com.au: http://9Soci.al/iyCO50GjSK6*  FOLLOW 9News Australia ► Facebook: https://www.facebook.com/9News/ ► Twitter: https://twitter.com/9NewsAUS ► Instagram: https://www.instagram.com/9news/  Join 9News for the latest in news and events that affect you in your local city, as well as news from across Australia and the world.  #9News #BreakingNews #NineNewsAustralia #9NewsAU",https://www.youtube.com/watch?v=lKyb2bIidgo,9News
