published,title,description,link,Pub
2025-11-11T21:52:17+00:00,How shoppers are taking advantage and snagging a bargain | 9 News Australia,"If you love snagging a bargain, look no further. Singles' Day and Click Frenzy sales are here, and shoppers are already taking advantage of some serious savings. | *Subscribe and 🔔: http://9Soci.al/KM6e50GjSK9*  *Get more breaking news at 9News.com.au: http://9Soci.al/iyCO50GjSK6*  FOLLOW 9News Australia ► Facebook: https://www.facebook.com/9News/ ► Twitter: https://twitter.com/9NewsAUS ► Instagram: https://www.instagram.com/9news/  Join 9News for the latest in news and events that affect you in your local city, as well as news from across Australia and the world.  #9News #BreakingNews #NineNewsAustralia #9NewsAU",https://www.youtube.com/watch?v=ey-cqFFdNOk,9News
2025-11-11T21:56:24+00:00,Police inestigate suspicious car fire | 9 News Australia,"The car fire in Chester Hill is being treated as suspicious. | Subscribe and 🔔: http://9Soci.al/KM6e50GjSK9 | Get more breaking news at 9News.com.au: http://9Soci.al/iyCO50GjSK6  FOLLOW 9News Australia ► Facebook: https://www.facebook.com/9News/ ► Twitter: https://twitter.com/9NewsAUS ► Instagram: https://www.instagram.com/9news/  Join 9News for the latest in news and events that affect you in your local city, as well as news from across Australia and the world.  #BREAKINGNEWS #9NEWS #AUSTRALIA",https://www.youtube.com/shorts/NhL1tWLANqI,9News
2025-11-11T21:59:24+00:00,Liberal party net zero debate | 9 News Australia,"Crucial talks will begin today as Liberal MPs gather to discuss the party's net zero commitment. | Subscribe and 🔔: http://9Soci.al/KM6e50GjSK9 | Get more breaking news at 9News.com.au: http://9Soci.al/iyCO50GjSK6  FOLLOW 9News Australia ► Facebook: https://www.facebook.com/9News/ ► Twitter: https://twitter.com/9NewsAUS ► Instagram: https://www.instagram.com/9news/  Join 9News for the latest in news and events that affect you in your local city, as well as news from across Australia and the world.  #BREAKINGNEWS #9NEWS #AUSTRALIA",https://www.youtube.com/shorts/9boVpq1nHw4,9News
2025-11-11T22:03:58+00:00,Man boasts world's biggest mouth | 9 News Australia,"Well what started out as a party trick has quickly turned into a world title, but it it wasn't until Isaac Johnson bagged and swallowed a Guinness World Record, that he realised just how talented he is. | *Subscribe and 🔔: http://9Soci.al/KM6e50GjSK9*  *Get more breaking news at 9News.com.au: http://9Soci.al/iyCO50GjSK6*  FOLLOW 9News Australia ► Facebook: https://www.facebook.com/9News/ ► Twitter: https://twitter.com/9NewsAUS ► Instagram: https://www.instagram.com/9news/  Join 9News for the latest in news and events that affect you in your local city, as well as news from across Australia and the world.  #9News #BreakingNews #NineNewsAustralia #9NewsAU",https://www.youtube.com/watch?v=XhcNK8_hDgI,9News
2025-11-11T22:06:11+00:00,Story Bridge access restored | 9 News Australia,"The Story Bridge is set to fully reopen to pedestrians and cyclists after being impacted by Cyclone Alfred earlier this year. | Subscribe and 🔔: http://9Soci.al/KM6e50GjSK9 | Get more breaking news at 9News.com.au: http://9Soci.al/iyCO50GjSK6  FOLLOW 9News Australia ► Facebook: https://www.facebook.com/9News/ ► Twitter: https://twitter.com/9NewsAUS ► Instagram: https://www.instagram.com/9news/  Join 9News for the latest in news and events that affect you in your local city, as well as news from across Australia and the world.  #BREAKINGNEWS #9NEWS #AUSTRALIA",https://www.youtube.com/shorts/FdkzxnAvTsc,9News
2025-11-11T22:08:38+00:00,Targeted bombing attack outside Pakistan court | 9 News Australia,"A suicide bomber has struck outside the gates of a district court in Islamabad, detonating explosives next to a police car and killing 12 people. | Subscribe and 🔔: http://9Soci.al/KM6e50GjSK9 | Get more breaking news at 9News.com.au: http://9Soci.al/iyCO50GjSK6  FOLLOW 9News Australia ► Facebook: https://www.facebook.com/9News/ ► Twitter: https://twitter.com/9NewsAUS ► Instagram: https://www.instagram.com/9news/  Join 9News for the latest in news and events that affect you in your local city, as well as news from across Australia and the world.  #BREAKINGNEWS #9NEWS #AUSTRALIA",https://www.youtube.com/shorts/20GHppuaJ_k,9News
2025-11-11T23:51:52+00:00,Would you choose live music over sex? | 9 News Australia,"Turns out Aussies really like a live gig, with a new survey finding we would pick a concert over sport, movies and even making love. | *Subscribe and 🔔: http://9Soci.al/KM6e50GjSK9*  *Get more breaking news at 9News.com.au: http://9Soci.al/iyCO50GjSK6*  FOLLOW 9News Australia ► Facebook: https://www.facebook.com/9News/ ► Twitter: https://twitter.com/9NewsAUS ► Instagram: https://www.instagram.com/9news/  Join 9News for the latest in news and events that affect you in your local city, as well as news from across Australia and the world.  #9News #BreakingNews #NineNewsAustralia #9NewsAU",https://www.youtube.com/watch?v=UbXBPjb8Obs,9News
2025-11-12T00:57:14+00:00,Day of reckoning for Liberal Party; Teen murder sentencing | 9 News Australia,"Liberal MPs in Canberra are gathering to finally thrash out their position on Net Zero, after their Coalition partner Nationals, scrapped 2050 targets. In other news, the teenager responsible for murdering Queensland grandmother Vyleen White is being sentenced inside Brisbane's Supreme Court. | *Subscribe and 🔔: http://9Soci.al/KM6e50GjSK9*  *Get more breaking news at 9News.com.au: http://9Soci.al/iyCO50GjSK6*  FOLLOW 9News Australia ► Facebook: https://www.facebook.com/9News/ ► Twitter: https://twitter.com/9NewsAUS ► Instagram: https://www.instagram.com/9news/  Join 9News for the latest in news and events that affect you in your local city, as well as news from across Australia and the world.  #9News #BreakingNews #NineNewsAustralia #9NewsAU",https://www.youtube.com/watch?v=OUWi2hV6lcQ,9News
2025-11-12T00:58:36+00:00,QantasLink flight forced to make emergency landing | 9 News Australia,"A QantasLink flight was forced to turn back just minutes after taking off from Adelaide this morning after smoke was seen in the cockpit.﻿ The plane, QF1972, was en route to Canberra but issued a PAN requesting priority landing. | *Subscribe and 🔔: http://9Soci.al/KM6e50GjSK9*  *Get more breaking news at 9News.com.au: http://9Soci.al/iyCO50GjSK6*  FOLLOW 9News Australia ► Facebook: https://www.facebook.com/9News/ ► Twitter: https://twitter.com/9NewsAUS ► Instagram: https://www.instagram.com/9news/  Join 9News for the latest in news and events that affect you in your local city, as well as news from across Australia and the world.  #9News #BreakingNews #NineNewsAustralia #9NewsAU",https://www.youtube.com/watch?v=TV0TAEDgqxg,9News
2025-11-12T01:22:44+00:00,Bridge partially collapses in China | 9 News Australia,"The bridge came crashing down just months after opening. | Subscribe and 🔔: http://9Soci.al/KM6e50GjSK9 | Get more breaking news at 9News.com.au: http://9Soci.al/iyCO50GjSK6  FOLLOW 9News Australia ► Facebook: https://www.facebook.com/9News/ ► Twitter: https://twitter.com/9NewsAUS ► Instagram: https://www.instagram.com/9news/  Join 9News for the latest in news and events that affect you in your local city, as well as news from across Australia and the world.  #BREAKINGNEWS #9NEWS #AUSTRALIA",https://www.youtube.com/shorts/z5NCosoQju8,9News
2025-11-12T01:25:01+00:00,Disgraced former CFMEU boss arrested | 9 News Australia,"The former CFMEU boss has been charged with using a telecom communications device to menace harass and offend. #9News   DETAILS: https://nine.social/12VD     | Subscribe and 🔔: http://9Soci.al/KM6e50GjSK9 | Get more breaking news at 9News.com.au: http://9Soci.al/iyCO50GjSK6  FOLLOW 9News Australia ► Facebook: https://www.facebook.com/9News/ ► Twitter: https://twitter.com/9NewsAUS ► Instagram: https://www.instagram.com/9news/  Join 9News for the latest in news and events that affect you in your local city, as well as news from across Australia and the world.  #BREAKINGNEWS #9NEWS #AUSTRALIA",https://www.youtube.com/shorts/WyQF04sAtfo,9News
2025-11-12T01:32:01+00:00,Indonesian President touches down in Australia | 9 News Australia,It marks the Indonesian President's first Australian visit since he was sworn in. #9News,https://www.youtube.com/shorts/-AkavLp8yaM,9News
2025-11-12T01:35:01+00:00,"Adult time, adult crime to be introduced in Victoria | 9 News Australia","Children as young as 14 face the possibility of being jailed for life in Victoria, under the planned government reforms. #9News   | Subscribe and 🔔: http://9Soci.al/KM6e50GjSK9 | Get more breaking news at 9News.com.au: http://9Soci.al/iyCO50GjSK6  FOLLOW 9News Australia ► Facebook: https://www.facebook.com/9News/ ► Twitter: https://twitter.com/9NewsAUS ► Instagram: https://www.instagram.com/9news/  Join 9News for the latest in news and events that affect you in your local city, as well as news from across Australia and the world.  #BREAKINGNEWS #9NEWS #AUSTRALIA",https://www.youtube.com/shorts/tVg9a9E3wXU,9News
2025-11-12T01:45:11+00:00,Are Aussie teens ready for the social media shutdown? | 9 News Australia,"With less than a month to go, are Australian teens actually ready for the looming social media ban? #9News #Shorts",https://www.youtube.com/shorts/BZxkQ8nzoh0,9News
2025-11-12T02:04:22+00:00,Date set for Lawsie's state funeral | 9 News Australia,The state funeral will take place next week in Sydney. #9News #Shorts,https://www.youtube.com/shorts/G4JDc0PBe-w,9News
