published,title,description,link,Pub
2026-03-16T18:57:24+00:00,20 per cent of emergency fuel stockpile released; Truck hits multiple vehicles | 9 News Australia,"The federal government has released 20 per cent of our emergency fuel stockpile. In other news, an out-of-control construction truck hit multiple vehicles on a busy road, causing crash chaos in Sydney's south-west. | *Subscribe and 🔔: http://9Soci.al/KM6e50GjSK9*  ►*Chapters in this video*: 00:00 Federal Government Releases Emergency Fuel Reserves 01:25 Victorian Farmers Warn of Potential Food Shortages 02:20 RBA Expected to Raise Interest Rates 03:12 Out-of-Control Construction Truck Hits Multiple Vehicles in Sydney 04:42 Melbourne Barber Shop Targeted in Firebombing Attack 04:56 International Allies Push Back on US Demands to Secure Strait of Hormuz 06:47 Body Found Following House Fire in Greensborough, Melbourne 07:02 Sydney Swans Apologize for Tribute Omission 07:22 Tropical Low Braces Far North Queensland for Heavy Rainfall 07:41 Three Charged After 5-Hour Bullying Ordeal at Kingsgrove North High School 08:21 Victorian Government Offers 18% Pay Rise to Teachers 08:41 King Frederik and Queen Mary of Denmark Arrive in Melbourne  *Get more breaking news at 9News.com.au: http://9Soci.al/iyCO50GjSK6*  FOLLOW 9News Australia ► Facebook: https://www.facebook.com/9News/ ► Twitter: https://twitter.com/9NewsAUS ► Instagram: https://www.instagram.com/9news/  Join 9News for the latest in news and events that affect you in your local city, as well as news from across Australia and the world.  #9News #BreakingNews #NineNewsAustralia #9NewsAU",https://www.youtube.com/watch?v=VqNnMy2mr0c,9News
2026-03-16T19:52:59+00:00,Smart investment moves to make during global uncertainty | 9 News Australia,"In a time of major global uncertainty, investment portfolio manager Jun Bei Lu breaks down smart moves you can make during this period. | *Subscribe and 🔔: http://9Soci.al/KM6e50GjSK9*  *Get more breaking news at 9News.com.au: http://9Soci.al/iyCO50GjSK6*  FOLLOW 9News Australia ► Facebook: https://www.facebook.com/9News/ ► Twitter: https://twitter.com/9NewsAUS ► Instagram: https://www.instagram.com/9news/  Join 9News for the latest in news and events that affect you in your local city, as well as news from across Australia and the world.  #9News #BreakingNews #NineNewsAustralia #9NewsAU",https://www.youtube.com/watch?v=2ikRZSTj-sA,9News
2026-03-16T20:46:23+00:00,U.S. allies push back against Trump’s demand to secure the Strait of Hormuz | 9 News Australia,"American allies are pushing back against the US President's demand that they help secure the Strait of Hormuz as global oil flows are restricted. | *Subscribe and 🔔: http://9Soci.al/KM6e50GjSK9*  *Get more breaking news at 9News.com.au: http://9Soci.al/iyCO50GjSK6*  FOLLOW 9News Australia ► Facebook: https://www.facebook.com/9News/ ► Twitter: https://twitter.com/9NewsAUS ► Instagram: https://www.instagram.com/9news/  Join 9News for the latest in news and events that affect you in your local city, as well as news from across Australia and the world.  #9News #BreakingNews #NineNewsAustralia #9NewsAU",https://www.youtube.com/watch?v=T_AOw2VI5GE,9News
2026-03-16T20:49:40+00:00,Australia taps into national fuel reserve as regional towns run dry | 9 News Australia,"Australia is tapping into the national fuel reserve as regional towns run dry and petrol prices skyrocket. | *Subscribe and 🔔: http://9Soci.al/KM6e50GjSK9*  *Get more breaking news at 9News.com.au: http://9Soci.al/iyCO50GjSK6*  FOLLOW 9News Australia ► Facebook: https://www.facebook.com/9News/ ► Twitter: https://twitter.com/9NewsAUS ► Instagram: https://www.instagram.com/9news/  Join 9News for the latest in news and events that affect you in your local city, as well as news from across Australia and the world.  #9News #BreakingNews #NineNewsAustralia #9NewsAU",https://www.youtube.com/watch?v=Fh7K7JlDEiY,9News
2026-03-16T21:17:23+00:00,Farmers warn of high food prices over fuel shortages | 9 News Australia,"Farmers warn Australians will face higher food prices despite the federal government releasing fuel from our domestic reserves. | *Subscribe and 🔔: http://9Soci.al/KM6e50GjSK9*  *Get more breaking news at 9News.com.au: http://9Soci.al/iyCO50GjSK6*  FOLLOW 9News Australia ► Facebook: https://www.facebook.com/9News/ ► Twitter: https://twitter.com/9NewsAUS ► Instagram: https://www.instagram.com/9news/  Join 9News for the latest in news and events that affect you in your local city, as well as news from across Australia and the world.  #9News #BreakingNews #NineNewsAustralia #9NewsAU",https://www.youtube.com/watch?v=IGVfy52iM84,9News
2026-03-16T21:33:55+00:00,Australia rules out sending a ship to help the U.S. reopen Strait of Hormuz | 9 News Australia,"The Albanese government is ruling out sending a ship to help the U.S. reopen the Strait of Hormuz. | *Subscribe and 🔔: http://9Soci.al/KM6e50GjSK9*  *Get more breaking news at 9News.com.au: http://9Soci.al/iyCO50GjSK6*  FOLLOW 9News Australia ► Facebook: https://www.facebook.com/9News/ ► Twitter: https://twitter.com/9NewsAUS ► Instagram: https://www.instagram.com/9news/  Join 9News for the latest in news and events that affect you in your local city, as well as news from across Australia and the world.  #9News #BreakingNews #NineNewsAustralia #9NewsAU",https://www.youtube.com/watch?v=giIVojC27MI,9News
2026-03-16T21:51:27+00:00,Reserve Bank meets for crucial interest rate decision | 9 News Australia,"Any prospect of rate relief has evaporated as the Reserve Bank meets for a crucial interest rate decision. | *Subscribe and 🔔: http://9Soci.al/KM6e50GjSK9*  *Get more breaking news at 9News.com.au: http://9Soci.al/iyCO50GjSK6*  FOLLOW 9News Australia ► Facebook: https://www.facebook.com/9News/ ► Twitter: https://twitter.com/9NewsAUS ► Instagram: https://www.instagram.com/9news/  Join 9News for the latest in news and events that affect you in your local city, as well as news from across Australia and the world.  #9News #BreakingNews #NineNewsAustralia #9NewsAU",https://www.youtube.com/watch?v=-tYIU4tfrO0,9News
2026-03-16T22:00:12+00:00,RBA’s decision could mark major turning point for property market | 9 News Australia,"The Reserve Bank is widely expected to announce another rate rise, which could mark a major turning point for the property market. | *Subscribe and 🔔: http://9Soci.al/KM6e50GjSK9*  *Get more breaking news at 9News.com.au: http://9Soci.al/iyCO50GjSK6*  FOLLOW 9News Australia ► Facebook: https://www.facebook.com/9News/ ► Twitter: https://twitter.com/9NewsAUS ► Instagram: https://www.instagram.com/9news/  Join 9News for the latest in news and events that affect you in your local city, as well as news from across Australia and the world.  #9News #BreakingNews #NineNewsAustralia #9NewsAU",https://www.youtube.com/watch?v=mDrMX5bbjpQ,9News
2026-03-16T22:03:07+00:00,#BREAKING: Major police operation underway in Sydney | 9 News Australia,"A major police operation is underway in Sydney's west after reports of suspicious activity. | *Subscribe and 🔔: http://9Soci.al/KM6e50GjSK9*  *Get more breaking news at 9News.com.au: http://9Soci.al/iyCO50GjSK6*  FOLLOW 9News Australia ► Facebook: https://www.facebook.com/9News/ ► Twitter: https://twitter.com/9NewsAUS ► Instagram: https://www.instagram.com/9news/  Join 9News for the latest in news and events that affect you in your local city, as well as news from across Australia and the world.  #9News #BreakingNews #NineNewsAustralia #9NewsAU",https://www.youtube.com/watch?v=USM29SI2Srk,9News
2026-03-16T22:21:48+00:00,Cutting everyday tech expenses amidst rising costs | 9 News Australia,"Tech expert Trevor Long helps find ways to cut down everyday tech expenses amidst rising costs and global impact. | *Subscribe and 🔔: http://9Soci.al/KM6e50GjSK9*  *Get more breaking news at 9News.com.au: http://9Soci.al/iyCO50GjSK6*  FOLLOW 9News Australia ► Facebook: https://www.facebook.com/9News/ ► Twitter: https://twitter.com/9NewsAUS ► Instagram: https://www.instagram.com/9news/  Join 9News for the latest in news and events that affect you in your local city, as well as news from across Australia and the world.  #9News #BreakingNews #NineNewsAustralia #9NewsAU",https://www.youtube.com/watch?v=kuyFswEsQQ0,9News
2026-03-16T22:29:33+00:00,"Melbourne school sees results for banning phones, smartwatches and headphones | 9 News Australia","One Melbourne school is taking 'do not disturb' to a whole new level by implementing one of the toughest tech bans in the country. They've banned phones, smartwatches and even wireless headphones, and they say they're seeing remarkable results. | *Subscribe and 🔔: http://9Soci.al/KM6e50GjSK9*  *Get more breaking news at 9News.com.au: http://9Soci.al/iyCO50GjSK6*  FOLLOW 9News Australia ► Facebook: https://www.facebook.com/9News/ ► Twitter: https://twitter.com/9NewsAUS ► Instagram: https://www.instagram.com/9news/  Join 9News for the latest in news and events that affect you in your local city, as well as news from across Australia and the world.  #9News #BreakingNews #NineNewsAustralia #9NewsAU",https://www.youtube.com/watch?v=JYWR-9y9LMI,9News
2026-03-17T00:30:19+00:00,Queen Mary and King Frederik’s historic return to Australia | 9 News Australia,"From a chance meeting at the Slip Inn to the throne of Denmark, Mary Donaldson’s journey is the ultimate modern-day fairytale. In this special presentation, 9News follows every major milestone of the royal couple's life, culminating in their historic 2026 state visit to Australia as King and Queen.  Watch as Queen Mary returns to her Australian roots, pays respects at the Australian War Memorial, and explores the spiritual heart of the nation at Uluru. This is the story of an Australian girl who captured a Prince’s heart and returned home to lead a nation.   CHAPTERS IN THIS VIDEO: 0:00 Princess Mary’s journey from commoner to Queen. 01:10 - 2005 07:20 - 2010 09:41 - 2011 17:40 - 2013 29:27 - 2016 30:57 - 2022 32:14 - 2024 38:19 - 2026  | Subscribe and 🔔: http://9Soci.al/KM6e50GjSK9 | Get more breaking news at 9News.com.au: http://9Soci.al/iyCO50GjSK6  FOLLOW 9News Australia ► Facebook: https://www.facebook.com/9News/ ► Twitter: https://twitter.com/9NewsAUS ► Instagram: https://www.instagram.com/9news/  Join 9News for the latest in news and events that affect you in your local city, as well as news from across Australia and the world.  #BREAKINGNEWS #9NEWS #AUSTRALIA",https://www.youtube.com/watch?v=6wHrhKqzSN0,9News
2026-03-17T00:53:38+00:00,Emergency meeting on fuel supply; RBA interest rate hike likely | 9 News Australia,"An emergency meeting on Australia's fuel supply takes place, with retailers summoned by the consumer watchdog to answer questions on concerns of price gouging at the petrol pump. In other news, it is almost guaranteed that the RBA will hike interest rates today, putting even more pressure on households. | *Subscribe and 🔔: http://9Soci.al/KM6e50GjSK9*  ►*Chapters in this video*: 00:00 ACCC Investigates Fuel Retailers Over Potential Price Gouging 01:46 Victorian Farmers Urge City Dwellers to Ditch Cars for Public Transport 02:52 Millions of Homeowners Await RBA Interest Rate Decision 04:56 Armed Suspect Hunted After Gunpoint Threat in Lidcombe 05:38 Barber Shop Firebombed in Glenroy, Melbourne 06:05 Donald Trump Criticizes Allies Over Strait of Hormuz 07:48 Alleged Drug Boat Stranded in Sydney Harbour After Running Out of Fuel  *Get more breaking news at 9News.com.au: http://9Soci.al/iyCO50GjSK6*  FOLLOW 9News Australia ► Facebook: https://www.facebook.com/9News/ ► Twitter: https://twitter.com/9NewsAUS ► Instagram: https://www.instagram.com/9news/  Join 9News for the latest in news and events that affect you in your local city, as well as news from across Australia and the world.  #9News #BreakingNews #NineNewsAustralia #9NewsAU",https://www.youtube.com/watch?v=-mW5KVsRNtQ,9News
2026-03-17T00:58:06+00:00,Hawks players arrested in the U.S. | 9 News Australia,"#EXCLUSIVE: Police have released new bodycam vision showing the moment Hawthorn teammates Dylan Moore and Connor Macdonald were arrested in the off-season.  The pair were detained after scaling a scissor lift in Arizona on private property. #9News    | Subscribe and 🔔: http://9Soci.al/KM6e50GjSK9 | Get more breaking news at 9News.com.au: http://9Soci.al/iyCO50GjSK6  FOLLOW 9News Australia ► Facebook: https://www.facebook.com/9News/ ► Twitter: https://twitter.com/9NewsAUS ► Instagram: https://www.instagram.com/9news/  Join 9News for the latest in news and events that affect you in your local city, as well as news from across Australia and the world.  #BREAKINGNEWS #9NEWS #AUSTRALIA",https://www.youtube.com/shorts/mTw22wOwzrA,9News
2026-03-17T01:25:43+00:00,What's next for Kyle Sandilands? | 9 News Australia,Today marks the deadline for Kyle Sandilands to rectify his alleged breach of contract. #9News,https://www.youtube.com/shorts/ZJMEeBel4Jk,9News
