published,title,description,link,Pub
2026-01-04T07:21:12+00:00,Hunt continues after Melbourne teenager shot dead | 9 News Australia,"Homicide squad detectives are investigating the fatal shooting of a teenage boy in Melbourne's inner north, as the manhunt for those responsible continues. MORE: https://nine.social/14eD  | Subscribe and 🔔: http://9Soci.al/KM6e50GjSK9 | Get more breaking news at 9News.com.au: http://9Soci.al/iyCO50GjSK6  FOLLOW 9News Australia ► Facebook: https://www.facebook.com/9News/ ► Twitter: https://twitter.com/9NewsAUS ► Instagram: https://www.instagram.com/9news/  Join 9News for the latest in news and events that affect you in your local city, as well as news from across Australia and the world.  #BREAKINGNEWS #9NEWS #AUSTRALIA",https://www.youtube.com/shorts/veu1LhEfUus,9News
2026-01-04T07:22:34+00:00,Swiss bar managers under criminal examination | 9 News Australia,"Swiss authorities have launched a criminal investigation into the two managers of the bar where a New Year's Eve fire killed 40 people.  READ MORE: https://nine.social/14ee | Subscribe and 🔔: http://9Soci.al/KM6e50GjSK9 | Get more breaking news at 9News.com.au: http://9Soci.al/iyCO50GjSK6  FOLLOW 9News Australia ► Facebook: https://www.facebook.com/9News/ ► Twitter: https://twitter.com/9NewsAUS ► Instagram: https://www.instagram.com/9news/  Join 9News for the latest in news and events that affect you in your local city, as well as news from across Australia and the world.  #BREAKINGNEWS #9NEWS #AUSTRALIA",https://www.youtube.com/shorts/lJ22_qbGB-s,9News
2026-01-04T07:27:55+00:00,Extraordinary operation as Venezuelan president captured by U.S. | 9 News Australia,"U.S. President Donald Trump has declared that America will ‘run the country’ indefinitely after the capture of Venezuela's President Nicolas Maduro. | *Subscribe and 🔔: http://9Soci.al/KM6e50GjSK9*  *Get more breaking news at 9News.com.au: http://9Soci.al/iyCO50GjSK6*  FOLLOW 9News Australia ► Facebook: https://www.facebook.com/9News/ ► Twitter: https://twitter.com/9NewsAUS ► Instagram: https://www.instagram.com/9news/  Join 9News for the latest in news and events that affect you in your local city, as well as news from across Australia and the world.  #9News #BreakingNews #NineNewsAustralia #9NewsAU",https://www.youtube.com/watch?v=BqtRFh_Z7iA,9News
2026-01-04T07:58:58+00:00,Heroes honoured as calls for Bondi attack royal commission increase | 9 News Australia,"More than 60 sporting stars have joined the chorus calling for a federal royal commission into the Bondi terror attack. | *Subscribe and 🔔: http://9Soci.al/KM6e50GjSK9*  *Get more breaking news at 9News.com.au: http://9Soci.al/iyCO50GjSK6*  FOLLOW 9News Australia ► Facebook: https://www.facebook.com/9News/ ► Twitter: https://twitter.com/9NewsAUS ► Instagram: https://www.instagram.com/9news/  Join 9News for the latest in news and events that affect you in your local city, as well as news from across Australia and the world.  #9News #BreakingNews #NineNewsAustralia #9NewsAU",https://www.youtube.com/watch?v=My4PzxNK3AA,9News
2026-01-04T08:03:37+00:00,"Manhunt after man kidnapped, found in car boot | 9 News Australia","A major manhunt is under way in Sydney's west after a man was kidnapped and found in the boot of a car. | *Subscribe and 🔔: http://9Soci.al/KM6e50GjSK9*  *Get more breaking news at 9News.com.au: http://9Soci.al/iyCO50GjSK6*  FOLLOW 9News Australia ► Facebook: https://www.facebook.com/9News/ ► Twitter: https://twitter.com/9NewsAUS ► Instagram: https://www.instagram.com/9news/  Join 9News for the latest in news and events that affect you in your local city, as well as news from across Australia and the world.  #9News #BreakingNews #NineNewsAustralia #9NewsAU",https://www.youtube.com/watch?v=WbigdLfZBts,9News
2026-01-04T08:05:42+00:00,Wild knife brawl erupts on Melbourne freeway | 9 News Australia,"Families have described cowering in their cars when a wild machete brawl erupted on the Monash Freeway in Melbourne. | *Subscribe and 🔔: http://9Soci.al/KM6e50GjSK9*  *Get more breaking news at 9News.com.au: http://9Soci.al/iyCO50GjSK6*  FOLLOW 9News Australia ► Facebook: https://www.facebook.com/9News/ ► Twitter: https://twitter.com/9NewsAUS ► Instagram: https://www.instagram.com/9news/  Join 9News for the latest in news and events that affect you in your local city, as well as news from across Australia and the world.  #9News #BreakingNews #NineNewsAustralia #9NewsAU",https://www.youtube.com/watch?v=-x2X0-UOn6g,9News
2026-01-04T08:10:45+00:00,"A record crowd has packed out the SCG, as the Ashes finally arrived in Sydney | 9 News Australia","Opposing fans have united for a special cause, but on the field, it was England who finished Day One on top. | *Subscribe and 🔔: http://9Soci.al/KM6e50GjSK9*  *Get more breaking news at 9News.com.au: http://9Soci.al/iyCO50GjSK6*  FOLLOW 9News Australia ► Facebook: https://www.facebook.com/9News/ ► Twitter: https://twitter.com/9NewsAUS ► Instagram: https://www.instagram.com/9news/  Join 9News for the latest in news and events that affect you in your local city, as well as news from across Australia and the world.  #9News #BreakingNews #NineNewsAustralia #9NewsAU",https://www.youtube.com/watch?v=gDc6GKt3SIo,9News
2026-01-04T08:18:26+00:00,Criminal investigation launched into Swiss bar fire | 9 News Australia,"Swiss authorities have launched a criminal investigation into the New Year’s Eve fire that killed 40 people. | *Subscribe and 🔔: http://9Soci.al/KM6e50GjSK9*  *Get more breaking news at 9News.com.au: http://9Soci.al/iyCO50GjSK6*  FOLLOW 9News Australia ► Facebook: https://www.facebook.com/9News/ ► Twitter: https://twitter.com/9NewsAUS ► Instagram: https://www.instagram.com/9news/  Join 9News for the latest in news and events that affect you in your local city, as well as news from across Australia and the world.  #9News #BreakingNews #NineNewsAustralia #9NewsAU",https://www.youtube.com/watch?v=F2Cka4MFKFU,9News
2026-01-04T08:20:44+00:00,Man killed in crash after police chase | 9 News Australia,"A police chase has ended in a horrific crash with an Adelaide man killed after his tyres were spiked on the Eyre Highway east of Kimba. | *Subscribe and 🔔: http://9Soci.al/KM6e50GjSK9*  *Get more breaking news at 9News.com.au: http://9Soci.al/iyCO50GjSK6*  FOLLOW 9News Australia ► Facebook: https://www.facebook.com/9News/ ► Twitter: https://twitter.com/9NewsAUS ► Instagram: https://www.instagram.com/9news/  Join 9News for the latest in news and events that affect you in your local city, as well as news from across Australia and the world.  #9News #BreakingNews #NineNewsAustralia #9NewsAU",https://www.youtube.com/watch?v=5i7L5Kn85cc,9News
2026-01-04T08:24:47+00:00,The Long Bay prisoner cooking up a storm from his jail cell | 9 News Australia,"A Sydney prisoner has amassed hundreds of thousands of views on TikTok after posting cooking videos behind bars. | *Subscribe and 🔔: http://9Soci.al/KM6e50GjSK9*  *Get more breaking news at 9News.com.au: http://9Soci.al/iyCO50GjSK6*  FOLLOW 9News Australia ► Facebook: https://www.facebook.com/9News/ ► Twitter: https://twitter.com/9NewsAUS ► Instagram: https://www.instagram.com/9news/  Join 9News for the latest in news and events that affect you in your local city, as well as news from across Australia and the world.  #9News #BreakingNews #NineNewsAustralia #9NewsAU",https://www.youtube.com/watch?v=B06f0wkZXG4,9News
2026-01-04T08:30:07+00:00,Millions across Australia could be missing out on seniors' benefits | 9 News Australia,"New data has revealed that almost a million seniors across the country could be missing out on a perk worth up to $3000 a year. | *Subscribe and 🔔: http://9Soci.al/KM6e50GjSK9*  *Get more breaking news at 9News.com.au: http://9Soci.al/iyCO50GjSK6*  FOLLOW 9News Australia ► Facebook: https://www.facebook.com/9News/ ► Twitter: https://twitter.com/9NewsAUS ► Instagram: https://www.instagram.com/9news/  Join 9News for the latest in news and events that affect you in your local city, as well as news from across Australia and the world.  #9News #BreakingNews #NineNewsAustralia #9NewsAU",https://www.youtube.com/watch?v=VJZmipCi1jA,9News
2026-01-04T11:01:13+00:00,9News Sydney | Sunday January 4 2026 | Full Episode,"Georgie Gardner leads the bulletin with an update on the U.S. military strikes that saw the capture of Venezuela's President Nicolas Maduro. Locally, more than 60 Australian sporting stars have joined the chorus calling for a Federal Royal Commission into the Bondi terror attack. In sport, a record crowd has packed out the SCG as the Ashes series finally reaches Sydney. | *Subscribe and 🔔: http://9Soci.al/KM6e50GjSK9*  *Get more breaking news at 9News.com.au: http://9Soci.al/iyCO50GjSK6*  FOLLOW 9News Australia ► Facebook: https://www.facebook.com/9News/ ► Twitter: https://twitter.com/9NewsAUS ► Instagram: https://www.instagram.com/9news/  Join 9News for the latest in news and events that affect you in your local city, as well as news from across Australia and the world.  #9News #BreakingNews #NineNewsAustralia #9NewsAU",https://www.youtube.com/watch?v=fzNovgC22d8,9News
2026-01-04T11:01:34+00:00,9News Melbourne | Sunday January 4 2026 | Full Episode,"Stephanie Anderson leads the bulletin with an update on the U.S. military strikes that saw the capture of Venezuela's President Nicolas Maduro. Locally, a wild machete brawl erupted on the Monash freeway. In other news, the heroes of the Bondi massacre have been honoured at the final Ashes test as more pressure is placed on the Albanese government for a Commonwealth Royal Commission into the attack. | *Subscribe and 🔔: http://9Soci.al/KM6e50GjSK9*  *Get more breaking news at 9News.com.au: http://9Soci.al/iyCO50GjSK6*  FOLLOW 9News Australia ► Facebook: https://www.facebook.com/9News/ ► Twitter: https://twitter.com/9NewsAUS ► Instagram: https://www.instagram.com/9news/  Join 9News for the latest in news and events that affect you in your local city, as well as news from across Australia and the world.  #9News #BreakingNews #NineNewsAustralia #9NewsAU",https://www.youtube.com/watch?v=uF704LPYB38,9News
2026-01-04T11:30:13+00:00,9News Adelaide | Sunday January 4 2026 | Full Episode,"Corey Norris leads the bulletin with an update on the U.S. military strikes that saw the capture of Venezuela's President Nicolas Maduro. Locally, a man has died after a police pursuit ended in a horrific crash on the Eyre highway east of Kimba. In other news, the heroes of the Bondi massacre have been honoured at the final Ashes test as more pressure is placed on the Albanese government for a Commonwealth Royal Commission into the attack. | *Subscribe and 🔔: http://9Soci.al/KM6e50GjSK9*  *Get more breaking news at 9News.com.au: http://9Soci.al/iyCO50GjSK6*  FOLLOW 9News Australia ► Facebook: https://www.facebook.com/9News/ ► Twitter: https://twitter.com/9NewsAUS ► Instagram: https://www.instagram.com/9news/  Join 9News for the latest in news and events that affect you in your local city, as well as news from across Australia and the world.  #9News #BreakingNews #NineNewsAustralia #9NewsAU",https://www.youtube.com/watch?v=GDvrcVl9IHo,9News
2026-01-04T12:00:47+00:00,9News Brisbane | Sunday January 4 2026 | Full Episode,"Lily Greer leads the bulletin with an update on the U.S. military strikes that saw the capture of Venezuela's President Nicolas Maduro. Locally, confirmation of a worker's body has been located after a roof collapse at a Brisbane mine. In other news, the heroes of the Bondi massacre have been honoured at the final Ashes test as more pressure is placed on the Albanese government for a Commonwealth Royal Commission into the attack. | *Subscribe and 🔔: http://9Soci.al/KM6e50GjSK9*  *Get more breaking news at 9News.com.au: http://9Soci.al/iyCO50GjSK6*  FOLLOW 9News Australia ► Facebook: https://www.facebook.com/9News/ ► Twitter: https://twitter.com/9NewsAUS ► Instagram: https://www.instagram.com/9news/  Join 9News for the latest in news and events that affect you in your local city, as well as news from across Australia and the world.  #9News #BreakingNews #NineNewsAustralia #9NewsAU",https://www.youtube.com/watch?v=P2x6miRQFfA,9News
