published,title,description,link,Pub
2026-01-18T09:58:58+00:00,Healthcare workers set to walk off the job in major strike action | 9 News Australia,"They're demanding a wage increase in line with inflation, but negotiations have stalled. | *Subscribe and 🔔: http://9Soci.al/KM6e50GjSK9*  *Get more breaking news at 9News.com.au: http://9Soci.al/iyCO50GjSK6*  FOLLOW 9News Australia ► Facebook: https://www.facebook.com/9News/ ► Twitter: https://twitter.com/9NewsAUS ► Instagram: https://www.instagram.com/9news/  Join 9News for the latest in news and events that affect you in your local city, as well as news from across Australia and the world.  #9News #BreakingNews #NineNewsAustralia #9NewsAU",https://www.youtube.com/watch?v=qalXU-tv84E,9News
2026-01-18T10:26:39+00:00,Hundreds protest WA government's fishing ban | 9 News Australia,"Hundreds of fishers have sparked traffic chaos, travelling from across WA to protest against the government's controversial fishing ban on demersal species.  | *Subscribe and 🔔: http://9Soci.al/KM6e50GjSK9*  *Get more breaking news at 9News.com.au: http://9Soci.al/iyCO50GjSK6*  FOLLOW 9News Australia ► Facebook: https://www.facebook.com/9News/ ► Twitter: https://twitter.com/9NewsAUS ► Instagram: https://www.instagram.com/9news/  Join 9News for the latest in news and events that affect you in your local city, as well as news from across Australia and the world.  #9News #BreakingNews #NineNewsAustralia #9NewsAU",https://www.youtube.com/watch?v=JiGW40euPQM,9News
2026-01-18T11:00:51+00:00,9News Melbourne | Sunday January 18 | Full Episode,"Tonight, we lead with the electric start to the Australian Open as record crowds descend on Melbourne Park.  In local news, Premier Jacinta Allan is under fire over claims of significant funding cuts to the CFA, while a local community in Berwick mourns the loss of an elderly woman following a tragic crash. We also bring you a breaking report on a critical shark attack in Sydney and the latest on the international trade tensions surrounding Donald Trump and Greenland.  CHAPTERS:  00:00 - News Opening & Main Headlines  00:21 - Australian Open Day 1: Records Smashed  06:15 - Melbourne Weather Forecast  07:20 - CFA Funding Dispute: Premier Responds  09:16 - Berwick Pharmacy Crash Tragedy  09:33 - Breaking News: Critical Sydney Shark Attack  10:33 - Phillip Island Scrub Fire Emergency  10:48 - PM Faces Criticism as Parliament Returns  13:24 - Lorne Cleanup: Open for Business  15:29 - Global News: Trump’s Tariff Threats  17:30 - Victoria Hospital Strikes Announced  19:55 - Bondi Memorial: National Day of Mourning  21:44 - Magda Szubanski's Scam Warning  | *Subscribe and 🔔: http://9Soci.al/KM6e50GjSK9*  *Get more breaking news at 9News.com.au: http://9Soci.al/iyCO50GjSK6*  FOLLOW 9News Australia ► Facebook: https://www.facebook.com/9News/ ► Twitter: https://twitter.com/9NewsAUS ► Instagram: https://www.instagram.com/9news/  Join 9News for the latest in news and events that affect you in your local city, as well as news from across Australia and the world.  #9News #BreakingNews #NineNewsAustralia #9NewsAU",https://www.youtube.com/watch?v=WJNdpjRfZyg,9News
2026-01-18T11:01:18+00:00,9News Sydney | Sunday January 18 | Full Episode,"Peter Overton leads tonight’s bulletin with breaking news from Sydney’s eastern suburbs where a 13-year-old boy is in critical condition following a shark attack off Vaucluse. We have the latest on the emergency response and his condition from Rose Bay.  Also tonight, wild weather lashes New South Wales. Severe storms have triggered flash flooding and landslides across Sydney, leaving homes damaged and thousands without power. In the city, controversial anti-protest laws face their first major test at a rally in Hyde Park, while the federal government warns of the dangers of failing to pass new hate speech legislation.  CHAPTERS:  00:00 9News Sydney Intro  00:06 Boy bitten by shark at Vaucluse  01:18 Severe storms and flash flooding hit Sydney  05:01 Anti-protest laws tested at Hyde Park rally  07:13 Federal Government warns over hate speech laws  09:51 National Day of Mourning for Bondi victims  11:59 Child killed in Canberra shopping centre tragedy  13:02 Donald Trump threatens tariffs over Greenland  14:44 Australian Open Day 1: Record crowds  17:35 Arrest made over Canberra pipe bombs  19:37 Historic Sydney Fish Market site trades for last time  | *Subscribe and 🔔: http://9Soci.al/KM6e50GjSK9*  *Get more breaking news at 9News.com.au: http://9Soci.al/iyCO50GjSK6*  FOLLOW 9News Australia ► Facebook: https://www.facebook.com/9News/ ► Twitter: https://twitter.com/9NewsAUS ► Instagram: https://www.instagram.com/9news/  Join 9News for the latest in news and events that affect you in your local city, as well as news from across Australia and the world.  #9News #BreakingNews #NineNewsAustralia #9NewsAU",https://www.youtube.com/watch?v=h14aggO3u1E,9News
2026-01-18T11:01:34+00:00,9News Brisbane | Thursday November 6 | Full Episode,"Stay up to date with the latest 9 News Queensland bulletin. Today’s top stories include a critical shark attack in Sydney, a major murder investigation in Cairns, and the ongoing flood crisis in Northwest Queensland. We also cover the community backlash in Samford Valley, the latest crime-fighting statistics under ""Jack's Law,"" and a developing international standoff involving the U.S. and Greenland. | *Subscribe and 🔔: http://9Soci.al/KM6e50GjSK9*  *Chapters* 0:00 Shark Attack in Sydney Harbor 1:08 Cairns Murder Investigation  1:36 Northwest Queensland Flood Crisis  2:46 Weather & South East Flash Flooding  4:25 Samford Valley Community Protest  6:42 Jack’s Law Weapon Seizures  8:24 Ipswich House Fire  8:45 Bondi Attack Memorial Plans  10:35 Federal Parliament Hate Law Clash  13:08 Tragic Canberra Store Crash  14:13 Trump’s Greenland Tariff Threat  15:58 Canberra Pipe Bomb Arrest  17:13 International News Wrap  18:09 Barty & Federer at Australian Open  *Get more breaking news at 9News.com.au: http://9Soci.al/iyCO50GjSK6*  FOLLOW 9News Australia ► Facebook: https://www.facebook.com/9News/ ► Twitter: https://twitter.com/9NewsAUS ► Instagram: https://www.instagram.com/9news/  Join 9News for the latest in news and events that affect you in your local city, as well as news from across Australia and the world.  #9News #BreakingNews #NineNewsAustralia #9NewsAU",https://www.youtube.com/watch?v=sF_ysG-GP60,9News
2026-01-18T11:30:32+00:00,9News Adelaide | Sunday January 18 | Full Episode,"Stay updated with 9 News Adelaide. Tonight’s major headlines include a devastating industrial fire in Croydon Park, a critical shark attack in Sydney Harbour, and the official opening of the 2026 Australian Open in Melbourne. We also cover the breaking news of a tragic fatal crash in Canberra and escalating international tensions regarding Donald Trump's latest Greenland acquisition proposal.  CHAPTERS:  00:00 - Adelaide Industrial Inferno: Croydon Park Fire  02:51 - Eyre Peninsula Boating Tragedy  03:11 - Adelaide Airport Baggage System Chaos  04:18 - Breaking News: Sydney Harbour Shark Attack  05:23 - Regional Health Funding & Political Clash  07:38 - Liberal Party’s $1 Billion SA Road Pledge  09:04 - Federal Parliament Emergency Session: New Security Laws  11:34 - Breaking News: Bushfire Warning for Mount Compass  11:51 - National Day of Mourning for Bondi Victims  13:38 - Global Tensions: Trump’s Greenland Tariff Threats  15:20 - Australian Open Day 1: Records & Legends Match  18:08 - Canberra Tragedy: 4-Year-Old Killed in Shop Crash  19:29 - Magda Szubanski Warning: Medical Scam Alert  19:52 - Adelaide Weather Report: Cool Change Approaching  | *Subscribe and 🔔: http://9Soci.al/KM6e50GjSK9*  *Get more breaking news at 9News.com.au: http://9Soci.al/iyCO50GjSK6*  FOLLOW 9News Australia ► Facebook: https://www.facebook.com/9News/ ► Twitter: https://twitter.com/9NewsAUS ► Instagram: https://www.instagram.com/9news/  Join 9News for the latest in news and events that affect you in your local city, as well as news from across Australia and the world.  #9News #BreakingNews #NineNewsAustralia #9NewsAU",https://www.youtube.com/watch?v=Ne8crw18VyU,9News
2026-01-18T19:24:13+00:00,Boy fights for life after shark attack; Police investigate ISIS link to Bondi | 9 News Australia,"A young boy is fighting for life after being attacked by a large shark in Sydney Harbour. In other news, New South Wales detectives will head to the Philippines to investigate whether local ISIS-linked terrorist helped plan the Bondi Beach terror attack. | *Subscribe and 🔔: http://9Soci.al/KM6e50GjSK9*  *Get more breaking news at 9News.com.au: http://9Soci.al/iyCO50GjSK6*  FOLLOW 9News Australia ► Facebook: https://www.facebook.com/9News/ ► Twitter: https://twitter.com/9NewsAUS ► Instagram: https://www.instagram.com/9news/  Join 9News for the latest in news and events that affect you in your local city, as well as news from across Australia and the world.  #9News #BreakingNews #NineNewsAustralia #9NewsAU",https://www.youtube.com/watch?v=Y3gcIdUQuVg,9News
2026-01-18T21:09:19+00:00,Labor faces an uphill battle heading into Parliament’s return | 9 News Australia,"There's a poll shock for federal politicians heading into Canberra today, as One Nation surges ahead of the Coalition for the first time. | *Subscribe and 🔔: http://9Soci.al/KM6e50GjSK9*  *Get more breaking news at 9News.com.au: http://9Soci.al/iyCO50GjSK6*  FOLLOW 9News Australia ► Facebook: https://www.facebook.com/9News/ ► Twitter: https://twitter.com/9NewsAUS ► Instagram: https://www.instagram.com/9news/  Join 9News for the latest in news and events that affect you in your local city, as well as news from across Australia and the world.  #9News #BreakingNews #NineNewsAustralia #9NewsAU",https://www.youtube.com/watch?v=sAZeEzzYzgU,9News
2026-01-18T21:16:14+00:00,Boy fights for life after being attacked by shark in Sydney Harbour | 9 News Australia,"A teenage boy is fighting for life after being attacked by a shark while swimming in Sydney Harbour. It's believed the boy was with up to five friends, jumping off rocks into the water before the predator struck. | *Subscribe and 🔔: http://9Soci.al/KM6e50GjSK9*  *Get more breaking news at 9News.com.au: http://9Soci.al/iyCO50GjSK6*  FOLLOW 9News Australia ► Facebook: https://www.facebook.com/9News/ ► Twitter: https://twitter.com/9NewsAUS ► Instagram: https://www.instagram.com/9news/  Join 9News for the latest in news and events that affect you in your local city, as well as news from across Australia and the world.  #9News #BreakingNews #NineNewsAustralia #9NewsAU",https://www.youtube.com/watch?v=_t62pZOtTNU,9News
2026-01-18T21:26:10+00:00,Danish Prime Minister declares “Europe won’t be blackmailed” | 9 News Australia,"The Danish Prime Minister has declared that ""Europe won't be blackmailed"" in response to Donald Trump threatening tariffs in his fight for Greenland. | *Subscribe and 🔔: http://9Soci.al/KM6e50GjSK9*  *Get more breaking news at 9News.com.au: http://9Soci.al/iyCO50GjSK6*  FOLLOW 9News Australia ► Facebook: https://www.facebook.com/9News/ ► Twitter: https://twitter.com/9NewsAUS ► Instagram: https://www.instagram.com/9news/  Join 9News for the latest in news and events that affect you in your local city, as well as news from across Australia and the world.  #9News #BreakingNews #NineNewsAustralia #9NewsAU",https://www.youtube.com/watch?v=EN0dham4H_s,9News
2026-01-18T21:38:48+00:00,Anthony Albanese considers invitation from the U.S. President | 9 News Australia,"Prime Minister Anthony Albanese is considering an invitation sent by President Donald Trump to join his so-called 'Board of Peace'. | *Subscribe and 🔔: http://9Soci.al/KM6e50GjSK9*  *Get more breaking news at 9News.com.au: http://9Soci.al/iyCO50GjSK6*  FOLLOW 9News Australia ► Facebook: https://www.facebook.com/9News/ ► Twitter: https://twitter.com/9NewsAUS ► Instagram: https://www.instagram.com/9news/  Join 9News for the latest in news and events that affect you in your local city, as well as news from across Australia and the world.  #9News #BreakingNews #NineNewsAustralia #9NewsAU",https://www.youtube.com/watch?v=zBlYQYNuJ0I,9News
2026-01-18T21:50:39+00:00,Dangerous bushfire forces urgent emergency warnings in South Australia | 9 News Australia,"A dangerous bushfire is burning out of control in South Australia's south-east, forcing urgent warnings for communities in its path. | *Subscribe and 🔔: http://9Soci.al/KM6e50GjSK9*  *Get more breaking news at 9News.com.au: http://9Soci.al/iyCO50GjSK6*  FOLLOW 9News Australia ► Facebook: https://www.facebook.com/9News/ ► Twitter: https://twitter.com/9NewsAUS ► Instagram: https://www.instagram.com/9news/  Join 9News for the latest in news and events that affect you in your local city, as well as news from across Australia and the world.  #9News #BreakingNews #NineNewsAustralia #9NewsAU",https://www.youtube.com/watch?v=iWvW_HeCDzc,9News
2026-01-18T22:29:39+00:00,Queensland police seize 600 weapons since permanent Jack’s Law | 9 News Australia,"Queensland Police have seized over 600 weapons and scanned more than 80-thousand people in the six months since Jack's Law was made permanent. Officers can now patrol the streets, using hand-held scanners to detect deadly weapons. | *Subscribe and 🔔: http://9Soci.al/KM6e50GjSK9*  *Get more breaking news at 9News.com.au: http://9Soci.al/iyCO50GjSK6*  FOLLOW 9News Australia ► Facebook: https://www.facebook.com/9News/ ► Twitter: https://twitter.com/9NewsAUS ► Instagram: https://www.instagram.com/9news/  Join 9News for the latest in news and events that affect you in your local city, as well as news from across Australia and the world.  #9News #BreakingNews #NineNewsAustralia #9NewsAU",https://www.youtube.com/watch?v=lQvkXckzPrk,9News
2026-01-18T22:59:19+00:00,Tennis fans set new attendance record for Day One of the Australian Open | 9 News Australia,"Melbourne Park is back to its best, setting a new attendance record for Tennis fans on Day One of the Australian Open. | *Subscribe and 🔔: http://9Soci.al/KM6e50GjSK9*  *Get more breaking news at 9News.com.au: http://9Soci.al/iyCO50GjSK6*  FOLLOW 9News Australia ► Facebook: https://www.facebook.com/9News/ ► Twitter: https://twitter.com/9NewsAUS ► Instagram: https://www.instagram.com/9news/  Join 9News for the latest in news and events that affect you in your local city, as well as news from across Australia and the world.  #9News #BreakingNews #NineNewsAustralia #9NewsAU",https://www.youtube.com/watch?v=THkTu49kzvg,9News
2026-01-19T02:06:55+00:00,Gun safety advocates are calling on both major parties to unite | 9 News Australia,"""It's good that gun safety will be given a focus on it's own, separate from the other complex issues...""  Gun safety advocates are calling on both major parties to unite in passing reforms that would crack down on firearm ownership in Australia. #9News",https://www.youtube.com/shorts/EEdVWyWO0O8,9News
