published,title,description,link,Pub
2025-12-22T09:33:11+00:00,Young mother allegedly murdered in Adelaide | 9 News Australia,"A woman has died and a man has been charged with murder after an alleged domestic violence incident in Adelaide's north. | *Subscribe and 🔔: http://9Soci.al/KM6e50GjSK9*  *Get more breaking news at 9News.com.au: http://9Soci.al/iyCO50GjSK6*  FOLLOW 9News Australia ► Facebook: https://www.facebook.com/9News/ ► Twitter: https://twitter.com/9NewsAUS ► Instagram: https://www.instagram.com/9news/  Join 9News for the latest in news and events that affect you in your local city, as well as news from across Australia and the world.  #9News #BreakingNews #NineNewsAustralia #9NewsAU",https://www.youtube.com/watch?v=9aLjjHAztNs,9News
2025-12-22T10:04:31+00:00,Christmas arrives early at animal hospital | 9 News Australia,"Christmas has come early at Lort Smith Animal Hospital where Santa delivered hundred of donated toys and treats. | *Subscribe and 🔔: http://9Soci.al/KM6e50GjSK9*  *Get more breaking news at 9News.com.au: http://9Soci.al/iyCO50GjSK6*  FOLLOW 9News Australia ► Facebook: https://www.facebook.com/9News/ ► Twitter: https://twitter.com/9NewsAUS ► Instagram: https://www.instagram.com/9news/  Join 9News for the latest in news and events that affect you in your local city, as well as news from across Australia and the world.  #9News #BreakingNews #NineNewsAustralia #9NewsAU",https://www.youtube.com/watch?v=C5AvPALofq4,9News
2025-12-22T10:09:21+00:00,Seafood market busy with just three days till Christmas | 9 News Australia,"Victorians are racing to stock up for Christmas feasts, and with cooler weather forecast, turkey is proving popular. | *Subscribe and 🔔: http://9Soci.al/KM6e50GjSK9*  *Get more breaking news at 9News.com.au: http://9Soci.al/iyCO50GjSK6*  FOLLOW 9News Australia ► Facebook: https://www.facebook.com/9News/ ► Twitter: https://twitter.com/9NewsAUS ► Instagram: https://www.instagram.com/9news/  Join 9News for the latest in news and events that affect you in your local city, as well as news from across Australia and the world.  #9News #BreakingNews #NineNewsAustralia #9NewsAU",https://www.youtube.com/watch?v=a0gNEF9w1dQ,9News
2025-12-22T10:24:08+00:00,9News Sydney | Monday 22 December | Full Episode,"Tonight, we reveal the chilling details from court documents regarding the Bondi terror attack. Police allege the father-and-son gunmen spent months meticulously planning the December 14th massacre, which claimed 15 lives. We follow the high-risk transfer of the surviving accused, Naveed Akram, to Long Bay Jail and witness the emotional removal of community tributes at Bondi Pavilion. | *Subscribe and 🔔: http://9Soci.al/KM6e50GjSK9*  0:00 Bondi Terror Attack 4:40 Community Tributes Removed from Bondi Pavilion  8:15 NSW Parliament Recalled for Emergency Meeting 11:34 Armed Police Surge for Boxing Day Test Security  12:09 Message of Support from Israeli President Isaac Herzog  12:50 PM Anthony Albanese Apology & Royal Commission Debate  14:25 Northern Beaches Hospital Goes Fully Public  15:06 Sydney Transport: Massive Christmas Infrastructure Blitz  16:55 Sydney Weather: Severe Heatwave Warning  *Get more breaking news at 9News.com.au: http://9Soci.al/iyCO50GjSK6*  FOLLOW 9News Australia ► Facebook: https://www.facebook.com/9News/ ► Twitter: https://twitter.com/9NewsAUS ► Instagram: https://www.instagram.com/9news/  Join 9News for the latest in news and events that affect you in your local city, as well as news from across Australia and the world.  #9News #BreakingNews #NineNewsAustralia #9NewsAU",https://www.youtube.com/watch?v=jykWGec612I,9News
2025-12-22T10:52:54+00:00,9News Melbourne | Monday 22 December | Full Episode,"Tonight, Premier Jacinta Allan announces sweeping new police powers to shut down protests and fast-track anti-vilification laws following the Bondi massacre. We provide an exclusive look at the ""Ring of Steel"" security measures for the Boxing Day Test, featuring specialist officers armed with semi-automatic rifles patrolling the MCG. | *Subscribe and 🔔: http://9Soci.al/KM6e50GjSK9*  Chapters:  0:00 Intro & Headlines  0:45 Victoria Grants Police New Powers 4:49 MCG Boxing Day Test Security  6:51 Chilling Details of Bondi Terror Plot Unveiled in Court  9:53 Prime Minister’s Apology at Vigil  11:43 Sea of Flowers Removed from Bondi Pavilion Memorial  15:13 Group of Youths Flee Freeway Smash  16:43 Ashes Heroes Return to Melbourne  *Get more breaking news at 9News.com.au: http://9Soci.al/iyCO50GjSK6*  FOLLOW 9News Australia ► Facebook: https://www.facebook.com/9News/ ► Twitter: https://twitter.com/9NewsAUS ► Instagram: https://www.instagram.com/9news/  Join 9News for the latest in news and events that affect you in your local city, as well as news from across Australia and the world.  #9News #BreakingNews #NineNewsAustralia #9NewsAU",https://www.youtube.com/watch?v=ovGYFQthVVM,9News
2025-12-22T11:30:14+00:00,9News Adelaide | Monday 22 December | Full Episode,"A woman has died and a man has been charged with murder after an alleged domestic violence incident in Adelaide's north. | *Subscribe and 🔔: http://9Soci.al/KM6e50GjSK9*  CHAPTER LIST:  00:00 Northfield Alleged Murder 01:51 Bondi Investigation 07:02 Victim Funeral 07:51 Community Vigil 09:14 Political Backlash 11:06 MP Reprimanded 13:00 Campbelltown Arson 13:17 Vehicle Rollover 13:45 Ashes Celebrations 15:45 Stadium Security 17:40 Blood Donations 19:28 Hero Mural 19:52 Gas Policy  *Get more breaking news at 9News.com.au: http://9Soci.al/iyCO50GjSK6*  FOLLOW 9News Australia ► Facebook: https://www.facebook.com/9News/ ► Twitter: https://twitter.com/9NewsAUS ► Instagram: https://www.instagram.com/9news/  Join 9News for the latest in news and events that affect you in your local city, as well as news from across Australia and the world.  #9News #BreakingNews #NineNewsAustralia #9NewsAU",https://www.youtube.com/watch?v=F5gJGXflnIo,9News
2025-12-22T12:15:17+00:00,9News Brisbane | Monday 22 December | Full Episode,"9News Queensland bulletin from December 22, 2025. | *Subscribe and 🔔: http://9Soci.al/KM6e50GjSK9*  CHAPTER LIST:   0:23 - Bondi Investigation 4:30 - Victim Funeral 5:19 - National Vigil 6:41 - Cricket Security 7:15 - Political Fallout 9:06 - Sweltering Heat 10:32 - Weather Forecast 11:17 - Security Breach 12:13 - Yeronga Fire 12:47 - Power Crash 13:09 - Gas Policy 13:49 - New Polling 15:35 - Cricket Celebrations 20:21 - Support Hub 21:06 - Shark Catch 22:31 - President Message 22:55 - Epstein Files 24:48 - Retail Fine 25:09 - Tanker Seizure 25:31 - Blood Donation  *Get more breaking news at 9News.com.au: http://9Soci.al/iyCO50GjSK6*  FOLLOW 9News Australia ► Facebook: https://www.facebook.com/9News/ ► Twitter: https://twitter.com/9NewsAUS ► Instagram: https://www.instagram.com/9news/  Join 9News for the latest in news and events that affect you in your local city, as well as news from across Australia and the world.  #9News #BreakingNews #NineNewsAustralia #9NewsAU",https://www.youtube.com/watch?v=eyZ7Nga6RqA,9News
2025-12-22T19:23:11+00:00,Timeline of events leading up to the Bondi Beach attack; PM Albanese apologises | 9 News Australia,"A chilling timeline of events has been revealed of the two alleged killers of the Bondi terror attack. In other news, Anthony Albanese has apologised for what the Jewish and Australian community has endured, yet still resists a Royal Commission. | *Subscribe and 🔔: http://9Soci.al/KM6e50GjSK9*  *Get more breaking news at 9News.com.au: http://9Soci.al/iyCO50GjSK6*  FOLLOW 9News Australia ► Facebook: https://www.facebook.com/9News/ ► Twitter: https://twitter.com/9NewsAUS ► Instagram: https://www.instagram.com/9news/  Join 9News for the latest in news and events that affect you in your local city, as well as news from across Australia and the world.  #9News #BreakingNews #NineNewsAustralia #9NewsAU",https://www.youtube.com/watch?v=S-hSWMczhyc,9News
2025-12-22T19:35:30+00:00,Chilling new details of alleged Bondi attack gunmen unveiled in court documents | 9 News Australia,"New details about the Bondi terror attack have been released, with pictures of the alleged gunmen unveiled in court documents. | *Subscribe and 🔔: http://9Soci.al/KM6e50GjSK9*  *Get more breaking news at 9News.com.au: http://9Soci.al/iyCO50GjSK6*  FOLLOW 9News Australia ► Facebook: https://www.facebook.com/9News/ ► Twitter: https://twitter.com/9NewsAUS ► Instagram: https://www.instagram.com/9news/  Join 9News for the latest in news and events that affect you in your local city, as well as news from across Australia and the world.  #9News #BreakingNews #NineNewsAustralia #9NewsAU",https://www.youtube.com/watch?v=bwf4odhLyis,9News
2025-12-22T19:53:05+00:00,The U.S. Department of Justice removes several items from the Epstein files | 9 News Australia,"The U.S. Department of Justice is under fire after removing and later restoring several items from the Epstein files. | *Subscribe and 🔔: http://9Soci.al/KM6e50GjSK9*  *Get more breaking news at 9News.com.au: http://9Soci.al/iyCO50GjSK6*  FOLLOW 9News Australia ► Facebook: https://www.facebook.com/9News/ ► Twitter: https://twitter.com/9NewsAUS ► Instagram: https://www.instagram.com/9news/  Join 9News for the latest in news and events that affect you in your local city, as well as news from across Australia and the world.  #9News #BreakingNews #NineNewsAustralia #9NewsAU",https://www.youtube.com/watch?v=JSIZ313gRWc,9News
2025-12-22T20:42:45+00:00,Specialist police armed with semi-automatic rifles will be deployed to the MCG | 9 News Australia,"Specialist police armed with semi-automatic rifles will be deployed to the MCG to bolster security at the Boxing Day Test, following the Bondi terror attack. | *Subscribe and 🔔: http://9Soci.al/KM6e50GjSK9*  *Get more breaking news at 9News.com.au: http://9Soci.al/iyCO50GjSK6*  FOLLOW 9News Australia ► Facebook: https://www.facebook.com/9News/ ► Twitter: https://twitter.com/9NewsAUS ► Instagram: https://www.instagram.com/9news/  Join 9News for the latest in news and events that affect you in your local city, as well as news from across Australia and the world.  #9News #BreakingNews #NineNewsAustralia #9NewsAU",https://www.youtube.com/watch?v=pEqrrTNDiEQ,9News
2025-12-22T21:08:12+00:00,PM Albanese faces mounting pressure to launch a federal Royal Commission | 9 News Australia,"Prime Minister Anthony Albanese is facing mounting pressure to launch a federal Royal Commission into the Bondi terror attack, and the opposition is claiming this could and should be done before Christmas. | *Subscribe and 🔔: http://9Soci.al/KM6e50GjSK9*  *Get more breaking news at 9News.com.au: http://9Soci.al/iyCO50GjSK6*  FOLLOW 9News Australia ► Facebook: https://www.facebook.com/9News/ ► Twitter: https://twitter.com/9NewsAUS ► Instagram: https://www.instagram.com/9news/  Join 9News for the latest in news and events that affect you in your local city, as well as news from across Australia and the world.  #9News #BreakingNews #NineNewsAustralia #9NewsAU",https://www.youtube.com/watch?v=j8yZdbP-SJ0,9News
2025-12-23T01:29:32+00:00,Alleged gunman spends first night behind bars; Terrorism laws pass first step | 9 News Australia,"The alleged Bondi gunman has spent his firstnight behind bars, following his release from hospital after nine days. In other news, the NSW Government's controversial new terrorism laws have passed their first hurdle, clearing the lower house late last night. | *Subscribe and 🔔: http://9Soci.al/KM6e50GjSK9*  *Get more breaking news at 9News.com.au: http://9Soci.al/iyCO50GjSK6*  FOLLOW 9News Australia ► Facebook: https://www.facebook.com/9News/ ► Twitter: https://twitter.com/9NewsAUS ► Instagram: https://www.instagram.com/9news/  Join 9News for the latest in news and events that affect you in your local city, as well as news from across Australia and the world.  #9News #BreakingNews #NineNewsAustralia #9NewsAU",https://www.youtube.com/watch?v=bGrX7tc5PI8,9News
2025-12-23T01:53:38+00:00,Bipartisanship has collapsed following the Bondi terror attack | 9 News Australia,"Bipartisanship has collapsed following the Bondi terror attack as the Coalition and Labor clash over gun laws and a potential Royal Commission. | *Subscribe and 🔔: http://9Soci.al/KM6e50GjSK9*  *Get more breaking news at 9News.com.au: http://9Soci.al/iyCO50GjSK6*  FOLLOW 9News Australia ► Facebook: https://www.facebook.com/9News/ ► Twitter: https://twitter.com/9NewsAUS ► Instagram: https://www.instagram.com/9news/  Join 9News for the latest in news and events that affect you in your local city, as well as news from across Australia and the world.  #9News #BreakingNews #NineNewsAustralia #9NewsAU",https://www.youtube.com/watch?v=3tw0WrHh-tk,9News
2025-12-23T02:08:14+00:00,The U.S. President has announced a new ship for the Navy | 9 News Australia,"The introduction of the ""Trump class Battleship"", is coming against a backdrop of tensions in the Caribbean and a pressure campaign on Venezuela. | *Subscribe and 🔔: http://9Soci.al/KM6e50GjSK9*  *Get more breaking news at 9News.com.au: http://9Soci.al/iyCO50GjSK6*  FOLLOW 9News Australia ► Facebook: https://www.facebook.com/9News/ ► Twitter: https://twitter.com/9NewsAUS ► Instagram: https://www.instagram.com/9news/  Join 9News for the latest in news and events that affect you in your local city, as well as news from across Australia and the world.  #9News #BreakingNews #NineNewsAustralia #9NewsAU",https://www.youtube.com/watch?v=wIckwA0Uz_0,9News
