published,title,description,link,Pub
2026-02-27T08:11:31+00:00,Parents charged after three-year-old killed in car crash | 9 News Australia,"The parents of a three-year-old killed in a car crash have been charged with manslaughter. | *Subscribe and 🔔: http://9Soci.al/KM6e50GjSK9*  *Get more breaking news at 9News.com.au: http://9Soci.al/iyCO50GjSK6*  FOLLOW 9News Australia ► Facebook: https://www.facebook.com/9News/ ► Twitter: https://twitter.com/9NewsAUS ► Instagram: https://www.instagram.com/9news/  Join 9News for the latest in news and events that affect you in your local city, as well as news from across Australia and the world.  #9News #BreakingNews #NineNewsAustralia #9NewsAU",https://www.youtube.com/watch?v=56nebR0oveI,9News
2026-02-27T08:28:07+00:00,Supporters fill the streets of Las Vegas for the NRL's Fan Fest | 9 News Australia,"Supporters have filled the streets of Las Vegas for the NRL's Fan Fest, with teams walking the red carpet before walking onto the pitch ahead of the games. | Subscribe and 🔔: http://9Soci.al/KM6e50GjSK9 | Get more breaking news at 9News.com.au: http://9Soci.al/iyCO50GjSK6  #NRLBulldogsDragons | Live and free Sunday 3.00pm AEDT on @Channel9 and 9Now   FOLLOW 9News Australia ► Facebook: https://www.facebook.com/9News/ ► Twitter: https://twitter.com/9NewsAUS ► Instagram: https://www.instagram.com/9news/  Join 9News for the latest in news and events that affect you in your local city, as well as news from across Australia and the world.  #BREAKINGNEWS #9NEWS #AUSTRALIA",https://www.youtube.com/shorts/WN6ZQ1clzts,9News
2026-02-27T08:55:04+00:00,Shocking pursuit across Adelaide's suburbs | 9 News Australia,"Shocked motorists have filmed an alleged drunk driver in a stolen car, leading police on a pursuit across Adelaide's suburbs. | *Subscribe and 🔔: http://9Soci.al/KM6e50GjSK9*  *Get more breaking news at 9News.com.au: http://9Soci.al/iyCO50GjSK6*  FOLLOW 9News Australia ► Facebook: https://www.facebook.com/9News/ ► Twitter: https://twitter.com/9NewsAUS ► Instagram: https://www.instagram.com/9news/  Join 9News for the latest in news and events that affect you in your local city, as well as news from across Australia and the world.  #9News #BreakingNews #NineNewsAustralia #9NewsAU",https://www.youtube.com/watch?v=cDXIw45nxRk,9News
2026-02-27T09:16:17+00:00,60 years of Aussie coins | 9 News Australia,Check your pockets for this special edition dollar coin marking 60 years of decimal currency. #9News,https://www.youtube.com/shorts/BRO7sWDmhpY,9News
2026-02-27T09:18:50+00:00,Pro-Israel supporters protest Grace Tame's IWD panel appearance | 9 News Australia,"Grace Tame has dodged protesters and questions after appearing at an International Women's Day event in Bendigo. | *Subscribe and 🔔: http://9Soci.al/KM6e50GjSK9*  *Get more breaking news at 9News.com.au: http://9Soci.al/iyCO50GjSK6*  FOLLOW 9News Australia ► Facebook: https://www.facebook.com/9News/ ► Twitter: https://twitter.com/9NewsAUS ► Instagram: https://www.instagram.com/9news/  Join 9News for the latest in news and events that affect you in your local city, as well as news from across Australia and the world.  #9News #BreakingNews #NineNewsAustralia #9NewsAU",https://www.youtube.com/watch?v=JBSPxS8ATf8,9News
2026-02-27T09:33:42+00:00,VB goes mid-strength! | 9 News Australia,"A hard-earned thirst is now mid? Mid-strength that is! | *Subscribe and 🔔: http://9Soci.al/KM6e50GjSK9*  *Get more breaking news at 9News.com.au: http://9Soci.al/iyCO50GjSK6*  FOLLOW 9News Australia ► Facebook: https://www.facebook.com/9News/ ► Twitter: https://twitter.com/9NewsAUS ► Instagram: https://www.instagram.com/9news/  Join 9News for the latest in news and events that affect you in your local city, as well as news from across Australia and the world.  #9News #BreakingNews #NineNewsAustralia #9NewsAU",https://www.youtube.com/watch?v=l0BBmSsAtp0,9News
2026-02-27T10:00:59+00:00,9News Sydney | Friday February 27 | Full Episode,"The late summer storm delivered some suburbs more rain in a few hours than they'd usually see in a month, catching many Sydneysiders off guard during peak hour. In other news, the State Police Minister is refusing to reveal how the Bondi Beach terrorist was granted a gun licence years before he unleashed carnage. | *Subscribe and 🔔: http://9Soci.al/KM6e50GjSK9*  *Get more breaking news at 9News.com.au: http://9Soci.al/iyCO50GjSK6*  FOLLOW 9News Australia ► Facebook: https://www.facebook.com/9News/ ► Twitter: https://twitter.com/9NewsAUS ► Instagram: https://www.instagram.com/9news/  Join 9News for the latest in news and events that affect you in your local city, as well as news from across Australia and the world.  #9News #BreakingNews #NineNewsAustralia #9NewsAU",https://www.youtube.com/watch?v=YfqW52S8ns4,9News
2026-02-27T10:09:21+00:00,Terror threat foiled by police | 9 News Australia,"A 20-year-old man has been charged with preparing for a terrorist act against West Australians. | *Subscribe and 🔔: http://9Soci.al/KM6e50GjSK9*  *Get more breaking news at 9News.com.au: http://9Soci.al/iyCO50GjSK6*  FOLLOW 9News Australia ► Facebook: https://www.facebook.com/9News/ ► Twitter: https://twitter.com/9NewsAUS ► Instagram: https://www.instagram.com/9news/  Join 9News for the latest in news and events that affect you in your local city, as well as news from across Australia and the world.  #9News #BreakingNews #NineNewsAustralia #9NewsAU",https://www.youtube.com/watch?v=pzttIy4Ylo8,9News
2026-02-27T10:09:41+00:00,9News Melbourne | Friday February 27 | Full Episode,"Brave bystanders have tackled an alleged drink driver who crashed into a pedestrian and a cyclist on Chapel Street and in other news, an Australian father has been been killed at a tourist hotspot in Thailand. | *Subscribe and 🔔: http://9Soci.al/KM6e50GjSK9*  *Get more breaking news at 9News.com.au: http://9Soci.al/iyCO50GjSK6*  FOLLOW 9News Australia ► Facebook: https://www.facebook.com/9News/ ► Twitter: https://twitter.com/9NewsAUS ► Instagram: https://www.instagram.com/9news/  Join 9News for the latest in news and events that affect you in your local city, as well as news from across Australia and the world.  #9News #BreakingNews #NineNewsAustralia #9NewsAU",https://www.youtube.com/watch?v=pkBlAiSGHl8,9News
2026-02-27T10:15:48+00:00,Review of AI traffic cameras | 9 News Australia,"As we head into the long weekend and double demerits, the Road Safety Commission has announced a review of its AI cameras. | *Subscribe and 🔔: http://9Soci.al/KM6e50GjSK9*  *Get more breaking news at 9News.com.au: http://9Soci.al/iyCO50GjSK6*  FOLLOW 9News Australia ► Facebook: https://www.facebook.com/9News/ ► Twitter: https://twitter.com/9NewsAUS ► Instagram: https://www.instagram.com/9news/  Join 9News for the latest in news and events that affect you in your local city, as well as news from across Australia and the world.  #9News #BreakingNews #NineNewsAustralia #9NewsAU",https://www.youtube.com/watch?v=RAeQnfVfXDQ,9News
2026-02-27T10:31:34+00:00,Wild wet weather splashes its way across Australia | 9 News Australia,"Wild, wet weather has made its way across parts of Australia, bringing flash flooding and triggering several rescues. | *Subscribe and 🔔: http://9Soci.al/KM6e50GjSK9*  *Get more breaking news at 9News.com.au: http://9Soci.al/iyCO50GjSK6*  FOLLOW 9News Australia ► Facebook: https://www.facebook.com/9News/ ► Twitter: https://twitter.com/9NewsAUS ► Instagram: https://www.instagram.com/9news/  Join 9News for the latest in news and events that affect you in your local city, as well as news from across Australia and the world.  #9News #BreakingNews #NineNewsAustralia #9NewsAU",https://www.youtube.com/watch?v=hLXMNFEOWx8,9News
2026-02-27T10:32:21+00:00,Batteries to blame for rubbish trucks catching fire | 9 News Australia,"There's a warning tonight against throwing old batteries into household bins, with a growing number of rubbish trucks catching alight. | Subscribe and 🔔: http://9Soci.al/KM6e50GjSK9 | Get more breaking news at 9News.com.au: http://9Soci.al/iyCO50GjSK6  FOLLOW 9News Australia ► Facebook: https://www.facebook.com/9News/ ► Twitter: https://twitter.com/9NewsAUS ► Instagram: https://www.instagram.com/9news/  Join 9News for the latest in news and events that affect you in your local city, as well as news from across Australia and the world.  #BREAKINGNEWS #9NEWS #AUSTRALIA",https://www.youtube.com/shorts/2oPPsfwfCFg,9News
2026-02-27T10:38:07+00:00,Rubbish trucks catching on fire from batteries | 9 News Australia,"There's a warning tonight against throwing old batteries into household bins, with a growing number of rubbish trucks catching alight. | *Subscribe and 🔔: http://9Soci.al/KM6e50GjSK9*  *Get more breaking news at 9News.com.au: http://9Soci.al/iyCO50GjSK6*  FOLLOW 9News Australia ► Facebook: https://www.facebook.com/9News/ ► Twitter: https://twitter.com/9NewsAUS ► Instagram: https://www.instagram.com/9news/  Join 9News for the latest in news and events that affect you in your local city, as well as news from across Australia and the world.  #9News #BreakingNews #NineNewsAustralia #9NewsAU",https://www.youtube.com/watch?v=LVfNCVfc-Go,9News
2026-02-27T11:00:04+00:00,9News Brisbane | Friday February 27 | Full Episode,"The parents of a little boy killed following a car crash on the Gold Coast late last year have been charged with manslaughter. In other news, Queensland's big Olympics build has begun with works commencing at the site of the Logan Indoor Sports Centre. | *Subscribe and 🔔: http://9Soci.al/KM6e50GjSK9*  *Get more breaking news at 9News.com.au: http://9Soci.al/iyCO50GjSK6*  FOLLOW 9News Australia ► Facebook: https://www.facebook.com/9News/ ► Twitter: https://twitter.com/9NewsAUS ► Instagram: https://www.instagram.com/9news/  Join 9News for the latest in news and events that affect you in your local city, as well as news from across Australia and the world.  #9News #BreakingNews #NineNewsAustralia #9NewsAU",https://www.youtube.com/watch?v=24JtxMTPBog,9News
2026-02-27T11:00:33+00:00,9News Adelaide | Friday February 27 | Full Episode,"David Speirs, once Leader of the Liberal Party, who Bowed-out amid a Drugs Disgrace, is launching a Political Comeback, and Notorious Snowtown Serial Killer, James Vlassakis, tonight remains at the centre of a Freedom Fight, which has divided SA's Legal System. | *Subscribe and 🔔: http://9Soci.al/KM6e50GjSK9*  *Get more breaking news at 9News.com.au: http://9Soci.al/iyCO50GjSK6*  FOLLOW 9News Australia ► Facebook: https://www.facebook.com/9News/ ► Twitter: https://twitter.com/9NewsAUS ► Instagram: https://www.instagram.com/9news/  Join 9News for the latest in news and events that affect you in your local city, as well as news from across Australia and the world.  #9News #BreakingNews #NineNewsAustralia #9NewsAU",https://www.youtube.com/watch?v=HeWTv-tmSoQ,9News
