published,title,description,link,Pub
2026-01-19T08:48:06+00:00,Police officer thrown off horse after being struck by motorbike | 9 News Australia,"Two police horses and an officer have been injured after they were struck by a motorbike in Surfers Paradise on Saturday night. | *Subscribe and 🔔: http://9Soci.al/KM6e50GjSK9*  *Get more breaking news at 9News.com.au: http://9Soci.al/iyCO50GjSK6*  FOLLOW 9News Australia ► Facebook: https://www.facebook.com/9News/ ► Twitter: https://twitter.com/9NewsAUS ► Instagram: https://www.instagram.com/9news/  Join 9News for the latest in news and events that affect you in your local city, as well as news from across Australia and the world.  #9News #BreakingNews #NineNewsAustralia #9NewsAU",https://www.youtube.com/watch?v=kmg0ILWnYjA,9News
2026-01-19T08:48:26+00:00,Saying goodbye to the V-set trains | 9 News Australia,"After more than five decades on our tracks, the V-set ""steel rattlers"" are retiring next week, and after one last makeover, looking as good as new. | *Subscribe and 🔔: http://9Soci.al/KM6e50GjSK9*  *Get more breaking news at 9News.com.au: http://9Soci.al/iyCO50GjSK6*  FOLLOW 9News Australia ► Facebook: https://www.facebook.com/9News/ ► Twitter: https://twitter.com/9NewsAUS ► Instagram: https://www.instagram.com/9news/  Join 9News for the latest in news and events that affect you in your local city, as well as news from across Australia and the world.  #9News #BreakingNews #NineNewsAustralia #9NewsAU",https://www.youtube.com/watch?v=2Dz_An7Gx-s,9News
2026-01-19T08:54:11+00:00,50 degree heatwave inbound? | 9 News Australia,"Could WA be set for a 50 degree heatwave this week?  Weather Presenter Natalia Cooper talks us through the possibility. | Subscribe and 🔔: http://9Soci.al/KM6e50GjSK9 | Get more breaking news at 9News.com.au: http://9Soci.al/iyCO50GjSK6  FOLLOW 9News Australia ► Facebook: https://www.facebook.com/9News/ ► Twitter: https://twitter.com/9NewsAUS ► Instagram: https://www.instagram.com/9news/  Join 9News for the latest in news and events that affect you in your local city, as well as news from across Australia and the world.  #BREAKINGNEWS #9NEWS #AUSTRALIA",https://www.youtube.com/shorts/WK9f0xT9Wp0,9News
2026-01-19T08:57:22+00:00,Gunman on the run after house shooting | 9 News Australia,"Two people have been hospitalised after a suspected targeted shooting in Adelaide. | *Subscribe and 🔔: http://9Soci.al/KM6e50GjSK9*  *Get more breaking news at 9News.com.au: http://9Soci.al/iyCO50GjSK6*  FOLLOW 9News Australia ► Facebook: https://www.facebook.com/9News/ ► Twitter: https://twitter.com/9NewsAUS ► Instagram: https://www.instagram.com/9news/  Join 9News for the latest in news and events that affect you in your local city, as well as news from across Australia and the world.  #9News #BreakingNews #NineNewsAustralia #9NewsAU",https://www.youtube.com/watch?v=hcsWT5kDmuU,9News
2026-01-19T09:01:50+00:00,Multiple structures lost in Tooperang bushfire | 9 News Australia,"A bushfire that has ripped through more than 600 hectares south of Adelaide. | *Subscribe and 🔔: http://9Soci.al/KM6e50GjSK9*  *Get more breaking news at 9News.com.au: http://9Soci.al/iyCO50GjSK6*  FOLLOW 9News Australia ► Facebook: https://www.facebook.com/9News/ ► Twitter: https://twitter.com/9NewsAUS ► Instagram: https://www.instagram.com/9news/  Join 9News for the latest in news and events that affect you in your local city, as well as news from across Australia and the world.  #9News #BreakingNews #NineNewsAustralia #9NewsAU",https://www.youtube.com/watch?v=P8DlcVfZpAE,9News
2026-01-19T09:26:12+00:00,Trump’s new ‘Board of Peace’ proposal | 9 News Australia,"Donald Trump wants to form his own United Nations, and charge world leaders $1.5 billion to join.  | *Subscribe and 🔔: http://9Soci.al/KM6e50GjSK9*  *Get more breaking news at 9News.com.au: http://9Soci.al/iyCO50GjSK6*  FOLLOW 9News Australia ► Facebook: https://www.facebook.com/9News/ ► Twitter: https://twitter.com/9NewsAUS ► Instagram: https://www.instagram.com/9news/  Join 9News for the latest in news and events that affect you in your local city, as well as news from across Australia and the world.  #9News #BreakingNews #NineNewsAustralia #9NewsAU",https://www.youtube.com/watch?v=hRzuD_q37Ro,9News
2026-01-19T09:36:06+00:00,European leaders stand firm over Greenland dispute with Trump | 9 News Australia,"Danish Prime Minister Mette Frederiksen says ""Europe will not be blackmailed"" as the continent's leaders pushed back against Donald Trump's Greenland tariffs. | *Subscribe and 🔔: http://9Soci.al/KM6e50GjSK9*  *Get more breaking news at 9News.com.au: http://9Soci.al/iyCO50GjSK6*  FOLLOW 9News Australia ► Facebook: https://www.facebook.com/9News/ ► Twitter: https://twitter.com/9NewsAUS ► Instagram: https://www.instagram.com/9news/  Join 9News for the latest in news and events that affect you in your local city, as well as news from across Australia and the world.  #9News #BreakingNews #NineNewsAustralia #9NewsAU",https://www.youtube.com/watch?v=_od-ye08iKM,9News
2026-01-19T09:41:27+00:00,First Aussie athletes bound to Olympic Winter games | 9 News Australia,"18 days to The Winter Olympics, and the Australian team is taking shape. | *Subscribe and 🔔: http://9Soci.al/KM6e50GjSK9*  *Get more breaking news at 9News.com.au: http://9Soci.al/iyCO50GjSK6*  FOLLOW 9News Australia ► Facebook: https://www.facebook.com/9News/ ► Twitter: https://twitter.com/9NewsAUS ► Instagram: https://www.instagram.com/9news/  Join 9News for the latest in news and events that affect you in your local city, as well as news from across Australia and the world.  #9News #BreakingNews #NineNewsAustralia #9NewsAU",https://www.youtube.com/watch?v=YhFp7wBeflI,9News
2026-01-19T10:16:45+00:00,Third shark attack in Sydney in two days | 9 News Australia,"There's been a third shark attack in Sydney, the third in two days. The surfer in his 20's was attacked at Manly Beach and pulled from the water unconscious. | *Subscribe and 🔔: http://9Soci.al/KM6e50GjSK9*  *Get more breaking news at 9News.com.au: http://9Soci.al/iyCO50GjSK6*  FOLLOW 9News Australia ► Facebook: https://www.facebook.com/9News/ ► Twitter: https://twitter.com/9NewsAUS ► Instagram: https://www.instagram.com/9news/  Join 9News for the latest in news and events that affect you in your local city, as well as news from across Australia and the world.  #9News #BreakingNews #NineNewsAustralia #9NewsAU",https://www.youtube.com/watch?v=rX9hLO7UqL0,9News
2026-01-19T10:31:38+00:00,Teenage boy dies after car crash in Perth's south | 9 News Australia,"A fiery crash in Mandurah has claimed the life of a teenage boy, with his 18-year-old sister behind the wheel. Their sedan collided with another vehicle south of Perth, bursting into flames. | *Subscribe and 🔔: http://9Soci.al/KM6e50GjSK9*  *Get more breaking news at 9News.com.au: http://9Soci.al/iyCO50GjSK6*  FOLLOW 9News Australia ► Facebook: https://www.facebook.com/9News/ ► Twitter: https://twitter.com/9NewsAUS ► Instagram: https://www.instagram.com/9news/  Join 9News for the latest in news and events that affect you in your local city, as well as news from across Australia and the world.  #9News #BreakingNews #NineNewsAustralia #9NewsAU",https://www.youtube.com/watch?v=I9LProdMDHg,9News
2026-01-19T10:57:18+00:00,9News Sydney | Monday January 19 | Full Episode,"Sydney is on high alert after two separate shark encounters within 24 hours. And in Canberra, Federal Parliament held a solemn emergency session to honour the victims of the December 14 Bondi terror attack. | *Subscribe and 🔔: http://9Soci.al/KM6e50GjSK9*  CHAPTERS  00:00 - 00:46 | News Headlines 00:46 - 02:17 | Harbour Shark Attack 02:17 - 03:06 | Bull shark activity 03:06 - 04:00 | A look back at previous attacks in Sydney Harbour 04:00 - 04:56 | Sydney Children's Hospital 04:56 - 05:56 | Dee Why Shark Encounte 05:56 - 07:19 | Bondi Tributes 07:19 - 08:12 | Political Debate 08:12 - 08:45 | Hate Speech Laws 08:45 - 09:13 | Terror Investigation 09:13 - 10:56 | K'gari Dingo Mystery 10:56 - 12:30 | Spain Train Horror 12:30 - 15:08 | New Sydney Fish Market 15:08 - 17:21 | Australian Open Action 17:21 - 18:07 | Sydney Weather 18:07 | More News  *Get more breaking news at 9News.com.au: http://9Soci.al/iyCO50GjSK6*  FOLLOW 9News Australia ► Facebook: https://www.facebook.com/9News/ ► Twitter: https://twitter.com/9NewsAUS ► Instagram: https://www.instagram.com/9news/  Join 9News for the latest in news and events that affect you in your local city, as well as news from across Australia and the world.  #9News #BreakingNews #NineNewsAustralia #9NewsAU",https://www.youtube.com/watch?v=KZioxx3GR_Y,9News
2026-01-19T11:03:14+00:00,Perth's first film studio open for business | 9 News Australia,"Malaga's new movie studios ready to roll, but no Hollywood productions have been booked just yet. The Cook government confident though, promising an announcement within months. | *Subscribe and 🔔: http://9Soci.al/KM6e50GjSK9*  *Get more breaking news at 9News.com.au: http://9Soci.al/iyCO50GjSK6*  FOLLOW 9News Australia ► Facebook: https://www.facebook.com/9News/ ► Twitter: https://twitter.com/9NewsAUS ► Instagram: https://www.instagram.com/9news/  Join 9News for the latest in news and events that affect you in your local city, as well as news from across Australia and the world.  #9News #BreakingNews #NineNewsAustralia #9NewsAU",https://www.youtube.com/watch?v=xltRHxw28vw,9News
2026-01-19T11:11:10+00:00,9News Adelaide | Monday January 19 | Full Episode,"This bulletin's coverage includes the Tooperang bushfires, the Huntfield Heights shooting investigation, and the tragic passing of Tim Picton. Plus, AFL injury news and the latest from the Australian Open. | *Subscribe and 🔔: http://9Soci.al/KM6e50GjSK9*  *Get more breaking news at 9News.com.au: http://9Soci.al/iyCO50GjSK6*  CHAPTERS  0:00 News Headlines 0:36 Bushfire Devastation 3:31 Huntfield Heights 4:11 Police search for suspect 4:56 Tim Picton 5:38 Fatal Northbridge assault  6:47 Crows Injury 8:04 Croydon Park Fire 9:59 Parliament Recalled 11:04 Emotional tributes 12:13 National Security 12:46 NSW Police to Philippines 13:13 Spain Train Disaster 14:46 Australian Open 16:16 Aussie Wrap 17:00 Sports Preview 17:32 More News  FOLLOW 9News Australia ► Facebook: https://www.facebook.com/9News/ ► Twitter: https://twitter.com/9NewsAUS ► Instagram: https://www.instagram.com/9news/  Join 9News for the latest in news and events that affect you in your local city, as well as news from across Australia and the world.  #9News #BreakingNews #NineNewsAustralia #9NewsAU",https://www.youtube.com/watch?v=gop8b4k81Uk,9News
2026-01-19T11:15:05+00:00,9News Melbourne | Monday January 19 | Full Episode,"Alicia Loxley and Tom Steinfort present the Melbourne news. The father of brave cancer fighter Tyler Fishlock has been rushed to hospital after he was mauled by a fox at their Romsey home. In other news, three men have been charged with the murder of a Fitzroy teenager, who was gunned down in a drive-by shooting. In breaking news, a truck driver has serious injuries after a terrifying run in with another truck on the Monash Freeway. | *Subscribe and 🔔: http://9Soci.al/KM6e50GjSK9*  *Get more breaking news at 9News.com.au: http://9Soci.al/iyCO50GjSK6*  FOLLOW 9News Australia ► Facebook: https://www.facebook.com/9News/ ► Twitter: https://twitter.com/9NewsAUS ► Instagram: https://www.instagram.com/9news/  Join 9News for the latest in news and events that affect you in your local city, as well as news from across Australia and the world.  #9News #BreakingNews #NineNewsAustralia #9NewsAU",https://www.youtube.com/watch?v=reOc0ez4Q9Y,9News
2026-01-19T12:15:03+00:00,9News Brisbane | Monday January 19 | Full Episode,"Joel Dry presents the Queensland news. A young woman has been found dead on K'gari, washed up and surrounded by dingoes. Police are working to determine her cause of death. In other news, police have released body worn vision showing the moment a motorcycle rider accelerates straight into an officer on horseback, throwing the senior constable onto the ground. | *Subscribe and 🔔: http://9Soci.al/KM6e50GjSK9*  *Get more breaking news at 9News.com.au: http://9Soci.al/iyCO50GjSK6*  FOLLOW 9News Australia ► Facebook: https://www.facebook.com/9News/ ► Twitter: https://twitter.com/9NewsAUS ► Instagram: https://www.instagram.com/9news/  Join 9News for the latest in news and events that affect you in your local city, as well as news from across Australia and the world.  #9News #BreakingNews #NineNewsAustralia #9NewsAU",https://www.youtube.com/watch?v=LD6cbVUbbZ0,9News
