published,title,description,link,Pub
2026-01-07T08:39:19+00:00,State MP on home detention bail granted freedoms | 9 News Australia,"State MP Nick McBride has been granted freedoms on his home detention bail, now allowed to travel as often as he needs for his campaign.  | Subscribe and 🔔: http://9Soci.al/KM6e50GjSK9 | Get more breaking news at 9News.com.au: http://9Soci.al/iyCO50GjSK6  FOLLOW 9News Australia ► Facebook: https://www.facebook.com/9News/ ► Twitter: https://twitter.com/9NewsAUS ► Instagram: https://www.instagram.com/9news/  Join 9News for the latest in news and events that affect you in your local city, as well as news from across Australia and the world.  #BREAKINGNEWS #9NEWS #AUSTRALIA",https://www.youtube.com/shorts/u8xsHRH55-g,9News
2026-01-07T08:41:00+00:00,Woman in critical condition after house fire | 9 News Australia,"The police's arson and explosives squad is investigating a house fire that tore through a Melton South home, putting the disabled inhabitant in hospital. | *Subscribe and 🔔: http://9Soci.al/KM6e50GjSK9*  *Get more breaking news at 9News.com.au: http://9Soci.al/iyCO50GjSK6*  FOLLOW 9News Australia ► Facebook: https://www.facebook.com/9News/ ► Twitter: https://twitter.com/9NewsAUS ► Instagram: https://www.instagram.com/9news/  Join 9News for the latest in news and events that affect you in your local city, as well as news from across Australia and the world.  #9News #BreakingNews #NineNewsAustralia #9NewsAU",https://www.youtube.com/watch?v=eurjZNcHm9o,9News
2026-01-07T08:41:43+00:00,South Australia swelters | 9 News Australia,"South Australians are desperately trying to escape the heat as temperatures reach 46 degrees in parts of the state. | Subscribe and 🔔: http://9Soci.al/KM6e50GjSK9 | Get more breaking news at 9News.com.au: http://9Soci.al/iyCO50GjSK6  FOLLOW 9News Australia ► Facebook: https://www.facebook.com/9News/ ► Twitter: https://twitter.com/9NewsAUS ► Instagram: https://www.instagram.com/9news/  Join 9News for the latest in news and events that affect you in your local city, as well as news from across Australia and the world.  #BREAKINGNEWS #9NEWS #AUSTRALIA",https://www.youtube.com/shorts/Zlr2XzegAic,9News
2026-01-07T08:42:13+00:00,Five years on from U.S. Capitol attack | 9 News Australia,"Five years on from the attack on Capitol Hill, the White House has updated portrayals of those involved in a more favourable light. | Subscribe and 🔔: http://9Soci.al/KM6e50GjSK9 | Get more breaking news at 9News.com.au: http://9Soci.al/iyCO50GjSK6  FOLLOW 9News Australia ► Facebook: https://www.facebook.com/9News/ ► Twitter: https://twitter.com/9NewsAUS ► Instagram: https://www.instagram.com/9news/  Join 9News for the latest in news and events that affect you in your local city, as well as news from across Australia and the world.  #BREAKINGNEWS #9NEWS #AUSTRALIA",https://www.youtube.com/shorts/ANqWiqP-_Og,9News
2026-01-07T08:48:18+00:00,Aussies living with debilitating diseases will now benefit from PBS | 9 News Australia,"Australians living with a range of debilitating diseases have been given a lifeline, with expensive drugs just added to the Pharmaceutical Benefits Scheme. | *Subscribe and 🔔: http://9Soci.al/KM6e50GjSK9*  *Get more breaking news at 9News.com.au: http://9Soci.al/iyCO50GjSK6*  FOLLOW 9News Australia ► Facebook: https://www.facebook.com/9News/ ► Twitter: https://twitter.com/9NewsAUS ► Instagram: https://www.instagram.com/9news/  Join 9News for the latest in news and events that affect you in your local city, as well as news from across Australia and the world.  #9News #BreakingNews #NineNewsAustralia #9NewsAU",https://www.youtube.com/watch?v=kU5MH6d82cY,9News
2026-01-07T08:50:26+00:00,Tribute concert comes down under | 9 News Australia,"Some of the biggest names in music are back on stage in the tribute show ""Legends in Concert"". | *Subscribe and 🔔: http://9Soci.al/KM6e50GjSK9*  *Get more breaking news at 9News.com.au: http://9Soci.al/iyCO50GjSK6*  FOLLOW 9News Australia ► Facebook: https://www.facebook.com/9News/ ► Twitter: https://twitter.com/9NewsAUS ► Instagram: https://www.instagram.com/9news/  Join 9News for the latest in news and events that affect you in your local city, as well as news from across Australia and the world.  #9News #BreakingNews #NineNewsAustralia #9NewsAU",https://www.youtube.com/watch?v=6B5kMJcRmKw,9News
2026-01-07T09:00:07+00:00,Heat wave hits the southern states,"Firefighters are tackling blazes across Victoria and South Australia, as the temperature surges past 40 degrees. | *Subscribe and 🔔: http://9Soci.al/KM6e50GjSK9*  *Get more breaking news at 9News.com.au: http://9Soci.al/iyCO50GjSK6*  FOLLOW 9News Australia ► Facebook: https://www.facebook.com/9News/ ► Twitter: https://twitter.com/9NewsAUS ► Instagram: https://www.instagram.com/9news/  Join 9News for the latest in news and events that affect you in your local city, as well as news from across Australia and the world.  #9News #BreakingNews #NineNewsAustralia #9NewsAU",https://www.youtube.com/watch?v=EJOJTEL33mo,9News
2026-01-07T09:08:30+00:00,MP daring to contest election whilst on home detention bail | 9 News Australia,"Nick McBride has been granted some freedoms and allowed to travel as often as he needs for his campaign. | *Subscribe and 🔔: http://9Soci.al/KM6e50GjSK9*  *Get more breaking news at 9News.com.au: http://9Soci.al/iyCO50GjSK6*  FOLLOW 9News Australia ► Facebook: https://www.facebook.com/9News/ ► Twitter: https://twitter.com/9NewsAUS ► Instagram: https://www.instagram.com/9news/  Join 9News for the latest in news and events that affect you in your local city, as well as news from across Australia and the world.  #9News #BreakingNews #NineNewsAustralia #9NewsAU",https://www.youtube.com/watch?v=cx5JmcTd0ok,9News
2026-01-07T09:15:12+00:00,Family held at knife point in home invasion | 9 News Australia,"A Windsor Gardens family has told of the frightening moment two People broke through their front window in the middle of the night. | *Subscribe and 🔔: http://9Soci.al/KM6e50GjSK9*  *Get more breaking news at 9News.com.au: http://9Soci.al/iyCO50GjSK6*  FOLLOW 9News Australia ► Facebook: https://www.facebook.com/9News/ ► Twitter: https://twitter.com/9NewsAUS ► Instagram: https://www.instagram.com/9news/  Join 9News for the latest in news and events that affect you in your local city, as well as news from across Australia and the world.  #9News #BreakingNews #NineNewsAustralia #9NewsAU",https://www.youtube.com/watch?v=KF2q8EQxN1Y,9News
2026-01-07T09:23:41+00:00,Why does Trump want Greenland? | 9 News Australia,"After the U.S. military operation to remove Nicolas Maduro in Venezuela, Donald Trump is now considering other options, including a U.S. takeover of Greenland. | Subscribe and 🔔: http://9Soci.al/KM6e50GjSK9 | Get more breaking news at 9News.com.au: http://9Soci.al/iyCO50GjSK6  FOLLOW 9News Australia ► Facebook: https://www.facebook.com/9News/ ► Twitter: https://twitter.com/9NewsAUS ► Instagram: https://www.instagram.com/9news/  Join 9News for the latest in news and events that affect you in your local city, as well as news from across Australia and the world.  #BREAKINGNEWS #9NEWS #AUSTRALIA",https://www.youtube.com/shorts/D3oQrfdc0WE,9News
2026-01-07T11:00:03+00:00,9News Sydney | Wednesday January 7 | Full Episode,"Georgie Gardner leads the bulletin with the emotional final farewell to Peter Meagher, a retired detective and victim of the Bondi terror attack, where a powerful call for gun reform took center stage. In world news, Donald Trump’s foreign policy shift toward Greenland has caused a major rift within NATO, while locally, Sydney residents are warned to prepare for a dangerous record-breaking heatwave reaching 43°C. Additional coverage includes the dismantling of a multi-million dollar international car theft syndicate in Brisbane, the sentencing of an NDIS worker following a fatal group home fire, and breaking entertainment news as Nicole Kidman and Keith Urban finalize their divorce.  CHAPTERS:  00:00 - Headlines and Introduction  00:34 - Bondi Attack Victim Peter Meagher Laid to Rest 03:11 - Calls for Royal Commission into National Security  05:40 - Trump Eyes Greenland: New US Foreign Policy Rift  10:02 - Mount Druitt Airbnb Party Stabbing Investigation  12:04 - Manslaughter Charge Over Fatal Carramar House Fire  12:21 - Mass Casualty Crash North of Wollongong  12:43 - Sydney Weather: Extreme Heatwave & Fire Warning  14:17 - Fatal Flash Flooding in Northern Indonesia  14:37 - 5-Year Anniversary of January 6 US Capitol Riots  15:02 - Europe Whiteout: Snow Chaos and Flight Cancellations  16:34 - Major International Toyota Theft Syndicate Busted  19:27 - LinkedIn 2026: AI Engineers Top Fastest Growing Jobs  20:54 - Nicole Kidman and Keith Urban Finalise Divorce  | *Subscribe and 🔔: http://9Soci.al/KM6e50GjSK9*  *Get more breaking news at 9News.com.au: http://9Soci.al/iyCO50GjSK6*  FOLLOW 9News Australia ► Facebook: https://www.facebook.com/9News/ ► Twitter: https://twitter.com/9NewsAUS ► Instagram: https://www.instagram.com/9news/  Join 9News for the latest in news and events that affect you in your local city, as well as news from across Australia and the world.  #9News #BreakingNews #NineNewsAustralia #9NewsAU",https://www.youtube.com/watch?v=0jE_-TEJxDI,9News
2026-01-07T11:00:15+00:00,9News Melbourne | Wednesday January 7 | Full Episode,"In major local news, a technical fault shut down the new West Gate Tunnel, and former socialite Brynne Edelsten faces court over serious drug trafficking allegations. Internationally, we look at the growing tension between Donald Trump and European leaders over his pursuit of Greenland, and the latest security developments for Ukraine from the summit in Paris. Finally, we pay tribute to Peter Meagher, the final victim of the Bondi attack to be laid to rest, featuring a powerful plea for national gun reform.   CHAPTERS:  00:00 Victoria Bushfire Crisis: Blazes Rage Near Seymour  01:32 Friday Fire Warning: Catastrophic Conditions Forecast  01:47 Melbourne Heatwave: Temperatures Surge Past 40°C  03:22 West Gate Tunnel Shut: Heat Triggers Sprinkler Fault  06:02 Crime: Tourist Charged Over New Year’s Day Sexual Assault  06:29 Brynne Edelsten Charged: Socialite’s Major Drug Trafficking Charges  08:24 Trump’s Greenland Pursuit: European Leaders Slam US Ambitions  11:38 Paris Summit: Security Guarantees for Ukraine  12:47 Rap Video Boasts: Police Probe Clips Mocking Teen’s Murder  13:14 Farewell to Peter Meagher: Bondi Victim’s Funeral & Gun Reform Plea  17:22 Beyond the Valley Festival: Security Guards Charged with Trafficking  17:41 Eastern Freeway Closure: Section Shut for Major Upgrades  18:00 Melton South Fire: Woman in Critical Condition After House Blaze  19:51 Phuket Pier Fire: Millions in Damage as Speedboats Engulfed  20:05 Europe Snow Chaos: Travel Disruptions Across the Continent  | *Subscribe and 🔔: http://9Soci.al/KM6e50GjSK9*  *Get more breaking news at 9News.com.au: http://9Soci.al/iyCO50GjSK6*  FOLLOW 9News Australia ► Facebook: https://www.facebook.com/9News/ ► Twitter: https://twitter.com/9NewsAUS ► Instagram: https://www.instagram.com/9news/  Join 9News for the latest in news and events that affect you in your local city, as well as news from across Australia and the world.  #9News #BreakingNews #NineNewsAustralia #9NewsAU",https://www.youtube.com/watch?v=9-jwIU0glyY,9News
2026-01-07T11:01:22+00:00,9News Adelaide | Wednesday January 7 | Full Episode,"In crime and politics, a Windsor Gardens family shares their terrifying experience of a knifepoint home invasion, and independent MP Nick McBride is granted new freedoms while on home detention bail. We also provide updates on an international car theft syndicate bust, the latest AI job market trends for 2026, and a touching farewell to Bondi attack victim Peter Meagher. | *Subscribe and 🔔: http://9Soci.al/KM6e50GjSK9*  CHAPTERS:  0:00 9News Adelaide Intro  0:06 Heatwave Crisis: Adelaide Hits 43 Degrees  2:34 Windsor Gardens Family Held at Knifepoint  4:24 Arson Attack on Malvern Car Wash  4:59 MP Nick McBride Granted Election Campaign Freedoms  7:00 Freight Train Derailment Blocks Major Route  7:22 Donald Trump Sets Sights on Greenland  11:54 Farewell to Bondi Attack Victim Peter Marr  13:52 Property Update: Adelaide Rental Growth Slows  14:26 Job Market 2026: AI Engineers in High Demand  15:36 $9 Million International Car Theft Syndicate Busted  18:08 Brynne Edelston Released on Bail for Drug Charges  *Get more breaking news at 9News.com.au: http://9Soci.al/iyCO50GjSK6*  FOLLOW 9News Australia ► Facebook: https://www.facebook.com/9News/ ► Twitter: https://twitter.com/9NewsAUS ► Instagram: https://www.instagram.com/9news/  Join 9News for the latest in news and events that affect you in your local city, as well as news from across Australia and the world.  #9News #BreakingNews #NineNewsAustralia #9NewsAU",https://www.youtube.com/watch?v=gnArHImoYyg,9News
2026-01-07T12:01:36+00:00,9News Brisbane | Wednesday January 7 | Full Episode,"In tonight's Queensand bulletin, a courageous shop owner defends his livelihood against armed intruders, police shut down a sophisticated global car theft operation, and geopolitical tensions rise as Donald Trump eyes Greenland. We also cover the emotional farewell to a Bondi hero and the growing pressure for a national Royal Commission.  CHAPTERS:  0:00 9News Brisbane Opening  0:23 Cancer survivor fights off armed intruders with a machete  2:02 Police dismantle global luxury car theft syndicate  4:39 Donald Trump targets Greenland as next US acquisition  8:02 US and EU leaders form united front in Paris summit  9:13 Bondi attack victim Peter Meagher laid to rest  11:18 Calls intensify for Bondi attack Royal Commission  13:10 Bondi survivor Leibel Lazaroff speaks from hospital  13:49 Outback Queensland flood emergency updates  14:15 Tropical low develops off the Queensland coast  15:13 Socialite Brynne Edelsten faces drug trafficking charges  18:25 Life-changing medical treatments become more affordable  | *Subscribe and 🔔: http://9Soci.al/KM6e50GjSK9*  *Get more breaking news at 9News.com.au: http://9Soci.al/iyCO50GjSK6*  FOLLOW 9News Australia ► Facebook: https://www.facebook.com/9News/ ► Twitter: https://twitter.com/9NewsAUS ► Instagram: https://www.instagram.com/9news/  Join 9News for the latest in news and events that affect you in your local city, as well as news from across Australia and the world.  #9News #BreakingNews #NineNewsAustralia #9NewsAU",https://www.youtube.com/watch?v=jFZi_eQ4P70,9News
2026-01-07T18:51:30+00:00,Weather alerts for south-east; Bondi victims' families travelling to Canberra | 9 News Australia,"Emergency fire warnings and weather alerts are in place across Victoria as an extreme heatwave grips the region and moves north towards Sydney. Meanwhile, families of the victims of the Bondi terror attack are travelling to Canberra to push for a national inquiry. | *Subscribe and 🔔: http://9Soci.al/KM6e50GjSK9*  *Get more breaking news at 9News.com.au: http://9Soci.al/iyCO50GjSK6*  FOLLOW 9News Australia ► Facebook: https://www.facebook.com/9News/ ► Twitter: https://twitter.com/9NewsAUS ► Instagram: https://www.instagram.com/9news/  Join 9News for the latest in news and events that affect you in your local city, as well as news from across Australia and the world.  #9News #BreakingNews #NineNewsAustralia #9NewsAU",https://www.youtube.com/watch?v=oXwNzp8GF0c,9News
