published,title,description,link,Pub
2026-03-01T07:59:21+00:00,Iran Supreme Leader's rise to power | 9 News Australia,"The death of Iran's Supreme Leader has been met with mixed reactions around the world, including jubilant celebrations in the street and fears of a wide-scale war. #9News",https://www.youtube.com/shorts/vSm6wcqJd9k,9News
2026-03-01T08:06:25+00:00,Fuel up now: Fears Middle East conflict could drive up global oil price | 9 News Australia,"Australian motorists are being told to fuel up now, amid fears the escalating tensions in the Middle East could drive up the global price of crude oil. #9News",https://www.youtube.com/shorts/b_O_JCsyQAI,9News
2026-03-01T08:10:23+00:00,"Who was Ayatollah Ali Khamenei, Iran's Supreme Leader? | 9 News Australia","Iran's Supreme Leader, Ayatollah Ali Khamenei is dead, killed in his office after an extraordinary attack by Israel and the United States. His death marks the end of a brutal almost four-decade rule. | *Subscribe and 🔔: http://9Soci.al/KM6e50GjSK9*  *Get more breaking news at 9News.com.au: http://9Soci.al/iyCO50GjSK6*  FOLLOW 9News Australia ► Facebook: https://www.facebook.com/9News/ ► Twitter: https://twitter.com/9NewsAUS ► Instagram: https://www.instagram.com/9news/  Join 9News for the latest in news and events that affect you in your local city, as well as news from across Australia and the world.  #9News #BreakingNews #NineNewsAustralia #9NewsAU",https://www.youtube.com/watch?v=vAPC59Rrpy0,9News
2026-03-01T08:12:47+00:00,Fears global oil prices will skyrocket following attack on Iran | 9 News Australia,"A crucial supply route has been cut off by the Middle East conflict as Iran warns ships to stay away from the Strait of Hormuz. | *Subscribe and 🔔: http://9Soci.al/KM6e50GjSK9*  *Get more breaking news at 9News.com.au: http://9Soci.al/iyCO50GjSK6*  FOLLOW 9News Australia ► Facebook: https://www.facebook.com/9News/ ► Twitter: https://twitter.com/9NewsAUS ► Instagram: https://www.instagram.com/9news/  Join 9News for the latest in news and events that affect you in your local city, as well as news from across Australia and the world.  #9News #BreakingNews #NineNewsAustralia #9NewsAU",https://www.youtube.com/watch?v=5D054BWv08w,9News
2026-03-01T08:17:33+00:00,FULL COVERAGE: Middle East on the brink | 9 News Australia,"War has broken out in the Middle East, after Iran's Supreme Leader Ayatollah Ali Khamenei was killed in a joint attack by the U.S. and Israel. | *Subscribe and 🔔: http://9Soci.al/KM6e50GjSK9*  *Get more breaking news at 9News.com.au: http://9Soci.al/iyCO50GjSK6*  FOLLOW 9News Australia ► Facebook: https://www.facebook.com/9News/ ► Twitter: https://twitter.com/9NewsAUS ► Instagram: https://www.instagram.com/9news/  Join 9News for the latest in news and events that affect you in your local city, as well as news from across Australia and the world.  #9News #BreakingNews #NineNewsAustralia #9NewsAU",https://www.youtube.com/watch?v=K9Vrt1huTLk,9News
2026-03-01T09:07:54+00:00,"Clean-up begins after 250,000 people turn out for Sydney Mardi Gras parade | 9 News Australia","A major glitter cleanup is underway in Sydney, following the 48th annual Sydney Gay and lesbian Mardi Gras parade. | *Subscribe and 🔔: http://9Soci.al/KM6e50GjSK9*  *Get more breaking news at 9News.com.au: http://9Soci.al/iyCO50GjSK6*  FOLLOW 9News Australia ► Facebook: https://www.facebook.com/9News/ ► Twitter: https://twitter.com/9NewsAUS ► Instagram: https://www.instagram.com/9news/  Join 9News for the latest in news and events that affect you in your local city, as well as news from across Australia and the world.  #9News #BreakingNews #NineNewsAustralia #9NewsAU",https://www.youtube.com/watch?v=Qi_WhP9f9Xg,9News
2026-03-01T09:09:56+00:00,Bulldogs fans steal the show at NRL opening round in Las Vegas | 9 News Australia,"Dragons, Cowboys, and Knights fans have flocked to Las Vegas to kick off the 2026 season, but were out-numbered by the blue and white army of the Bulldogs. | *Subscribe and 🔔: http://9Soci.al/KM6e50GjSK9*  *Get more breaking news at 9News.com.au: http://9Soci.al/iyCO50GjSK6*  FOLLOW 9News Australia ► Facebook: https://www.facebook.com/9News/ ► Twitter: https://twitter.com/9NewsAUS ► Instagram: https://www.instagram.com/9news/  Join 9News for the latest in news and events that affect you in your local city, as well as news from across Australia and the world.  #9News #BreakingNews #NineNewsAustralia #9NewsAU",https://www.youtube.com/watch?v=AGdY2XUtOPM,9News
2026-03-01T09:15:16+00:00,"""Accident"": John Howard's scathing review of Pauline Hanson | 9 News Australia","30 years ago, John Howard shattered the Liberal Party's power drought to become Australia's 26th Prime Minister. Angus Taylor hopes to engineer a similar resurrection, despite One Nation's surge in popularity. | *Subscribe and 🔔: http://9Soci.al/KM6e50GjSK9*  *Get more breaking news at 9News.com.au: http://9Soci.al/iyCO50GjSK6*  FOLLOW 9News Australia ► Facebook: https://www.facebook.com/9News/ ► Twitter: https://twitter.com/9NewsAUS ► Instagram: https://www.instagram.com/9news/  Join 9News for the latest in news and events that affect you in your local city, as well as news from across Australia and the world.  #9News #BreakingNews #NineNewsAustralia #9NewsAU",https://www.youtube.com/watch?v=vGOzkHZ9gOU,9News
2026-03-01T09:23:19+00:00,Melbourne Grand Prix in question as F1 staffers rush to flee Middle East | 9 News Australia,"F1 is racing the clock to get out of Bahrain after strikes where launched into the country. | *Subscribe and 🔔: http://9Soci.al/KM6e50GjSK9*  *Get more breaking news at 9News.com.au: http://9Soci.al/iyCO50GjSK6*  FOLLOW 9News Australia ► Facebook: https://www.facebook.com/9News/ ► Twitter: https://twitter.com/9NewsAUS ► Instagram: https://www.instagram.com/9news/  Join 9News for the latest in news and events that affect you in your local city, as well as news from across Australia and the world.  #9News #BreakingNews #NineNewsAustralia #9NewsAU",https://www.youtube.com/watch?v=uh5DKac3llE,9News
2026-03-01T09:26:06+00:00,Police presence and patrol to continue at shopping centres | 9 News Australia,"Police and PSOs will continue patrolling suburban shopping centres in a bid to combat violence and retail crime. | *Subscribe and 🔔: http://9Soci.al/KM6e50GjSK9*  *Get more breaking news at 9News.com.au: http://9Soci.al/iyCO50GjSK6*  FOLLOW 9News Australia ► Facebook: https://www.facebook.com/9News/ ► Twitter: https://twitter.com/9NewsAUS ► Instagram: https://www.instagram.com/9news/  Join 9News for the latest in news and events that affect you in your local city, as well as news from across Australia and the world.  #9News #BreakingNews #NineNewsAustralia #9NewsAU",https://www.youtube.com/watch?v=1skz-lzHkZQ,9News
2026-03-01T09:52:29+00:00,What is it like in Dubai right now? | 9 News Australia,"""We're all in shock.""  Residents are fearing for their safety as Iran launches retaliatory strikes into Dubai. #9News",https://www.youtube.com/shorts/qHHVKNnAxE0,9News
2026-03-01T11:00:18+00:00,9News Sydney | Sunday March 1 | Full Episode,"Peter Overton leads the bulletin with the death of Iran's Supreme Leader Ayatollah Ali Khamenei, who was killed in his office after an extraordinary joint attack by Israel and the United States. Meanwhile in Australia, thousands of people celebrate the demise of Iran's Supreme Leader in Sydney's Hyde Park. In other news, faithful fans flock to Vegas to kick off the 2026 NRL season. | *Subscribe and 🔔: http://9Soci.al/KM6e50GjSK9*  *Get more breaking news at 9News.com.au: http://9Soci.al/iyCO50GjSK6*  FOLLOW 9News Australia ► Facebook: https://www.facebook.com/9News/ ► Twitter: https://twitter.com/9NewsAUS ► Instagram: https://www.instagram.com/9news/  Join 9News for the latest in news and events that affect you in your local city, as well as news from across Australia and the world.  #9News #BreakingNews #NineNewsAustralia #9NewsAU",https://www.youtube.com/watch?v=EQItjAoZac4,9News
2026-03-01T11:15:04+00:00,"FULL INTERVIEW: John Howard on Pauline Hanson, Angus Taylor and life in politics | 9 News Australia","It's been 30 years since John Howard was elected Prime Minister, holding the office to become our second-longest serving. His leadership defined an era of Australian politics, with economic reform and strong border protection. He sat down with Nine Political Editor Charles Croucher to reflect on a life in politics. | Subscribe and 🔔: http://9Soci.al/KM6e50GjSK9 | Get more breaking news at 9News.com.au: http://9Soci.al/iyCO50GjSK6  FOLLOW 9News Australia ► Facebook: https://www.facebook.com/9News/ ► Twitter: https://twitter.com/9NewsAUS ► Instagram: https://www.instagram.com/9news/  Join 9News for the latest in news and events that affect you in your local city, as well as news from across Australia and the world.  #BREAKINGNEWS #9NEWS #AUSTRALIA",https://www.youtube.com/watch?v=KiWXQVzOk5A,9News
2026-03-01T11:26:13+00:00,Aussies stuck in Dubai amid escalating conflict | 9 News Australia,"The US and Israeli attack on Iran and the regime’s retaliation has left many Australians stranded across the Middle East. Australian traveller Scott Graham is in Dubai and was just 200 metres from where a luxury hotel was hit during missile strikes. Subscribe and 🔔: http://9Soci.al/KM6e50GjSK9 | Get more breaking news at 9News.com.au: http://9Soci.al/iyCO50GjSK6  FOLLOW 9News Australia ► Facebook: https://www.facebook.com/9News/ ► Twitter: https://twitter.com/9NewsAUS ► Instagram: https://www.instagram.com/9news/  Join 9News for the latest in news and events that affect you in your local city, as well as news from across Australia and the world.  #BREAKINGNEWS #9NEWS #AUSTRALIA",https://www.youtube.com/watch?v=B55YTjpyYjY,9News
2026-03-01T11:30:50+00:00,"Hanson was an accident, says Howard | 9 News Australia","Despite a recent surge in support for One Nation, former Prime Minister John Howard believes Pauline Hanson's party is simply benefiting from current dissatisfaction with the Liberal Party.   Speaking to Nine’s Charles Croucher, he says her initial election was an ""accident"". #9News",https://www.youtube.com/shorts/v8XMgWCpnvE,9News
