published,title,description,link,Pub
2025-12-04T07:18:10+00:00,Two killed in horror smash in Melbourne’s south-east | 9 News Australia,"A man and an elderly woman have died after a motorcycle and a car collided at an intersection in Melbourne's south-east. | *Subscribe and 🔔: http://9Soci.al/KM6e50GjSK9*  *Get more breaking news at 9News.com.au: http://9Soci.al/iyCO50GjSK6*  FOLLOW 9News Australia ► Facebook: https://www.facebook.com/9News/ ► Twitter: https://twitter.com/9NewsAUS ► Instagram: https://www.instagram.com/9news/  Join 9News for the latest in news and events that affect you in your local city, as well as news from across Australia and the world.  #9News #BreakingNews #NineNewsAustralia #9NewsAU",https://www.youtube.com/watch?v=fzdDBVsDDIA,9News
2025-12-04T07:19:31+00:00,Sentence hearing over deadly Easter Show rival teenage gang stabbing | 9 News Australia,"The family of the teenager who was fatally stabbed at the Easter Show in 2022 have spoken at a sentence hearing. | *Subscribe and 🔔: http://9Soci.al/KM6e50GjSK9*  *Get more breaking news at 9News.com.au: http://9Soci.al/iyCO50GjSK6*  FOLLOW 9News Australia ► Facebook: https://www.facebook.com/9News/ ► Twitter: https://twitter.com/9NewsAUS ► Instagram: https://www.instagram.com/9news/  Join 9News for the latest in news and events that affect you in your local city, as well as news from across Australia and the world.  #9News #BreakingNews #NineNewsAustralia #9NewsAU",https://www.youtube.com/watch?v=puS7UdzJCQ0,9News
2025-12-04T07:23:11+00:00,U.S. Secretary of War accused of endangering American troops | 9 News Australia,"Investigation shows the U.S. Secretary of War ""violated Pentagon protocol"", when he shared sensitive plans over a messaging app. | *Subscribe and 🔔: http://9Soci.al/KM6e50GjSK9*  *Get more breaking news at 9News.com.au: http://9Soci.al/iyCO50GjSK6*  FOLLOW 9News Australia ► Facebook: https://www.facebook.com/9News/ ► Twitter: https://twitter.com/9NewsAUS ► Instagram: https://www.instagram.com/9news/  Join 9News for the latest in news and events that affect you in your local city, as well as news from across Australia and the world.  #9News #BreakingNews #NineNewsAustralia #9NewsAU",https://www.youtube.com/watch?v=mfYfnRyArvc,9News
2025-12-04T07:26:51+00:00,Australia to send $95 million in military assistance to Ukraine | 9 News Australia,"Australia will provide $95 million in military assistance to Ukraine, as it slaps new sanctions on Russia's so-called ""shadow fleet"", which are vessels that operate illegally. | *Subscribe and 🔔: http://9Soci.al/KM6e50GjSK9*  *Get more breaking news at 9News.com.au: http://9Soci.al/iyCO50GjSK6*  FOLLOW 9News Australia ► Facebook: https://www.facebook.com/9News/ ► Twitter: https://twitter.com/9NewsAUS ► Instagram: https://www.instagram.com/9news/  Join 9News for the latest in news and events that affect you in your local city, as well as news from across Australia and the world.  #9News #BreakingNews #NineNewsAustralia #9NewsAU",https://www.youtube.com/watch?v=dRezZ2cqjKw,9News
2025-12-04T07:34:54+00:00,Major boost for public housing met with protest upon announcement | 9 News Australia,"In a major boost for public housing, construction is now underway on a new development at Wentworth Park.   43 apartments will replace 17 ageing buildings, but the decision sparked protests when it was announced.  | *Subscribe and 🔔: http://9Soci.al/KM6e50GjSK9*  *Get more breaking news at 9News.com.au: http://9Soci.al/iyCO50GjSK6*  FOLLOW 9News Australia ► Facebook: https://www.facebook.com/9News/ ► Twitter: https://twitter.com/9NewsAUS ► Instagram: https://www.instagram.com/9news/  Join 9News for the latest in news and events that affect you in your local city, as well as news from across Australia and the world.  #9News #BreakingNews #NineNewsAustralia #9NewsAU",https://www.youtube.com/watch?v=kJLSUVaBX_M,9News
2025-12-04T07:36:52+00:00,Countdown and preparations begin for Sydney's world-famous NYE fireworks | 9 News Australia,"With more than a million people expected to flock to 50 free vantage points along the harbour, organisers are promising to light the fuse on the celebrations like nowhere else in the world. | *Subscribe and 🔔: http://9Soci.al/KM6e50GjSK9*  *Get more breaking news at 9News.com.au: http://9Soci.al/iyCO50GjSK6*  FOLLOW 9News Australia ► Facebook: https://www.facebook.com/9News/ ► Twitter: https://twitter.com/9NewsAUS ► Instagram: https://www.instagram.com/9news/  Join 9News for the latest in news and events that affect you in your local city, as well as news from across Australia and the world.  #9News #BreakingNews #NineNewsAustralia #9NewsAU",https://www.youtube.com/watch?v=WZB6h-q2JVQ,9News
2025-12-04T07:38:20+00:00,Doctor who sold Matthew Perry illegal ketamine jailed | 9 News Australia,"A doctor who pleaded guilty to selling ketamine to Matthew Perry in the weeks before the Friends star's overdose death has been sentenced to two-and-a-half years in prison in the U.S. | *Subscribe and 🔔: http://9Soci.al/KM6e50GjSK9*  *Get more breaking news at 9News.com.au: http://9Soci.al/iyCO50GjSK6*  FOLLOW 9News Australia ► Facebook: https://www.facebook.com/9News/ ► Twitter: https://twitter.com/9NewsAUS ► Instagram: https://www.instagram.com/9news/  Join 9News for the latest in news and events that affect you in your local city, as well as news from across Australia and the world.  #9News #BreakingNews #NineNewsAustralia #9NewsAU",https://www.youtube.com/watch?v=bvS1r_ErZ5o,9News
2025-12-04T07:38:55+00:00,Aussie scientists behind new research into Alzheimer's disease | 9 News Australia,"A world-first nasal spray developed in Melbourne could be a new frontier in the fight against Alzheimer's disease. | *Subscribe and 🔔: http://9Soci.al/KM6e50GjSK9*  *Get more breaking news at 9News.com.au: http://9Soci.al/iyCO50GjSK6*  FOLLOW 9News Australia ► Facebook: https://www.facebook.com/9News/ ► Twitter: https://twitter.com/9NewsAUS ► Instagram: https://www.instagram.com/9news/  Join 9News for the latest in news and events that affect you in your local city, as well as news from across Australia and the world.  #9News #BreakingNews #NineNewsAustralia #9NewsAU",https://www.youtube.com/watch?v=izxVmxTyYs8,9News
2025-12-04T08:08:39+00:00,#EXCLUSIVE: 9News reporter invites Oprah Winfrey to NRL's Vegas extravaganza | 9 News Australia,"9News' Danny Weidler invites American talk show queen Oprah Winfrey to the NRL's 2026 Las Vegas round. | *Subscribe and 🔔: http://9Soci.al/KM6e50GjSK9*  *Get more breaking news at 9News.com.au: http://9Soci.al/iyCO50GjSK6*  FOLLOW 9News Australia ► Facebook: https://www.facebook.com/9News/ ► Twitter: https://twitter.com/9NewsAUS ► Instagram: https://www.instagram.com/9news/  Join 9News for the latest in news and events that affect you in your local city, as well as news from across Australia and the world.  #9News #BreakingNews #NineNewsAustralia #9NewsAU",https://www.youtube.com/watch?v=PP4WCN6ozXE,9News
2025-12-04T08:29:30+00:00,Fans come out in force for Ashes second Test | 9 News Australia,"From misery out west to hope in Queensland, English cricket fans have packed out pubs and seats in and around the Gabba for the start of the 2nd test of the Ashes. Outnumbered by the Green and Gold crowd though, it was a hot start for the Aussies, as they seek out a dominant 2-nil lead. | *Subscribe and 🔔: http://9Soci.al/KM6e50GjSK9*  *Get more breaking news at 9News.com.au: http://9Soci.al/iyCO50GjSK6*  FOLLOW 9News Australia ► Facebook: https://www.facebook.com/9News/ ► Twitter: https://twitter.com/9NewsAUS ► Instagram: https://www.instagram.com/9news/  Join 9News for the latest in news and events that affect you in your local city, as well as news from across Australia and the world.  #9News #BreakingNews #NineNewsAustralia #9NewsAU",https://www.youtube.com/watch?v=qY2-p0B9y2E,9News
2025-12-04T10:22:25+00:00,Thirsty thief smashes his way into Gold Coast bar | 9 News Australia,"A family-run bar in Pimpama has received a late night visit from a thirsty thief, smashing his way in, before helping himself to an all-inclusive experience. | Subscribe and 🔔: http://9Soci.al/KM6e50GjSK9 | Get more breaking news at 9News.com.au: http://9Soci.al/iyCO50GjSK6  FOLLOW 9News Australia ► Facebook: https://www.facebook.com/9News/ ► Twitter: https://twitter.com/9NewsAUS ► Instagram: https://www.instagram.com/9news/  Join 9News for the latest in news and events that affect you in your local city, as well as news from across Australia and the world.  #BREAKINGNEWS #9NEWS #AUSTRALIA",https://www.youtube.com/watch?v=zo7joEhKxEA,9News
2025-12-04T11:00:07+00:00,9News Adelaide | Thursday December 4 | Full Episode,"Brenton Ragless leads the Adelaide bulletin, which features shocking revelations as a relief teacher accused of serious child sex crimes is revealed to have worked at over 40 schools across South Australia, leaving parents demanding answers.   The city also received its hottest day since March, prompting a fire scare in the Barossa Valley.   In a shocking series of events, an elderly man was violently robbed at a Campbelltown ATM, followed by the robbery of a woman who tried to intervene.   Police are also on the hunt for a shooter who fired a bullet into a Para Hills home in what is believed to be a targeted attack.   Internationally, the government's stance on repatriating ISIS brides is under fire, and Australia announces $95 million in military assistance for Ukraine.   Other stories include a court hearing for a teenager accused of her father's Boxing Day murder, a new electric bus fleet for Adelaide, and a game-changing drug for multiple sclerosis patients hitting the PBS.  | Subscribe and 🔔: http://9Soci.al/KM6e50GjSK9 | Get more breaking news at 9News.com.au: http://9Soci.al/iyCO50GjSK6  CHAPTERS: 0:00 Opening Titles & Headlines 0:40 Relief teacher linked to 40+ schools in sex crime scandal 2:37 Elderly man violently robbed at ATM, helper also attacked 4:01 Adelaide records hottest day since March; fire update 5:07 Shooter fires bullet into Para Hills home door 6:28 Teen accused of father's murder seeks bail 7:59 Researchers monitor algal bloom impact in warmer waters 8:45 Ambulance officers agree to 13.5 per cent pay deal 9:16 ISIS repatriation talks condemned by opposition 11:12 Australia to send $95M military aid to Ukraine 13:08 Man arrested after Glenelg foot chase, cannabis found 13:28 Woman injured as car flips in truck crash 13:48 $60 million electric bus fleet rolls out in Adelaide 15:31 Five AFL Gather Round games sold out rapidly 15:56 Barmy Army clashes with Aussies at Ashes Gabba 18:49 $2.5M invested in new cancer treatment technology 19:12 Whyalla drug bust uncovers LSD, vapes, and Xanax 19:33 Gawler real estate business damaged by fire 21:58 Game-changing MS drug price slashed on PBS 22:17 Micro preemie baby Ellie finally heads home  FOLLOW 9News Australia ► Facebook: https://www.facebook.com/9News/ ► Twitter: https://twitter.com/9NewsAUS ► Instagram: https://www.instagram.com/9news/  Join 9News for the latest in news and events that affect you in your local city, as well as news from across Australia and the world.  #BREAKINGNEWS #9NEWS #AUSTRALIA",https://www.youtube.com/watch?v=394IARz03PU,9News
2025-12-04T11:00:31+00:00,9News Sydney | Thursday December 4 | Full Episode,"Peter Overton leads the Sydney bulletin, with widespread fury over a major traffic breakdown as the M4 WestConnex tunnel closed for repairs, trapping Sydney drivers for up to four hours and causing immense congestion across the city.   Further breaking news includes the arrest and murder charge of a man in Northern NSW following a fatal shooting that escalated from a minor argument over a truck, alongside serious allegations against former NRL player Josh McGuire, who is facing court on charges related to a child.   On the national security front, there is political backlash concerning the government's quiet repatriation of Australian women and children from Syrian ISIS camps.   The program also features an exclusive preview of the elaborate plans for Sydney's upcoming New Year's Eve 2026 fireworks, a review of the second Ashes Test at the Gabba, and a major appeal for information, with the reward increased to $500,000, in the 2005 Jordan Thompson cold case murder.    | Subscribe and 🔔: http://9Soci.al/KM6e50GjSK9 | Get more breaking news at 9News.com.au: http://9Soci.al/iyCO50GjSK6  CHAPTERS: 0:00 Opening Titles & Headlines 0:41 Sydney tunnel meltdown traps drivers for hours 3:08 Man charged with murder after deadly dispute 4:56 Former NRL player Josh McGuire charged 6:14 Two out-of-control bushfires burn across NSW 6:41 ISIS brides repatriation sparks political controversy 8:38 Six Chinese nationals breach WA border 9:06 Partner faces killer in Easter Show murder 10:56 South African neo-Nazi leaves Australia 11:15 US Secretary of War breaches security protocol 13:00 Thai hostage remains handed over by Hamas 13:21 Australia sends $95M military aid to Ukraine 15:17 E-bike rider hospitalised after Barrenjoey crash 15:31 Australia dominates second Ashes Test at Gabba 19:04 Work begins on controversial Glebe public housing 20:52 $500,000 reward in Jordan Thompson cold case 21:39 Christmas tree torched in Kempsey firebug attack 21:59 Best and brightest NYE fireworks preview  FOLLOW 9News Australia ► Facebook: https://www.facebook.com/9News/ ► Twitter: https://twitter.com/9NewsAUS ► Instagram: https://www.instagram.com/9news/  Join 9News for the latest in news and events that affect you in your local city, as well as news from across Australia and the world.  #BREAKINGNEWS #9NEWS #AUSTRALIA",https://www.youtube.com/watch?v=APzakdwO4dA,9News
2025-12-04T11:15:03+00:00,9News Melbourne | Thursday December 4 | Full Episode,"Alicia Loxley and Tom Steinfort present the Melbourne news, covering a series of major local, national, and international stories. Locally, tragedy struck Ocean Grove as a beloved 69-year-old resident died in a house fire after running back into the burning home to save his pet dog, while a devastating car and motorcycle collision at a notorious Mentone intersection resulted in two fatalities, a crash hotspot that residents had long warned authorities about. Nationally, the Victorian government faces pressure over teacher pay negotiations, with the union demanding a significant pay rise to match wages in other states like New South Wales. | *Subscribe and 🔔: http://9Soci.al/KM6e50GjSK9*  CHAPTERS IN THIS VIDEO:  0:00 Fire Tragedy 2:00 Alleged Childcare Abuse 3:30 Government Cuts 6:10 United Front 8:03 Deadly Collision 9:53 Melbourne Heat 10:49 ISIS Repatriation 12:49 Stadium Vote 15:00 McIlroy Golf 16:26 Drug Lord Sentenced 18:14 Machete Chaos 18:53 Perry Doctor  *Get more breaking news at 9News.com.au: http://9Soci.al/iyCO50GjSK6*  FOLLOW 9News Australia ► Facebook: https://www.facebook.com/9News/ ► Twitter: https://twitter.com/9NewsAUS ► Instagram: https://www.instagram.com/9news/  Join 9News for the latest in news and events that affect you in your local city, as well as news from across Australia and the world.  #9News #BreakingNews #NineNewsAustralia #9NewsAU",https://www.youtube.com/watch?v=Nt44scJ15H0,9News
2025-12-04T12:15:01+00:00,9News Brisbane | Thursday December 4 | Full Episode,"Catch up on the latest breaking news and in-depth reports from Queensland and around the world. | *Subscribe and 🔔: http://9Soci.al/KM6e50GjSK9*  CHAPTERS IN THIS VIDEO:  0:06 Breaking News: Former NRL Star Charged 1:25 German Shepherd Arnie Investigation Twist 2:36 ISIS Repatriation & Political Row 4:32 Beenleigh Shooting Charges 5:00 Tweed Heads Murder Charge 5:20 Union Inquiry: Harassment & Intimidation 7:25 Toyah Cordingley Murder Trial Looms 8:55 Optus Outage Update 9:21 Border Breach: Chinese Nationals Found in WA 9:50 US ""Signal-Gate"" Investigation Findings 11:33 Gaza Hostage Remains Handed Over 11:50 Australia's $95M Aid to Ukraine 13:44 Troubling Homelessness Statistics 14:24 The Ashes: Second Test at The Gabba 16:52 Gold Coast Summer Safety 18:01 Epstein Island Images Released 18:22 Matthew Perry Doctor Sentenced 20:07 Royals: German President State Banquet  *Get more breaking news at 9News.com.au: http://9Soci.al/iyCO50GjSK6*  FOLLOW 9News Australia ► Facebook: https://www.facebook.com/9News/ ► Twitter: https://twitter.com/9NewsAUS ► Instagram: https://www.instagram.com/9news/  Join 9News for the latest in news and events that affect you in your local city, as well as news from across Australia and the world.  #9News #BreakingNews #NineNewsAustralia #9NewsAU",https://www.youtube.com/watch?v=ACYTA241k3A,9News
