published,title,description,link,Pub
2026-01-13T08:34:00+00:00,Victorian premier heckled by locals in bushfire zone | 9 News Australia,"Jacinta Allan has been holed up inside a regional hospital as furious locals demanded answers about Victoria's bushfire disaster. | *Subscribe and 🔔: http://9Soci.al/KM6e50GjSK9*  *Get more breaking news at 9News.com.au: http://9Soci.al/iyCO50GjSK6*  FOLLOW 9News Australia ► Facebook: https://www.facebook.com/9News/ ► Twitter: https://twitter.com/9NewsAUS ► Instagram: https://www.instagram.com/9news/  Join 9News for the latest in news and events that affect you in your local city, as well as news from across Australia and the world.  #9News #BreakingNews #NineNewsAustralia #9NewsAU",https://www.youtube.com/watch?v=k0sfQvj9438,9News
2026-01-13T08:37:19+00:00,Tributes flow for support worker found dead in Queensland home | 9 News Australia,"Loved ones are paying tribute to a much-loved support worker and musician, found dead at a client's home in Brisbane's south. | *Subscribe and 🔔: http://9Soci.al/KM6e50GjSK9*  *Get more breaking news at 9News.com.au: http://9Soci.al/iyCO50GjSK6*  FOLLOW 9News Australia ► Facebook: https://www.facebook.com/9News/ ► Twitter: https://twitter.com/9NewsAUS ► Instagram: https://www.instagram.com/9news/  Join 9News for the latest in news and events that affect you in your local city, as well as news from across Australia and the world.  #9News #BreakingNews #NineNewsAustralia #9NewsAU",https://www.youtube.com/watch?v=YAjWS2ar_as,9News
2026-01-13T08:38:32+00:00,Rescues unfold as full devastation of ex-Tropical Cyclone Koji is revealed | 9 News Australia,"Multiple rescue operations have unfolded overnight, with crews saving Queenslanders from the inland flood caused by ex-Tropical Cyclone Koji. | *Subscribe and 🔔: http://9Soci.al/KM6e50GjSK9*  *Get more breaking news at 9News.com.au: http://9Soci.al/iyCO50GjSK6*  FOLLOW 9News Australia ► Facebook: https://www.facebook.com/9News/ ► Twitter: https://twitter.com/9NewsAUS ► Instagram: https://www.instagram.com/9news/  Join 9News for the latest in news and events that affect you in your local city, as well as news from across Australia and the world.  #9News #BreakingNews #NineNewsAustralia #9NewsAU",https://www.youtube.com/watch?v=ZgijC5QlI2s,9News
2026-01-13T08:40:24+00:00,Toddler killed in Melbourne house fire | 9 News Australia,"Police are still trying to work out the cause of the fire, which claimed the life of a three-year-old boy in Fawkner. The child's father tried desperately to save him. Now, detectives believe the toddler may have accidentally sparked it himself. | *Subscribe and 🔔: http://9Soci.al/KM6e50GjSK9*  *Get more breaking news at 9News.com.au: http://9Soci.al/iyCO50GjSK6*  FOLLOW 9News Australia ► Facebook: https://www.facebook.com/9News/ ► Twitter: https://twitter.com/9NewsAUS ► Instagram: https://www.instagram.com/9news/  Join 9News for the latest in news and events that affect you in your local city, as well as news from across Australia and the world.  #9News #BreakingNews #NineNewsAustralia #9NewsAU",https://www.youtube.com/watch?v=A9iJU3OxePA,9News
2026-01-13T08:49:11+00:00,Adelaide United accused of homophobia | 9 News Australia,"Instead of celebrating their pride round, Adelaide United is now defending itself amid claims of homophobia within its club. | Subscribe and 🔔: http://9Soci.al/KM6e50GjSK9 | Get more breaking news at 9News.com.au: http://9Soci.al/iyCO50GjSK6  FOLLOW 9News Australia ► Facebook: https://www.facebook.com/9News/ ► Twitter: https://twitter.com/9NewsAUS ► Instagram: https://www.instagram.com/9news/  Join 9News for the latest in news and events that affect you in your local city, as well as news from across Australia and the world.  #BREAKINGNEWS #9NEWS #AUSTRALIA",https://www.youtube.com/shorts/GjvzWsRA8xY,9News
2026-01-13T08:50:43+00:00,Man wearing suspicious vest banished to Victoria | 9 News Australia,"A Victorian man who was stopped on his way to Bondi Beach wearing a camouflage vest covered in duct tape has been banished back across the border. | *Subscribe and 🔔: http://9Soci.al/KM6e50GjSK9*  *Get more breaking news at 9News.com.au: http://9Soci.al/iyCO50GjSK6*  FOLLOW 9News Australia ► Facebook: https://www.facebook.com/9News/ ► Twitter: https://twitter.com/9NewsAUS ► Instagram: https://www.instagram.com/9news/  Join 9News for the latest in news and events that affect you in your local city, as well as news from across Australia and the world.  #9News #BreakingNews #NineNewsAustralia #9NewsAU",https://www.youtube.com/watch?v=OXVnmpInjlY,9News
2026-01-13T08:50:52+00:00,Victorian man at the centre of bomb scare in Bondi apologises | 9 News Australia,"A Victorian man at the centre of a bomb scare at Bondi has apologised to the community for any concerns caused by what he says was an honest mistake. | Subscribe and 🔔: http://9Soci.al/KM6e50GjSK9 | Get more breaking news at 9News.com.au: http://9Soci.al/iyCO50GjSK6  FOLLOW 9News Australia ► Facebook: https://www.facebook.com/9News/ ► Twitter: https://twitter.com/9NewsAUS ► Instagram: https://www.instagram.com/9news/  Join 9News for the latest in news and events that affect you in your local city, as well as news from across Australia and the world.  #BREAKINGNEWS #9NEWS #AUSTRALIA",https://www.youtube.com/watch?v=gs3oUvUuOgA,9News
2026-01-13T09:03:10+00:00,Million-dollar reward offered over Melbourne girl's disappearance | 9 News Australia,"A $1 million reward has been announced for information about the disappearance of Melbourne girl Eloise Worledge 50 years ago. | *Subscribe and 🔔: http://9Soci.al/KM6e50GjSK9*  *Get more breaking news at 9News.com.au: http://9Soci.al/iyCO50GjSK6*  FOLLOW 9News Australia ► Facebook: https://www.facebook.com/9News/ ► Twitter: https://twitter.com/9NewsAUS ► Instagram: https://www.instagram.com/9news/  Join 9News for the latest in news and events that affect you in your local city, as well as news from across Australia and the world.  #9News #BreakingNews #NineNewsAustralia #9NewsAU",https://www.youtube.com/watch?v=X1SEjk6qfg4,9News
2026-01-13T09:04:23+00:00,New study linking ADHD symptoms to menopause | 9 News Australia,"A first-of-its-kind study from Monash University has revealed that nearly all women with ADHD experience worse symptoms while going through menopause. | *Subscribe and 🔔: http://9Soci.al/KM6e50GjSK9*  *Get more breaking news at 9News.com.au: http://9Soci.al/iyCO50GjSK6*  FOLLOW 9News Australia ► Facebook: https://www.facebook.com/9News/ ► Twitter: https://twitter.com/9NewsAUS ► Instagram: https://www.instagram.com/9news/  Join 9News for the latest in news and events that affect you in your local city, as well as news from across Australia and the world.  #9News #BreakingNews #NineNewsAustralia #9NewsAU",https://www.youtube.com/watch?v=spLmMCR9wi8,9News
2026-01-13T10:21:31+00:00,Author Craig Silvey faces court on alleged child exploitation offences | 9 News Australia,"Acclaimed Australian author Craig Silvey has faced a Perth court accused of distributing and possessing child exploitation material. | *Subscribe and 🔔: http://9Soci.al/KM6e50GjSK9*  *Get more breaking news at 9News.com.au: http://9Soci.al/iyCO50GjSK6*  FOLLOW 9News Australia ► Facebook: https://www.facebook.com/9News/ ► Twitter: https://twitter.com/9NewsAUS ► Instagram: https://www.instagram.com/9news/  Join 9News for the latest in news and events that affect you in your local city, as well as news from across Australia and the world.  #9News #BreakingNews #NineNewsAustralia #9NewsAU",https://www.youtube.com/watch?v=zrj9Qs1g8uQ,9News
2026-01-13T11:01:27+00:00,9News Sydney | Tuesday January 13 | Full Episode,"Georgie Gardner leads the bulletin with Kevin Rudd's resignation announcement, cutting his stint a year short. Internationally, more than 640 people have been killed in Iran as anti-government protests swell in size. Locally, Australia Day celebrations on Sydney Harbour are promised to be the biggest yet. | *Subscribe and 🔔: http://9Soci.al/KM6e50GjSK9*  CHAPTERS:  00:00 - Kevin Rudd Resigns: Australia’s Ambassador to the U.S. to step down early 03:07 - Bondi False Alarm: Cleophas Machaya apologises for weight-vest misunderstanding 05:08 - New Security Laws: Government unseals tough legislation following Bondi attack 07:17 - Neo-Nazi Group Disbands: National Socialist Network to dissolve ahead of new laws 07:56 - Iran Unrest: Anti-government protests swell as death toll rises 10:31 - Sydney Protests: Local crowd gathers outside U.S. Consulate in North Sydney 10:54 - Mount Druitt Murder Charge: 19-year-old charged over fatal 2023 stabbing 13:00 - Adelaide Writers' Week: Festival cancelled amid controversy and mass exodus 13:23 - U.S. Shooting Hoax: NSW teen charged over false reports to FBI 13:44 - Australia Day Tribute: Sydney Harbour preparations to include Bondi victims 15:33 - Cricket Legend Retires: Alyssa Healy calls time on storied career 17:15 - Sydney Weather Forecast 17:54 - Author Charged: Jasper Jones writer Craig Silvey faces court in Perth 18:22 - Victoria Premier Heckled: Jacinta Allan confronted by angry locals over CFA funding 18:59 - E-Bike Safety Concerns: Five teenagers injured in separate Sydney crashes 20:23 - Vatican Visit: Pope meets with Venezuelan opposition leader Maria Machado 20:45 - Record Cocaine Bust: Spanish police seize 10 tonnes of drugs hidden in salt  *Get more breaking news at 9News.com.au: http://9Soci.al/iyCO50GjSK6*  FOLLOW 9News Australia ► Facebook: https://www.facebook.com/9News/ ► Twitter: https://twitter.com/9NewsAUS ► Instagram: https://www.instagram.com/9news/  Join 9News for the latest in news and events that affect you in your local city, as well as news from across Australia and the world.  #9News #BreakingNews #NineNewsAustralia #9NewsAU",https://www.youtube.com/watch?v=j8_wNN2B5lA,9News
2026-01-13T11:01:52+00:00,9News Melbourne | Tuesday January 13 | Full Episode,"Brett McLeod leads the bulletin with an update on the Victorian bushfire disaster as furious locals demand answers from Premier Jacinta Allan. In other news, Kevin Rudd has resigned as Australia's Ambassador to the United States a year early. Internationally, more than 640 people have been killed in Iran as anti-government protests swell in size. | *Subscribe and 🔔: http://9Soci.al/KM6e50GjSK9*  *Get more breaking news at 9News.com.au: http://9Soci.al/iyCO50GjSK6*  FOLLOW 9News Australia ► Facebook: https://www.facebook.com/9News/ ► Twitter: https://twitter.com/9NewsAUS ► Instagram: https://www.instagram.com/9news/  Join 9News for the latest in news and events that affect you in your local city, as well as news from across Australia and the world.  #9News #BreakingNews #NineNewsAustralia #9NewsAU",https://www.youtube.com/watch?v=qO6yCD5GwNw,9News
2026-01-13T11:18:46+00:00,Alyssa Healy to retire from cricket | 9 News Australia,"Alyssa Healy has called time on her legendary cricket career, hoping to usher in the next generation who she's helped inspire. | Subscribe and 🔔: http://9Soci.al/KM6e50GjSK9 | Get more breaking news at 9News.com.au: http://9Soci.al/iyCO50GjSK6  FOLLOW 9News Australia ► Facebook: https://www.facebook.com/9News/ ► Twitter: https://twitter.com/9NewsAUS ► Instagram: https://www.instagram.com/9news/  Join 9News for the latest in news and events that affect you in your local city, as well as news from across Australia and the world.  #BREAKINGNEWS #9NEWS #AUSTRALIA",https://www.youtube.com/shorts/zaM3sFVDOPw,9News
2026-01-13T11:30:06+00:00,9News Adelaide | Tuesday January 13 | Full Episode,"Alice Monfries leads the bulletin with an update on Adelaide Writer's Week, with the entire governing board resigning, more than 180 authors boycotting the event and the whole program sensationally axed. In other local news, the first openly gay professional footballer Josh Cavallo has claimed he experienced homophobia within the Adelaide United club. Nationally, Kevin Rudd has resigned as Australia's Ambassador to the United States a year early. | *Subscribe and 🔔: http://9Soci.al/KM6e50GjSK9*  *Get more breaking news at 9News.com.au: http://9Soci.al/iyCO50GjSK6*  FOLLOW 9News Australia ► Facebook: https://www.facebook.com/9News/ ► Twitter: https://twitter.com/9NewsAUS ► Instagram: https://www.instagram.com/9news/  Join 9News for the latest in news and events that affect you in your local city, as well as news from across Australia and the world.  #9News #BreakingNews #NineNewsAustralia #9NewsAU",https://www.youtube.com/watch?v=1ySiJfLj6xY,9News
2026-01-13T12:15:07+00:00,9News Queensland | Tuesday January 13 | Full Episode,"Aislin Kriukelis leads the Queensland news with an update on ex-Tropical Cyclone Koji. 9News takes you onboard with rescue crews, saving Queenslanders from the inland flood caused by ex-tropical Cyclone Koji. In other news, loved ones are paying tribute to a much-loved support worker and musician, found dead at a client's home in Brisbane's south. | *Subscribe and 🔔: http://9Soci.al/KM6e50GjSK9*  *Get more breaking news at 9News.com.au: http://9Soci.al/iyCO50GjSK6*  FOLLOW 9News Australia ► Facebook: https://www.facebook.com/9News/ ► Twitter: https://twitter.com/9NewsAUS ► Instagram: https://www.instagram.com/9news/  Join 9News for the latest in news and events that affect you in your local city, as well as news from across Australia and the world.  #9News #BreakingNews #NineNewsAustralia #9NewsAU",https://www.youtube.com/watch?v=iS8-XLTti4w,9News
