published,title,description,link,Pub
2025-10-28T09:11:49+00:00,Police seize $63 million cocaine shipment | 7NEWS,"State and Federal police have seized 128 kilograms of cocaine worth $63 million in Condell Park, arresting two men allegedly connected to the KVT criminal syndicate. The drug importation bust emerged during investigations into a July drive-by shooting at Concord, with police linking the cocaine shipment to recent public place shootings across Sydney. The arrested men, who were once associated with the Alameddine crime family but are now at war with them, face life imprisonment and will appear in court again in January.  Subscribe and set 🔔 » https://7news.link/YTSubscribe |   For the latest Australian news and breaking news alerts, connect with 7NEWS online: Visit » https://7news.com.au 7Plus » https://7plus.com.au/ 7NEWS Podcast » https://open.spotify.com/user/dm9fk9hzoe68ibpttheragdgi Facebook » https://www.facebook.com/7NewsAustralia TikTok » https://www.tiktok.com/@7newsaustralia Instagram » https://www.instagram.com/7newsaustralia/ X » https://x.com/7NewsAustralia  7NEWS combines the trusted and powerful news brands including Sunrise, The Morning Show, Spotlight and 7NEWS.com.au, delivering unique, engaging and continuous coverage on the issues that matter most to Australians. Watch 7 News Australia full broadcasts and full episodes at 6pm and weekdays at 12pm and 4pm on Channel 7 and 7plus.  #BREAKINGNEWS #7NEWS",https://www.youtube.com/watch?v=lNInCH76csQ,7News
2025-10-28T09:11:26+00:00,Albanese wraps up ASEAN diplomatic tour | 7NEWS,"Australian Prime Minister Anthony Albanese conducts diplomatic meetings with Southeast Asian leaders during his visit to Kuala Lumpur for ASEAN summit. The Prime Minister met with leaders from the Philippines, Thailand, Vietnam and Cambodia, emphasising Australia's commitment to greater regional engagement. Albanese will depart for South Korea tomorrow to attend the APEC meeting.  Subscribe and set 🔔 » https://7news.link/YTSubscribe |   For the latest Australian news and breaking news alerts, connect with 7NEWS online: Visit » https://7news.com.au 7Plus » https://7plus.com.au/ 7NEWS Podcast » https://open.spotify.com/user/dm9fk9hzoe68ibpttheragdgi Facebook » https://www.facebook.com/7NewsAustralia TikTok » https://www.tiktok.com/@7newsaustralia Instagram » https://www.instagram.com/7newsaustralia/ X » https://x.com/7NewsAustralia  7NEWS combines the trusted and powerful news brands including Sunrise, The Morning Show, Spotlight and 7NEWS.com.au, delivering unique, engaging and continuous coverage on the issues that matter most to Australians. Watch 7 News Australia full broadcasts and full episodes at 6pm and weekdays at 12pm and 4pm on Channel 7 and 7plus.  #BREAKINGNEWS #7NEWS",https://www.youtube.com/watch?v=F9vu-rlU3pU,7News
2025-10-28T09:09:52+00:00,Cruise passenger dies after being left on remote island | 7NEWS,"An 81-year-old cruise ship passenger died after being left behind on Lizard Island, a remote location on the Great Barrier Reef 1600 kilometres north of Brisbane. The woman was hiking a bush trail when she became tired and turned back, but the Coral Adventurer departed without realising she wasn't on board, leading to a five-hour delay before a search began. Her body was found 50 metres from the hiking trail on Sunday, raising questions about safety procedures and whether the tragedy could have been prevented.  Subscribe and set 🔔 » https://7news.link/YTSubscribe |   For the latest Australian news and breaking news alerts, connect with 7NEWS online: Visit » https://7news.com.au 7Plus » https://7plus.com.au/ 7NEWS Podcast » https://open.spotify.com/user/dm9fk9hzoe68ibpttheragdgi Facebook » https://www.facebook.com/7NewsAustralia TikTok » https://www.tiktok.com/@7newsaustralia Instagram » https://www.instagram.com/7newsaustralia/ X » https://x.com/7NewsAustralia  7NEWS combines the trusted and powerful news brands including Sunrise, The Morning Show, Spotlight and 7NEWS.com.au, delivering unique, engaging and continuous coverage on the issues that matter most to Australians. Watch 7 News Australia full broadcasts and full episodes at 6pm and weekdays at 12pm and 4pm on Channel 7 and 7plus.  #BREAKINGNEWS #7NEWS",https://www.youtube.com/watch?v=vbD0PxtNcCs,7News
2025-10-28T09:09:33+00:00,Police officer injured in Parramatta patrol car crash | 7NEWS,"A 23-year-old probationary constable underwent emergency surgery after being impaled by a guard rail when his patrol car spun off the road at a Parramatta intersection. The officers were responding to a call under lights and sirens when the accident occurred, with the injured officer rushed to Westmead Hospital for serious arm injuries.  Subscribe and set 🔔 » https://7news.link/YTSubscribe |   For the latest Australian news and breaking news alerts, connect with 7NEWS online: Visit » https://7news.com.au 7Plus » https://7plus.com.au/ 7NEWS Podcast » https://open.spotify.com/user/dm9fk9hzoe68ibpttheragdgi Facebook » https://www.facebook.com/7NewsAustralia TikTok » https://www.tiktok.com/@7newsaustralia Instagram » https://www.instagram.com/7newsaustralia/ X » https://x.com/7NewsAustralia  7NEWS combines the trusted and powerful news brands including Sunrise, The Morning Show, Spotlight and 7NEWS.com.au, delivering unique, engaging and continuous coverage on the issues that matter most to Australians. Watch 7 News Australia full broadcasts and full episodes at 6pm and weekdays at 12pm and 4pm on Channel 7 and 7plus.  #BREAKINGNEWS #7NEWS",https://www.youtube.com/watch?v=68GGXcR4nh4,7News
2025-10-28T09:08:20+00:00,Porsche splits in half in Gordon crash | 7NEWS,"A white Porsche crashed across the median strip on Ryde Road at Gordon during peak hour, splitting in half and hitting a Land Rover containing a mother and teenage daughter, plus a third vehicle. The 40-year-old Porsche driver has not been charged, and remarkably no one was seriously injured despite the dramatic nature of the collision.  Subscribe and set 🔔 » https://7news.link/YTSubscribe |   For the latest Australian news and breaking news alerts, connect with 7NEWS online: Visit » https://7news.com.au 7Plus » https://7plus.com.au/ 7NEWS Podcast » https://open.spotify.com/user/dm9fk9hzoe68ibpttheragdgi Facebook » https://www.facebook.com/7NewsAustralia TikTok » https://www.tiktok.com/@7newsaustralia Instagram » https://www.instagram.com/7newsaustralia/ X » https://x.com/7NewsAustralia  7NEWS combines the trusted and powerful news brands including Sunrise, The Morning Show, Spotlight and 7NEWS.com.au, delivering unique, engaging and continuous coverage on the issues that matter most to Australians. Watch 7 News Australia full broadcasts and full episodes at 6pm and weekdays at 12pm and 4pm on Channel 7 and 7plus.  #BREAKINGNEWS #7NEWS",https://www.youtube.com/watch?v=H5PiC8BEj4I,7News
2025-10-28T09:01:16+00:00,Australia's biggest electricity user could close due to power prices | ABC NEWS,"Australia's largest aluminium smelter has begun a consultation process with employees about the future of its operations.   Tomago Aluminium says, despite extensive engagement, it has not identified a pathway that supports commercially sustainable operations beyond 2028. Subscribe: http://ab.co/1svxLVE Read more here: https://www.abc.net.au/news/2025-10-28/tomago-aluminum-closure-risk-energy-price-increase/105941120  ABC NEWS provides around the clock coverage of news events as they break in Australia and abroad. It's news when you want it, from Australia's most trusted news organisation.  For more from ABC NEWS, click here: https://ab.co/2kxYCZY Watch more ABC NEWS content ad-free on ABC iview: https://ab.co/2OB7Mk1  Go deeper on our ABC NEWS In-depth channel: https://ab.co/2lNeBn2 Like ABC NEWS on Facebook: http://facebook.com/abcnews.au Follow ABC NEWS on Instagram: http://instagram.com/abcnews_au Follow ABC NEWS on X (Twitter): http://twitter.com/abcnews  Note: In most cases, our captions are auto-generated.  #ABCNEWS #ABCNEWSAustralia",https://www.youtube.com/watch?v=jHIIIA8VALA,ABC
2025-10-28T09:00:57+00:00,King Charles Heckled As Prince Andrew Reportedly Agrees To Leave Royal Lodge | 10 News+,"King Charles has been heckled over his brother Prince Andrew, with the protester shouting questions about Andrew’s links to Jeffrey Epstein as the monarch greeted fans outside a cathedral in north-west England.   It comes as reports indicate Andrew has agreed to leave the 30-bedroom Royal Lodge where he stays for a peppercorn rent. Royal Commentator Victoria Arbiter joined 10 News+ to break it all down.   Join the conversation and follow us on:  Instagram: https://www.instagram.com/10NewsPlus/ TikTok: https://www.tiktok.com/@10newsplus/ Snapchat: https://www.snapchat.com/add/tennewsplus Spotify: https://open.spotify.com/show/0tWZ6sIJTQ2WHgYdjgaAA7?si=cb30d7fd3d3541fa 10 News+ airs at 6pm, from Sunday to Friday on Network 10.  Missed the bulletin? Catch up at https://10.com.au/news/  10 News+ is based in Australia and is a division of Paramount.",https://www.youtube.com/watch?v=gthpJ_V2lAk,10 News
2025-10-28T08:58:42+00:00,Western Sydney Airport's historic first jet landing | 7NEWS,"Western Sydney Airport conducts its first passenger jet landing as part of a full-scale emergency disaster simulation, marking a major milestone 80 years after the airport was first proposed and seven years after construction began. The Boeing 737 air tanker from the Rural Fire Service fleet successfully touched down on runway 05, with 300 rescue workers participating in the rehearsal ahead of the airport's opening next year. The 24-hour international airport aims to carry up to 10 million passengers annually, though concerns remain about attracting sufficient airline interest with only QantasLink, Jetstar, Singapore Airlines and Air New Zealand signed up so far.  Subscribe and set 🔔 » https://7news.link/YTSubscribe |   For the latest Australian news and breaking news alerts, connect with 7NEWS online: Visit » https://7news.com.au 7Plus » https://7plus.com.au/ 7NEWS Podcast » https://open.spotify.com/user/dm9fk9hzoe68ibpttheragdgi Facebook » https://www.facebook.com/7NewsAustralia TikTok » https://www.tiktok.com/@7newsaustralia Instagram » https://www.instagram.com/7newsaustralia/ X » https://x.com/7NewsAustralia  7NEWS combines the trusted and powerful news brands including Sunrise, The Morning Show, Spotlight and 7NEWS.com.au, delivering unique, engaging and continuous coverage on the issues that matter most to Australians. Watch 7 News Australia full broadcasts and full episodes at 6pm and weekdays at 12pm and 4pm on Channel 7 and 7plus.  #BREAKINGNEWS #7NEWS",https://www.youtube.com/watch?v=DCJPO3cNzZg,7News
2025-10-28T08:57:47+00:00,Two killed in Cobar mine explosion | 7NEWS,"Two workers have been killed and another seriously injured in an explosion at the Endeavour silver-zinc mine near Cobar in far western New South Wales. Holly Clarke, 24, and Patrick McMullen, 66, died when explosives unexpectedly detonated at 3:45am during a routine evening shift, while survivor Mackenzie Sterling remains hospitalised in stable condition. The mine, operated by Polymetals since 2023, has been closed pending investigation into the catastrophic safety system failure.  Subscribe and set 🔔 » https://7news.link/YTSubscribe |   For the latest Australian news and breaking news alerts, connect with 7NEWS online: Visit » https://7news.com.au 7Plus » https://7plus.com.au/ 7NEWS Podcast » https://open.spotify.com/user/dm9fk9hzoe68ibpttheragdgi Facebook » https://www.facebook.com/7NewsAustralia TikTok » https://www.tiktok.com/@7newsaustralia Instagram » https://www.instagram.com/7newsaustralia/ X » https://x.com/7NewsAustralia  7NEWS combines the trusted and powerful news brands including Sunrise, The Morning Show, Spotlight and 7NEWS.com.au, delivering unique, engaging and continuous coverage on the issues that matter most to Australians. Watch 7 News Australia full broadcasts and full episodes at 6pm and weekdays at 12pm and 4pm on Channel 7 and 7plus.  #BREAKINGNEWS #7NEWS",https://www.youtube.com/watch?v=-Dz0xsOtacg,7News
2025-10-28T08:56:52+00:00,Social Media Companies Face Senate Grilling Ahead Of Youth Ban | 10 News+,"The owners of Facebook, Snapchat and TikTok have testified at a Senate inquiry ahead of the looming social media ban for users under the age of 16.   The tech giants have fought the ban from the start but insist they will comply once it takes effect in December.   Nationals Senator Ross Cadell has also made a bombshell claim, accusing TikTok of intimidating and bullying his office.  Join the conversation and follow us on:  Instagram: https://www.instagram.com/10NewsPlus/ TikTok: https://www.tiktok.com/@10newsplus/ Snapchat: https://www.snapchat.com/add/tennewsplus Spotify: https://open.spotify.com/show/0tWZ6sIJTQ2WHgYdjgaAA7?si=cb30d7fd3d3541fa 10 News+ airs at 6pm, from Sunday to Friday on Network 10.  Missed the bulletin? Catch up at https://10.com.au/news/  10 News+ is based in Australia and is a division of Paramount.",https://www.youtube.com/watch?v=GZqCjj4io0c,10 News
2025-10-28T08:54:12+00:00,Clean-up continues after devastating Brisbane storms | 9 News Australia,"Almost 5000 people remain without power in Brisbane, two days after storms hit the city with destructive winds and large hail. | *Subscribe and 🔔: http://9Soci.al/KM6e50GjSK9*  *Get more breaking news at 9News.com.au: http://9Soci.al/iyCO50GjSK6*  FOLLOW 9News Australia ► Facebook: https://www.facebook.com/9News/ ► Twitter: https://twitter.com/9NewsAUS ► Instagram: https://www.instagram.com/9news/  Join 9News for the latest in news and events that affect you in your local city, as well as news from across Australia and the world.  #9News #BreakingNews #NineNewsAustralia #9NewsAU",https://www.youtube.com/watch?v=cXfRFERCdI0,9News
2025-10-28T08:53:53+00:00,Brain cancer advocates call for action in Canberra | 7NEWS,"Brain cancer is the leading cause of cancer death for Australians under 40, yet it remains underfunded and poorly understood. Today, advocates took their fight to Canberra, demanding better support.  Subscribe and set 🔔 » https://7news.link/YTSubscribe |   For the latest Australian news and breaking news alerts, connect with 7NEWS online: Visit » https://7news.com.au 7Plus » https://7plus.com.au/ 7NEWS Podcast » https://open.spotify.com/user/dm9fk9hzoe68ibpttheragdgi Facebook » https://www.facebook.com/7NewsAustralia TikTok » https://www.tiktok.com/@7newsaustralia Instagram » https://www.instagram.com/7newsaustralia/  X » https://x.com/7NewsAustralia   7NEWS combines the trusted and powerful news brands including Sunrise, The Morning Show, Spotlight and 7NEWS.com.au, delivering unique, engaging and continuous coverage on the issues that matter most to Australians. Watch 7 News Australia full broadcasts and full episodes at 6pm and weekdays at 12pm and 4pm on Channel 7 and 7plus.  #BREAKINGNEWS #7NEWS",https://www.youtube.com/watch?v=bvzVzJ5kBOA,7News
2025-10-28T08:53:34+00:00,Global Demand Surges For New Australian-Made Anti-Drone Laser Weapon | 10 News+,"Australian defence company Electro Optics Systems has developed a groundbreaking new laser weapon called Apollo, which can shoot down drones on the battlefield with a beam of light.   It’s now in high demand around the globe, with the Netherlands being the first country to purchase the high-tech system.   The company says other NATO member states, as well as Middle Eastern and East Asian countries are interested in buying the anti-drone weapon too.  Join the conversation and follow us on:  Instagram: https://www.instagram.com/10NewsPlus/ TikTok: https://www.tiktok.com/@10newsplus/ Snapchat: https://www.snapchat.com/add/tennewsplus Spotify: https://open.spotify.com/show/0tWZ6sIJTQ2WHgYdjgaAA7?si=cb30d7fd3d3541fa 10 News+ airs at 6pm, from Sunday to Friday on Network 10.  Missed the bulletin? Catch up at https://10.com.au/news/  10 News+ is based in Australia and is a division of Paramount.",https://www.youtube.com/watch?v=eHDLW5TQ2xs,10 News
2025-10-28T08:52:49+00:00,Woman charged over hospital sabotage rampage | 7NEWS,"A 42-year-old woman has been charged with allegedly sabotaging critical infrastructure at two Sydney hospitals, cutting water and gas supplies at Kareena Private Hospital before scaling a wall to enter Sutherland Hospital and switching off medical gas mains including oxygen supplies to patients. The incident, which occurred just after midnight, has prompted a NSW Health review into hospital security after the woman, who was on bail, was able to access highly restricted areas with apparent knowledge of what she was targeting.  Subscribe and set 🔔 » https://7news.link/YTSubscribe |   For the latest Australian news and breaking news alerts, connect with 7NEWS online: Visit » https://7news.com.au 7Plus » https://7plus.com.au/ 7NEWS Podcast » https://open.spotify.com/user/dm9fk9hzoe68ibpttheragdgi Facebook » https://www.facebook.com/7NewsAustralia TikTok » https://www.tiktok.com/@7newsaustralia Instagram » https://www.instagram.com/7newsaustralia/ X » https://x.com/7NewsAustralia  7NEWS combines the trusted and powerful news brands including Sunrise, The Morning Show, Spotlight and 7NEWS.com.au, delivering unique, engaging and continuous coverage on the issues that matter most to Australians. Watch 7 News Australia full broadcasts and full episodes at 6pm and weekdays at 12pm and 4pm on Channel 7 and 7plus.  #BREAKINGNEWS #7NEWS",https://www.youtube.com/watch?v=sWvdgepLyEA,7News
2025-10-28T08:51:46+00:00,Aussies urged to check underused Medicare rebate eligibility | 9 News Australia,"Australians living with chronic health issues are being urged to see if they're eligible for an underused Medicare rebate. The subsidy gives them access to treatments that can help them better manage their conditions.| *Subscribe and 🔔: http://9Soci.al/KM6e50GjSK9*  *Get more breaking news at 9News.com.au: http://9Soci.al/iyCO50GjSK6*  FOLLOW 9News Australia ► Facebook: https://www.facebook.com/9News/ ► Twitter: https://twitter.com/9NewsAUS ► Instagram: https://www.instagram.com/9news/  Join 9News for the latest in news and events that affect you in your local city, as well as news from across Australia and the world.  #9News #BreakingNews #NineNewsAustralia #9NewsAU",https://www.youtube.com/watch?v=Za22xXGu_us,9News
2025-10-28T08:50:25+00:00,"Bill Shorten on politics, education & where Australia's heading next | 9 News Australia","I chat to former opposition leader Bill Shorten about his career in politics, the challenges facing our universities and why the country 'needs to move up a gear'.   Bill Shorten is now Vice Chancellor at the University of Canberra.  | Subscribe and 🔔: http://9Soci.al/KM6e50GjSK9 | Get more breaking news at 9News.com.au: http://9Soci.al/iyCO50GjSK6  FOLLOW 9News Australia ► Facebook: https://www.facebook.com/9News/ ► Twitter: https://twitter.com/9NewsAUS ► Instagram: https://www.instagram.com/9news/  Join 9News for the latest in news and events that affect you in your local city, as well as news from across Australia and the world.  #BREAKINGNEWS #9NEWS #AUSTRALIA",https://www.youtube.com/watch?v=-fRIGJEorfc,9News
2025-10-28T08:48:55+00:00,Suspected Meteorite Hits Tesla Car’s Windscreen In South Australia | 10 News+,"Dr Andrew Melville Smith was driving his Tesla along South Australia’s Port Augusta Highway when his windscreen shattered, spraying glass everywhere.   The heat radiating from his windscreen has led experts to suspect the rock that hit his car was a meteorite.   The South Australian Museum is now inspecting the damage and combing for clues of cosmic origin.  Join the conversation and follow us on:  Instagram: https://www.instagram.com/10NewsPlus/ TikTok: https://www.tiktok.com/@10newsplus/ Snapchat: https://www.snapchat.com/add/tennewsplus Spotify: https://open.spotify.com/show/0tWZ6sIJTQ2WHgYdjgaAA7?si=cb30d7fd3d3541fa 10 News+ airs at 6pm, from Sunday to Friday on Network 10.  Missed the bulletin? Catch up at https://10.com.au/news/  10 News+ is based in Australia and is a division of Paramount.",https://www.youtube.com/watch?v=FL7cCHehPRk,10 News
2025-10-28T08:47:26+00:00,Calls for government to do more for brain cancer funding | 9 News Australia,"It's the leading cause of death for people under 40, but research into brain cancer gets some of the smallest levels of funding compared to other cancers. | *Subscribe and 🔔: http://9Soci.al/KM6e50GjSK9*  *Get more breaking news at 9News.com.au: http://9Soci.al/iyCO50GjSK6*  FOLLOW 9News Australia ► Facebook: https://www.facebook.com/9News/ ► Twitter: https://twitter.com/9NewsAUS ► Instagram: https://www.instagram.com/9news/  Join 9News for the latest in news and events that affect you in your local city, as well as news from across Australia and the world.  #9News #BreakingNews #NineNewsAustralia #9NewsAU",https://www.youtube.com/watch?v=UxfOXbRqVk0,9News
2025-10-28T08:47:07+00:00,Australia's hidden gems - How you can upsize your next holiday for less | 7NEWS,"There is a new push to get more Australians travelling locally.  The number of Aussies taking domestic holidays is flatlining as overseas jaunts take priority.   Subscribe and set 🔔 » https://7news.link/YTSubscribe |   For the latest Australian news and breaking news alerts, connect with 7NEWS online: Visit » https://7news.com.au 7Plus » https://7plus.com.au/ 7NEWS Podcast » https://open.spotify.com/user/dm9fk9hzoe68ibpttheragdgi Facebook » https://www.facebook.com/7NewsAustralia TikTok » https://www.tiktok.com/@7newsaustralia Instagram » https://www.instagram.com/7newsaustralia/  X » https://x.com/7NewsAustralia   7NEWS combines the trusted and powerful news brands including Sunrise, The Morning Show, Spotlight and 7NEWS.com.au, delivering unique, engaging and continuous coverage on the issues that matter most to Australians. Watch 7 News Australia full broadcasts and full episodes at 6pm and weekdays at 12pm and 4pm on Channel 7 and 7plus.  #BREAKINGNEWS #7NEWS",https://www.youtube.com/watch?v=1sIwwmmUp44,7News
2025-10-28T08:44:43+00:00,At least eight Qld schools teach wrong topic for Year 12 exam | ABC NEWS,"In a serious curriculum blunder, at least eight Queensland state high schools have taught Year 12 students the wrong topic for their Ancient History exam. Students studied Augustus, an exam topic in previous years, instead of Julius Caesar. Subscribe: http://ab.co/1svxLVE Read more here: https://www.abc.net.au/news/2025-10-28/brisbane-school-apologies-teaching-wrong-topic/105941574  ABC NEWS provides around the clock coverage of news events as they break in Australia and abroad. It's news when you want it, from Australia's most trusted news organisation.  For more from ABC NEWS, click here: https://ab.co/2kxYCZY Watch more ABC NEWS content ad-free on ABC iview: https://ab.co/2OB7Mk1  Go deeper on our ABC NEWS In-depth channel: https://ab.co/2lNeBn2 Like ABC NEWS on Facebook: http://facebook.com/abcnews.au Follow ABC NEWS on Instagram: http://instagram.com/abcnews_au Follow ABC NEWS on X (Twitter): http://twitter.com/abcnews  Note: In most cases, our captions are auto-generated.  #ABCNEWS #ABCNEWSAustralia #ABCNEWSChannel",https://www.youtube.com/watch?v=1KQnTV1CX8k,ABC
2025-10-28T08:43:52+00:00,Melbourne's runaway crime crisis sparks decision to reopen a notorious children's jail | 7NEWS,"The youth crime crisis has prompted a U-turn on the closure of a controversial prison.   A costly overhaul and recruiting drive is planned for the Malmsbury Youth Justice Centre to reopen, just two years after it was closed down at great expense.   Subscribe and set 🔔 » https://7news.link/YTSubscribe |   For the latest Australian news and breaking news alerts, connect with 7NEWS online: Visit » https://7news.com.au 7Plus » https://7plus.com.au/ 7NEWS Podcast » https://open.spotify.com/user/dm9fk9hzoe68ibpttheragdgi Facebook » https://www.facebook.com/7NewsAustralia TikTok » https://www.tiktok.com/@7newsaustralia Instagram » https://www.instagram.com/7newsaustralia/  X » https://x.com/7NewsAustralia   7NEWS combines the trusted and powerful news brands including Sunrise, The Morning Show, Spotlight and 7NEWS.com.au, delivering unique, engaging and continuous coverage on the issues that matter most to Australians. Watch 7 News Australia full broadcasts and full episodes at 6pm and weekdays at 12pm and 4pm on Channel 7 and 7plus.  #BREAKINGNEWS #7NEWS",https://www.youtube.com/watch?v=rG1DbSAHJNE,7News
2025-10-28T08:42:32+00:00,How telcos are being forced to change in wake of last month's Triple Zero meltdown | 7NEWS,"Telcos are facing even bigger fines if their networks go offline in light of last month's deadly Optus outage.  Federal politicians are not seeing eye to eye on how to rein them in and prevent another catastrophic failure.  Subscribe and set 🔔 » https://7news.link/YTSubscribe |   For the latest Australian news and breaking news alerts, connect with 7NEWS online: Visit » https://7news.com.au 7Plus » https://7plus.com.au/ 7NEWS Podcast » https://open.spotify.com/user/dm9fk9hzoe68ibpttheragdgi Facebook » https://www.facebook.com/7NewsAustralia TikTok » https://www.tiktok.com/@7newsaustralia Instagram » https://www.instagram.com/7newsaustralia/  X » https://x.com/7NewsAustralia   7NEWS combines the trusted and powerful news brands including Sunrise, The Morning Show, Spotlight and 7NEWS.com.au, delivering unique, engaging and continuous coverage on the issues that matter most to Australians. Watch 7 News Australia full broadcasts and full episodes at 6pm and weekdays at 12pm and 4pm on Channel 7 and 7plus.  #BREAKINGNEWS #7NEWS",https://www.youtube.com/watch?v=d8lZxnbTr7I,7News
