published,title,description,link,Pub
2025-10-27T21:22:14+00:00,Labor preparing to scale back medal reform after veteran backlash,Labor is preparing to dramatically scale back plans to disqualify thousands of veterans from eligibility for retrospective honours.  A Senate Inquiry examining the bill is due to report back this week.  The bill remains highly contentious amongst veterans.,https://www.youtube.com/watch?v=6ytrXrxYdKQ,Sky News Australia
2025-10-27T21:21:55+00:00,"Two people killed in mine explosion in Cobar, western NSW | ABC NEWS","A man and a woman are dead after an explosion at the Endeavour Mine in western New South Wales. One other woman was taken to hospital with minor injuries. Subscribe: http://ab.co/1svxLVE Read more here: https://www.abc.net.au/news/2025-10-28/nsw-fatal-mine-explosion-cobar/105941058  ABC NEWS provides around the clock coverage of news events as they break in Australia and abroad. It's news when you want it, from Australia's most trusted news organisation.  For more from ABC NEWS, click here: https://ab.co/2kxYCZY Watch more ABC NEWS content ad-free on ABC iview: https://ab.co/2OB7Mk1  Go deeper on our ABC NEWS In-depth channel: https://ab.co/2lNeBn2 Like ABC NEWS on Facebook: http://facebook.com/abcnews.au Follow ABC NEWS on Instagram: http://instagram.com/abcnews_au Follow ABC NEWS on X (Twitter): http://twitter.com/abcnews  Note: In most cases, our captions are auto-generated.  #ABCNEWS #ABCNEWSAustralia",https://www.youtube.com/watch?v=meM2KYz8fC4,ABC
2025-10-27T21:10:26+00:00,Police scale back search for missing boatie,Victoria Police are slowing their search for 26-year-old boatie Sam Fowler after his boat capsized on Friday night. #capsize #boat #police #morningtonpier #victoria,https://www.youtube.com/shorts/siGukZAcCtM,7News
2025-10-27T21:03:27+00:00,ACCC sues Microsoft for misleading customers,"Australia's consumer watchdog has launched legal proceedings against Microsoft, accusing the tech giant of misleading tactics by showing customers cheaper Microsoft 365 plans when they attempted to cancel their subscriptions. #microsoft #techgiant #accc #subscription #consumerwatchdog",https://www.youtube.com/shorts/lFWLjJ_osM8,7News
2025-10-27T20:54:24+00:00,Donald Trump meets Japanese emperor,"US President Donald Trump has travelled to Japan to meet Emperor Naruhito, with talks scheduled with new Prime Minister Sanae Takaichi. #trump #japan #emperornaruhito #worldleader #sanaetakaichi",https://www.youtube.com/shorts/P3n5kSvSIjc,7News
2025-10-27T20:38:52+00:00,Prince Andrew agrees to leave Royal Lodge,"Disgraced royal Prince Andrew will be moving out of the Royal Lodge in Windsor, caving in to pressure from the Royal Family. #princeandrew #royals #britishroyals #royallodge #ukroyals",https://www.youtube.com/shorts/V2j6aU1YdpQ,7News
2025-10-27T20:35:25+00:00,‘Completely failing’: Labor’s net-zero agenda deteriorating ‘on its own terms’,Nationals Senator Matt Canavan says Labor’s net-zero agenda is “completely failing”.  Mr Canavan told Sky News Australia that it’s “failing on its own terms”.  “Because they promised us that net zero would lower power prices.”,https://www.youtube.com/watch?v=4LrabOg5iPc,Sky News Australia
2025-10-27T20:28:54+00:00,Bureau of Meteorology website under fire,"What do you think of the Bureau of Meteorology website redesign? | Subscribe and 🔔: http://9Soci.al/KM6e50GjSK9 | Get more breaking news at 9News.com.au: http://9Soci.al/iyCO50GjSK6  FOLLOW 9News Australia ► Facebook: https://www.facebook.com/9News/ ► Twitter: https://twitter.com/9NewsAUS ► Instagram: https://www.instagram.com/9news/  Join 9News for the latest in news and events that affect you in your local city, as well as news from across Australia and the world.  #BREAKINGNEWS #9NEWS #AUSTRALIA",https://www.youtube.com/shorts/CPf4GJay3Aw,9News
2025-10-27T20:26:23+00:00,Officer injured after police car crash,A NSW officer is being treated after a police car lost control and hit a guard rail in Parramatta. #police #crash #policecrash #sydney #parramatta,https://www.youtube.com/shorts/iP-AgRuIyFE,7News
2025-10-27T20:11:35+00:00,Donald Trump renews talks of running for a third US Presidential term | 9 News Australia,"US President Donald Trump has renewed talks of a third term. | *Subscribe and 🔔: http://9Soci.al/KM6e50GjSK9*  *Get more breaking news at 9News.com.au: http://9Soci.al/iyCO50GjSK6*  FOLLOW 9News Australia ► Facebook: https://www.facebook.com/9News/ ► Twitter: https://twitter.com/9NewsAUS ► Instagram: https://www.instagram.com/9news/  Join 9News for the latest in news and events that affect you in your local city, as well as news from across Australia and the world.  #9News #BreakingNews #NineNewsAustralia #9NewsAU",https://www.youtube.com/watch?v=z5RI8iacHlk,9News
2025-10-27T19:42:37+00:00,King Charles heckled over Prince Andrew; BOM's website faces backlash | 9 News Australia,"A member of the public has heckled King Charles during a royal visit over Prince Andrew's links to Jeffrey Epstein. In other news, the Bureau of Meteorology's new $4.1 million website is under fire, with one of its own meteorologists even admitting he does not use it. | *Subscribe and 🔔: http://9Soci.al/KM6e50GjSK9*  ►*Chapters in this video*: 0:00 King Charles heckled 2:17 Royal visit 2:31 Donald Trump's MRI scan 3:04 BOM website backlash 3:48 Victoria youth justice 4:09 Security focus at ASEAN 4:51 Barnaby Joyce plays down One Nation move 5:13 Nicole's revenge dress 6:44 Microsoft to face federal court 7:02 Adelaide Airport international travel 7:22 Queensland teachers given final pay offer 7:42 Swiftie spectacle spooks the suburbs  *Get more breaking news at 9News.com.au: http://9Soci.al/iyCO50GjSK6*  FOLLOW 9News Australia ► Facebook: https://www.facebook.com/9News/ ► Twitter: https://twitter.com/9NewsAUS ► Instagram: https://www.instagram.com/9news/  Join 9News for the latest in news and events that affect you in your local city, as well as news from across Australia and the world.  #9News #BreakingNews #NineNewsAustralia #9NewsAU",https://www.youtube.com/watch?v=2N28gdKXOkc,9News
2025-10-27T19:40:34+00:00,Donald Trump has not ruled out possibility of third term in office,US President Donald Trump has not ruled out the possibility of seeking a third term in office.  Mr Trump has conceded that he won’t be running as vice president.  Running as vice president would allow Donald Trump to circumvent the US Constitution and run for a third term.,https://www.youtube.com/watch?v=VOthgYaFxpI,Sky News Australia
2025-10-27T19:35:40+00:00,Hurricane Melissa strengthens to Category five storm,Hurricane Melissa has strengthened to a Category five storm as it begins lashing Jamaica.  Residents are preparing for what is expected to be the strongest Hurricane to ever hit the Island.  Forecasters expect the slow-moving system to drop as many as 40 inches of rain across parts of the island.,https://www.youtube.com/watch?v=SSUHNA-qH3A,Sky News Australia
2025-10-27T19:27:49+00:00,Trade truce between US and China looking likely,A trade truce between the United States and China looks likely ahead of the meeting between the country's leaders this week.   Donald Trump has arrived in Tokyo for talks with Japan's first female PM.  US Secretary of the Treasury Scott Bessent said the 100 per cent tariffs with China will be averted.,https://www.youtube.com/watch?v=yfU6ZowhfEQ,Sky News Australia
2025-10-27T18:47:01+00:00,Donald Trump arrives in Japan to meet Emperor and Prime Minister| 7NEWS,"Meeting Emperor and Prime Minister following ASEAN summit. Subscribe and set 🔔 » https://7news.link/YTSubscribe |   For the latest Australian news and breaking news alerts, connect with 7NEWS online: Visit » https://7news.com.au 7Plus » https://7plus.com.au/ 7NEWS Podcast » https://open.spotify.com/user/dm9fk9hzoe68ibpttheragdgi Facebook » https://www.facebook.com/7NewsAustralia TikTok » https://www.tiktok.com/@7newsaustralia Instagram » https://www.instagram.com/7newsaustralia/  X » https://x.com/7NewsAustralia   7NEWS combines the trusted and powerful news brands including Sunrise, The Morning Show, Spotlight and 7NEWS.com.au, delivering unique, engaging and continuous coverage on the issues that matter most to Australians. Watch 7 News Australia full broadcasts and full episodes at 6pm and weekdays at 12pm and 4pm on Channel 7 and 7plus.  #BREAKINGNEWS #7NEWS",https://www.youtube.com/watch?v=FzgHforx2VQ,7News
2025-10-27T18:46:59+00:00,Prince Andrew agrees to move | 7NEWS,"Disgraced royal reportedly relents, wants to move to Frogmore Cottage. Subscribe and set 🔔 » https://7news.link/YTSubscribe |   For the latest Australian news and breaking news alerts, connect with 7NEWS online: Visit » https://7news.com.au 7Plus » https://7plus.com.au/ 7NEWS Podcast » https://open.spotify.com/user/dm9fk9hzoe68ibpttheragdgi Facebook » https://www.facebook.com/7NewsAustralia TikTok » https://www.tiktok.com/@7newsaustralia Instagram » https://www.instagram.com/7newsaustralia/  X » https://x.com/7NewsAustralia   7NEWS combines the trusted and powerful news brands including Sunrise, The Morning Show, Spotlight and 7NEWS.com.au, delivering unique, engaging and continuous coverage on the issues that matter most to Australians. Watch 7 News Australia full broadcasts and full episodes at 6pm and weekdays at 12pm and 4pm on Channel 7 and 7plus.  #BREAKINGNEWS #7NEWS",https://www.youtube.com/watch?v=W_pZIxBuiR0,7News
2025-10-27T18:46:56+00:00,"Western Sydney police crash, Prince Andrew moves, BOM radar slammed |7NEWS","Subscribe and set 🔔 » https://7news.link/YTSubscribe |   For the latest Australian news and breaking news alerts, connect with 7NEWS online: Visit » https://7news.com.au 7Plus » https://7plus.com.au/ 7NEWS Podcast » https://open.spotify.com/user/dm9fk9hzoe68ibpttheragdgi Facebook » https://www.facebook.com/7NewsAustralia TikTok » https://www.tiktok.com/@7newsaustralia Instagram » https://www.instagram.com/7newsaustralia/  X » https://x.com/7NewsAustralia   7NEWS combines the trusted and powerful news brands including Sunrise, The Morning Show, Spotlight and 7NEWS.com.au, delivering unique, engaging and continuous coverage on the issues that matter most to Australians. Watch 7 News Australia full broadcasts and full episodes at 6pm and weekdays at 12pm and 4pm on Channel 7 and 7plus.  #BREAKINGNEWS #7NEWS",https://www.youtube.com/watch?v=VYyz7105WNU,7News
2025-10-27T18:01:04+00:00,Shania Twain Joins Australian TikTok Comedian Tom Cardy In New Uber Ad | 10 News+,"Entertainment Editor Angela Bishop spoke to Shania Twain on the set of a new Uber advertisement featuring the ‘Queen of Country Pop’. Twain has teamed up with Aussie comedian and TikTok star Tom Cardy for the ad campaign, which celebrates the freedom and joy of being an Uber passenger.   Join the conversation and follow us on:  Instagram: https://www.instagram.com/10NewsPlus/  TikTok: https://www.tiktok.com/@10newsplus/  Snapchat: https://www.snapchat.com/add/tennewsplus  Spotify: https://open.spotify.com/show/0tWZ6sIJTQ2WHgYdjgaAA7?si=cb30d7fd3d3541fa   10 News+ airs at 6pm, from Sunday to Friday on Network 10.  Missed the bulletin? Catch up at https://10.com.au/news/   10 News+ is based in Australia and is a division of Paramount.",https://www.youtube.com/watch?v=tbCUVBPPjQE,10 News
2025-10-27T12:11:41+00:00,‘Walking disaster’: Catherine Connolly won the Irish election off a ‘technicality’,"Writer and Broadcaster Esther Krakue discusses Ireland’s recently elected hard-left President Catherine Connolly.  “She won basically off a technicality,” Ms Krakue told Sky News host Andrew Bolt.  “She is a complete walking disaster.  “She’s a typical champagne socialist.”",https://www.youtube.com/watch?v=p9LNaHNLh9o,Sky News Australia
2025-10-27T12:11:30+00:00,‘A complete mess’: Transmission line planning continues after failing thresholds,"Nationals MP Brendan Moylan explains the poor choices behind new transmission lines locations.  “It’s a complete mess,” Mr Moylan told Sky News host Paul Murray.  “This path that they’ve adopted failed five out of six of the government’s own thresholds.  “It just makes no sense.”",https://www.youtube.com/watch?v=kPcpi-vbue0,Sky News Australia
2025-10-27T12:09:49+00:00,‘Forced Acquisition’: Government takes farmland then complains when farmers are upset,"New South Wales farmer Anna Young expresses frustrations over the lack of government transparency and consultation, particularly with structures which could severely impact her land.  “It’s going to be forced acquisition of our land,” Ms Young told Sky News host Paul Murray.   “Anyone in our position has a right to be upset about your land being taken.”",https://www.youtube.com/watch?v=NrqHOgVxLWY,Sky News Australia
2025-10-27T12:01:24+00:00,‘Threat of China’: Albanese meets with Chinese Premier Li,"Sky News host Sharri Markson discusses the “threat of China” as Prime Minister Anthony Albanese meets with Chinese Premier Li Qiang.  “The threat of China’s aggressive conduct is the underlying concern … two US aircraft have crashed over the South China Sea. This is alarming and we await more details from the United States about the cause,” Ms Markson said.  “Prime Minister Anthony Albanese met with Chinese Premier Li Qiang today for their bilateral, it was their seventh meeting and it came just a week after a dangerous incident for Australian pilots over the South China Sea.”",https://www.youtube.com/watch?v=gnSVM_8ulRk,Sky News Australia
2025-10-27T12:00:58+00:00,9News Brisbane | Monday October 27 | Full Episode,"Melissa Downs and Joel Dry lead the Queensland news with extensive coverage of the severe storm that battered the Southeast over the weekend. They show the full force of the storm's destruction, which has led to mass power outages and 15 school closures. Clean-up crews are racing against time to restore electricity to tens of thousands of homes.  Politically, the Queensland Teachers' Union has received a ""final pay offer"" from the State Government, which union members will now vote on amidst concerns over class violence and teacher retention. Plus, a new Bureau of Meteorology website is causing frustration among users, and we have full details on when the record heat will finally break.  | Subscribe and 🔔: http://9Soci.al/KM6e50GjSK9 | Get more breaking news at 9News.com.au: http://9Soci.al/iyCO50GjSK6  CHAPTERS 0:00 Intro Headlines 0:54 Storm Destruction Live from Mount Ommaney 1:27 Home Owners Detail Tree Intrusion Damage 1:55 Home Owner Lucy Meutermans Describes the Trauma 2:14 Emilia Mardani on Wind and Hail Experience 2:28 Damage at Jamboree Heights State School 2:41 Damaged House in Highgate Hill 2:57 School Closures Due to Storm Damage 3:02 SES Nadine Ramsay on Clean-Up Efforts 3:13 Energex Crew Working on Power Lines 3:37 Golf Ball Sized Hail 3:55 Storm Cloud Over Brisbane 4:01 Brisbane City Council on Recovery Patience 4:10 Live from Mount Ommaney: Full Extent of Damage 4:30 Damage to School Property 4:36 Education Minister John-Paul Langbroek on School Closures 4:50 List of 15 Schools Closed Today 5:17 Live from Corinda: School Closures and Re-opening 5:51 Live from State Parliament: Education Minister John-Paul Langbroek 6:55 Live from Mount Ommaney: Power Outages Update 7:13 Hail and Rain Damage Footage 7:25 Resident on Storm Damage and Insurance 7:31 Insurance Claims Top 4,000 for Storms 7:45 Weather Expert Josh Bavas on Hail Track 7:56 Weather Bureau Staff Working on Data 8:07 Insurance Council of Australia on Claims Process 8:36 Suncorp on Customer Calls and Support 9:03 Live from Kenmore: Mass Power Outages Continue 9:55 Energex Crew on Ongoing Restoration Efforts 10:32 BOM Website New Look Backlash 11:10 Record Heat in Southeast Queensland 11:22 Brisbane Records Hottest October Day on Record 11:43 Ambulance Service on Heat-Related Illness Spike 12:20 Rural Fire Service on Extreme Fire Danger 13:13 Live from Surfers Paradise: Wild Weather Update 17:02 Queensland Teachers' Union Pay Offer Rally 17:12 Education Minister on Pay Offer 17:24 Teacher Salary Increases by 2028 18:20 Teachers Union on Pay Frustrations 18:42 Teacher Union Members to Vote on New Deal 19:35 Upcoming Stories 20:13 Microsoft Accused by ACCC 21:53 Anti-Semitic Attack Mastermind Identified 22:19 Hurricane Melissa Gathers Strength Towards Jamaica 22:38 Darren Palmer's Prize Home Tour 22:52 Upcoming Stories 23:21 Russia Hails Missile Test 23:39 London Sex Offender Back in Custody 24:04 Brisbane Airport Security Overhaul  FOLLOW 9News Australia ► Facebook: https://www.facebook.com/9News/ ► Twitter: https://twitter.com/9NewsAUS ► Instagram: https://www.instagram.com/9news/  Join 9News for the latest in news and events that affect you in your local city, as well as news from across Australia and the world.  #BREAKINGNEWS #9NEWS #AUSTRALIA",https://www.youtube.com/watch?v=UElEbQdF_CQ,9News
2025-10-27T12:00:41+00:00,Farmers uproar as government takes land without informing them,"New South Wales farmer Anna Young shares concerns about the abrupt changes to transmission line routes affecting her properties without prior notification.  “They just said we’re moving the line,” Ms Young told Sky News host Paul Murray.   “They’ve studied this line … they’ve said multiple times that it’s not a good option.  “Some farmers haven’t actually been told yet.”",https://www.youtube.com/watch?v=6mG5zo7D_p0,Sky News Australia
2025-10-27T11:57:35+00:00,‘Fighting a war’: Iran allegedly orchestrates worldwide antisemitic attacks,"Israel’s Deputy Foreign Minister Sharren Haskel explains revelations of Iran's alleged orchestration of worldwide antisemitic actions aimed at creating terror.  “Iran’s fighting a war, which in not a territorial war. It’s fighting a religious war, a cultural war where the Jews are at the frontline,” Ms Haskel told Sky News host Sharri Markson.   “Part of their strategy and how they're operating all around the world.”",https://www.youtube.com/watch?v=NGGpAo3iSjw,Sky News Australia
2025-10-27T11:56:11+00:00,Queensland psychiatrist fights termination notice,"Senior Child and Adolescent Psychiatrist Dr Jillian Spencer discusses her legal battle with Queensland Health after she was sent an employment termination notice by Queensland’s Children’s Hospital.   She has consistently spoken out about the potential harm of puberty blockers and gender affirming care when it comes to children.   Her termination notice, because of this pending legal action, has been put on hold.",https://www.youtube.com/watch?v=OzW0zm0jvdg,Sky News Australia
2025-10-27T11:55:50+00:00,‘Cards stacked against’: Prince Andrew forced to leave his home,"Writer and Broadcaster Esther Krakue explains the serious allegations Prince Andrew faces.  “This is probably as serious as it gets,” Ms Krakue told Sky News host Andrew Bolt.  “Stripping Prince Andrew of his titles is just the beginning.  “Now that the cards are stacked against him and things are looking dicier than usual … he has no choice but to leave.”",https://www.youtube.com/watch?v=uLw4YM9-ZTY,Sky News Australia
2025-10-27T11:55:41+00:00,‘Planning and sophistication’ of Louvre heist suggests a ‘broader' network involved,"Spiked online editor Tom Slater details the Louvre heist arrests and hints at a broader network involvement.  “These two individuals have been arrested,” Mr Slater told Sky News host Sharri Markson.  “The fact that the police are particularly touchy about information getting out there would suggest that a kind broader network beyond those two were involved in this heist.  “Maybe that indicates the level of planning and sophistication that goes beyond those two.”",https://www.youtube.com/watch?v=Ppt2i6ffSQo,Sky News Australia
2025-10-27T11:30:32+00:00,Hurricane Melissa tipped to bring catastrophic flooding to Jamaica | The World | ABC NEWS,"Hurricane Melissa is threatening to unleash catastrophic flooding in the northern Caribbean, as the slow-moving system heads towards Jamaica. David Kennedy, a coastal geomorphologist and professor in physical geography, tells The World the island is in the direct path of the system and will feel the full impact when it hits.   Subscribe: http://ab.co/1svxLVE  ABC NEWS provides around the clock coverage of news events as they break in Australia and abroad. It's news when you want it, from Australia's most trusted news organisation.  For more from ABC NEWS, click here: https://ab.co/2kxYCZY Watch more ABC NEWS content ad-free on ABC iview: https://ab.co/2OB7Mk1  Go deeper on our ABC NEWS In-depth channel: https://ab.co/2lNeBn2 Like ABC NEWS on Facebook: http://facebook.com/abcnews.au Follow ABC NEWS on Instagram: http://instagram.com/abcnews_au Follow ABC NEWS on X (Twitter): http://twitter.com/abcnews  Note: In most cases, our captions are auto-generated.  #ABCNEWS #ABCNEWSAustralia #ABCTheWorld #ABCAsiaPacific",https://www.youtube.com/watch?v=GbVhg8YQkig,ABC
2025-10-27T11:26:29+00:00,US Democratic Senate candidate apologises for tattoo of Nazi symbol | ABC NEWS,"US senate candidate in the state of Maine, Graham Platner, has been making headlines after a revelation he had a Nazi symbol tattooed on his chest. But Alexander Hinton, director of the Center for the Study of Genocide and Human Rights, says his main concern is still with the right wing of US politics, where apologies over Nazi references and symbols are less forthcoming.  Subscribe: http://ab.co/1svxLVE  ABC NEWS provides around the clock coverage of news events as they break in Australia and abroad. It's news when you want it, from Australia's most trusted news organisation.  For more from ABC NEWS, click here: https://ab.co/2kxYCZY Watch more ABC NEWS content ad-free on ABC iview: https://ab.co/2OB7Mk1  Go deeper on our ABC NEWS In-depth channel: https://ab.co/2lNeBn2 Like ABC NEWS on Facebook: http://facebook.com/abcnews.au Follow ABC NEWS on Instagram: http://instagram.com/abcnews_au Follow ABC NEWS on X (Twitter): http://twitter.com/abcnews  Note: In most cases, our captions are auto-generated  #ABCNEWS #ABCNEWSAustralia #ABCTheWorld #ABCAsiaPacific",https://www.youtube.com/watch?v=Z-gW3x25Uqo,ABC
2025-10-27T11:00:37+00:00,9News Melbourne | Monday October 27 | Full Episode,"Alicia Loxley and Tom Steinfort present the Melbourne news featuring harrowing exclusive vision of a Clyde North family fighting off armed intruders during an early morning home invasion. The weather has caused widespread damage, with a tornado tearing a path of destruction through Melbourne's west, and emergency services battling an overnight house fire caused by lightning.  The parents of Hanna McGuire deliver powerful victim impact statements to the court following their daughter's murder, and tech giant Microsoft faces a major lawsuit from the ACCC over alleged misleading subscription price hikes. Plus, racing royalty Gai and Robbie Waterhouse share their secrets for success. | Subscribe and 🔔: http://9Soci.al/KM6e50GjSK9 | Get more breaking news at 9News.com.au: http://9Soci.al/iyCO50GjSK6  CHAPTERS 0:00 Intro Headlines 0:48 Clyde North Home Invasion: Family Under Siege 1:34 Victim Reynod Ephraim Recounts Terror 2:22 Opposition Leader Brad Battin Criticises Crime Spike 2:56 Albion Standoff: Man Waving Imitation Gun Arrested 3:21 Police Use Critical Incident Response Team 4:05 Tornado Chaos: Freak Storm Hits Werribee 4:39 Residents Describe Intense Wind and Damage 4:56 Resident Glenn Freeman on Ruined Home 5:15 Path of Destruction: Manor Lakes to Hoppers Crossing 5:30 Weather Bureau on Storm's Suddenness 5:46 Tornado Damage: Roofs Ripped Off, Clean-Up Underway 6:15 Flash Flooding in Footscray and Melbourne 6:20 Lightning Strike House Fire 6:28 SES Commander on Calls for Help 6:35 Live from Werribee: Clean-Up Continues 7:31 Search Scaled Back for Missing Fisherman Sam Fowler 7:48 Hanna McGuire's Parents' Pain: Killer to be Sentenced 8:17 Mother Debbie McGuire on Enduring Pain 8:35 Father Glenn McGuire on Loss 8:41 Body Found in Burnt-Out Car (Lochlan Young) 9:04 Young Described as Controlling and Abusive 9:58 Hanna McGuire and Lochlan Young Background 10:11 Australia-China Meeting: ""Word of Warning"" 10:27 Albanese Meets Chinese Premier Li Qiang 11:30 US-Australia Critical Minerals Deal 12:12 Live from Malaysia: Liz Daniels on ASEAN Summit 13:00 Melbourne Airport Rail Planning Discussions 13:24 Traffic Relief: New Wurundjeri Way Extension Opens 13:50 Software Shock: Microsoft Sued by ACCC 14:18 ACCC Chair Gina Cass-Gottlieb on Alleged Misleading Prices 15:07 Potential $6 Trillion Fine 15:40 Melbourne Cup Carnival Launch 16:00 Live from Flemington: Tony Jones on Festivities 17:09 Racing Royalty Gai and Robbie Waterhouse Interview 18:51 Upcoming Stories 19:22 Hoon Driver Misses Pedestrians by ""Sheer Miracle"" 19:57 Taxi Carjacked in the City Last Night 20:14 Melbourne Lord Mayor Nick Reece on Street Watch Cameras 21:46 AI Technology to Assist CCTV Monitoring 22:33 Live from Town Hall: Street Safety Officers Deployed 23:19 Louvre Heist Arrests 23:40 Iranian Official Identified as Attack Mastermind 24:07 Cargo Plane Wreckage Salvaged in Hong Kong 24:24 Surfboard Lost Off Tasmania Found in New Zealand 24:57 Melbourne Weather Forecast FOLLOW 9News Australia ► Facebook: https://www.facebook.com/9News/ ► Twitter: https://twitter.com/9NewsAUS ► Instagram: https://www.instagram.com/9news/  Join 9News for the latest in news and events that affect you in your local city, as well as news from across Australia and the world.  #BREAKINGNEWS #9NEWS #AUSTRALIA",https://www.youtube.com/watch?v=HVKsWpi4-HU,9News
