published,title,description,link,Pub
2025-10-29T02:21:54+00:00,Building resilience in struggling young minds | 7NEWS,"Scott Watters, founder of Life Changer, discusses the mental health crisis affecting young people globally, with 80% suffering mental health issues in the past two years. His program worked with 141,000 young people last year, focusing on building resilience skills and social connections before problems develop. Watters emphasises the importance of meaningful presence and conversation, noting that adults spend only 18 seconds daily in meaningful conversation with young people in their lives.  Subscribe and set 🔔 » https://7news.link/YTSubscribe |   For the latest Australian news and breaking news alerts, connect with 7NEWS online: Visit » https://7news.com.au 7Plus » https://7plus.com.au/ 7NEWS Podcast » https://open.spotify.com/user/dm9fk9hzoe68ibpttheragdgi Facebook » https://www.facebook.com/7NewsAustralia TikTok » https://www.tiktok.com/@7newsaustralia Instagram » https://www.instagram.com/7newsaustralia/ X » https://x.com/7NewsAustralia  7NEWS combines the trusted and powerful news brands including Sunrise, The Morning Show, Spotlight and 7NEWS.com.au, delivering unique, engaging and continuous coverage on the issues that matter most to Australians. Watch 7 News Australia full broadcasts and full episodes at 6pm and weekdays at 12pm and 4pm on Channel 7 and 7plus.  #BREAKINGNEWS #7NEWS",https://www.youtube.com/watch?v=SMPjD3PS9Vw,7News
2025-10-29T02:20:51+00:00,Patients dies at Sutherland Hospital after critical services allegedly cut off,A patient has died after the gas supply was allegedly switched off at Sutherland Hospital in Sydney's south. #hospital #gas #oxygen #sutherland #sydney,https://www.youtube.com/shorts/rv44VC05S1s,7News
2025-10-29T02:19:15+00:00,Netanyahu orders ‘powerful’ strikes on Gaza as fragile ceasefire is broken,"Only a few weeks after the Gaza ceasefire came into effect, Israel has launched fresh strikes on the territory.  Both sides have accused each other of violating the fragile truce.  The strikes followed an order from Israeli Prime Minister Benjamin Netanyahu for ""powerful"" attacks.  Since those strikes landed, a Hamas-affiliated defence agency has claimed nine people have been killed.  This comes as Hamas has delayed handing over another hostage’s body in response to Israel’s planned strikes.",https://www.youtube.com/watch?v=osZ5Hrr7ajg,Sky News Australia
2025-10-29T02:16:04+00:00,Billions in super sitting unclaimed | 7NEWS,"The federal government has revealed $19 billion in superannuation is currently sitting lost or unclaimed across Australia. This can occur when people change their name, change jobs, or work overseas, potentially resulting in multiple fees being charged. Australians can check if they're owed money through their super fund directly or via the Super Health Check portal on their ATO-linked myGov account.  Subscribe and set 🔔 » https://7news.link/YTSubscribe |   For the latest Australian news and breaking news alerts, connect with 7NEWS online: Visit » https://7news.com.au 7Plus » https://7plus.com.au/ 7NEWS Podcast » https://open.spotify.com/user/dm9fk9hzoe68ibpttheragdgi Facebook » https://www.facebook.com/7NewsAustralia TikTok » https://www.tiktok.com/@7newsaustralia Instagram » https://www.instagram.com/7newsaustralia/ X » https://x.com/7NewsAustralia  7NEWS combines the trusted and powerful news brands including Sunrise, The Morning Show, Spotlight and 7NEWS.com.au, delivering unique, engaging and continuous coverage on the issues that matter most to Australians. Watch 7 News Australia full broadcasts and full episodes at 6pm and weekdays at 12pm and 4pm on Channel 7 and 7plus.  #BREAKINGNEWS #7NEWS",https://www.youtube.com/watch?v=KlKDJD8IbZs,7News
2025-10-29T02:15:42+00:00,Queensland students taught wrong history topic for exams | 7NEWS,"An investigation has been ordered into a major education blunder in Queensland where students from up to nine schools were taught the wrong topic for their Year 12 ancient history exams. The 140 affected students learnt about Augustus instead of Julius Caesar, but the state's education minister says they will be scored using their completed assessments and will not be disadvantaged. School leavers are sitting their final exams today.  Subscribe and set 🔔 » https://7news.link/YTSubscribe |   For the latest Australian news and breaking news alerts, connect with 7NEWS online: Visit » https://7news.com.au 7Plus » https://7plus.com.au/ 7NEWS Podcast » https://open.spotify.com/user/dm9fk9hzoe68ibpttheragdgi Facebook » https://www.facebook.com/7NewsAustralia TikTok » https://www.tiktok.com/@7newsaustralia Instagram » https://www.instagram.com/7newsaustralia/ X » https://x.com/7NewsAustralia  7NEWS combines the trusted and powerful news brands including Sunrise, The Morning Show, Spotlight and 7NEWS.com.au, delivering unique, engaging and continuous coverage on the issues that matter most to Australians. Watch 7 News Australia full broadcasts and full episodes at 6pm and weekdays at 12pm and 4pm on Channel 7 and 7plus.  #BREAKINGNEWS #7NEWS",https://www.youtube.com/watch?v=CG2Z8_hiz70,7News
2025-10-29T02:15:18+00:00,Critical shortage of O-negative blood in Australia | 7NEWS,"Australia's blood supply is experiencing a critical shortage of O-negative blood, the universal blood type that can be given to any patient during emergencies. Lifeblood requires a blood donation every 18 seconds to meet patient demand and is urgently seeking more donors this week.  Subscribe and set 🔔 » https://7news.link/YTSubscribe |   For the latest Australian news and breaking news alerts, connect with 7NEWS online: Visit » https://7news.com.au 7Plus » https://7plus.com.au/ 7NEWS Podcast » https://open.spotify.com/user/dm9fk9hzoe68ibpttheragdgi Facebook » https://www.facebook.com/7NewsAustralia TikTok » https://www.tiktok.com/@7newsaustralia Instagram » https://www.instagram.com/7newsaustralia/ X » https://x.com/7NewsAustralia  7NEWS combines the trusted and powerful news brands including Sunrise, The Morning Show, Spotlight and 7NEWS.com.au, delivering unique, engaging and continuous coverage on the issues that matter most to Australians. Watch 7 News Australia full broadcasts and full episodes at 6pm and weekdays at 12pm and 4pm on Channel 7 and 7plus.  #BREAKINGNEWS #7NEWS",https://www.youtube.com/watch?v=W1wTITuygh4,7News
2025-10-29T02:14:20+00:00,Neighbour threatens elderly dogs | 9 News Australia,"A Sydney family has been shaken up, after receiving a sinister letter from a neighbour threatening to poison their dogs. #9News",https://www.youtube.com/shorts/SPcqIZZpLpA,9News
2025-10-29T02:14:19+00:00,Chuck Schumer blasted for bizarrely demanding $4M for LGBT campaign in order to reopen government,"Speaker Johnson has gone on a rampage against Chuck Schumer and the Democrats, blasting their list of demands in order to reopen the government.",https://www.youtube.com/watch?v=VeTCySf4PM0,Sky News Australia
2025-10-29T02:03:37+00:00,Donald Trump breaks out iconic dance for troops aboard US aircraft carrier in Japan,"US President Donald Trump put on a show for US troops aboard an aircraft carrier during his trip to Japan alongside Prime Minister Sanae Takaichi.  On Wednesday, President Trump delivered an address to sailors and Navy personnel on the USS George Washington.  Before Trump’s arrival, the ‘Top Gun’ theme song played before the troops sang along to ‘Sweet Caroline’ and ‘Party in the USA’ while awaiting Trump.  Once the president arrived on the ship, he made an incredible entrance, standing between two aircraft, leading to a crowd of troops roaring.",https://www.youtube.com/watch?v=S2gwfIivRuY,Sky News Australia
2025-10-29T02:01:04+00:00,City of Sydney limits busking in the CBD | ABC NEWS,"The City of Sydney is introducing laws to limit buskers from performing in the CBD. Under the changes, no busking is permitted on George Street between Circular Quay and Haymarket except for six spots, limited to an hour per busker per day on a first-in basis. Subscribe: http://ab.co/1svxLVE Read more here: https://www.abc.net.au/news/2025-10-29/nsw-city-of-sydney-council-busking-policy-introduced-music/105942862   ABC NEWS provides around the clock coverage of news events as they break in Australia and abroad. It's news when you want it, from Australia's most trusted news organisation.  For more from ABC NEWS, click here: https://ab.co/2kxYCZY Watch more ABC NEWS content ad-free on ABC iview: https://ab.co/2OB7Mk1  Go deeper on our ABC NEWS In-depth channel: https://ab.co/2lNeBn2 Like ABC NEWS on Facebook: http://facebook.com/abcnews.au Follow ABC NEWS on Instagram: http://instagram.com/abcnews_au Follow ABC NEWS on X (Twitter): http://twitter.com/abcnews  Note: In most cases, our captions are auto-generated.  #ABCNEWS #ABCNEWSAustralia",https://www.youtube.com/watch?v=tctghy8YvUo,ABC
2025-10-29T01:56:29+00:00,Coalition is set to ‘abandon net zero’,"Sky News Political Editor Andrew Clennell says the Coalition is “going to abandon net zero”.  Mr Clennell said it will “save” Opposition Leader Sussan Ley’s leadership in the short term.  “They’ll still have a climate target, but they’ll focus on energy price.”",https://www.youtube.com/watch?v=neQrXMXyh54,Sky News Australia
2025-10-29T01:55:42+00:00,Labor's environmental law reforms put a ‘handbrake’ on investment,"Liberal Senator Jane Hume says the EPBC Act needs to help not just the environment, but also the economy, which is where ""the problem lies”.  ""Our concern is that these new laws are simply nature positive two point zero, that they are a handbrake on investment,” Ms Hume told Sky News Australia.  “That they are a red light to jobs in Australia and they are a  green light for sending more investments overseas.”",https://www.youtube.com/watch?v=_sDDvkWzdNM,Sky News Australia
2025-10-29T01:48:45+00:00,Queensland reinstates puberty blocker ban hours after court ruling | 7NEWS,"Queensland's Health Minister Tim Nicholls has reinstated a ban on doctors prescribing puberty blockers for gender dysphoric adolescents, just six hours after the Supreme Court ruled the original ban unlawful. The judge clarified his decision was based on legal requirements rather than health advice, allowing the Minister to implement his own pause on these healthcare services.  Subscribe and set 🔔 » https://7news.link/YTSubscribe |   For the latest Australian news and breaking news alerts, connect with 7NEWS online: Visit » https://7news.com.au 7Plus » https://7plus.com.au/ 7NEWS Podcast » https://open.spotify.com/user/dm9fk9hzoe68ibpttheragdgi Facebook » https://www.facebook.com/7NewsAustralia TikTok » https://www.tiktok.com/@7newsaustralia Instagram » https://www.instagram.com/7newsaustralia/ X » https://x.com/7NewsAustralia  7NEWS combines the trusted and powerful news brands including Sunrise, The Morning Show, Spotlight and 7NEWS.com.au, delivering unique, engaging and continuous coverage on the issues that matter most to Australians. Watch 7 News Australia full broadcasts and full episodes at 6pm and weekdays at 12pm and 4pm on Channel 7 and 7plus.  #BREAKINGNEWS #7NEWS",https://www.youtube.com/watch?v=mUuR-SintJs,7News
2025-10-29T01:46:35+00:00,Two miners killed in Cobar mine explosion | 7NEWS,"Two miners were killed in an underground explosion at the Polymetals Silver and Zinc Mine in Cobar, New South Wales, just before 4am yesterday morning. The victims were 66-year-old Ambrose McMullen and 24-year-old Holly Clarke, while sole survivor 24-year-old Mackenzie Stirling was airlifted to Orange Hospital with hearing damage and shock. An investigation including a full audit of safety processes is underway, with the mine remaining closed and Polymetals in a trading halt.  Subscribe and set 🔔 » https://7news.link/YTSubscribe |   For the latest Australian news and breaking news alerts, connect with 7NEWS online: Visit » https://7news.com.au 7Plus » https://7plus.com.au/ 7NEWS Podcast » https://open.spotify.com/user/dm9fk9hzoe68ibpttheragdgi Facebook » https://www.facebook.com/7NewsAustralia TikTok » https://www.tiktok.com/@7newsaustralia Instagram » https://www.instagram.com/7newsaustralia/ X » https://x.com/7NewsAustralia  7NEWS combines the trusted and powerful news brands including Sunrise, The Morning Show, Spotlight and 7NEWS.com.au, delivering unique, engaging and continuous coverage on the issues that matter most to Australians. Watch 7 News Australia full broadcasts and full episodes at 6pm and weekdays at 12pm and 4pm on Channel 7 and 7plus.  #BREAKINGNEWS #7NEWS",https://www.youtube.com/watch?v=kvZgpazDCrU,7News
2025-10-29T01:44:21+00:00,Armed gang threatens Melbourne family in home invasion | 7NEWS,"Three armed men broke into a family home in Melbourne's inner east at 3am, threatening a 46-year-old father with hammers and bats while demanding car keys. The intruders fled in the family's white Jeep Cherokee after the father's three-and-a-half-year-old daughter briefly appeared during the confrontation. No one was injured in the incident, which adds to Melbourne's escalating run of home invasions.  Subscribe and set 🔔 » https://7news.link/YTSubscribe |   For the latest Australian news and breaking news alerts, connect with 7NEWS online: Visit » https://7news.com.au 7Plus » https://7plus.com.au/ 7NEWS Podcast » https://open.spotify.com/user/dm9fk9hzoe68ibpttheragdgi Facebook » https://www.facebook.com/7NewsAustralia TikTok » https://www.tiktok.com/@7newsaustralia Instagram » https://www.instagram.com/7newsaustralia/ X » https://x.com/7NewsAustralia  7NEWS combines the trusted and powerful news brands including Sunrise, The Morning Show, Spotlight and 7NEWS.com.au, delivering unique, engaging and continuous coverage on the issues that matter most to Australians. Watch 7 News Australia full broadcasts and full episodes at 6pm and weekdays at 12pm and 4pm on Channel 7 and 7plus.  #BREAKINGNEWS #7NEWS",https://www.youtube.com/watch?v=Zloz41iQ900,7News
2025-10-29T01:43:21+00:00,Oasis arrives in Australia for reunion tour | 7NEWS,"British rock band Oasis has arrived in Australia for their highly anticipated reunion tour. Frontman Liam Gallagher was spotted making a low-key arrival in Melbourne wearing a bucket hat and sunglasses. The band will perform three shows starting Friday in Melbourne before moving to Sydney.  Subscribe and set 🔔 » https://7news.link/YTSubscribe |   For the latest Australian news and breaking news alerts, connect with 7NEWS online: Visit » https://7news.com.au 7Plus » https://7plus.com.au/ 7NEWS Podcast » https://open.spotify.com/user/dm9fk9hzoe68ibpttheragdgi Facebook » https://www.facebook.com/7NewsAustralia TikTok » https://www.tiktok.com/@7newsaustralia Instagram » https://www.instagram.com/7newsaustralia/ X » https://x.com/7NewsAustralia  7NEWS combines the trusted and powerful news brands including Sunrise, The Morning Show, Spotlight and 7NEWS.com.au, delivering unique, engaging and continuous coverage on the issues that matter most to Australians. Watch 7 News Australia full broadcasts and full episodes at 6pm and weekdays at 12pm and 4pm on Channel 7 and 7plus.  #BREAKINGNEWS #7NEWS",https://www.youtube.com/watch?v=JvVN6lAmqQw,7News
2025-10-29T01:41:29+00:00,CNN bitterly admit Republican polling has impoved during shutdown,"CNN has had to admit that the Republicans have gained popularity while breaking down polling data regarding the shutdown.  Chief Data Analyst Harry Enten says the shutdown, which was supposed to hurt the GOP, has actually helped the party's brand.  The polls come amid the federal government shutdown, which began on October 1 and is quickly approaching the one-month mark.  Citing the Generic Congressional Ballot, which shows that the Democrats are less favourable than at the same time during Trump's first term.  Enten goes on to say the Democrats are in their ""worst"" position in 20 years and that the number is ""concerning"" for the party.",https://www.youtube.com/watch?v=1LossM_eeHE,Sky News Australia
2025-10-29T01:38:57+00:00,Pat Cummins puts back injury to the test in the nets,"Australian fast bowler Pat Cummins has been seen putting his back injury to the test in the nets today.  His initial efforts were seen at New South Wales Cricket Central in Sydney’s west today.   Fox Sports News exclusive footage captured the moment the Test captain was seen rolling the arm over.   This move hopes to be a sign for his road to recovery, which will lead him to play some role in the Ashes, after it was revealed Cummins has been dealing with lower lumbar back stress.",https://www.youtube.com/watch?v=MeTbnrrFV3Y,Sky News Australia
2025-10-29T01:38:40+00:00,Inflation spike kills Melbourne Cup rate cut hopes | 7NEWS,"Australia's inflation rate has risen to 3.2% headline and 3% underlying, marking the first increase in underlying inflation since 2022. Electricity prices have surged 23% over the past 12 months, driving the inflation spike and pushing the underlying rate to the top of the Reserve Bank's 2-3% target band. The Reserve Bank Board is now extremely unlikely to cut the cash rate from its current 3.6% when it meets on Melbourne Cup Day.  Subscribe and set 🔔 » https://7news.link/YTSubscribe |   For the latest Australian news and breaking news alerts, connect with 7NEWS online: Visit » https://7news.com.au 7Plus » https://7plus.com.au/ 7NEWS Podcast » https://open.spotify.com/user/dm9fk9hzoe68ibpttheragdgi Facebook » https://www.facebook.com/7NewsAustralia TikTok » https://www.tiktok.com/@7newsaustralia Instagram » https://www.instagram.com/7newsaustralia/ X » https://x.com/7NewsAustralia  7NEWS combines the trusted and powerful news brands including Sunrise, The Morning Show, Spotlight and 7NEWS.com.au, delivering unique, engaging and continuous coverage on the issues that matter most to Australians. Watch 7 News Australia full broadcasts and full episodes at 6pm and weekdays at 12pm and 4pm on Channel 7 and 7plus.  #BREAKINGNEWS #7NEWS",https://www.youtube.com/watch?v=3Xp6Zi2o8I8,7News
2025-10-29T01:36:32+00:00,Woman charged over hospital sabotage linked to patient death | 7NEWS,"A 42-year-old woman, Vanessa Moulton, has been charged with sabotage after allegedly cutting gas and water supply lines to two hospitals in Caringbah, Sydney. Police are investigating whether her actions caused the death of a 72-year-old patient at Sutherland Hospital, which occurred in the hours following the alleged sabotage. Moulton appeared at Sutherland Local Court, pleaded not guilty to charges including public nuisance, trespass, sabotage and property damage, and was refused bail.  Subscribe and set 🔔 » https://7news.link/YTSubscribe |   For the latest Australian news and breaking news alerts, connect with 7NEWS online: Visit » https://7news.com.au 7Plus » https://7plus.com.au/ 7NEWS Podcast » https://open.spotify.com/user/dm9fk9hzoe68ibpttheragdgi Facebook » https://www.facebook.com/7NewsAustralia TikTok » https://www.tiktok.com/@7newsaustralia Instagram » https://www.instagram.com/7newsaustralia/ X » https://x.com/7NewsAustralia  7NEWS combines the trusted and powerful news brands including Sunrise, The Morning Show, Spotlight and 7NEWS.com.au, delivering unique, engaging and continuous coverage on the issues that matter most to Australians. Watch 7 News Australia full broadcasts and full episodes at 6pm and weekdays at 12pm and 4pm on Channel 7 and 7plus.  #BREAKINGNEWS #7NEWS",https://www.youtube.com/watch?v=WhBYp_d1ums,7News
2025-10-29T01:36:09+00:00,Major police sting nets 30 arrests across SA | 7NEWS,"More than 30 people have been arrested in a statewide police sting across South Australia, believed to be linked to the encrypted messaging app Anom. Two courtrooms have been set aside at the Adelaide Magistrates Court to hear all the cases. Police are expected to release more details later this afternoon.  Subscribe and set 🔔 » https://7news.link/YTSubscribe |   For the latest Australian news and breaking news alerts, connect with 7NEWS online: Visit » https://7news.com.au 7Plus » https://7plus.com.au/ 7NEWS Podcast » https://open.spotify.com/user/dm9fk9hzoe68ibpttheragdgi Facebook » https://www.facebook.com/7NewsAustralia TikTok » https://www.tiktok.com/@7newsaustralia Instagram » https://www.instagram.com/7newsaustralia/ X » https://x.com/7NewsAustralia  7NEWS combines the trusted and powerful news brands including Sunrise, The Morning Show, Spotlight and 7NEWS.com.au, delivering unique, engaging and continuous coverage on the issues that matter most to Australians. Watch 7 News Australia full broadcasts and full episodes at 6pm and weekdays at 12pm and 4pm on Channel 7 and 7plus.  #BREAKINGNEWS #7NEWS",https://www.youtube.com/watch?v=402OZMh5mSk,7News
2025-10-29T01:35:43+00:00,Israel strikes Gaza over hostage remains breach | 7NEWS,"Israeli Prime Minister orders immediate powerful strikes in Gaza, accusing Hamas of violating the ceasefire agreement by failing to properly return hostage remains. The breach involves Hamas returning the body of Ofer Tsarfati, whose remains were already recovered by Israeli forces in 2023, rather than one of the 13 remaining deceased hostages still held in Gaza. This marks the second time Israeli military has conducted airstrikes after alleging Hamas ceasefire violations.  Subscribe and set 🔔 » https://7news.link/YTSubscribe |   For the latest Australian news and breaking news alerts, connect with 7NEWS online: Visit » https://7news.com.au 7Plus » https://7plus.com.au/ 7NEWS Podcast » https://open.spotify.com/user/dm9fk9hzoe68ibpttheragdgi Facebook » https://www.facebook.com/7NewsAustralia TikTok » https://www.tiktok.com/@7newsaustralia Instagram » https://www.instagram.com/7newsaustralia/ X » https://x.com/7NewsAustralia  7NEWS combines the trusted and powerful news brands including Sunrise, The Morning Show, Spotlight and 7NEWS.com.au, delivering unique, engaging and continuous coverage on the issues that matter most to Australians. Watch 7 News Australia full broadcasts and full episodes at 6pm and weekdays at 12pm and 4pm on Channel 7 and 7plus.  #BREAKINGNEWS #7NEWS",https://www.youtube.com/watch?v=hhZkjGYFX4U,7News
2025-10-29T01:34:11+00:00,Elderly passenger dies after being left on island | 7NEWS,"An 80-year-old Australian woman died after being left behind during a day excursion on Lizard Island in North Queensland while travelling on the Coral Adventurer cruise ship. Maritime safety officers are preparing to board the vessel when it docks in Darwin to investigate the incident. The cruise ship company is cooperating with authorities and a coroner's report will be prepared.  Subscribe and set 🔔 » https://7news.link/YTSubscribe |   For the latest Australian news and breaking news alerts, connect with 7NEWS online: Visit » https://7news.com.au 7Plus » https://7plus.com.au/ 7NEWS Podcast » https://open.spotify.com/user/dm9fk9hzoe68ibpttheragdgi Facebook » https://www.facebook.com/7NewsAustralia TikTok » https://www.tiktok.com/@7newsaustralia Instagram » https://www.instagram.com/7newsaustralia/ X » https://x.com/7NewsAustralia  7NEWS combines the trusted and powerful news brands including Sunrise, The Morning Show, Spotlight and 7NEWS.com.au, delivering unique, engaging and continuous coverage on the issues that matter most to Australians. Watch 7 News Australia full broadcasts and full episodes at 6pm and weekdays at 12pm and 4pm on Channel 7 and 7plus.  #BREAKINGNEWS #7NEWS",https://www.youtube.com/watch?v=eINkm6cbTew,7News
2025-10-29T01:33:52+00:00,Albanese heads to APEC summit | 7NEWS,"Prime Minister Anthony Albanese travels from Malaysia's ASEAN summit to South Korea for the APEC summit, where world leaders including Donald Trump and Xi Jinping will meet to address trade disputes. Albanese concludes his Malaysia visit by unveiling plans for a $1 billion Monash University campus in Kuala Lumpur and receiving praise from Prime Minister Anwar Ibrahim for Australia's position on Gaza. His first commitment in South Korea will be laying a wreath at the United Nations Memorial Cemetery in Busan, honouring 340 Australians who died in the Korean War 75 years ago.  Subscribe and set 🔔 » https://7news.link/YTSubscribe |   For the latest Australian news and breaking news alerts, connect with 7NEWS online: Visit » https://7news.com.au 7Plus » https://7plus.com.au/ 7NEWS Podcast » https://open.spotify.com/user/dm9fk9hzoe68ibpttheragdgi Facebook » https://www.facebook.com/7NewsAustralia TikTok » https://www.tiktok.com/@7newsaustralia Instagram » https://www.instagram.com/7newsaustralia/ X » https://x.com/7NewsAustralia  7NEWS combines the trusted and powerful news brands including Sunrise, The Morning Show, Spotlight and 7NEWS.com.au, delivering unique, engaging and continuous coverage on the issues that matter most to Australians. Watch 7 News Australia full broadcasts and full episodes at 6pm and weekdays at 12pm and 4pm on Channel 7 and 7plus.  #BREAKINGNEWS #7NEWS",https://www.youtube.com/watch?v=ntKQA-k_kEI,7News
