published,title,description,link,Pub
2026-02-04T10:31:16+00:00,‘Things could spiral out of control’: US shoots down Iranian drone as tensions escalate,"The Australian columnist Tom Switzer discusses tensions between America and Iran after the US military shot down an Iranian drone approaching an aircraft carrier.  “All it requires is an accident or a miscalculation, and things could spiral out of control,” Mr Switzer told Sky News host Chris Kenny.  “My sense is the president wants to show force, to intimidate the Mullahs.”",https://www.youtube.com/watch?v=8Pgt3qRl1vs,Sky News Australia
2026-02-04T10:31:38+00:00,Bill and Hillary Clinton agree to testify in US Congress,Sky News host Danica De Giorgio says Bill and Hillary Clinton have agreed to testify in US Congress.,https://www.youtube.com/watch?v=-BL1pAkH07U,Sky News Australia
2026-02-04T10:32:34+00:00,Bill Gates rebukes allegations of STD in Epstein files,Sky News host Danica De Giorgio says billionaire Bill Gates has rebuked the details alleged in the Epstein files of him contracting a sexually transmitted disease and sought to give his wife antibiotics.,https://www.youtube.com/watch?v=8MDFsEGaSfI,Sky News Australia
2026-02-04T10:34:53+00:00,The police publicly admit they can’t guarantee safety,"Shadow Education Minister Julian Lesser criticises the police for admitting publicly that they cannot guarantee safety.  “I don’t want to see the Jewish community retraumatised after what it’s gone through at Bondi,” Mr Lesser told Sky News host Sharri Markson.   “To the police, I say your job is not just to protect the peace, but it’s to protect the peaceful.  “We have to be able to have gatherings.”",https://www.youtube.com/watch?v=3aajsh1A27Y,Sky News Australia
2026-02-04T10:36:07+00:00,Michele Bullock under fire for interest rate hike,Former Treasury assistant secretary David Pearl expressed anger over the Reserve Bank of Australia's (RBA) interest rate hike.  Mr Pearl criticised the lack of contrition from RBA Governor Michele Bullock.,https://www.youtube.com/watch?v=fahtPWguHCg,Sky News Australia
2026-02-04T10:36:08+00:00,‘Flabbergasted’: Teal MP’s ‘completely out of touch’ question,"Shadow Education Minister Julian Lesser slams Teal MP for ridiculous statement during question time.   “I was flabbergasted by this question,” Mr Lesser told Sky News host Sharri Markson.  “The teals are completely out of touch here.”",https://www.youtube.com/watch?v=XnRudmhDp4E,Sky News Australia
2026-02-04T11:20:50+00:00,Albanese causing household finances to ‘crumble’ amid non-functional opposition,"Sky News host Sharri Markson says without a functioning opposition government to hold Prime Minister Anthony Albanese to account, Australia’s economy and household finances are “crumbling”.   “Around the world, inflation is mostly no longer a problem, and interest rates are falling. Households are feeling relief in most comparable developed nations,” Ms Markson said.  “But without a functioning opposition to hold the Albanese Government to account, our economy and household finances are crumbling.”",https://www.youtube.com/watch?v=4G4CmmrI2ow,Sky News Australia
2026-02-04T12:10:55+00:00,Andrew Hastie spotted in parliament with Sun Tzu’s The Art of War,"Sky News host Freya Leach says Liberal MP Andrew Hastie was spotted sitting in parliament with Sun Tzu’s The Art of War.   “Andrew Hastie … he was spotted sitting on the very back bench of parliament reading a copy of Sun Tzu’s The Art of War,” Ms Leach said.  “Next to him was one of his allies, Garth Hamilton, who was reading Shakespeare's Othello.”",https://www.youtube.com/watch?v=Kaey1gL9jhg,Sky News Australia
2026-02-04T12:12:20+00:00,‘Party full of w**kers’: Clive Palmer hits out against Liberal Party,"Sky News host Freya Leach comments on today’s parliamentary intervention from Clive Palmer.    “There was a surprising intervention today from Clive Palmer, who’s said behind the scenes he’s been talking with individual members of the National Party about its future direction,” Ms Leach said.   “He did not mince his words.”",https://www.youtube.com/watch?v=9SQiEhZVhLE,Sky News Australia
2026-02-04T12:23:52+00:00,Activists hijack street art campaign with images of man charged with terrorism in Bondi massacre,"Sky News host Peta Credlin says activists hijacking street art with images of the man charged with the Bondi terror attack is “disgusting”.  “Action on the streets of Melbourne where activists have hijacked a street art campaign and they’ve plastered the city of Melbourne with images of the man charged by police with terrorism over the Bondi events,” Ms Credlin said.  Melbourne Deputy Lord Mayor Roshena Campbell joined Ms Credlin to discuss the consequences around the posters.",https://www.youtube.com/watch?v=Cpyr0BWvfnA,Sky News Australia
2026-02-04T12:25:13+00:00,Greens Councillor thinks ‘vandals shouldn’t pay for damage if the monument was unpopular’,"Sky News host James Macpherson criticises Greens Councillor Olivia Ball for voting against a crackdown on vandals.  “City of Melbourne councillors voted this week to crack down on people who vandalise historic monuments, agreeing that if you damage a monument, you pay for it.  “Greens Councillor Olivia Ball voted against the motion, arguing that damage to monuments should be considered on a case-by-case basis.  “Vandals wouldn't need to pay for damage if it were agreed the monument was already unpopular.  “She was promoting a protest on the steps of State Parliament at which the steps of Parliament were vandalised with the phrase globalise the intifada""",https://www.youtube.com/watch?v=W36gGYR4OxY,Sky News Australia
2026-02-04T12:27:07+00:00,‘People are doing it tough’: 13th rate rise under this government,"Shadow Attorney General Andrew Wallace criticises the Australian government for yet another rate rise.   “I think what Australians are seeing is a government that is absolutely full of hubris,” Mr Wallace told Sky News host Danica DeGiorgio.  “Australians can see that the government is not focused on them.  “People are really doing it tough; we’ve seen the 13th interest rate rise under this government.”",https://www.youtube.com/watch?v=H3Cyyc4r-gs,Sky News Australia
2026-02-04T12:45:03+00:00,‘Not great’: Looking ‘terrible’ for Republicans ahead of US midterms,"'The Megyn Kelly Show' host Megyn Kelly says it’s looking “terrible” for Republicans ahead of the US midterms.   “Right now, I think it’s looking terrible for Republicans in the midterm,” Ms Kelly told Sky News host Paul Murray.  “It’s not great … I think the Democrats will easily win the House in the midterm election.”",https://www.youtube.com/watch?v=5g3yHCs6zcg,Sky News Australia
2026-02-04T12:50:06+00:00,Megyn Kelly blasts Billie Eilish claiming she looked like a ‘piano’ at 2026 Grammys,"'The Megyn Kelly Show' host Megyn Kelly says Billie Eilish looked like a “piano” at the 2026 Grammys.   “Billie Eilish … she looked like a piano,” Ms Kelly told Sky News host Paul Murray.  “Stiff, weird angles, she never looks good.”",https://www.youtube.com/watch?v=-xJUw-5MujM,Sky News Australia
2026-02-04T12:55:31+00:00,‘Privileged out-of-touch elite jerks’ attempt to lecture public at Grammys: Megyn Kelly,"'The Megyn Kelly Show' host Megyn Kelly blasts Hollywood celebrities for having the nerve to “lecture the rest of us on how we need to live.”  “It’s amazing to me, to watch these rich privileged out of-touch elite jerks stand up there and try to lecture the rest of us on how we need to live,” Ms Kelly told Sky News host Paul Murray.  “Each one of whom … lives in a guarded estate and will never have to deal with the consequences of an illegal immigrant in their lives.”",https://www.youtube.com/watch?v=i3NigVkGyjg,Sky News Australia
